title	link	source	date	title_corrected
Indignante: detienen en Conchalí a violador de menor de sólo 10 años - Publimetro	https://news.google.com/__i/rss/rd/articles/CBMiVWh0dHBzOi8vd3d3LnB1YmxpbWV0cm8uY2wvY2wvbm90aWNpYXMvMjAyMS8wOC8xNS9jb25jaGFsaS12aW9sYWRvci1tZW5vci0xMC1hbm9zLmh0bWzSAWRodHRwczovL3d3dy5wdWJsaW1ldHJvLmNsL2NsL25vdGljaWFzLzIwMjEvMDgvMTUvY29uY2hhbGktdmlvbGFkb3ItbWVub3ItMTAtYW5vcy5odG1sP291dHB1dFR5cGU9YW1w?oc=5	Publimetro	2021-08-15	Indignante: detienen en Conchalí a violador de menor de sólo 10 años
Condenan a exempleado de CMPC como cómplice en matanza en Laja - Publimetro	https://news.google.com/__i/rss/rd/articles/CBMiXGh0dHBzOi8vd3d3LnB1YmxpbWV0cm8uY2wvY2wvbm90aWNpYXMvMjAyMS8wOC8xNS9jbXBjLWV4ZW1wbGVhZG8tY29uZGVuYWRvLW1hdGFuemEtbGFqYS5odG1s0gFraHR0cHM6Ly93d3cucHVibGltZXRyby5jbC9jbC9ub3RpY2lhcy8yMDIxLzA4LzE1L2NtcGMtZXhlbXBsZWFkby1jb25kZW5hZG8tbWF0YW56YS1sYWphLmh0bWw_b3V0cHV0VHlwZT1hbXA?oc=5	Publimetro	2021-08-15	Condenan a exempleado de CMPC como cómplice en matanza en Laja
Carabinera perdió un dedo a causa de violencia intrafamiliar - Publimetro	https://news.google.com/__i/rss/rd/articles/CBMic2h0dHBzOi8vd3d3LnB1YmxpbWV0cm8uY2wvY2wvbm90aWNpYXMvMjAyMS8wOC8xNS9jYXJhYmluZXJhLXBlcmRpby1kZWRvLXZpb2xlbmNpYS1pbnRyYWZhbWlsaWFyLXBhcmVqYS1wb2xpY2lhLmh0bWzSAYIBaHR0cHM6Ly93d3cucHVibGltZXRyby5jbC9jbC9ub3RpY2lhcy8yMDIxLzA4LzE1L2NhcmFiaW5lcmEtcGVyZGlvLWRlZG8tdmlvbGVuY2lhLWludHJhZmFtaWxpYXItcGFyZWphLXBvbGljaWEuaHRtbD9vdXRwdXRUeXBlPWFtcA?oc=5	Publimetro	2021-08-15	Carabinera perdió un dedo a causa de violencia intrafamiliar
PDI indaga posible infanticidio tras hallazgo de un feto al interior de un basurero en Talca - Cooperativa.cl	https://news.google.com/__i/rss/rd/articles/CBMilAFodHRwczovL2Nvb3BlcmF0aXZhLmNsL25vdGljaWFzL3BhaXMvcmVnaW9uLWRlbC1tYXVsZS9wZGktaW5kYWdhLXBvc2libGUtaW5mYW50aWNpZGlvLXRyYXMtaGFsbGF6Z28tZGUtdW4tZmV0by1hbC1pbnRlcmlvci1kZS8yMDIxLTA4LTE2LzE2MjIwNC5odG1s0gFUaHR0cHM6Ly93d3cuY29vcGVyYXRpdmEuY2wvbm90aWNpYXMvc2l0ZS9hcnRpYy8yMDIxMDgxNi9wYWdzLWFtcC8yMDIxMDgxNjE2MjIwNC5odG1s?oc=5	Cooperativa.cl	2021-08-16	PDI indaga posible infanticidio tras hallazgo de un feto al interior de un basurero en Talca
Fiscalía acusa a Sebastián Sichel de infringir norma sanitaria al no portar permiso en toque de queda: candidato arriesga multa de 6 UTM - El Mostrador	https://news.google.com/__i/rss/rd/articles/CBMirQFodHRwczovL20uZWxtb3N0cmFkb3IuY2wvZGlhLzIwMjEvMDgvMTYvZmlzY2FsaWEtYWN1c2EtYS1zZWJhc3RpYW4tc2ljaGVsLWluZnJpbmdpci1ub3JtYS1zYW5pdGFyaWEtYWwtbm8tcG9ydGFyLXBlcm1pc28tZW4tdG9xdWUtZGUtcXVlZGEtY2FuZGlkYXRvLWFycmllc2dhLW11bHRhLWRlLTYtdXRtL9IBsQFodHRwczovL20uZWxtb3N0cmFkb3IuY2wvZGlhLzIwMjEvMDgvMTYvZmlzY2FsaWEtYWN1c2EtYS1zZWJhc3RpYW4tc2ljaGVsLWluZnJpbmdpci1ub3JtYS1zYW5pdGFyaWEtYWwtbm8tcG9ydGFyLXBlcm1pc28tZW4tdG9xdWUtZGUtcXVlZGEtY2FuZGlkYXRvLWFycmllc2dhLW11bHRhLWRlLTYtdXRtL2FtcC8?oc=5	El Mostrador	2021-08-16	Fiscalía acusa a Sebastián Sichel de infringir norma sanitaria al no portar permiso en toque de queda: candidato arriesga multa de 6 UTM
Un muerto deja atropello tras accidente vehicular en el acceso norte a Chillán - BioBioChile	https://news.google.com/__i/rss/rd/articles/CBMirQFodHRwczovL3d3dy5iaW9iaW9jaGlsZS5jbC9ub3RpY2lhcy9uYWNpb25hbC9yZWdpb24tZGUtbnVibGUvMjAyMS8wOC8xNi91bi1tdWVydG8tZGVqYS1hdHJvcGVsbG8tYS0zLXBlcnNvbmFzLXktcG9zdGVyaW9yLWNob3F1ZS1kZS12ZWhpY3Vsb3MtZW4tYWNjZXNvLW5vcnRlLWEtY2hpbGxhbi5zaHRtbNIBsQFodHRwczovL3d3dy5iaW9iaW9jaGlsZS5jbC9ub3RpY2lhcy9uYWNpb25hbC9yZWdpb24tZGUtbnVibGUvMjAyMS8wOC8xNi9hbXAvdW4tbXVlcnRvLWRlamEtYXRyb3BlbGxvLWEtMy1wZXJzb25hcy15LXBvc3Rlcmlvci1jaG9xdWUtZGUtdmVoaWN1bG9zLWVuLWFjY2Vzby1ub3J0ZS1hLWNoaWxsYW4uc2h0bWw?oc=5	BioBioChile	2021-08-16	Un muerto deja atropello tras accidente vehicular en el acceso norte a Chillán
¡A sacar los paraguas!: Pronostican lluvias para la región a partir del miércoles - El Día	https://news.google.com/__i/rss/rd/articles/CBMiYGh0dHA6Ly93d3cuZGlhcmlvZWxkaWEuY2wvcmVnaW9uL3NhY2FyLXBhcmFndWFzLXByb25vc3RpY2FuLWxsdXZpYXMtcGFyYS1yZWdpb24tcGFydGlyLW1pZXJjb2xlc9IBAA?oc=5	El Día	2021-08-16	¡A sacar los paraguas!: Pronostican lluvias para la región a partir del miércoles
Las razones de Camila Vallejo para no repostular a la Cámara de Diputados « Diario y Radio U Chile - Diario y Radio Uchile	https://news.google.com/__i/rss/rd/articles/CBMibWh0dHBzOi8vcmFkaW8udWNoaWxlLmNsLzIwMjEvMDgvMTYvbGFzLXJhem9uZXMtZGUtY2FtaWxhLXZhbGxlam8tcGFyYS1uby1yZXBvc3R1bGFyLWEtbGEtY2FtYXJhLWRlLWRpcHV0YWRvcy_SAQA?oc=5	Diario y Radio Uchile	2021-08-16	Las razones de Camila Vallejo para no repostular a la Cámara de Diputados « Diario y Radio U Chile
Vuelco en caso de incendio en hostal de Castro: detienen a sujeto acusado de incendiar la vivienda y asesinar a dos adultos mayores - Publimetro	https://news.google.com/__i/rss/rd/articles/CBMid2h0dHBzOi8vd3d3LnB1YmxpbWV0cm8uY2wvY2wvbm90aWNpYXMvMjAyMS8wOC8xNi9ob3N0YWwtdnVlbGNvLWRldGllbmVuLWFjdXNhZG8taW5jZW5kaWFyLWFzZXNpbmFyLWFkdWx0b3MtbWF5b3Jlcy5odG1s0gGGAWh0dHBzOi8vd3d3LnB1YmxpbWV0cm8uY2wvY2wvbm90aWNpYXMvMjAyMS8wOC8xNi9ob3N0YWwtdnVlbGNvLWRldGllbmVuLWFjdXNhZG8taW5jZW5kaWFyLWFzZXNpbmFyLWFkdWx0b3MtbWF5b3Jlcy5odG1sP291dHB1dFR5cGU9YW1w?oc=5	Publimetro	2021-08-16	Vuelco en caso de incendio en hostal de Castro: detienen a sujeto acusado de incendiar la vivienda y asesinar a dos adultos mayores
Minsal revela las 10 comunas con más rezagados en la RM (y que impiden que cambie el toque de queda) - Teletrece	https://news.google.com/__i/rss/rd/articles/CBMibGh0dHBzOi8vd3d3LnQxMy5jbC9ub3RpY2lhL25hY2lvbmFsL21pbnNhbC0xMC1jb211bmFzLW1hcy1yZXphZ2Fkb3Mtcm0taW1waWRlbi1jYW1iaWUtdG9xdWUtcXVlZGEtMTYtMDgtMjAyMdIBcGh0dHBzOi8vd3d3LnQxMy5jbC9hbXAvbm90aWNpYS9uYWNpb25hbC9taW5zYWwtMTAtY29tdW5hcy1tYXMtcmV6YWdhZG9zLXJtLWltcGlkZW4tY2FtYmllLXRvcXVlLXF1ZWRhLTE2LTA4LTIwMjE?oc=5	Teletrece	2021-08-16	Minsal revela las 10 comunas con más rezagados en la RM (y que impiden que cambie el toque de queda)
Chile Transparente y querella contra exdirector de la PDI: “No hay aprendizaje, uno espera que existiera toma de conciencia” tras desfalcos en Carabineros y el Ejército - El Mostrador	https://news.google.com/__i/rss/rd/articles/CBMizQFodHRwczovL20uZWxtb3N0cmFkb3IuY2wvZGlhLzIwMjEvMDgvMTYvY2hpbGUtdHJhbnNwYXJlbnRlLXktcXVlcmVsbGEtY29udHJhLWV4ZGlyZWN0b3ItZGUtbGEtcGRpLW5vLWhheS1hcHJlbmRpemFqZS11bm8tZXNwZXJhLXF1ZS1leGlzdGllcmEtdG9tYS1kZS1jb25jaWVuY2lhLXRyYXMtZGVzZmFsY29zLWVuLWNhcmFiaW5lcm9zLXktZWwtZWplcmNpdG8v0gHRAWh0dHBzOi8vbS5lbG1vc3RyYWRvci5jbC9kaWEvMjAyMS8wOC8xNi9jaGlsZS10cmFuc3BhcmVudGUteS1xdWVyZWxsYS1jb250cmEtZXhkaXJlY3Rvci1kZS1sYS1wZGktbm8taGF5LWFwcmVuZGl6YWplLXVuby1lc3BlcmEtcXVlLWV4aXN0aWVyYS10b21hLWRlLWNvbmNpZW5jaWEtdHJhcy1kZXNmYWxjb3MtZW4tY2FyYWJpbmVyb3MteS1lbC1lamVyY2l0by9hbXAv?oc=5	El Mostrador	2021-08-16	Chile Transparente y querella contra exdirector de la PDI: “No hay aprendizaje, uno espera que existiera toma de conciencia” tras desfalcos en Carabineros y el Ejército
"""Entristece y exaspera"": Amaro Gómez-Pablos criticó duramente las medidas de arribo a Chile - BioBioChile"	https://news.google.com/__i/rss/rd/articles/CBMiemh0dHBzOi8vd3d3LmJpb2Jpb2NoaWxlLmNsL25vdGljaWFzL2VzcGVjdGFjdWxvcy15LXR2L3R2LzIwMjEvMDgvMTUvYW1hcm8tZ29tZXotcGFibG9zLWFlcm9wdWVydG8tbWVkaWRhcy1zYW5pdGFyaWFzLnNodG1s0gF-aHR0cHM6Ly93d3cuYmlvYmlvY2hpbGUuY2wvbm90aWNpYXMvZXNwZWN0YWN1bG9zLXktdHYvdHYvMjAyMS8wOC8xNS9hbXAvYW1hcm8tZ29tZXotcGFibG9zLWFlcm9wdWVydG8tbWVkaWRhcy1zYW5pdGFyaWFzLnNodG1s?oc=5	BioBioChile	2021-08-16	"""Entristece y exaspera"": Amaro Gómez-Pablos criticó duramente las medidas de arribo a Chile"
"La ""conducta homosexual"" ya no es causal admitida para pedir el divorcio - Cooperativa.cl"	https://news.google.com/__i/rss/rd/articles/CBMimAFodHRwczovL2Nvb3BlcmF0aXZhLmNsL25vdGljaWFzL3NvY2llZGFkL21pbm9yaWFzLXNleHVhbGVzL2xhLWNvbmR1Y3RhLWhvbW9zZXh1YWwteWEtbm8tZXMtY2F1c2FsLWFkbWl0aWRhLXBhcmEtcGVkaXItZWwtZGl2b3JjaW8vMjAyMS0wOC0xNi8xODM2NDMuaHRtbNIBVGh0dHBzOi8vd3d3LmNvb3BlcmF0aXZhLmNsL25vdGljaWFzL3NpdGUvYXJ0aWMvMjAyMTA4MTYvcGFncy1hbXAvMjAyMTA4MTYxODM2NDMuaHRtbA?oc=5	Cooperativa.cl	2021-08-16	"La ""conducta homosexual"" ya no es causal admitida para pedir el divorcio"
Daza por brote de Delta en O'Higgins: “Todos los contactos estrechos identificados y casos positivos se encuentran en residencias sanitarias, excepto por cinco de ellos que han sido hospitalizados” - La Tercera	https://news.google.com/__i/rss/rd/articles/CBMi_gFodHRwczovL3d3dy5sYXRlcmNlcmEuY29tL25hY2lvbmFsL25vdGljaWEvZGF6YS1wb3ItYnJvdGUtZGUtZGVsdGEtZW4tb2hpZ2dpbnMtdG9kb3MtbG9zLWNvbnRhY3Rvcy1lc3RyZWNob3MtaWRlbnRpZmljYWRvcy1zZS1lbmN1ZW50cmFuLWFpc2xhZG9zLWVuLXJlc2lkZW5jaWFzLXNhbml0YXJpYXMtZXhjZXB0by1wb3ItY2luY28tZGUtZWxsb3MtcXVlLWhhbi1zaWRvLWhvc3BpdGFsaXphZG9zLzdaV1AzUTY0V1pEM1ZQQ09HQUdSQTY0VVJNL9IBjQJodHRwczovL3d3dy5sYXRlcmNlcmEuY29tL25hY2lvbmFsL25vdGljaWEvZGF6YS1wb3ItYnJvdGUtZGUtZGVsdGEtZW4tb2hpZ2dpbnMtdG9kb3MtbG9zLWNvbnRhY3Rvcy1lc3RyZWNob3MtaWRlbnRpZmljYWRvcy1zZS1lbmN1ZW50cmFuLWFpc2xhZG9zLWVuLXJlc2lkZW5jaWFzLXNhbml0YXJpYXMtZXhjZXB0by1wb3ItY2luY28tZGUtZWxsb3MtcXVlLWhhbi1zaWRvLWhvc3BpdGFsaXphZG9zLzdaV1AzUTY0V1pEM1ZQQ09HQUdSQTY0VVJNLz9vdXRwdXRUeXBlPWFtcA?oc=5	La Tercera	2021-08-16	Daza por brote de Delta en O'Higgins: “Todos los contactos estrechos identificados y casos positivos se encuentran en residencias sanitarias, excepto por cinco de ellos que han sido hospitalizados”
Pulso Ciudadano: Sichel lidera y Kast supera a Provoste en el tercer lugar - El Dínamo	https://news.google.com/__i/rss/rd/articles/CBMiemh0dHBzOi8vd3d3LmVsZGluYW1vLmNsL3BvbGl0aWNhLzIwMjEvMDgvMTYvcHVsc28tY2l1ZGFkYW5vLXNpY2hlbC1saWRlcmEteS1rYXN0LXN1cGVyYS1hLXByb3Zvc3RlLWVuLWVsLXRlcmNlci1sdWdhci9hbXAv0gF6aHR0cHM6Ly93d3cuZWxkaW5hbW8uY2wvcG9saXRpY2EvMjAyMS8wOC8xNi9wdWxzby1jaXVkYWRhbm8tc2ljaGVsLWxpZGVyYS15LWthc3Qtc3VwZXJhLWEtcHJvdm9zdGUtZW4tZWwtdGVyY2VyLWx1Z2FyL2FtcC8?oc=5	El Dínamo	2021-08-16	Pulso Ciudadano: Sichel lidera y Kast supera a Provoste en el tercer lugar
Los mayores patrimonios de la Convención Constitucional - El Dínamo	https://news.google.com/__i/rss/rd/articles/CBMidGh0dHBzOi8vd3d3LmVsZGluYW1vLmNsL3BvbGl0aWNhLzIwMjEvMDgvMTYvbG9zLW1heW9yZXMtcGF0cmltb25pb3MtYWwtaW50ZXJpb3ItZGUtbGEtY29udmVuY2lvbi1jb25zdGl0dWNpb25hbC9hbXAv0gF0aHR0cHM6Ly93d3cuZWxkaW5hbW8uY2wvcG9saXRpY2EvMjAyMS8wOC8xNi9sb3MtbWF5b3Jlcy1wYXRyaW1vbmlvcy1hbC1pbnRlcmlvci1kZS1sYS1jb252ZW5jaW9uLWNvbnN0aXR1Y2lvbmFsL2FtcC8?oc=5	El Dínamo	2021-08-16	Los mayores patrimonios de la Convención Constitucional
Millonaria licitación de pasaportes: Sonda e Idemia recurren al TCP para anular a china Aisino - BioBioChile	https://news.google.com/__i/rss/rd/articles/CBMinQFodHRwczovL3d3dy5iaW9iaW9jaGlsZS5jbC9lc3BlY2lhbC9yZXBvcnRhamVzLzIwMjEvMDgvMTYvbWlsbG9uYXJpYS1saWNpdGFjaW9uLWRlLXBhc2Fwb3J0ZXMtc29uZGEtZS1pZGVtaWEtcmVjdXJyZW4tYWwtdGNwLXBhcmEtYW51bGFyLWEtY2hpbmEtYWlzaW5vLnNodG1s0gGhAWh0dHBzOi8vd3d3LmJpb2Jpb2NoaWxlLmNsL2VzcGVjaWFsL3JlcG9ydGFqZXMvMjAyMS8wOC8xNi9hbXAvbWlsbG9uYXJpYS1saWNpdGFjaW9uLWRlLXBhc2Fwb3J0ZXMtc29uZGEtZS1pZGVtaWEtcmVjdXJyZW4tYWwtdGNwLXBhcmEtYW51bGFyLWEtY2hpbmEtYWlzaW5vLnNodG1s?oc=5	BioBioChile	2021-08-16	Millonaria licitación de pasaportes: Sonda e Idemia recurren al TCP para anular a china Aisino
Incendio en la Planta de Cementos Bío Bío en Talcahuano: reportan fuerte ruido previo a emergencia - BioBioChile	https://news.google.com/__i/rss/rd/articles/CBMisgFodHRwczovL3d3dy5iaW9iaW9jaGlsZS5jbC9ub3RpY2lhcy9uYWNpb25hbC9yZWdpb24tZGVsLWJpby1iaW8vMjAyMS8wOC8xNi9pbmNlbmRpby1lbi1sYS1wbGFudGEtZGUtY2VtZW50b3MtYmlvLWJpby1lbi10YWxjYWh1YW5vLXJlcG9ydGFuLWZ1ZXJ0ZS1ydWlkby1wcmV2aW8tYS1lbWVyZ2VuY2lhLnNodG1s0gG2AWh0dHBzOi8vd3d3LmJpb2Jpb2NoaWxlLmNsL25vdGljaWFzL25hY2lvbmFsL3JlZ2lvbi1kZWwtYmlvLWJpby8yMDIxLzA4LzE2L2FtcC9pbmNlbmRpby1lbi1sYS1wbGFudGEtZGUtY2VtZW50b3MtYmlvLWJpby1lbi10YWxjYWh1YW5vLXJlcG9ydGFuLWZ1ZXJ0ZS1ydWlkby1wcmV2aW8tYS1lbWVyZ2VuY2lhLnNodG1s?oc=5	BioBioChile	2021-08-16	Incendio en la Planta de Cementos Bío Bío en Talcahuano: reportan fuerte ruido previo a emergencia
Alcaldes piden al Minsal mayor flexibilidad para gestionar la vacunación contra el Covid - Cooperativa.cl	https://news.google.com/__i/rss/rd/articles/CBMimgFodHRwczovL2Nvb3BlcmF0aXZhLmNsL25vdGljaWFzL3NvY2llZGFkL3NhbHVkL2Nvcm9uYXZpcnVzL2FsY2FsZGVzLXBpZGVuLWFsLW1pbnNhbC1tYXlvci1mbGV4aWJpbGlkYWQtcGFyYS1nZXN0aW9uYXItbGEtdmFjdW5hY2lvbi8yMDIxLTA4LTE2LzEwMjU0OS5odG1s0gFUaHR0cHM6Ly93d3cuY29vcGVyYXRpdmEuY2wvbm90aWNpYXMvc2l0ZS9hcnRpYy8yMDIxMDgxNi9wYWdzLWFtcC8yMDIxMDgxNjEwMjU0OS5odG1s?oc=5	Cooperativa.cl	2021-08-16	Alcaldes piden al Minsal mayor flexibilidad para gestionar la vacunación contra el Covid
Encuentran con vida a pareja tras estar tres días perdidos en Antofagasta - Publimetro	https://news.google.com/__i/rss/rd/articles/CBMiYWh0dHBzOi8vd3d3LnB1YmxpbWV0cm8uY2wvY2wvbm90aWNpYXMvMjAyMS8wOC8xNi9lbmN1ZW50cmFuLXZpZGEtcGFyZWphLXBlcmRpZG9zLWFudG9mYWdhc3RhLmh0bWzSAXBodHRwczovL3d3dy5wdWJsaW1ldHJvLmNsL2NsL25vdGljaWFzLzIwMjEvMDgvMTYvZW5jdWVudHJhbi12aWRhLXBhcmVqYS1wZXJkaWRvcy1hbnRvZmFnYXN0YS5odG1sP291dHB1dFR5cGU9YW1w?oc=5	Publimetro	2021-08-16	Encuentran con vida a pareja tras estar tres días perdidos en Antofagasta
Nueva trama en San Ramón: descubren fichas de afiliación al PS entre la basura de la municipalidad - El Mostrador	https://news.google.com/__i/rss/rd/articles/CBMiigFodHRwczovL20uZWxtb3N0cmFkb3IuY2wvZGlhLzIwMjEvMDgvMTYvbnVldmEtdHJhbWEtZW4tc2FuLXJhbW9uLWRlc2N1YnJlbi1maWNoYXMtZGUtYWZpbGlhY2lvbi1hbC1wcy1lbnRyZS1sYS1iYXN1cmEtZGUtbGEtbXVuaWNpcGFsaWRhZC_SAY4BaHR0cHM6Ly9tLmVsbW9zdHJhZG9yLmNsL2RpYS8yMDIxLzA4LzE2L251ZXZhLXRyYW1hLWVuLXNhbi1yYW1vbi1kZXNjdWJyZW4tZmljaGFzLWRlLWFmaWxpYWNpb24tYWwtcHMtZW50cmUtbGEtYmFzdXJhLWRlLWxhLW11bmljaXBhbGlkYWQvYW1wLw?oc=5	El Mostrador	2021-08-16	Nueva trama en San Ramón: descubren fichas de afiliación al PS entre la basura de la municipalidad
Escalofriante caso: Joven estuvo seis meses enterrado en fosa artesanal de Los Vilos - El Día	https://news.google.com/__i/rss/rd/articles/CBMib2h0dHA6Ly93d3cuZGlhcmlvZWxkaWEuY2wvcG9saWNpYWwvZXNjYWxvZnJpYW50ZS1jYXNvLWpvdmVuLWVzdHV2by1zZWlzLW1lc2VzLWVudGVycmFkby1lbi1mb3NhLWFydGVzYW5hbC12aWxvc9IBAA?oc=5	El Día	2021-08-16	Escalofriante caso: Joven estuvo seis meses enterrado en fosa artesanal de Los Vilos
Árbol que se desprendió y cayó sobre automóvil fue la causa de muerte de hombre en Los Ángeles - BioBioChile	https://news.google.com/__i/rss/rd/articles/CBMirwFodHRwczovL3d3dy5iaW9iaW9jaGlsZS5jbC9ub3RpY2lhcy9uYWNpb25hbC9yZWdpb24tZGVsLWJpby1iaW8vMjAyMS8wOC8xNi9hcmJvbC1xdWUtc2UtZGVzcHJlbmRpby15LWNheW8tc29icmUtYXV0b21vdmlsLWZ1ZS1sYS1jYXVzYS1kZS1tdWVydGUtZGUtaG9tYnJlLWVuLWxvcy1hbmdlbGVzLnNodG1s0gGzAWh0dHBzOi8vd3d3LmJpb2Jpb2NoaWxlLmNsL25vdGljaWFzL25hY2lvbmFsL3JlZ2lvbi1kZWwtYmlvLWJpby8yMDIxLzA4LzE2L2FtcC9hcmJvbC1xdWUtc2UtZGVzcHJlbmRpby15LWNheW8tc29icmUtYXV0b21vdmlsLWZ1ZS1sYS1jYXVzYS1kZS1tdWVydGUtZGUtaG9tYnJlLWVuLWxvcy1hbmdlbGVzLnNodG1s?oc=5	BioBioChile	2021-08-16	Árbol que se desprendió y cayó sobre automóvil fue la causa de muerte de hombre en Los Ángeles
Paso a Paso: Ya no habrá comunas en cuarentena y Antofagasta atrasa el toque de queda - Cooperativa.cl	https://news.google.com/__i/rss/rd/articles/CBMilwFodHRwczovL2Nvb3BlcmF0aXZhLmNsL25vdGljaWFzL3NvY2llZGFkL3NhbHVkL2Nvcm9uYXZpcnVzL3Bhc28tYS1wYXNvLXlhLW5vLWhhYnJhLWNvbXVuYXMtZW4tY3VhcmVudGVuYS15LWFudG9mYWdhc3RhLWF0cmFzYS1lbC8yMDIxLTA4LTE2LzE0MDQwMi5odG1s0gFUaHR0cHM6Ly93d3cuY29vcGVyYXRpdmEuY2wvbm90aWNpYXMvc2l0ZS9hcnRpYy8yMDIxMDgxNi9wYWdzLWFtcC8yMDIxMDgxNjE0MDQwMi5odG1s?oc=5	Cooperativa.cl	2021-08-16	Paso a Paso: Ya no habrá comunas en cuarentena y Antofagasta atrasa el toque de queda
Paso a Paso: Minsal anuncia que la totalidad del país salió de Cuarentena y seis regiones tendrán todas sus comunas en Apertura Inicial - La Tercera	https://news.google.com/__i/rss/rd/articles/CBMizQFodHRwczovL3d3dy5sYXRlcmNlcmEuY29tL25hY2lvbmFsL25vdGljaWEvcGFzby1hLXBhc28tbWluc2FsLWFudW5jaWEtcXVlLWxhLXRvdGFsaWRhZC1kZWwtcGFpcy1zYWxpby1kZS1jdWFyZW50ZW5hLXktc2Vpcy1yZWdpb25lcy10ZW5kcmFuLXRvZGFzLXN1cy1jb211bmFzLWVuLWFwZXJ0dXJhLWluaWNpYWwvQlhPSFkzRFEyNUcyUENCSFVaWkZZTDQ2Wkkv0gHcAWh0dHBzOi8vd3d3LmxhdGVyY2VyYS5jb20vbmFjaW9uYWwvbm90aWNpYS9wYXNvLWEtcGFzby1taW5zYWwtYW51bmNpYS1xdWUtbGEtdG90YWxpZGFkLWRlbC1wYWlzLXNhbGlvLWRlLWN1YXJlbnRlbmEteS1zZWlzLXJlZ2lvbmVzLXRlbmRyYW4tdG9kYXMtc3VzLWNvbXVuYXMtZW4tYXBlcnR1cmEtaW5pY2lhbC9CWE9IWTNEUTI1RzJQQ0JIVVpaRllMNDZaSS8_b3V0cHV0VHlwZT1hbXA?oc=5	La Tercera	2021-08-16	Paso a Paso: Minsal anuncia que la totalidad del país salió de Cuarentena y seis regiones tendrán todas sus comunas en Apertura Inicial
¿Cuándo comienza a llover en la región Metropolitana? - 24Horas.cl	https://news.google.com/__i/rss/rd/articles/CBMiW2h0dHBzOi8vd3d3LjI0aG9yYXMuY2wvbmFjaW9uYWwvY3VhbmRvLWNvbWllbnphLWEtbGxvdmVyLWVuLWxhLXJlZ2lvbi1tZXRyb3BvbGl0YW5hLTQ5MjQ0OTjSAVtodHRwczovL2FtcC4yNGhvcmFzLmNsL25hY2lvbmFsL2N1YW5kby1jb21pZW56YS1hLWxsb3Zlci1lbi1sYS1yZWdpb24tbWV0cm9wb2xpdGFuYS00OTI0NDk4?oc=5	24Horas.cl	2021-08-16	¿Cuándo comienza a llover en la región Metropolitana?
Los descargos de Jorge Arancibia, exedecán de Pinochet: “¿Soy un ejemplo de antidemocracia? ¿Soy un personaje negacionista?” - El Mostrador	https://news.google.com/__i/rss/rd/articles/CBMinQFodHRwczovL20uZWxtb3N0cmFkb3IuY2wvZGlhLzIwMjEvMDgvMTYvbG9zLWRlc2Nhcmdvcy1kZS1qb3JnZS1hcmFuY2liaWEtZXhlZGVjYW4tZGUtcGlub2NoZXQtc295LXVuLWVqZW1wbG8tZGUtYW50aWRlbW9jcmFjaWEtc295LXVuLXBlcnNvbmFqZS1uZWdhY2lvbmlzdGEv0gGhAWh0dHBzOi8vbS5lbG1vc3RyYWRvci5jbC9kaWEvMjAyMS8wOC8xNi9sb3MtZGVzY2FyZ29zLWRlLWpvcmdlLWFyYW5jaWJpYS1leGVkZWNhbi1kZS1waW5vY2hldC1zb3ktdW4tZWplbXBsby1kZS1hbnRpZGVtb2NyYWNpYS1zb3ktdW4tcGVyc29uYWplLW5lZ2FjaW9uaXN0YS9hbXAv?oc=5	El Mostrador	2021-08-16	Los descargos de Jorge Arancibia, exedecán de Pinochet: “¿Soy un ejemplo de antidemocracia? ¿Soy un personaje negacionista?”
Médico que fue detenido en aeropuerto de Santiago pidió disculpas tras duros insultos a personal de aerolínea que se viralizaron por internet - El Mostrador	https://news.google.com/__i/rss/rd/articles/CBMixgFodHRwczovL20uZWxtb3N0cmFkb3IuY2wvbm90aWNpYXMvbXVsdGltZWRpYS8yMDIxLzA4LzE2L21lZGljby1xdWUtZnVlLWRldGVuaWRvLWVuLWFlcm9wdWVydG8tZGUtc2FudGlhZ28tcGlkaW8tZGlzY3VscGFzLXRyYXMtZHVyb3MtaW5zdWx0b3MtYS1wZXJzb25hbC1kZS1hZXJvbGluZWEtcXVlLXNlLXZpcmFsaXphcm9uLXBvci1pbnRlcm5ldC_SAcoBaHR0cHM6Ly9tLmVsbW9zdHJhZG9yLmNsL25vdGljaWFzL211bHRpbWVkaWEvMjAyMS8wOC8xNi9tZWRpY28tcXVlLWZ1ZS1kZXRlbmlkby1lbi1hZXJvcHVlcnRvLWRlLXNhbnRpYWdvLXBpZGlvLWRpc2N1bHBhcy10cmFzLWR1cm9zLWluc3VsdG9zLWEtcGVyc29uYWwtZGUtYWVyb2xpbmVhLXF1ZS1zZS12aXJhbGl6YXJvbi1wb3ItaW50ZXJuZXQvYW1wLw?oc=5	El Mostrador	2021-08-16	Médico que fue detenido en aeropuerto de Santiago pidió disculpas tras duros insultos a personal de aerolínea que se viralizaron por internet
Las gestiones de la fiscalía para evitar que Aguilera venda su casa en La Reina - La Tercera	https://news.google.com/__i/rss/rd/articles/CBMizAFodHRwczovL3d3dy5sYXRlcmNlcmEuY29tL2xhLXRlcmNlcmEtcG0vbm90aWNpYS9maXNjYWxpYS12YS1hLXRyaWJ1bmFsZXMtcGFyYS1xdWUtYWd1aWxlcmEtbm8tdmVuZGEtc3UtY2FzYS1lbi1sYS1yZWluYS15LWFzZWd1cmFyLXBhZ28tZGUtbXVsdGFzLXNpLWVzLWNvbmRlbmFkby1wb3ItY29ycnVwY2lvbi9BVUZFU0pFU1hCR0FCQlQyUTVURjRDNENVWS_SAdsBaHR0cHM6Ly93d3cubGF0ZXJjZXJhLmNvbS9sYS10ZXJjZXJhLXBtL25vdGljaWEvZmlzY2FsaWEtdmEtYS10cmlidW5hbGVzLXBhcmEtcXVlLWFndWlsZXJhLW5vLXZlbmRhLXN1LWNhc2EtZW4tbGEtcmVpbmEteS1hc2VndXJhci1wYWdvLWRlLW11bHRhcy1zaS1lcy1jb25kZW5hZG8tcG9yLWNvcnJ1cGNpb24vQVVGRVNKRVNYQkdBQkJUMlE1VEY0QzRDVVkvP291dHB1dFR5cGU9YW1w?oc=5	La Tercera	2021-08-17	Las gestiones de la fiscalía para evitar que Aguilera venda su casa en La Reina
Senado pide explicaciones a ministra Valdés por ayudas culturales VIP - El Mostrador	https://news.google.com/__i/rss/rd/articles/CBMicmh0dHBzOi8vbS5lbG1vc3RyYWRvci5jbC9jdWx0dXJhLzIwMjEvMDgvMTcvc2VuYWRvLXBpZGUtZXhwbGljYWNpb25lcy1hLW1pbmlzdHJhLXZhbGRlcy1wb3ItYXl1ZGFzLWN1bHR1cmFsZXMtdmlwL9IBdmh0dHBzOi8vbS5lbG1vc3RyYWRvci5jbC9jdWx0dXJhLzIwMjEvMDgvMTcvc2VuYWRvLXBpZGUtZXhwbGljYWNpb25lcy1hLW1pbmlzdHJhLXZhbGRlcy1wb3ItYXl1ZGFzLWN1bHR1cmFsZXMtdmlwL2FtcC8?oc=5	El Mostrador	2021-08-17	Senado pide explicaciones a ministra Valdés por ayudas culturales VIP
Lo que tienes que saber este martes en La Tercera: pánico en Afganistán por regreso de talibanes y el informe del PC por derrota de Jadue - La Tercera	https://news.google.com/__i/rss/rd/articles/CBMizwFodHRwczovL3d3dy5sYXRlcmNlcmEuY29tL25hY2lvbmFsL25vdGljaWEvbG8tcXVlLXRpZW5lcy1xdWUtc2FiZXItZXN0ZS1tYXJ0ZXMtZW4tbGEtdGVyY2VyYS1wYW5pY28tZW4tYWZnYW5pc3Rhbi1wb3ItcmVncmVzby1kZS10YWxpYmFuZXMteS1lbC1pbmZvcm1lLWRlbC1wYy1wb3ItZGVycm90YS1kZS1qYWR1ZS9TTURBQlpIS0FCRlFaREFEQzJJM1NOVFE1RS_SAd4BaHR0cHM6Ly93d3cubGF0ZXJjZXJhLmNvbS9uYWNpb25hbC9ub3RpY2lhL2xvLXF1ZS10aWVuZXMtcXVlLXNhYmVyLWVzdGUtbWFydGVzLWVuLWxhLXRlcmNlcmEtcGFuaWNvLWVuLWFmZ2FuaXN0YW4tcG9yLXJlZ3Jlc28tZGUtdGFsaWJhbmVzLXktZWwtaW5mb3JtZS1kZWwtcGMtcG9yLWRlcnJvdGEtZGUtamFkdWUvU01EQUJaSEtBQkZRWkRBREMySTNTTlRRNUUvP291dHB1dFR5cGU9YW1w?oc=5	La Tercera	2021-08-17	Lo que tienes que saber este martes en : pánico en Afganistán por regreso de talibanes y el informe del PC por derrota de Jadue
Marta Lagos y la consulta de Unidad Constituyente: “Hace dos semanas Provoste hubiera ganado con una importante mayoría, pero la cancha se ha ido emparejando” - El Mostrador	https://news.google.com/__i/rss/rd/articles/CBMiyQFodHRwczovL20uZWxtb3N0cmFkb3IuY2wvZGVzdGFjYWRvLzIwMjEvMDgvMTcvbWFydGEtbGFnb3MteS1sYS1jb25zdWx0YS1kZS11bmlkYWQtY29uc3RpdHV5ZW50ZS1oYWNlLWRvcy1zZW1hbmFzLXByb3Zvc3RlLWh1YmllcmEtZ2FuYWRvLWNvbi11bmEtaW1wb3J0YW50ZS1tYXlvcmlhLXBlcm8tbGEtY2FuY2hhLXNlLWhhLWlkby1lbXBhcmVqYW5kby_SAc0BaHR0cHM6Ly9tLmVsbW9zdHJhZG9yLmNsL2Rlc3RhY2Fkby8yMDIxLzA4LzE3L21hcnRhLWxhZ29zLXktbGEtY29uc3VsdGEtZGUtdW5pZGFkLWNvbnN0aXR1eWVudGUtaGFjZS1kb3Mtc2VtYW5hcy1wcm92b3N0ZS1odWJpZXJhLWdhbmFkby1jb24tdW5hLWltcG9ydGFudGUtbWF5b3JpYS1wZXJvLWxhLWNhbmNoYS1zZS1oYS1pZG8tZW1wYXJlamFuZG8vYW1wLw?oc=5	El Mostrador	2021-08-17	Marta Lagos y la consulta de Unidad Constituyente: “Hace dos semanas Provoste hubiera ganado con una importante mayoría, pero la cancha se ha ido emparejando”
Arturo Zúñiga es denunciado ante la comisión de Ética de la CC tras emplazamiento a Marcos Barraza - CNN Chile	https://news.google.com/__i/rss/rd/articles/CBMiU2h0dHBzOi8vd3d3LmNubmNoaWxlLmNvbS9wYWlzL2FydHVyby16dW5pZ2EtY29taXNpb24tZXRpY2EtbWFyY29zLWJhcnJhemFfMjAyMTA4MTcv0gEA?oc=5	CNN Chile	2021-08-17	Arturo Zúñiga es denunciado ante la comisión de Ética de la CC tras emplazamiento a Marcos Barraza
Hombre se perfora cuello y muere tras caer de segundo piso en casa de Renca - BioBioChile	https://news.google.com/__i/rss/rd/articles/CBMingFodHRwczovL3d3dy5iaW9iaW9jaGlsZS5jbC9ub3RpY2lhcy9uYWNpb25hbC9yZWdpb24tbWV0cm9wb2xpdGFuYS8yMDIxLzA4LzE2L2hvbWJyZS1zZS1wZXJmb3JhLWN1ZWxsby15LW11ZXJlLXRyYXMtY2Flci1kZS1zZWd1bmRvLXBpc28tZW4tY2FzYS1kZS1yZW5jYS5zaHRtbNIBogFodHRwczovL3d3dy5iaW9iaW9jaGlsZS5jbC9ub3RpY2lhcy9uYWNpb25hbC9yZWdpb24tbWV0cm9wb2xpdGFuYS8yMDIxLzA4LzE2L2FtcC9ob21icmUtc2UtcGVyZm9yYS1jdWVsbG8teS1tdWVyZS10cmFzLWNhZXItZGUtc2VndW5kby1waXNvLWVuLWNhc2EtZGUtcmVuY2Euc2h0bWw?oc=5	BioBioChile	2021-08-17	Hombre se perfora cuello y muere tras caer de segundo piso en casa de Renca
Se separan las aguas en la derecha: 15 convencionales de Chile Vamos, menos de la UDI, reconocen “errores e injusticias” hacia los pueblos originarios - El Mostrador	https://news.google.com/__i/rss/rd/articles/CBMiyQFodHRwczovL20uZWxtb3N0cmFkb3IuY2wvbnVldmEtY29uc3RpdHVjaW9uLzIwMjEvMDgvMTcvc2Utc2VwYXJhbi1sYXMtYWd1YXMtZW4tbGEtZGVyZWNoYS0xNS1jb252ZW5jaW9uYWxlcy1kZS1jaGlsZS12YW1vcy1tZW5vcy1kZS1sYS11ZGktcmVjb25vY2VuLWVycm9yZXMtZS1pbmp1c3RpY2lhcy1oYWNpYS1sb3MtcHVlYmxvcy1vcmlnaW5hcmlvcy_SAc0BaHR0cHM6Ly9tLmVsbW9zdHJhZG9yLmNsL251ZXZhLWNvbnN0aXR1Y2lvbi8yMDIxLzA4LzE3L3NlLXNlcGFyYW4tbGFzLWFndWFzLWVuLWxhLWRlcmVjaGEtMTUtY29udmVuY2lvbmFsZXMtZGUtY2hpbGUtdmFtb3MtbWVub3MtZGUtbGEtdWRpLXJlY29ub2Nlbi1lcnJvcmVzLWUtaW5qdXN0aWNpYXMtaGFjaWEtbG9zLXB1ZWJsb3Mtb3JpZ2luYXJpb3MvYW1wLw?oc=5	El Mostrador	2021-08-17	Se separan las aguas en la derecha: 15 convencionales de Chile Vamos, menos de la UDI, reconocen “errores e injusticias” hacia los pueblos originarios
Camión volcado camino a San Javier dejó una persona fallecida: Ruta 5 Sur se mantuvo cortada - BioBioChile	https://news.google.com/__i/rss/rd/articles/CBMipAFodHRwczovL3d3dy5iaW9iaW9jaGlsZS5jbC9ub3RpY2lhcy9uYWNpb25hbC9yZWdpb24tZGVsLW1hdWxlLzIwMjEvMDgvMTYvY2FtaW9uLXZvbGNhZG8tY2FtaW5vLWEtc2FuLWphdmllci1kZWphLXVuYS1wZXJzb25hLWZhbGxlY2lkYS1ydXRhLTUtc3VyLWVzdGEtY29ydGFkYS5zaHRtbNIBAA?oc=5	BioBioChile	2021-08-17	Camión volcado camino a San Javier dejó una persona fallecida: Ruta 5 Sur se mantuvo cortada
Codelco confirma que un tercer sindicato de División Andina rechazó propuesta e inició huelga legal - BioBioChile	https://news.google.com/__i/rss/rd/articles/CBMitgFodHRwczovL3d3dy5iaW9iaW9jaGlsZS5jbC9ub3RpY2lhcy9lY29ub21pYS9hY3R1YWxpZGFkLWVjb25vbWljYS8yMDIxLzA4LzE3L2NvZGVsY28tY29uZmlybWEtcXVlLXVuLXRlcmNlci1zaW5kaWNhdG8tZGUtZGl2aXNpb24tYW5kaW5hLXJlY2hhem8tcHJvcHVlc3RhLWUtaW5pY2lvLWh1ZWxnYS1sZWdhbC5zaHRtbNIBugFodHRwczovL3d3dy5iaW9iaW9jaGlsZS5jbC9ub3RpY2lhcy9lY29ub21pYS9hY3R1YWxpZGFkLWVjb25vbWljYS8yMDIxLzA4LzE3L2FtcC9jb2RlbGNvLWNvbmZpcm1hLXF1ZS11bi10ZXJjZXItc2luZGljYXRvLWRlLWRpdmlzaW9uLWFuZGluYS1yZWNoYXpvLXByb3B1ZXN0YS1lLWluaWNpby1odWVsZ2EtbGVnYWwuc2h0bWw?oc=5	BioBioChile	2021-08-17	Codelco confirma que un tercer sindicato de División Andina rechazó propuesta e inició huelga legal
“Vivimos entre ustedes”: el dramático testimonio del nieto de un sobreviviente del genocidio Selk’nam - El Mostrador	https://news.google.com/__i/rss/rd/articles/CBMijgFodHRwczovL20uZWxtb3N0cmFkb3IuY2wvY3VsdHVyYS8yMDIxLzA4LzE3L3Zpdmltb3MtZW50cmUtdXN0ZWRlcy1lbC1kcmFtYXRpY28tdGVzdGltb25pby1kZWwtbmlldG8tZGUtdW4tc29icmV2aXZpZW50ZS1kZWwtZ2Vub2NpZGlvLXNlbGtuYW0v0gGSAWh0dHBzOi8vbS5lbG1vc3RyYWRvci5jbC9jdWx0dXJhLzIwMjEvMDgvMTcvdml2aW1vcy1lbnRyZS11c3RlZGVzLWVsLWRyYW1hdGljby10ZXN0aW1vbmlvLWRlbC1uaWV0by1kZS11bi1zb2JyZXZpdmllbnRlLWRlbC1nZW5vY2lkaW8tc2Vsa25hbS9hbXAv?oc=5	El Mostrador	2021-08-17	“Vivimos entre ustedes”: el dramático testimonio del nieto de un sobreviviente del genocidio Selk’nam
