title	link	source	date	title_corrected
SLP se declara en semáforo rojo ante aumento en casos de covid - Milenio	https://news.google.com/__i/rss/rd/articles/CBMiVWh0dHBzOi8vd3d3Lm1pbGVuaW8uY29tL2VzdGFkb3Mvc2VtYWZvcm8tcm9qby1zYW4tbHVpcy1wb3Rvc2ktYWx6YS1jb250YWdpb3MtY292aWQtMTnSAVVodHRwczovL2FtcC5taWxlbmlvLmNvbS9lc3RhZG9zL3NlbWFmb3JvLXJvam8tc2FuLWx1aXMtcG90b3NpLWFsemEtY29udGFnaW9zLWNvdmlkLTE5?oc=5	Milenio	2021-08-15	SLP se declara en semáforo rojo ante aumento en casos de covid
"Morena da ""albazo"" legislativo a coalición Va por Durango, acusa PRI | El Universal - El Universal"	https://news.google.com/__i/rss/rd/articles/CBMibmh0dHBzOi8vd3d3LmVsdW5pdmVyc2FsLmNvbS5teC9uYWNpb24vcG9saXRpY2EvbW9yZW5hLWRhLWFsYmF6by1sZWdpc2xhdGl2by1jb2FsaWNpb24tdmEtcG9yLWR1cmFuZ28tYWN1c2EtcHJp0gFyaHR0cHM6Ly93d3cuZWx1bml2ZXJzYWwuY29tLm14L25hY2lvbi9wb2xpdGljYS9tb3JlbmEtZGEtYWxiYXpvLWxlZ2lzbGF0aXZvLWNvYWxpY2lvbi12YS1wb3ItZHVyYW5nby1hY3VzYS1wcmk_YW1w?oc=5	El Universal	2021-08-15	"Morena da ""albazo"" legislativo a coalición Va por Durango, acusa PRI"
Cae productor en la Condesa por violación agravada - Excélsior	https://news.google.com/__i/rss/rd/articles/CBMiYWh0dHBzOi8vd3d3LmV4Y2Vsc2lvci5jb20ubXgvY29tdW5pZGFkL2NhZS1wcm9kdWN0b3ItZW4tbGEtY29uZGVzYS1wb3ItdmlvbGFjaW9uLWFncmF2YWRhLzE0NjYxNzHSAWVodHRwczovL3d3dy5leGNlbHNpb3IuY29tLm14L2NvbXVuaWRhZC9jYWUtcHJvZHVjdG9yLWVuLWxhLWNvbmRlc2EtcG9yLXZpb2xhY2lvbi1hZ3JhdmFkYS8xNDY2MTcxP2FtcA?oc=5	Excélsior	2021-08-15	Cae productor en la Condesa por violación agravada
México registra 9 mil 295 nuevos contagios de COVID-19 en las últimas 24 horas - Radio Fórmula - Radio Fórmula	https://news.google.com/__i/rss/rd/articles/CBMigQFodHRwczovL3d3dy5yYWRpb2Zvcm11bGEuY29tLm14L25vdGljaWFzLzIwMjEwODE1L21leGljby1yZWdpc3RyYS05LW1pbC0yOTUtbnVldm9zLWNvbnRhZ2lvcy1kZS1jb3ZpZC0xOS1lbi1sYXMtdWx0aW1hcy0yNC1ob3Jhcy_SAYUBaHR0cHM6Ly93d3cucmFkaW9mb3JtdWxhLmNvbS5teC9ub3RpY2lhcy8yMDIxMDgxNS9tZXhpY28tcmVnaXN0cmEtOS1taWwtMjk1LW51ZXZvcy1jb250YWdpb3MtZGUtY292aWQtMTktZW4tbGFzLXVsdGltYXMtMjQtaG9yYXMvYW1wLw?oc=5	Radio Fórmula	2021-08-15	México registra 9 mil 295 nuevos contagios de COVID-19 en las últimas 24 horas
Más de 13 mil páginas se suman a las pruebas contra García Luna en Estados Unidos - SinEmbargo	https://news.google.com/__i/rss/rd/articles/CBMiLGh0dHBzOi8vd3d3LnNpbmVtYmFyZ28ubXgvMTYtMDgtMjAyMS80MDE1MjQw0gEA?oc=5	SinEmbargo	2021-08-16	Más de 13 mil páginas se suman a las pruebas contra García Luna en Estados Unidos
Precio del gas LP aumentó 0.64% respecto a la semana pasada - Noticieros Televisa	https://news.google.com/__i/rss/rd/articles/CBMiXWh0dHBzOi8vd3d3LnRlbGV2aXNhLmNvbS9ub3RpY2lhcy9wcmVjaW8tZGVsLWdhcy1scC1hdW1lbnRvLTAtNjQtcmVzcGVjdG8tYS1sYS1zZW1hbmEtcGFzYWRhL9IBYWh0dHBzOi8vd3d3LnRlbGV2aXNhLmNvbS9ub3RpY2lhcy9wcmVjaW8tZGVsLWdhcy1scC1hdW1lbnRvLTAtNjQtcmVzcGVjdG8tYS1sYS1zZW1hbmEtcGFzYWRhL2FtcC8?oc=5	Noticieros Televisa	2021-08-16	Precio del gas LP aumentó 0.64% respecto a la semana pasada
EU entregará menos agua a México. Es histórico. Por el cambio climático y la sequía - SinEmbargo	https://news.google.com/__i/rss/rd/articles/CBMiLGh0dHBzOi8vd3d3LnNpbmVtYmFyZ28ubXgvMTYtMDgtMjAyMS80MDE1MjU20gEA?oc=5	SinEmbargo	2021-08-16	EU entregará menos agua a México. Es histórico. Por el cambio climático y la sequía
Multa por 903 mdp contra Marzam, Saba, Fanasa, Nadro y Almacén de Drogas y 22 personas: Cofece | El Universal - El Universal	https://news.google.com/__i/rss/rd/articles/CBMigQFodHRwczovL3d3dy5lbHVuaXZlcnNhbC5jb20ubXgvY2FydGVyYS9tdWx0YS1wb3ItOTAzLW1kcC1jb250cmEtbWFyemFtLXNhYmEtZmFuYXNhLW5hZHJvLXktYWxtYWNlbi1kZS1kcm9nYXMteS0yMi1wZXJzb25hcy1jb2ZlY2XSAYUBaHR0cHM6Ly93d3cuZWx1bml2ZXJzYWwuY29tLm14L2NhcnRlcmEvbXVsdGEtcG9yLTkwMy1tZHAtY29udHJhLW1hcnphbS1zYWJhLWZhbmFzYS1uYWRyby15LWFsbWFjZW4tZGUtZHJvZ2FzLXktMjItcGVyc29uYXMtY29mZWNlP2FtcA?oc=5	El Universal	2021-08-16	Multa por 903 mdp contra Marzam, Saba, Fanasa, Nadro y Almacén de Drogas y 22 personas: Cofece
Mapa del coronavirus en México: CdMx y Edomex, con el mayor número de muertes - Milenio	https://news.google.com/__i/rss/rd/articles/CBMiTGh0dHBzOi8vd3d3Lm1pbGVuaW8uY29tL2VzdGFkb3MvY29yb25hdmlydXMtY2Fzb3MtbWV4aWNvLW1hcGEtMTUtYWdvc3RvLTIwMjHSAUxodHRwczovL2FtcC5taWxlbmlvLmNvbS9lc3RhZG9zL2Nvcm9uYXZpcnVzLWNhc29zLW1leGljby1tYXBhLTE1LWFnb3N0by0yMDIx?oc=5	Milenio	2021-08-16	Mapa del coronavirus en México: CdMx y Edomex, con el mayor número de muertes
En manos de Temaca - EL INFORMADOR	https://news.google.com/__i/rss/rd/articles/CBMiRWh0dHBzOi8vd3d3LmluZm9ybWFkb3IubXgvaWRlYXMvRW4tbWFub3MtZGUtVGVtYWNhLTIwMjEwODE2LTAwMjEuaHRtbNIBSWh0dHBzOi8vd3d3LmluZm9ybWFkb3IubXgvYW1wL2lkZWFzL0VuLW1hbm9zLWRlLVRlbWFjYS0yMDIxMDgxNi0wMDIxLmh0bWw?oc=5	EL INFORMADOR	2021-08-16	En manos de Temaca
Gobierno de AMLO ignora dónde están millones de vacunas anti-COVID - Vanguardia.com.mx	https://news.google.com/__i/rss/rd/articles/CBMid2h0dHBzOi8vdmFuZ3VhcmRpYS5jb20ubXgvbm90aWNpYXMvbmFjaW9uYWwvZ29iaWVybm8tZGUtYW1sby1pZ25vcmEtZG9uZGUtZXN0YW4tbWlsbG9uZXMtZGUtdmFjdW5hcy1hbnRpLWNvdmlkLVhMMzg2MzY10gEA?oc=5	Vanguardia.com.mx	2021-08-16	Gobierno de AMLO ignora dónde están millones de vacunas anti-COVID
Vacunación CDMX: ¿Dónde ponerte la segunda dosis de Pfizer y AstraZeneca? - Noticieros Televisa	https://news.google.com/__i/rss/rd/articles/CBMiaWh0dHBzOi8vd3d3LnRlbGV2aXNhLmNvbS9ub3RpY2lhcy92YWN1bmFjaW9uLWNkbXgtZG9uZGUtcG9uZXJ0ZS1sYS1zZWd1bmRhLWRvc2lzLWRlLXBmaXplci15LWFzdHJhemVuZWNhL9IBbWh0dHBzOi8vd3d3LnRlbGV2aXNhLmNvbS9ub3RpY2lhcy92YWN1bmFjaW9uLWNkbXgtZG9uZGUtcG9uZXJ0ZS1sYS1zZWd1bmRhLWRvc2lzLWRlLXBmaXplci15LWFzdHJhemVuZWNhL2FtcC8?oc=5	Noticieros Televisa	2021-08-16	Vacunación CDMX: ¿Dónde ponerte la segunda dosis de Pfizer y AstraZeneca?
Así fue realmente la caída de Tenochtitlán, según el historiador Pedro Salmerón - El Financiero Bloomberg	https://news.google.com/__i/rss/rd/articles/CBMiK2h0dHBzOi8vd3d3LnlvdXR1YmUuY29tL3dhdGNoP3Y9a1c3RGNSZ0VVTDDSAQA?oc=5	El Financiero Bloomberg	2021-08-16	Así fue realmente la caída de Tenochtitlán, según el historiador Pedro Salmerón
Anaya ‘reta’ a AMLO a hacer consulta popular sobre ingreso básico para mexicanos - El Financiero	https://news.google.com/__i/rss/rd/articles/CBMigwFodHRwczovL3d3dy5lbGZpbmFuY2llcm8uY29tLm14L25hY2lvbmFsLzIwMjEvMDgvMTYvYW5heWEtcmV0YS1hLWFtbG8tYS1udWV2YS1jb25zdWx0YS1wb3B1bGFyLWxhLWRlLWluZ3Jlc28tYmFzaWNvLXBhcmEtbWV4aWNhbm9zL9IBkgFodHRwczovL3d3dy5lbGZpbmFuY2llcm8uY29tLm14L25hY2lvbmFsLzIwMjEvMDgvMTYvYW5heWEtcmV0YS1hLWFtbG8tYS1udWV2YS1jb25zdWx0YS1wb3B1bGFyLWxhLWRlLWluZ3Jlc28tYmFzaWNvLXBhcmEtbWV4aWNhbm9zLz9vdXRwdXRUeXBlPWFtcA?oc=5	El Financiero	2021-08-16	Anaya ‘reta’ a AMLO a hacer consulta popular sobre ingreso básico para mexicanos
Beca para uniformes y útiles: ¿Cuándo y de cuánto será el pago para el regreso a clases? - Noticieros Televisa	https://news.google.com/__i/rss/rd/articles/CBMieGh0dHBzOi8vd3d3LnRlbGV2aXNhLmNvbS9ub3RpY2lhcy9iZWNhLXBhcmEtdW5pZm9ybWVzLXktdXRpbGVzLWN1YW5kby15LWRlLWN1YW50by1zZXJhLWVsLXBhZ28tcGFyYS1lbC1yZWdyZXNvLWEtY2xhc2VzL9IBfGh0dHBzOi8vd3d3LnRlbGV2aXNhLmNvbS9ub3RpY2lhcy9iZWNhLXBhcmEtdW5pZm9ybWVzLXktdXRpbGVzLWN1YW5kby15LWRlLWN1YW50by1zZXJhLWVsLXBhZ28tcGFyYS1lbC1yZWdyZXNvLWEtY2xhc2VzL2FtcC8?oc=5	Noticieros Televisa	2021-08-16	Beca para uniformes y útiles: ¿Cuándo y de cuánto será el pago para el regreso a clases?
Investigan muerte de mujer tras recibir la vacuna covid-19 en Nuevo León - Excélsior	https://news.google.com/__i/rss/rd/articles/CBMidmh0dHBzOi8vd3d3LmV4Y2Vsc2lvci5jb20ubXgvbmFjaW9uYWwvaW52ZXN0aWdhbi1tdWVydGUtZGUtbXVqZXItdHJhcy1yZWNpYmlyLWxhLXZhY3VuYS1jb3ZpZC0xOS1lbi1udWV2by1sZW9uLzE0NjYxNzfSAXpodHRwczovL3d3dy5leGNlbHNpb3IuY29tLm14L25hY2lvbmFsL2ludmVzdGlnYW4tbXVlcnRlLWRlLW11amVyLXRyYXMtcmVjaWJpci1sYS12YWN1bmEtY292aWQtMTktZW4tbnVldm8tbGVvbi8xNDY2MTc3P2FtcA?oc=5	Excélsior	2021-08-16	Investigan muerte de mujer tras recibir la vacuna covid-19 en Nuevo León
Desaparecidos en Jalisco: Buscan a cuatro jóvenes de SLP que iban a Tonalá - EL INFORMADOR	https://news.google.com/__i/rss/rd/articles/CBMifmh0dHBzOi8vd3d3LmluZm9ybWFkb3IubXgvamFsaXNjby9EZXNhcGFyZWNpZG9zLWVuLUphbGlzY28tQnVzY2FuLWEtY3VhdHJvLWpvdmVuZXMtZGUtU0xQLXF1ZS1pYmFuLWEtVG9uYWxhLTIwMjEwODE2LTAwNjUuaHRtbNIBggFodHRwczovL3d3dy5pbmZvcm1hZG9yLm14L2FtcC9qYWxpc2NvL0Rlc2FwYXJlY2lkb3MtZW4tSmFsaXNjby1CdXNjYW4tYS1jdWF0cm8tam92ZW5lcy1kZS1TTFAtcXVlLWliYW4tYS1Ub25hbGEtMjAyMTA4MTYtMDA2NS5odG1s?oc=5	EL INFORMADOR	2021-08-16	Desaparecidos en Jalisco: Buscan a cuatro jóvenes de SLP que iban a Tonalá
Clima hoy 16 de agosto: Onda tropical 21 causará fuertes lluvias - Noticieros Televisa	https://news.google.com/__i/rss/rd/articles/CBMiYmh0dHBzOi8vd3d3LnRlbGV2aXNhLmNvbS9ub3RpY2lhcy9jbGltYS1ob3ktMTYtZGUtYWdvc3RvLW9uZGEtdHJvcGljYWwtMjEtY2F1c2FyYS1mdWVydGVzLWxsdXZpYXMv0gFmaHR0cHM6Ly93d3cudGVsZXZpc2EuY29tL25vdGljaWFzL2NsaW1hLWhveS0xNi1kZS1hZ29zdG8tb25kYS10cm9waWNhbC0yMS1jYXVzYXJhLWZ1ZXJ0ZXMtbGx1dmlhcy9hbXAv?oc=5	Noticieros Televisa	2021-08-16	Clima hoy 16 de agosto: Onda tropical 21 causará fuertes lluvias
Infonavit: Así puedes comprar una casa a bajo precio - Noticieros Televisa	https://news.google.com/__i/rss/rd/articles/CBMiVmh0dHBzOi8vd3d3LnRlbGV2aXNhLmNvbS9ub3RpY2lhcy9pbmZvbmF2aXQtYXNpLXB1ZWRlcy1jb21wcmFyLXVuYS1jYXNhLWEtYmFqby1wcmVjaW8v0gFaaHR0cHM6Ly93d3cudGVsZXZpc2EuY29tL25vdGljaWFzL2luZm9uYXZpdC1hc2ktcHVlZGVzLWNvbXByYXItdW5hLWNhc2EtYS1iYWpvLXByZWNpby9hbXAv?oc=5	Noticieros Televisa	2021-08-16	Infonavit: Así puedes comprar una casa a bajo precio
Viola Ley familia de Manuel de la O; arman rodeo en Juárez - El Horizonte	https://news.google.com/__i/rss/rd/articles/CBMiVmh0dHBzOi8vd3d3LmVsaG9yaXpvbnRlLm14L2xvY2FsL3Zpb2xhLWxleS1mYW1pbGlhLW1hbnVlbC1vLWFybWFuLXJvZGVvLWp1YXJlei80MDI5NDA40gEA?oc=5	El Horizonte	2021-08-16	Viola Ley familia de Manuel de la O; arman rodeo en Juárez
¿A quién le corresponde la pensión por viudez de un trabajador bígamo? - El Economista	https://news.google.com/__i/rss/rd/articles/CBMihQFodHRwczovL3d3dy5lbGVjb25vbWlzdGEuY29tLm14L2NhcGl0YWxodW1hbm8vQS1xdWllbi1sZS1jb3JyZXNwb25kZS1sYS1wZW5zaW9uLXBvci12aXVkZXotZGUtdW4tdHJhYmFqYWRvci1iaWdhbW8tMjAyMTA4MTUtMDAwMy5odG1s0gGJAWh0dHBzOi8vd3d3LmVsZWNvbm9taXN0YS5jb20ubXgvYW1wL2NhcGl0YWxodW1hbm8vQS1xdWllbi1sZS1jb3JyZXNwb25kZS1sYS1wZW5zaW9uLXBvci12aXVkZXotZGUtdW4tdHJhYmFqYWRvci1iaWdhbW8tMjAyMTA4MTUtMDAwMy5odG1s?oc=5	El Economista	2021-08-16	¿A quién le corresponde la pensión por viudez de un trabajador bígamo?
“Si no se alinea (el H2), mátalo”, ordenó exgobernador Sandoval: exfiscal en EU - SinEmbargo	https://news.google.com/__i/rss/rd/articles/CBMiLGh0dHBzOi8vd3d3LnNpbmVtYmFyZ28ubXgvMTYtMDgtMjAyMS80MDE1MDM10gEA?oc=5	SinEmbargo	2021-08-16	“Si no se alinea (el H2), mátalo”, ordenó exgobernador Sandoval: exfiscal en EU
Hidalgo no regresará a clases presenciales: Fayad - Excélsior	https://news.google.com/__i/rss/rd/articles/CBMiXmh0dHBzOi8vd3d3LmV4Y2Vsc2lvci5jb20ubXgvbmFjaW9uYWwvaGlkYWxnby1uby1yZWdyZXNhcmEtYS1jbGFzZXMtcHJlc2VuY2lhbGVzLWZheWFkLzE0NjYxODjSAWJodHRwczovL3d3dy5leGNlbHNpb3IuY29tLm14L25hY2lvbmFsL2hpZGFsZ28tbm8tcmVncmVzYXJhLWEtY2xhc2VzLXByZXNlbmNpYWxlcy1mYXlhZC8xNDY2MTg4P2FtcA?oc=5	Excélsior	2021-08-16	Hidalgo no regresará a clases presenciales: Fayad
Mario Delgado, líder de Morena, denuncia que su cuenta de WhatsApp fue hackeada - Radio Fórmula - Radio Fórmula	https://news.google.com/__i/rss/rd/articles/CBMigAFodHRwczovL3d3dy5yYWRpb2Zvcm11bGEuY29tLm14L25vdGljaWFzLzIwMjEwODE2L21hcmlvLWRlbGdhZG8tbGlkZXItZGUtbW9yZW5hLWRlbnVuY2lhLXF1ZS1zdS1jdWVudGEtZGUtd2hhdHNhcHAtZnVlLWhhY2tlYWRhL9IBhAFodHRwczovL3d3dy5yYWRpb2Zvcm11bGEuY29tLm14L25vdGljaWFzLzIwMjEwODE2L21hcmlvLWRlbGdhZG8tbGlkZXItZGUtbW9yZW5hLWRlbnVuY2lhLXF1ZS1zdS1jdWVudGEtZGUtd2hhdHNhcHAtZnVlLWhhY2tlYWRhL2FtcC8?oc=5	Radio Fórmula	2021-08-16	Mario Delgado, líder de Morena, denuncia que su cuenta de WhatsApp fue hackeada
Feministas arriban al Ángel de la Independencia; se registra trifulca | El Universal - El Universal	https://news.google.com/__i/rss/rd/articles/CBMicmh0dHBzOi8vd3d3LmVsdW5pdmVyc2FsLmNvbS5teC9tZXRyb3BvbGkvY2RteC9mZW1pbmlzdGFzLWFycmliYW4tYWwtYW5nZWwtZGUtbGEtaW5kZXBlbmRlbmNpYS1zZS1yZWdpc3RyYS10cmlmdWxjYdIBdmh0dHBzOi8vd3d3LmVsdW5pdmVyc2FsLmNvbS5teC9tZXRyb3BvbGkvY2RteC9mZW1pbmlzdGFzLWFycmliYW4tYWwtYW5nZWwtZGUtbGEtaW5kZXBlbmRlbmNpYS1zZS1yZWdpc3RyYS10cmlmdWxjYT9hbXA?oc=5	El Universal	2021-08-16	Feministas arriban al Ángel de la Independencia; se registra trifulca
Perrito es jefe de seguridad de una farmacia, Pachuca - Las Noticias - Noticieros Televisa	https://news.google.com/__i/rss/rd/articles/CBMiK2h0dHBzOi8vd3d3LnlvdXR1YmUuY29tL3dhdGNoP3Y9d28xbmhjSmJ4NknSAQA?oc=5	Noticieros Televisa	2021-08-16	Perrito es jefe de seguridad de una farmacia, PachucaLas Noticias
Elon Musk quiere arrebatarle la marca Starlink a la firma mexicana StarGroup - El Financiero	https://news.google.com/__i/rss/rd/articles/CBMiiQFodHRwczovL3d3dy5lbGZpbmFuY2llcm8uY29tLm14L2VtcHJlc2FzLzIwMjEvMDgvMTYvZW1wcmVzYS1kZS1lbG9uLW11c2stcXVpZXJlLXF1aXRhcmxlLWxhLW1hcmNhLXN0YXJsaW5rLWEtbGEtZmlybWEtbWV4aWNhbmEtc3Rhcmdyb3VwL9IBmAFodHRwczovL3d3dy5lbGZpbmFuY2llcm8uY29tLm14L2VtcHJlc2FzLzIwMjEvMDgvMTYvZW1wcmVzYS1kZS1lbG9uLW11c2stcXVpZXJlLXF1aXRhcmxlLWxhLW1hcmNhLXN0YXJsaW5rLWEtbGEtZmlybWEtbWV4aWNhbmEtc3Rhcmdyb3VwLz9vdXRwdXRUeXBlPWFtcA?oc=5	El Financiero	2021-08-16	Elon Musk quiere arrebatarle la marca Starlink a la firma mexicana StarGroup
SEP: ¿Cuándo son las inscripciones y qué requisitos piden? - Noticieros Televisa	https://news.google.com/__i/rss/rd/articles/CBMiWmh0dHBzOi8vd3d3LnRlbGV2aXNhLmNvbS9ub3RpY2lhcy9zZXAtY3VhbmRvLXNvbi1sYXMtaW5zY3JpcGNpb25lcy15LXF1ZS1yZXF1aXNpdG9zLXBpZGVuL9IBXmh0dHBzOi8vd3d3LnRlbGV2aXNhLmNvbS9ub3RpY2lhcy9zZXAtY3VhbmRvLXNvbi1sYXMtaW5zY3JpcGNpb25lcy15LXF1ZS1yZXF1aXNpdG9zLXBpZGVuL2FtcC8?oc=5	Noticieros Televisa	2021-08-16	SEP: ¿Cuándo son las inscripciones y qué requisitos piden?
CNTE aplica encuesta a padres de familia sobre regreso a clases presenciales - Milenio	https://news.google.com/__i/rss/rd/articles/CBMiUGh0dHBzOi8vd3d3Lm1pbGVuaW8uY29tL3BvbGl0aWNhL2NudGUtY29uc3VsdGFyYS1wYWRyZXMtY2FydGEtc2VwLXJlZ3Jlc28tY2xhc2Vz0gFQaHR0cHM6Ly9hbXAubWlsZW5pby5jb20vcG9saXRpY2EvY250ZS1jb25zdWx0YXJhLXBhZHJlcy1jYXJ0YS1zZXAtcmVncmVzby1jbGFzZXM?oc=5	Milenio	2021-08-16	CNTE aplica encuesta a padres de familia sobre regreso a clases presenciales
“Se entregaron a presiones del poderoso”: Margarita Zavala advirtió al INE y TEPJF sobre AMLO - infobae	https://news.google.com/__i/rss/rd/articles/CBMijQFodHRwczovL3d3dy5pbmZvYmFlLmNvbS9hbWVyaWNhL21leGljby8yMDIxLzA4LzE2L3NlLWVudHJlZ2Fyb24tYS1wcmVzaW9uZXMtZGVsLXBvZGVyb3NvLW1hcmdhcml0YS16YXZhbGEtYWR2aXJ0aW8tYWwtaW5lLXktdGVwamYtc29icmUtYW1sby_SAaEBaHR0cHM6Ly93d3cuaW5mb2JhZS5jb20vYW1lcmljYS9tZXhpY28vMjAyMS8wOC8xNi9zZS1lbnRyZWdhcm9uLWEtcHJlc2lvbmVzLWRlbC1wb2Rlcm9zby1tYXJnYXJpdGEtemF2YWxhLWFkdmlydGlvLWFsLWluZS15LXRlcGpmLXNvYnJlLWFtbG8vP291dHB1dFR5cGU9YW1wLXR5cGU?oc=5	infobae	2021-08-16	“Se entregaron a presiones del poderoso”: Margarita Zavala advirtió al INE y TEPJF sobre AMLO
“Nada humano es ajeno”: AMLO reafirmó el apoyo de México a Haití tras fuerte sismo - infobae	https://news.google.com/__i/rss/rd/articles/CBMifmh0dHBzOi8vd3d3LmluZm9iYWUuY29tL2FtZXJpY2EvbWV4aWNvLzIwMjEvMDgvMTYvZGVjaWRpbW9zLWFwb3lhci1hbWxvLXJlYWZpcm1vLWVsLWFwb3lvLWRlLW1leGljby1hLWhhaXRpLXRyYXMtZnVlcnRlLXNpc21vL9IBkgFodHRwczovL3d3dy5pbmZvYmFlLmNvbS9hbWVyaWNhL21leGljby8yMDIxLzA4LzE2L2RlY2lkaW1vcy1hcG95YXItYW1sby1yZWFmaXJtby1lbC1hcG95by1kZS1tZXhpY28tYS1oYWl0aS10cmFzLWZ1ZXJ0ZS1zaXNtby8_b3V0cHV0VHlwZT1hbXAtdHlwZQ?oc=5	infobae	2021-08-16	“Nada humano es ajeno”: AMLO reafirmó el apoyo de México a Haití tras fuerte sismo
Llama alcalde electo ‘bocón’ al gobernador - El Diario	https://news.google.com/__i/rss/rd/articles/CBMiV2h0dHBzOi8vZGlhcmlvLm14L2p1YXJlei9sbGFtYS1hbGNhbGRlLWVsZWN0by1ib2Nvbi1hbC1nb2Jlcm5hZG9yLTIwMjEwODE2LTE4MzA1MDguaHRtbNIBW2h0dHBzOi8vZGlhcmlvLm14L2p1YXJlei9hbXAvbGxhbWEtYWxjYWxkZS1lbGVjdG8tYm9jb24tYWwtZ29iZXJuYWRvci0yMDIxMDgxNi0xODMwNTA4Lmh0bWw?oc=5	El Diario	2021-08-16	Llama alcalde electo ‘bocón’ al gobernador
Unicef palomea regreso a las aulas; pide a SEP dar más información - Milenio	https://news.google.com/__i/rss/rd/articles/CBMiYGh0dHBzOi8vd3d3Lm1pbGVuaW8uY29tL3BvbGl0aWNhL2NvbXVuaWRhZC91bmljZWYtcGlkZS1zZXAtaW5mb3JtYWNpb24tcmVncmVzby1jbGFzZXMtcHJlc2VuY2lhbNIBYGh0dHBzOi8vYW1wLm1pbGVuaW8uY29tL3BvbGl0aWNhL2NvbXVuaWRhZC91bmljZWYtcGlkZS1zZXAtaW5mb3JtYWNpb24tcmVncmVzby1jbGFzZXMtcHJlc2VuY2lhbA?oc=5	Milenio	2021-08-16	Unicef palomea regreso a las aulas; pide a SEP dar más información
Moderna: Avanza en México el aval para el uso de la vacuna contra Covid-19 | El Universal - El Universal	https://news.google.com/__i/rss/rd/articles/CBMib2h0dHBzOi8vd3d3LmVsdW5pdmVyc2FsLmNvbS5teC9uYWNpb24vbW9kZXJuYS1hdmFuemEtZW4tbWV4aWNvLWVsLWF2YWwtcGFyYS1lbC11c28tZGUtbGEtdmFjdW5hLWNvbnRyYS1jb3ZpZC0xOdIBc2h0dHBzOi8vd3d3LmVsdW5pdmVyc2FsLmNvbS5teC9uYWNpb24vbW9kZXJuYS1hdmFuemEtZW4tbWV4aWNvLWVsLWF2YWwtcGFyYS1lbC11c28tZGUtbGEtdmFjdW5hLWNvbnRyYS1jb3ZpZC0xOT9hbXA?oc=5	El Universal	2021-08-16	Moderna: Avanza en México el aval para el uso de la vacuna contra Covid-19
El futuro del T-MEC está en Silao; y ya hubo ‘choque’ en votación sindical - El Financiero	https://news.google.com/__i/rss/rd/articles/CBMiZGh0dHBzOi8vd3d3LmVsZmluYW5jaWVyby5jb20ubXgvZWNvbm9taWEvMjAyMS8wOC8xNi9jaG9jYW4tZW4tbGEtcHJpbWVyYS12b3RhY2lvbi1zaW5kaWNhbC1lbi10LW1lYy_SAXNodHRwczovL3d3dy5lbGZpbmFuY2llcm8uY29tLm14L2Vjb25vbWlhLzIwMjEvMDgvMTYvY2hvY2FuLWVuLWxhLXByaW1lcmEtdm90YWNpb24tc2luZGljYWwtZW4tdC1tZWMvP291dHB1dFR5cGU9YW1w?oc=5	El Financiero	2021-08-16	El futuro del T-MEC está en Silao; y ya hubo ‘choque’ en votación sindical
En 15 días veríamos declive de la tercera ola de COVID: López-Gatell - Uno TV Noticias	https://news.google.com/__i/rss/rd/articles/CBMiY2h0dHBzOi8vd3d3LnVub3R2LmNvbS9uYWNpb25hbC90ZXJjZXJhLW9sYS1kZS1jb3ZpZC0xOS1lbi0xNS1kaWFzLXZlcmlhbW9zLXN1LWRlY2xpdmUtbG9wZXotZ2F0ZWxsL9IBY2h0dHBzOi8vd3d3LnVub3R2LmNvbS9uYWNpb25hbC90ZXJjZXJhLW9sYS1kZS1jb3ZpZC0xOS1lbi0xNS1kaWFzLXZlcmlhbW9zLXN1LWRlY2xpdmUtbG9wZXotZ2F0ZWxsLw?oc=5	Uno TV Noticias	2021-08-17	En 15 días veríamos declive de la tercera ola de COVID: López-Gatell
Rubén Rocha Moya adelanta dos nombres de quienes conformarían su gabinete - Debate	https://news.google.com/__i/rss/rd/articles/CBMif2h0dHBzOi8vd3d3LmRlYmF0ZS5jb20ubXgvY3VsaWFjYW4vUnViZW4tUm9jaGEtTW95YS1hZGVsYW50ZS1kb3Mtbm9tYnJlcy1kZS1xdWllbmVzLWNvbmZvcm1hcmlhbi1zdS1nYWJpbmV0ZS0yMDIxMDgxNy0wMTgxLmh0bWzSAX9odHRwczovL3d3dy5kZWJhdGUuY29tLm14L2N1bGlhY2FuL1J1YmVuLVJvY2hhLU1veWEtYWRlbGFudGUtZG9zLW5vbWJyZXMtZGUtcXVpZW5lcy1jb25mb3JtYXJpYW4tc3UtZ2FiaW5ldGUtMjAyMTA4MTctMDE4MS5odG1s?oc=5	Debate	2021-08-17	Rubén Rocha Moya adelanta dos nombres de quienes conformarían su gabinete
Víctimas de la México-Cuernavaca son identificadas. Una tenía 17 años - SinEmbargo	https://news.google.com/__i/rss/rd/articles/CBMiLGh0dHBzOi8vd3d3LnNpbmVtYmFyZ28ubXgvMTYtMDgtMjAyMS80MDE1MzM00gEA?oc=5	SinEmbargo	2021-08-17	Víctimas de la México-Cuernavaca son identificadas. Una tenía 17 años
Juez ordena vacunar contra COVID-19 a menor de edad en CDMX - El Financiero	https://news.google.com/__i/rss/rd/articles/CBMicGh0dHBzOi8vd3d3LmVsZmluYW5jaWVyby5jb20ubXgvbmFjaW9uYWwvMjAyMS8wOC8xNy9qdWV6LW9yZGVuYS12YWN1bmFyLWNvbnRyYS1jb3ZpZC0xOS1hLW1lbm9yLWRlLWVkYWQtZW4tY2RteC_SAX9odHRwczovL3d3dy5lbGZpbmFuY2llcm8uY29tLm14L25hY2lvbmFsLzIwMjEvMDgvMTcvanVlei1vcmRlbmEtdmFjdW5hci1jb250cmEtY292aWQtMTktYS1tZW5vci1kZS1lZGFkLWVuLWNkbXgvP291dHB1dFR5cGU9YW1w?oc=5	El Financiero	2021-08-17	Juez ordena vacunar contra COVID-19 a menor de edad en CDMX
Explosión Benito Juárez. Tras susto, vecinos denuncian robo de laptops, scooters y videojuegos | El Universal - El Universal	https://news.google.com/__i/rss/rd/articles/CBMieGh0dHBzOi8vd3d3LmVsdW5pdmVyc2FsLmNvbS5teC9tZXRyb3BvbGkvZXhwbG9zaW9uLWJlbml0by1qdWFyZXotdHJhcy1zdXN0by12ZWNpbm9zLWRlbnVuY2lhbi1yb2JvLWRlLWxhcHRvcHMtc2Nvb3RlcnMtedIBfGh0dHBzOi8vd3d3LmVsdW5pdmVyc2FsLmNvbS5teC9tZXRyb3BvbGkvZXhwbG9zaW9uLWJlbml0by1qdWFyZXotdHJhcy1zdXN0by12ZWNpbm9zLWRlbnVuY2lhbi1yb2JvLWRlLWxhcHRvcHMtc2Nvb3RlcnMteT9hbXA?oc=5	El Universal	2021-08-17	Explosión Benito Juárez. Tras susto, vecinos denuncian robo de laptops, scooters y videojuegos
Funcionario y seguidores de la 4T linchan a Brenda Lozano | El Universal - El Universal	https://news.google.com/__i/rss/rd/articles/CBMiXmh0dHBzOi8vd3d3LmVsdW5pdmVyc2FsLmNvbS5teC9jdWx0dXJhL2Z1bmNpb25hcmlvLXktc2VndWlkb3Jlcy1kZS1sYS00dC1saW5jaGFuLWJyZW5kYS1sb3phbm_SAWJodHRwczovL3d3dy5lbHVuaXZlcnNhbC5jb20ubXgvY3VsdHVyYS9mdW5jaW9uYXJpby15LXNlZ3VpZG9yZXMtZGUtbGEtNHQtbGluY2hhbi1icmVuZGEtbG96YW5vP2FtcA?oc=5	El Universal	2021-08-17	Funcionario y seguidores de la 4T linchan a Brenda Lozano
Miguel Alemán Magnani: Interpol emite ficha roja para su captura - El Financiero	https://news.google.com/__i/rss/rd/articles/CBMidGh0dHBzOi8vd3d3LmVsZmluYW5jaWVyby5jb20ubXgvbmFjaW9uYWwvMjAyMS8wOC8xNy9taWd1ZWwtYWxlbWFuLW1hZ25hbmktaW50ZXJwb2wtZW1pdGUtZmljaGEtcm9qYS1wYXJhLXN1LWNhcHR1cmEv0gGDAWh0dHBzOi8vd3d3LmVsZmluYW5jaWVyby5jb20ubXgvbmFjaW9uYWwvMjAyMS8wOC8xNy9taWd1ZWwtYWxlbWFuLW1hZ25hbmktaW50ZXJwb2wtZW1pdGUtZmljaGEtcm9qYS1wYXJhLXN1LWNhcHR1cmEvP291dHB1dFR5cGU9YW1w?oc=5	El Financiero	2021-08-17	Miguel Alemán Magnani: Interpol emite ficha roja para su captura
AMLO se deslinda de la carta compromiso de la SEP y dice que no es obligatoria - Expansión Política	https://news.google.com/__i/rss/rd/articles/CBMigwFodHRwczovL3BvbGl0aWNhLmV4cGFuc2lvbi5teC9wcmVzaWRlbmNpYS8yMDIxLzA4LzE3L2FtbG8tc2UtZGVzbGluZGEtZGUtbGEtY2FydGEtY29tcHJvbWlzby1kZS1sYS1zZXAteS1kaWNlLXF1ZS1uby1lcy1vYmxpZ2F0b3JpYdIBjQFodHRwczovL3BvbGl0aWNhLmV4cGFuc2lvbi5teC9wcmVzaWRlbmNpYS8yMDIxLzA4LzE3L2FtbG8tc2UtZGVzbGluZGEtZGUtbGEtY2FydGEtY29tcHJvbWlzby1kZS1sYS1zZXAteS1kaWNlLXF1ZS1uby1lcy1vYmxpZ2F0b3JpYT9fYW1wPXRydWU?oc=5	Expansión Política	2021-08-17	AMLO se deslinda de la carta compromiso de la SEP y dice que no es obligatoria
Precio del dólar hoy 17 de agosto de 2021 en México; tipo de cambio - Noticieros Televisa	https://news.google.com/__i/rss/rd/articles/CBMiZWh0dHBzOi8vd3d3LnRlbGV2aXNhLmNvbS9ub3RpY2lhcy9wcmVjaW8tZGVsLWRvbGFyLWhveS0xNy1kZS1hZ29zdG8tZGUtMjAyMS1lbi1tZXhpY28tdGlwby1kZS1jYW1iaW8v0gFpaHR0cHM6Ly93d3cudGVsZXZpc2EuY29tL25vdGljaWFzL3ByZWNpby1kZWwtZG9sYXItaG95LTE3LWRlLWFnb3N0by1kZS0yMDIxLWVuLW1leGljby10aXBvLWRlLWNhbWJpby9hbXAv?oc=5	Noticieros Televisa	2021-08-17	Precio del dólar hoy 17 de agosto de 2021 en México; tipo de cambio
Difunden nuevos videos sobre detención de José Eduardo Ravelo; están editados, acusa abogado de policías - Milenio	https://news.google.com/__i/rss/rd/articles/CBMiTWh0dHBzOi8vd3d3Lm1pbGVuaW8uY29tL3BvbGljaWEvam9zZS1lZHVhcmRvLXJhdmVsby1kaWZ1bmRlbi12aWRlb3MtZGV0ZW5jaW9u0gFNaHR0cHM6Ly9hbXAubWlsZW5pby5jb20vcG9saWNpYS9qb3NlLWVkdWFyZG8tcmF2ZWxvLWRpZnVuZGVuLXZpZGVvcy1kZXRlbmNpb24?oc=5	Milenio	2021-08-17	Difunden nuevos videos sobre detención de José Eduardo Ravelo; están editados, acusa abogado de policías
Aprueban en comisiones del Senado la Ley de Revocación de Mandato | El Universal - El Universal	https://news.google.com/__i/rss/rd/articles/CBMiZ2h0dHBzOi8vd3d3LmVsdW5pdmVyc2FsLmNvbS5teC9uYWNpb24vYXBydWViYW4tZW4tY29taXNpb25lcy1kZWwtc2VuYWRvLWxhLWxleS1kZS1yZXZvY2FjaW9uLWRlLW1hbmRhdG_SAWtodHRwczovL3d3dy5lbHVuaXZlcnNhbC5jb20ubXgvbmFjaW9uL2FwcnVlYmFuLWVuLWNvbWlzaW9uZXMtZGVsLXNlbmFkby1sYS1sZXktZGUtcmV2b2NhY2lvbi1kZS1tYW5kYXRvP2FtcA?oc=5	El Universal	2021-08-17	Aprueban en comisiones del Senado la Ley de Revocación de Mandato
Diálogo económico de alto nivel entre México y EU será el 9 de septiembre: Ebrard - SinEmbargo MX	https://news.google.com/__i/rss/rd/articles/CBMiLGh0dHBzOi8vd3d3LnNpbmVtYmFyZ28ubXgvMTctMDgtMjAyMS80MDE1Mzg30gEA?oc=5	SinEmbargo MX	2021-08-17	Diálogo económico de alto nivel entre México y EU será el 9 de septiembre: Ebrard
Último video de 'La Negrita' antes de morir en la México-Cuernavaca - Excélsior	https://news.google.com/__i/rss/rd/articles/CBMicGh0dHBzOi8vd3d3LmV4Y2Vsc2lvci5jb20ubXgvY29tdW5pZGFkL3VsdGltby12aWRlby1kZS1sYS1uZWdyaXRhLWFudGVzLWRlLW1vcmlyLWVuLWxhLW1leGljby1jdWVybmF2YWNhLzE0NjY0NjjSAXRodHRwczovL3d3dy5leGNlbHNpb3IuY29tLm14L2NvbXVuaWRhZC91bHRpbW8tdmlkZW8tZGUtbGEtbmVncml0YS1hbnRlcy1kZS1tb3Jpci1lbi1sYS1tZXhpY28tY3Vlcm5hdmFjYS8xNDY2NDY4P2FtcA?oc=5	Excélsior	2021-08-17	Último video de 'La Negrita' antes de morir en la México-Cuernavaca
VIDEOS: Youtuber mexicano muestra, desde adentro, cómo es la vida en Afganistán - SinEmbargo	https://news.google.com/__i/rss/rd/articles/CBMiLGh0dHBzOi8vd3d3LnNpbmVtYmFyZ28ubXgvMTYtMDgtMjAyMS80MDE1MzA40gEA?oc=5	SinEmbargo	2021-08-17	VIDEOS: Youtuber mexicano muestra, desde adentro, cómo es la vida en Afganistán
IMSS ofrece rehabilitación de secuelas post COVID-19 - Noticieros Televisa	https://news.google.com/__i/rss/rd/articles/CBMiV2h0dHBzOi8vd3d3LnRlbGV2aXNhLmNvbS9ub3RpY2lhcy9pbXNzLW9mcmVjZS1yZWhhYmlsaXRhY2lvbi1kZS1zZWN1ZWxhcy1wb3N0LWNvdmlkLTE5L9IBW2h0dHBzOi8vd3d3LnRlbGV2aXNhLmNvbS9ub3RpY2lhcy9pbXNzLW9mcmVjZS1yZWhhYmlsaXRhY2lvbi1kZS1zZWN1ZWxhcy1wb3N0LWNvdmlkLTE5L2FtcC8?oc=5	Noticieros Televisa	2021-08-17	IMSS ofrece rehabilitación de secuelas post COVID-19
Indigente robó traje de José María Morelos y recorrió las calles de Apatzingán, Michoacán con él - infobae	https://news.google.com/__i/rss/rd/articles/CBMikgFodHRwczovL3d3dy5pbmZvYmFlLmNvbS9hbWVyaWNhL21leGljby8yMDIxLzA4LzE3L2luZGlnZW50ZS1yb2JvLXRyYWplLWRlLWpvc2UtbWFyaWEtbW9yZWxvcy15LXJlY29ycmlvLWxhcy1jYWxsZXMtZGUtYXBhdHppbmdhbi1taWNob2FjYW4tY29uLWVsL9IBpgFodHRwczovL3d3dy5pbmZvYmFlLmNvbS9hbWVyaWNhL21leGljby8yMDIxLzA4LzE3L2luZGlnZW50ZS1yb2JvLXRyYWplLWRlLWpvc2UtbWFyaWEtbW9yZWxvcy15LXJlY29ycmlvLWxhcy1jYWxsZXMtZGUtYXBhdHppbmdhbi1taWNob2FjYW4tY29uLWVsLz9vdXRwdXRUeXBlPWFtcC10eXBl?oc=5	infobae	2021-08-17	Indigente robó traje de José María Morelos y recorrió las calles de Apatzingán, Michoacán con él
