title	link	source	date	title_corrected
Al menos 22 muertos en dos motines en cárceles de Ecuador - EL PAÍS	https://news.google.com/__i/rss/rd/articles/CBMiamh0dHBzOi8vZWxwYWlzLmNvbS9pbnRlcm5hY2lvbmFsLzIwMjEtMDctMjMvYWwtbWVub3MtMjItbXVlcnRvcy1lbi1kb3MtbW90aW5lcy1lbi1jYXJjZWxlcy1kZS1lY3VhZG9yLmh0bWzSAXlodHRwczovL2VscGFpcy5jb20vaW50ZXJuYWNpb25hbC8yMDIxLTA3LTIzL2FsLW1lbm9zLTIyLW11ZXJ0b3MtZW4tZG9zLW1vdGluZXMtZW4tY2FyY2VsZXMtZGUtZWN1YWRvci5odG1sP291dHB1dFR5cGU9YW1w?oc=5	EL PAÍS	2021-07-23	Al menos 22 muertos en dos motines en cárceles de Ecuador
En cuatro pasos puede obtener su licencia digital en Ecuador: el documento es válido desde enero de 2021 - El Universo	https://news.google.com/__i/rss/rd/articles/CBMimQFodHRwczovL3d3dy5lbHVuaXZlcnNvLmNvbS9ub3RpY2lhcy9lY3VhZG9yL2VuLWN1YXRyby1wYXNvcy1wdWVkZS1vYnRlbmVyLXN1LWxpY2VuY2lhLWRpZ2l0YWwtZW4tZWN1YWRvci1lbC1kb2N1bWVudG8tZXMtdmFsaWRvLWRlc2RlLWVuZXJvLWRlLTIwMjEtbm90YS_SAagBaHR0cHM6Ly93d3cuZWx1bml2ZXJzby5jb20vbm90aWNpYXMvZWN1YWRvci9lbi1jdWF0cm8tcGFzb3MtcHVlZGUtb2J0ZW5lci1zdS1saWNlbmNpYS1kaWdpdGFsLWVuLWVjdWFkb3ItZWwtZG9jdW1lbnRvLWVzLXZhbGlkby1kZXNkZS1lbmVyby1kZS0yMDIxLW5vdGEvP291dHB1dFR5cGU9YW1w?oc=5	El Universo	2021-07-27	En cuatro pasos puede obtener su licencia digital en Ecuador: el documento es válido desde enero de 2021
La justicia de Ecuador acepta la retirada de la nacionalidad de su país a Julian Assange - RT en Español	https://news.google.com/__i/rss/rd/articles/CBMiV2h0dHBzOi8vYWN0dWFsaWRhZC5ydC5jb20vYWN0dWFsaWRhZC8zOTg5ODUtanVzdGljaWEtZWN1YWRvci1hY2VwdGEtcmV0aXJvLW5hY2lvbmFsaWRhZNIBW2h0dHBzOi8vYWN0dWFsaWRhZC5ydC5jb20vYWN0dWFsaWRhZC8zOTg5ODUtanVzdGljaWEtZWN1YWRvci1hY2VwdGEtcmV0aXJvLW5hY2lvbmFsaWRhZC9hbXA?oc=5	RT en Español	2021-07-27	La justicia de Ecuador acepta la retirada de la nacionalidad de su país a Julian Assange
"¿Puede Ecuador lograr ""lo imposible"" y pasar de una economía petrolera a la bioeconomía? - BBC News Mundo"	https://news.google.com/__i/rss/rd/articles/CBMiOmh0dHBzOi8vd3d3LmJiYy5jb20vbXVuZG8vbm90aWNpYXMtYW1lcmljYS1sYXRpbmEtNTgwNTY5MDDSAT5odHRwczovL3d3dy5iYmMuY29tL211bmRvL25vdGljaWFzLWFtZXJpY2EtbGF0aW5hLTU4MDU2OTAwLmFtcA?oc=5	BBC News Mundo	2021-08-02	"¿Puede Ecuador lograr ""lo imposible"" y pasar de una economía petrolera a la bioeconomía?"
"Olímpicos de Tokio | El impacto en Ecuador de los ""turbantes"" y el afro de las mujeres medallistas olímpicas - BBC News Mundo"	https://news.google.com/__i/rss/rd/articles/CBMiOmh0dHBzOi8vd3d3LmJiYy5jb20vbXVuZG8vbm90aWNpYXMtYW1lcmljYS1sYXRpbmEtNTgwOTU1MznSAT5odHRwczovL3d3dy5iYmMuY29tL211bmRvL25vdGljaWFzLWFtZXJpY2EtbGF0aW5hLTU4MDk1NTM5LmFtcA?oc=5	BBC News Mundo	2021-08-05	"Olímpicos de TokioEl impacto en Ecuador de los ""turbantes"" y el afro de las mujeres medallistas olímpicas"
Putin y Lasso abordan la relación entre Rusia y Ecuador y la lucha contra el covid-19 en una conversación... - RT en Español	https://news.google.com/__i/rss/rd/articles/CBMiV2h0dHBzOi8vYWN0dWFsaWRhZC5ydC5jb20vYWN0dWFsaWRhZC8zOTk5NDMtcHV0aW4tbGFzc28tY29udmVyc2FjaW9uLXRlbGVmb25pY2EtZWN1YWRvctIBW2h0dHBzOi8vYWN0dWFsaWRhZC5ydC5jb20vYWN0dWFsaWRhZC8zOTk5NDMtcHV0aW4tbGFzc28tY29udmVyc2FjaW9uLXRlbGVmb25pY2EtZWN1YWRvci9hbXA?oc=5	RT en Español	2021-08-05	Putin y Lasso abordan la relación entre Rusia y Ecuador y la lucha contra el covid-19 en una conversación...
El riesgo de defender la naturaleza en Ecuador - Ecuavisa	https://news.google.com/__i/rss/rd/articles/CBMiYmh0dHBzOi8vd3d3LmVjdWF2aXNhLmNvbS9sby1udWV2by1lY3VhdmlzYS9lbC1yaWVzZ28tZGUtZGVmZW5kZXItbGEtbmF0dXJhbGV6YS1lbi1lY3VhZG9yLURMNjI5MjI10gFmaHR0cHM6Ly93d3cuZWN1YXZpc2EuY29tL2FtcC9sby1udWV2by1lY3VhdmlzYS9lbC1yaWVzZ28tZGUtZGVmZW5kZXItbGEtbmF0dXJhbGV6YS1lbi1lY3VhZG9yLURMNjI5MjI1?oc=5	Ecuavisa	2021-08-09	El riesgo de defender la naturaleza en Ecuador
La vuelta al mundo: balance de Ecuador, México y Venezuela en los Olímpicos de Tokio - FRANCE 24 Español	https://news.google.com/__i/rss/rd/articles/CBMiYWh0dHBzOi8vd3d3LmZyYW5jZTI0LmNvbS9lcy9hbSVDMyVBOXJpY2EtbGF0aW5hLzIwMjEwODExLW9saW1waWNvcy10b2tpby1lY3VhZG9yLW1leGljby12ZW5lenVlbGHSAWFodHRwczovL2FtcC5mcmFuY2UyNC5jb20vZXMvYW0lQzMlQTlyaWNhLWxhdGluYS8yMDIxMDgxMS1vbGltcGljb3MtdG9raW8tZWN1YWRvci1tZXhpY28tdmVuZXp1ZWxh?oc=5	FRANCE 24 Español	2021-08-11	La vuelta al mundo: balance de Ecuador, México y Venezuela en los Olímpicos de Tokio
Entra en vigor un nuevo estatuto migratorio entre Bolivia, Colombia, Ecuador y Perú: ¿cómo favorece la... - RT en Español	https://news.google.com/__i/rss/rd/articles/CBMiXWh0dHBzOi8vYWN0dWFsaWRhZC5ydC5jb20vYWN0dWFsaWRhZC80MDA1NTktZXN0YXR1dG8tbWlncmF0b3Jpby1ib2xpdmlhLWNvbG9tYmlhLWVjdWFkb3ItcGVyddIBYWh0dHBzOi8vYWN0dWFsaWRhZC5ydC5jb20vYWN0dWFsaWRhZC80MDA1NTktZXN0YXR1dG8tbWlncmF0b3Jpby1ib2xpdmlhLWNvbG9tYmlhLWVjdWFkb3ItcGVydS9hbXA?oc=5	RT en Español	2021-08-12	Entra en vigor un nuevo estatuto migratorio entre Bolivia, Colombia, Ecuador y Perú: ¿cómo favorece la...
Ecuador está en el puesto 19 de los países con los costos más baratos en combustibles - El Telégrafo 	https://news.google.com/__i/rss/rd/articles/CBMiiwFodHRwczovL3d3dy5lbHRlbGVncmFmby5jb20uZWMvbm90aWNpYXMvYWN0dWFsaWRhZC80NC9lY3VhZG9yLWVzdGEtZW4tZWwtcHVlc3RvLTE5LWRlLWxvcy1wYWlzZXMtY29uLWxvcy1jb3N0b3MtbWFzLWJhcmF0b3MtZW4tY29tYnVzdGlibGVz0gEA?oc=5	El Telégrafo 	2021-08-13	Ecuador está en el puesto 19 de los países con los costos más baratos en combustibles
Si va a viajar a México desde Ecuador, estos son los documentos que debe presentar antes del abordaje y al arribar a ese país - El Universo	https://news.google.com/__i/rss/rd/articles/CBMiqQFodHRwczovL3d3dy5lbHVuaXZlcnNvLmNvbS9ub3RpY2lhcy9lY3VhZG9yL3NpLXZhLWEtdmlhamFyLWEtbWV4aWNvLWRlc2RlLWVjdWFkb3ItZXN0b3Mtc29uLWRvY3VtZW50b3MtcXVlLWRlYmUtcHJlc2VudGFyLXByZXZpby1hbC1hYm9yZGFqZS15LWFsLWFycmliby1hLWVzZS1wYWlzLW5vdGEv0gG4AWh0dHBzOi8vd3d3LmVsdW5pdmVyc28uY29tL25vdGljaWFzL2VjdWFkb3Ivc2ktdmEtYS12aWFqYXItYS1tZXhpY28tZGVzZGUtZWN1YWRvci1lc3Rvcy1zb24tZG9jdW1lbnRvcy1xdWUtZGViZS1wcmVzZW50YXItcHJldmlvLWFsLWFib3JkYWplLXktYWwtYXJyaWJvLWEtZXNlLXBhaXMtbm90YS8_b3V0cHV0VHlwZT1hbXA?oc=5	El Universo	2021-08-15	Si va a viajar a México desde Ecuador, estos son los documentos que debe presentar antes del abordaje y al arribar a ese país
Osa de anteojos es captada en video mientras juega en los páramos de Quito - El Comercio (Ecuador)	https://news.google.com/__i/rss/rd/articles/CBMiUmh0dHBzOi8vd3d3LmVsY29tZXJjaW8uY29tL3RlbmRlbmNpYXMvYW1iaWVudGUvb3NvLWFuZGluby1jYXB0YWRvLXZpZGVvLXF1aXRvLmh0bWzSAQA?oc=5	El Comercio (Ecuador)	2021-08-16	Osa de anteojos es captada en video mientras juega en los páramos de Quito
Imágenes del ECU-911 muestran aglomeraciones en playas de Esmeraldas - El Comercio (Ecuador)	https://news.google.com/__i/rss/rd/articles/CBMiY2h0dHBzOi8vd3d3LmVsY29tZXJjaW8uY29tL2FjdHVhbGlkYWQvZWN1YWRvci9lY3U5MTEtaW1hZ2VuZXMtYWdsb21lcmFjaW9uZXMtcGxheWFzLWVzbWVyYWxkYXMuaHRtbNIBAA?oc=5	El Comercio (Ecuador)	2021-08-16	Imágenes del ECU-911 muestran aglomeraciones en playas de Esmeraldas
Ecuador enciende conexión a cable submarino de 7 mil 300 kilómetros que conecta a Guatemala con Chile - Prensa Libre	https://news.google.com/__i/rss/rd/articles/CBMiiwFodHRwczovL3d3dy5wcmVuc2FsaWJyZS5jb20vZWNvbm9taWEvZWN1YWRvci1lbmNpZW5kZS1jb25leGlvbi1hLWNhYmxlLXN1Ym1hcmluby1kZS03LW1pbC0zMDAta2lsb21ldHJvcy1xdWUtY29uZWN0YS1hLWd1YXRlbWFsYS1jb24tY2hpbGUv0gEA?oc=5	Prensa Libre	2021-08-16	Ecuador enciende conexión a cable submarino de 7 mil 300 kilómetros que conecta a Guatemala con Chile
Los talibanes se divierten mientras el caos continúa en Afganistán - El Telégrafo 	https://news.google.com/__i/rss/rd/articles/CBMicmh0dHBzOi8vd3d3LmVsdGVsZWdyYWZvLmNvbS5lYy9ub3RpY2lhcy9tdW5kby84L2xvcy10YWxpYmFuZXMtc2UtZGl2aWVydGVuLW1pZW50cmFzLWVsLWNhb3MtY29udGludWEtZW4tYWZnYW5pc3RhbtIBAA?oc=5	El Telégrafo 	2021-08-16	Los talibanes se divierten mientras el caos continúa en Afganistán
Desde Ecuador ya se puede comprar en la tienda Macy’s más de un millón de productos - El Universo	https://news.google.com/__i/rss/rd/articles/CBMiiAFodHRwczovL3d3dy5lbHVuaXZlcnNvLmNvbS9sYXJldmlzdGEvdGVjbm9sb2dpYS9kZXNkZS1lY3VhZG9yLXlhLXNlLXB1ZWRlLWNvbXByYXItZW4tbGEtdGllbmRhLW1hY3lzLW1hcy1kZS11bi1taWxsb24tZGUtcHJvZHVjdG9zLW5vdGEv0gGXAWh0dHBzOi8vd3d3LmVsdW5pdmVyc28uY29tL2xhcmV2aXN0YS90ZWNub2xvZ2lhL2Rlc2RlLWVjdWFkb3IteWEtc2UtcHVlZGUtY29tcHJhci1lbi1sYS10aWVuZGEtbWFjeXMtbWFzLWRlLXVuLW1pbGxvbi1kZS1wcm9kdWN0b3Mtbm90YS8_b3V0cHV0VHlwZT1hbXA?oc=5	El Universo	2021-08-16	Desde Ecuador ya se puede comprar en la tienda Macy’s más de un millón de productos
El poder del amor - Capítulo Completo 16-08-2021 - Ecuavisa	https://news.google.com/__i/rss/rd/articles/CBMidWh0dHBzOi8vd3d3LmVjdWF2aXNhLmNvbS9udWVzdHJvcy1wcm9ncmFtYXMvZWwtcG9kZXItZGVsLWFtb3IvZWwtcG9kZXItZGVsLWFtb3ItY2FwaXR1bG8tY29tcGxldG8tMTYtMDgtMjAyMS1GQjY2MzM1MdIBeWh0dHBzOi8vd3d3LmVjdWF2aXNhLmNvbS9hbXAvbnVlc3Ryb3MtcHJvZ3JhbWFzL2VsLXBvZGVyLWRlbC1hbW9yL2VsLXBvZGVyLWRlbC1hbW9yLWNhcGl0dWxvLWNvbXBsZXRvLTE2LTA4LTIwMjEtRkI2NjMzNTE?oc=5	Ecuavisa	2021-08-16	El poder del amorCapítulo Completo 16-08-2021
Luis Cordero Benítez, una muerte llena de incógnitas - El Telégrafo (por eliminar)	https://news.google.com/__i/rss/rd/articles/CBMiZmh0dHBzOi8vd3d3LmVsdGVsZWdyYWZvLmNvbS5lYy9ub3RpY2lhcy9zb2NpZWRhZC82L2x1aXMtY29yZGVyby1iZW5pdGV6LXVuYS1tdWVydGUtbGxlbmEtZGUtaW5jb2duaXRhc9IBAA?oc=5	El Telégrafo (por eliminar)	2021-08-16	Luis Cordero Benítez, una muerte llena de incógnitas
Ecuavisa estrena este lunes el reality ‘El poder del amor’. Ecuador está presente con Don Day, Mare Cevallos y Andreína Bravo - El Universo	https://news.google.com/__i/rss/rd/articles/CBMigwFodHRwczovL3d3dy5lbHVuaXZlcnNvLmNvbS9lbnRyZXRlbmltaWVudG8vdGVsZXZpc2lvbi9lbC1wb2Rlci1kZWwtYW1vci1yZWFsaXR5LWRvbi1kYXktbWFyZS1jZXZhbGxvcy1lY3VhdmlzYS1hbmRyZWluYS1icmF2by1ub3RhL9IBkgFodHRwczovL3d3dy5lbHVuaXZlcnNvLmNvbS9lbnRyZXRlbmltaWVudG8vdGVsZXZpc2lvbi9lbC1wb2Rlci1kZWwtYW1vci1yZWFsaXR5LWRvbi1kYXktbWFyZS1jZXZhbGxvcy1lY3VhdmlzYS1hbmRyZWluYS1icmF2by1ub3RhLz9vdXRwdXRUeXBlPWFtcA?oc=5	El Universo	2021-08-16	Ecuavisa estrena este lunes el reality ‘El poder del amor’. Ecuador está presente con Don Day, Mare Cevallos y Andreína Bravo
Cuatro nuevos requisitos para ecuatorianos que quieran viajar a México - Primicias	https://news.google.com/__i/rss/rd/articles/CBMiWGh0dHBzOi8vd3d3LnByaW1pY2lhcy5lYy9ub3RpY2lhcy9zb2NpZWRhZC9udWV2b3MtcmVxdWlzaXRvcy1lY3VhdG9yaWFub3MtdmlhamVuLW1leGljby_SAQA?oc=5	Primicias	2021-08-16	Cuatro nuevos requisitos para ecuatorianos que quieran viajar a México
Barcelona Sporting Club pone en duda su participación en torneos de Ecuador por ‘altas y profundas preocupaciones sobre nivel de arbitraje nacional’ - El Universo	https://news.google.com/__i/rss/rd/articles/CBMi0AFodHRwczovL3d3dy5lbHVuaXZlcnNvLmNvbS9kZXBvcnRlcy9jYW1wZW9uYXRvLWVjdWF0b3JpYW5vL2JhcmNlbG9uYS1zcG9ydGluZy1jbHViLXBvbmUtZW4tZHVkYS1wYXJ0aWNpcGFjaW9uLWVuLXRvcm5lb3MtZGUtZWN1YWRvci1wb3ItYWx0YXMteS1wcm9mdW5kYXMtcHJlb2N1cGFjaW9uZXMtc29icmUtbml2ZWwtZGUtYXJiaXRyYWplLW5hY2lvbmFsLW5vdGEv0gHfAWh0dHBzOi8vd3d3LmVsdW5pdmVyc28uY29tL2RlcG9ydGVzL2NhbXBlb25hdG8tZWN1YXRvcmlhbm8vYmFyY2Vsb25hLXNwb3J0aW5nLWNsdWItcG9uZS1lbi1kdWRhLXBhcnRpY2lwYWNpb24tZW4tdG9ybmVvcy1kZS1lY3VhZG9yLXBvci1hbHRhcy15LXByb2Z1bmRhcy1wcmVvY3VwYWNpb25lcy1zb2JyZS1uaXZlbC1kZS1hcmJpdHJhamUtbmFjaW9uYWwtbm90YS8_b3V0cHV0VHlwZT1hbXA?oc=5	El Universo	2021-08-16	Barcelona Sporting Club pone en duda su participación en torneos de Ecuador por ‘altas y profundas preocupaciones sobre nivel de arbitraje nacional’
Fuga de información reservada afectó el proceso judicial de Lisbeth Baquerizo, según sus familiares - El Comercio (Ecuador)	https://news.google.com/__i/rss/rd/articles/CBMihAFodHRwczovL3d3dy5lbGNvbWVyY2lvLmNvbS9hY3R1YWxpZGFkL3NlZ3VyaWRhZC9mdWdhLWluZm9ybWFjaW9uLXJlc2VydmFkYS1hZmVjdG8tcHJvY2Vzby1qdWRpY2lhbC1saXNiZXRoLWJhcXVlcml6by1mYW1pbGlhcmVzLmh0bWzSAQA?oc=5	El Comercio (Ecuador)	2021-08-16	Fuga de información reservada afectó el proceso judicial de Lisbeth Baquerizo, según sus familiares
Quintero, Bauman y Achilier marcaron los mejores goles de la cuarta fecha del campeonato ecuatoriano - El Comercio (Ecuador)	https://news.google.com/__i/rss/rd/articles/CBMikQFodHRwczovL3d3dy5lbGNvbWVyY2lvLmNvbS91bmNhdGVnb3JpemVkL3F1aW50ZXJvLWJhdW1hbi15LWFjaGlsaWVyLW1hcmNhcm9uLWxvcy1tZWpvcmVzLWdvbGVzLWRlLWxhLWN1YXJ0YS1mZWNoYS1kZWwtY2FtcGVvbmF0by1lY3VhdG9yaWFuby5odG1s0gEA?oc=5	El Comercio (Ecuador)	2021-08-16	Quintero, Bauman y Achilier marcaron los mejores goles de la cuarta fecha del campeonato ecuatoriano
El piloto Alfonso Darquea sufrió un accidente en la Primera Válida Nacional de autos clásicos - El Comercio (Ecuador)	https://news.google.com/__i/rss/rd/articles/CBMihgFodHRwczovL3d3dy5lbGNvbWVyY2lvLmNvbS9kZXBvcnRlcy9lbC1waWxvdG8tYWxmb25zby1kYXJxdWVhLXN1ZnJpby11bi1hY2NpZGVudGUtZW4tbGEtcHJpbWVyYS12YWxpZGEtbmFjaW9uYWwtZGUtYXV0b3MtY2xhc2ljb3MuaHRtbNIBAA?oc=5	El Comercio (Ecuador)	2021-08-16	El piloto Alfonso Darquea sufrió un accidente en la Primera Válida Nacional de autos clásicos
Hallan a migrante que cayó del muro de EE.UU. y llevaba tres días lesionado - El Comercio (Ecuador)	https://news.google.com/__i/rss/rd/articles/CBMiVmh0dHBzOi8vd3d3LmVsY29tZXJjaW8uY29tL2FjdHVhbGlkYWQvbXVuZG8vaGFsbGFuLW1pZ3JhbnRlLWNheW8tbXVyby1lZXV1LWxlc2lvbi5odG1s0gEA?oc=5	El Comercio (Ecuador)	2021-08-16	Hallan a migrante que cayó del muro de EE.UU. y llevaba tres días lesionado
Barcelona SC reclamó a la FEF por el arbitraje de Juan Carlos Andrade - El Comercio (Ecuador)	https://news.google.com/__i/rss/rd/articles/CBMidWh0dHBzOi8vd3d3LmVsY29tZXJjaW8uY29tL2RlcG9ydGVzL2Z1dGJvbC9iYXJjZWxvbmEtc2MtcmVjbGFtby1hLWxhLWZlZi1wb3ItZWwtYXJiaXRyYWplLWRlLWp1YW4tY2FybG9zLWFuZHJhZGUuaHRtbNIBAA?oc=5	El Comercio (Ecuador)	2021-08-16	Barcelona SC reclamó a la FEF por el arbitraje de Juan Carlos Andrade
El enigmático espía nazi Walther Giese, el “Führer de Ecuador” que se esfumó sin dejar rastros - infobae	https://news.google.com/__i/rss/rd/articles/CBMimAFodHRwczovL3d3dy5pbmZvYmFlLmNvbS9hbWVyaWNhL2hpc3RvcmlhLWFtZXJpY2EvMjAyMS8wOC8xNi9lbC1lbmlnbWF0aWNvLWVzcGlhLW5hemktd2FsdGhlci1naWVzZS1lbC1mdWhyZXItZGUtZWN1YWRvci1xdWUtc2UtZXNmdW1vLXNpbi1kZWphci1yYXN0cm9zL9IBrAFodHRwczovL3d3dy5pbmZvYmFlLmNvbS9hbWVyaWNhL2hpc3RvcmlhLWFtZXJpY2EvMjAyMS8wOC8xNi9lbC1lbmlnbWF0aWNvLWVzcGlhLW5hemktd2FsdGhlci1naWVzZS1lbC1mdWhyZXItZGUtZWN1YWRvci1xdWUtc2UtZXNmdW1vLXNpbi1kZWphci1yYXN0cm9zLz9vdXRwdXRUeXBlPWFtcC10eXBl?oc=5	infobae	2021-08-16	El enigmático espía nazi Walther Giese, el “Führer de Ecuador” que se esfumó sin dejar rastros
No hubo acuerdos en la reunión entre gobernador de Manabí y quienes se oponen a instalación de radar en cerro de Montecristi - El Universo	https://news.google.com/__i/rss/rd/articles/CBMirgFodHRwczovL3d3dy5lbHVuaXZlcnNvLmNvbS9ub3RpY2lhcy9lY3VhZG9yL25vLWh1Ym8tYWN1ZXJkb3MtZW4tbGEtcmV1bmlvbi1lbnRyZS1nb2Jlcm5hZG9yLWRlLW1hbmFiaS15LXF1aWVuZXMtc2Utb3BvbmVuLWEtaW5zdGFsYWNpb24tZGUtcmFkYXItZW4tY2Vycm8tZGUtbW9udGVjcmlzdGktbm90YS_SAb0BaHR0cHM6Ly93d3cuZWx1bml2ZXJzby5jb20vbm90aWNpYXMvZWN1YWRvci9uby1odWJvLWFjdWVyZG9zLWVuLWxhLXJldW5pb24tZW50cmUtZ29iZXJuYWRvci1kZS1tYW5hYmkteS1xdWllbmVzLXNlLW9wb25lbi1hLWluc3RhbGFjaW9uLWRlLXJhZGFyLWVuLWNlcnJvLWRlLW1vbnRlY3Jpc3RpLW5vdGEvP291dHB1dFR5cGU9YW1w?oc=5	El Universo	2021-08-17	No hubo acuerdos en la reunión entre gobernador de Manabí y quienes se oponen a instalación de radar en cerro de Montecristi
CorteIDH condena a Ecuador por destitución de militar que denunció torturas y desapariciones forzadas - El Comercio (Ecuador)	https://news.google.com/__i/rss/rd/articles/CBMic2h0dHBzOi8vd3d3LmVsY29tZXJjaW8uY29tL2FjdHVhbGlkYWQvc2VndXJpZGFkL2NvcnRlaWRoLWNvbmRlbmEtZWN1YWRvci1kZXN0aXR1Y2lvbi1taWxpdGFyLWRlbnVuY2lhLXRvcnR1cmFzLmh0bWzSAQA?oc=5	El Comercio (Ecuador)	2021-08-17	CorteIDH condena a Ecuador por destitución de militar que denunció torturas y desapariciones forzadas
El BIESS no hará desinversiones de su portafolio de $21 millones - Ecuavisa	https://news.google.com/__i/rss/rd/articles/CBMicmh0dHBzOi8vd3d3LmVjdWF2aXNhLmNvbS9ub3RpY2lhcy9lY3VhZG9yL2VsLWJpZXNzLW5vLWhhcmEtZGVzaW52ZXJzaW9uZXMtZGUtc3UtcG9ydGFmb2xpby1kZS0yMS1taWxsb25lcy1EQzY2NDczMdIBdmh0dHBzOi8vd3d3LmVjdWF2aXNhLmNvbS9hbXAvbm90aWNpYXMvZWN1YWRvci9lbC1iaWVzcy1uby1oYXJhLWRlc2ludmVyc2lvbmVzLWRlLXN1LXBvcnRhZm9saW8tZGUtMjEtbWlsbG9uZXMtREM2NjQ3MzE?oc=5	Ecuavisa	2021-08-17	El BIESS no hará desinversiones de su portafolio de $21 millones
Monedero figura en una organización de Correa en plena polémica por los pagos de Ecuador a Podemos - Okdiario	https://news.google.com/__i/rss/rd/articles/CBMibGh0dHBzOi8vb2tkaWFyaW8uY29tL2VzcGFuYS9tb25lZGVyby1maWd1cmEtb3JnYW5pemFjaW9uLWNvcnJlYS1wbGVuYS1wb2xlbWljYS1wYWdvcy1lY3VhZG9yLXBvZGVtb3MtNzY2NjM4MdIBcGh0dHBzOi8vb2tkaWFyaW8uY29tL2VzcGFuYS9tb25lZGVyby1maWd1cmEtb3JnYW5pemFjaW9uLWNvcnJlYS1wbGVuYS1wb2xlbWljYS1wYWdvcy1lY3VhZG9yLXBvZGVtb3MtNzY2NjM4MS9hbXA?oc=5	Okdiario	2021-08-17	Monedero figura en una organización de Correa en plena polémica por los pagos de Ecuador a Podemos
De nuevo Loustau y Cunha: Conmebol confirma árbitros para la triple fecha de clasificatorias - BioBioChile	https://news.google.com/__i/rss/rd/articles/CBMiqAFodHRwczovL3d3dy5iaW9iaW9jaGlsZS5jbC9ub3RpY2lhcy9kZXBvcnRlcy9mdXRib2wvbGEtcm9qYS8yMDIxLzA4LzE3L2RlLW51ZXZvLWxvdXN0YXUteS1jdW5oYS1jb25tZWJvbC1jb25maXJtYS1hcmJpdHJvcy1wYXJhLWxhLXRyaXBsZS1mZWNoYS1kZS1jbGFzaWZpY2F0b3JpYXMuc2h0bWzSAawBaHR0cHM6Ly93d3cuYmlvYmlvY2hpbGUuY2wvbm90aWNpYXMvZGVwb3J0ZXMvZnV0Ym9sL2xhLXJvamEvMjAyMS8wOC8xNy9hbXAvZGUtbnVldm8tbG91c3RhdS15LWN1bmhhLWNvbm1lYm9sLWNvbmZpcm1hLWFyYml0cm9zLXBhcmEtbGEtdHJpcGxlLWZlY2hhLWRlLWNsYXNpZmljYXRvcmlhcy5zaHRtbA?oc=5	BioBioChile	2021-08-17	De nuevo Loustau y Cunha: Conmebol confirma árbitros para la triple fecha de clasificatorias
Meta de incremento de 40.000 barriles para 2021 llegaría con ayuda privada; duplicación se ve más lejana - El Universo	https://news.google.com/__i/rss/rd/articles/CBMimwFodHRwczovL3d3dy5lbHVuaXZlcnNvLmNvbS9ub3RpY2lhcy9lY29ub21pYS9jb21vLXNlLWNvbnNlZ3VpcmEtbGEtbWV0YS1kZS1wcm9kdWNpci00MDAwMC1iYXJyaWxlcy1hLWRpY2llbWJyZS1kZWwtMjAyMS1wcm9wdWVzdGEtcG9yLWd1aWxsZXJtby1sYXNzby1ub3RhL9IBqgFodHRwczovL3d3dy5lbHVuaXZlcnNvLmNvbS9ub3RpY2lhcy9lY29ub21pYS9jb21vLXNlLWNvbnNlZ3VpcmEtbGEtbWV0YS1kZS1wcm9kdWNpci00MDAwMC1iYXJyaWxlcy1hLWRpY2llbWJyZS1kZWwtMjAyMS1wcm9wdWVzdGEtcG9yLWd1aWxsZXJtby1sYXNzby1ub3RhLz9vdXRwdXRUeXBlPWFtcA?oc=5	El Universo	2021-08-17	Meta de incremento de 40.000 barriles para 2021 llegaría con ayuda privada; duplicación se ve más lejana
En reinicio de dosis de Sinovac hubo masiva afluencia; otras personas fueron por otras marcas anticoronavirus - El Universo	https://news.google.com/__i/rss/rd/articles/CBMinAFodHRwczovL3d3dy5lbHVuaXZlcnNvLmNvbS9ub3RpY2lhcy9lY3VhZG9yL2dyYW4tYWZsdWVuY2lhLWRlLXBlcnNvbmFzLWVuLXB1bnRvcy1kZS12YWN1bmFjaW9uLXRyYXMtcmVpbmljaW8tZGUtYXBsaWFjaW9uLWRlLXNlZ3VuZGFzLWRvc2lzLWRlLXNpbm92YWMtbm90YS_SAasBaHR0cHM6Ly93d3cuZWx1bml2ZXJzby5jb20vbm90aWNpYXMvZWN1YWRvci9ncmFuLWFmbHVlbmNpYS1kZS1wZXJzb25hcy1lbi1wdW50b3MtZGUtdmFjdW5hY2lvbi10cmFzLXJlaW5pY2lvLWRlLWFwbGlhY2lvbi1kZS1zZWd1bmRhcy1kb3Npcy1kZS1zaW5vdmFjLW5vdGEvP291dHB1dFR5cGU9YW1w?oc=5	El Universo	2021-08-17	En reinicio de dosis de Sinovac hubo masiva afluencia; otras personas fueron por otras marcas anticoronavirus
La enigmática Cueva de los Tayos en Ecuador: Un tesoro escondido, una biblioteca metálica y mundos intraterrestres - El Universo	https://news.google.com/__i/rss/rd/articles/CBMiowFodHRwczovL3d3dy5lbHVuaXZlcnNvLmNvbS9ub3RpY2lhcy9pbmZvcm1lcy9sYS1lbmlnbWF0aWNhLWN1ZXZhLWRlLWxvcy10YXlvcy1lbi1lY3VhZG9yLXVuLXRlc29yby1lc2NvbmRpZG8tdW5hLWJpYmxpb3RlY2EtbWV0YWxpY2EteS1tdW5kb3MtaW50cmF0ZXJyZXN0cmVzLW5vdGEv0gGyAWh0dHBzOi8vd3d3LmVsdW5pdmVyc28uY29tL25vdGljaWFzL2luZm9ybWVzL2xhLWVuaWdtYXRpY2EtY3VldmEtZGUtbG9zLXRheW9zLWVuLWVjdWFkb3ItdW4tdGVzb3JvLWVzY29uZGlkby11bmEtYmlibGlvdGVjYS1tZXRhbGljYS15LW11bmRvcy1pbnRyYXRlcnJlc3RyZXMtbm90YS8_b3V0cHV0VHlwZT1hbXA?oc=5	El Universo	2021-08-17	La enigmática Cueva de los Tayos en Ecuador: Un tesoro escondido, una biblioteca metálica y mundos intraterrestres
Un accidente en la vía Alóag- Santo Domingo complica el paso desde Pichincha hacia la Costa - El Comercio (Ecuador)	https://news.google.com/__i/rss/rd/articles/CBMiXWh0dHBzOi8vd3d3LmVsY29tZXJjaW8uY29tL2FjdHVhbGlkYWQvZWN1YWRvci9hY2NpZGVudGUtYWxvYWctc2FudG9kb21pbmdvLWNvbXBsaWNhLXBhc28uaHRtbNIBAA?oc=5	El Comercio (Ecuador)	2021-08-17	Un accidente en la vía Alóag- Santo Domingo complica el paso desde Pichincha hacia la Costa
Miguel Ángel Loor: Es normal que cuando se cometen errores los perjudicados no estén contentos - El Universo	https://news.google.com/__i/rss/rd/articles/CBMingFodHRwczovL3d3dy5lbHVuaXZlcnNvLmNvbS9kZXBvcnRlcy9jYW1wZW9uYXRvLWVjdWF0b3JpYW5vL21pZ3VlbC1hbmdlbC1sb29yLWVzLW5vcm1hbC1xdWUtY3VhbmRvLXNlLWNvbWV0ZW4tZXJyb3Jlcy1sb3MtcGVyanVkaWNhZG9zLW5vLWVzdGVuLWNvbnRlbnRvcy1ub3RhL9IBrQFodHRwczovL3d3dy5lbHVuaXZlcnNvLmNvbS9kZXBvcnRlcy9jYW1wZW9uYXRvLWVjdWF0b3JpYW5vL21pZ3VlbC1hbmdlbC1sb29yLWVzLW5vcm1hbC1xdWUtY3VhbmRvLXNlLWNvbWV0ZW4tZXJyb3Jlcy1sb3MtcGVyanVkaWNhZG9zLW5vLWVzdGVuLWNvbnRlbnRvcy1ub3RhLz9vdXRwdXRUeXBlPWFtcA?oc=5	El Universo	2021-08-17	Miguel Ángel Loor: Es normal que cuando se cometen errores los perjudicados no estén contentos
Matrículas en el régimen Sierra y Amazonía se extienden hasta el 23 de agosto - El Comercio (Ecuador)	https://news.google.com/__i/rss/rd/articles/CBMiZGh0dHBzOi8vd3d3LmVsY29tZXJjaW8uY29tL3RlbmRlbmNpYXMvc29jaWVkYWQvbWF0cmljdWxhcy1lZHVjYWNpb24tZXN0dWRpYW50ZXMtc2llcnJhLWFtYXpvbmlhLmh0bWzSAQA?oc=5	El Comercio (Ecuador)	2021-08-17	Matrículas en el régimen Sierra y Amazonía se extienden hasta el 23 de agosto
Guillermo Lasso entrega proyecto de reformas a la educación superior y pide aprobación urgente de la Asamblea - El Universo	https://news.google.com/__i/rss/rd/articles/CBMikAFodHRwczovL3d3dy5lbHVuaXZlcnNvLmNvbS9ub3RpY2lhcy9wb2xpdGljYS9ndWlsbGVybW8tbGFzc28tZW50cmVnYS1wcm95ZWN0by1yZWZvcm1hcy1lZHVjYWNpb24tc3VwZXJpb3ItcGlkZS1hcHJvYmFjaW9uLXVyZ2VudGUtYXNhbWJsZWEtbm90YS_SAZ8BaHR0cHM6Ly93d3cuZWx1bml2ZXJzby5jb20vbm90aWNpYXMvcG9saXRpY2EvZ3VpbGxlcm1vLWxhc3NvLWVudHJlZ2EtcHJveWVjdG8tcmVmb3JtYXMtZWR1Y2FjaW9uLXN1cGVyaW9yLXBpZGUtYXByb2JhY2lvbi11cmdlbnRlLWFzYW1ibGVhLW5vdGEvP291dHB1dFR5cGU9YW1w?oc=5	El Universo	2021-08-17	Guillermo Lasso entrega proyecto de reformas a la educación superior y pide aprobación urgente de la Asamblea
Erwin Ronquillo: 'Hay muchos niños no registrados' - El Comercio (Ecuador)	https://news.google.com/__i/rss/rd/articles/CBMiWGh0dHBzOi8vd3d3LmVsY29tZXJjaW8uY29tL3NvY2llZGFkLTIvbWVub3Jlcy1yZWdpc3Ryby1kZXNudXRyaWNpb24taW5mYW50aWwtY2lmcmFzLmh0bWzSAQA?oc=5	El Comercio (Ecuador)	2021-08-17	Erwin Ronquillo: 'Hay muchos niños no registrados'
Cuatro personas resultaron heridas tras una balacera en una gallera clandestina de Guayas - El Comercio (Ecuador)	https://news.google.com/__i/rss/rd/articles/CBMiaWh0dHBzOi8vd3d3LmVsY29tZXJjaW8uY29tL2FjdHVhbGlkYWQvc2VndXJpZGFkL3BlcnNvbmFzLWhlcmlkYXMtYmFsYWNlcmEtZ2FsbGVyYS1jbGFuZGVzdGluYS1ndWF5YXMuaHRtbNIBAA?oc=5	El Comercio (Ecuador)	2021-08-17	Cuatro personas resultaron heridas tras una balacera en una gallera clandestina de Guayas
La Conaie dice que está en camino de unificar con Pachakutik la lucha institucional y legal - El Comercio (Ecuador)	https://news.google.com/__i/rss/rd/articles/CBMiXmh0dHBzOi8vd3d3LmVsY29tZXJjaW8uY29tL2FjdHVhbGlkYWQvcG9saXRpY2EvY29uYWllLWNhbWluby11bmlmaWNhY2lvbi1sZWdhbC1wYWNoYWt1dGlrLmh0bWzSAQA?oc=5	El Comercio (Ecuador)	2021-08-17	La Conaie dice que está en camino de unificar con Pachakutik la lucha institucional y legal
Ecuador: vacunación reduce ocupación de camas hospitalarias - WPLG Local 10	https://news.google.com/__i/rss/rd/articles/CBMiZmh0dHBzOi8vd3d3LmxvY2FsMTAuY29tL2VzcGFub2wvMjAyMS8wOC8xNy9lY3VhZG9yLXZhY3VuYWNpb24tcmVkdWNlLW9jdXBhY2lvbi1kZS1jYW1hcy1ob3NwaXRhbGFyaWFzL9IBAA?oc=5	WPLG Local 10	2021-08-17	Ecuador: vacunación reduce ocupación de camas hospitalarias
CPCCS investigará denuncias de irregularidades en sorteo de medida cautelar presentada por Yunda - Ecuavisa	https://news.google.com/__i/rss/rd/articles/CBMikwFodHRwczovL3d3dy5lY3VhdmlzYS5jb20vbm90aWNpYXMvZWN1YWRvci9jcGNjcy1pbnZlc3RpZ2FyYS1kZW51bmNpYXMtZGUtaXJyZWd1bGFyaWRhZGVzLWVuLXNvcnRlby1kZS1tZWRpZGEtY2F1dGVsYXItcHJlc2VudGFkYS1wb3IteXVuZGEtRUU2NjY5NzjSAZcBaHR0cHM6Ly93d3cuZWN1YXZpc2EuY29tL2FtcC9ub3RpY2lhcy9lY3VhZG9yL2NwY2NzLWludmVzdGlnYXJhLWRlbnVuY2lhcy1kZS1pcnJlZ3VsYXJpZGFkZXMtZW4tc29ydGVvLWRlLW1lZGlkYS1jYXV0ZWxhci1wcmVzZW50YWRhLXBvci15dW5kYS1FRTY2Njk3OA?oc=5	Ecuavisa	2021-08-17	CPCCS investigará denuncias de irregularidades en sorteo de medida cautelar presentada por Yunda
USD 9,3 millones se destinan a compra de equipos militares en Ecuador - El Comercio (Ecuador)	https://news.google.com/__i/rss/rd/articles/CBMiX2h0dHBzOi8vd3d3LmVsY29tZXJjaW8uY29tL2FjdHVhbGlkYWQvc2VndXJpZGFkL2Z1ZXJ6YXMtYXJtYWRhcy1jb21wcmVhcy1lcXVpcG9zLW1pbGl0YXJlcy5odG1s0gEA?oc=5	El Comercio (Ecuador)	2021-08-17	USD 9,3 millones se destinan a compra de equipos militares en Ecuador
Borussia Dortmund vs. Bayern Munich: horarios y canales para ver en vivo la Supercopa de Alemania - El Universo	https://news.google.com/__i/rss/rd/articles/CBMikAFodHRwczovL3d3dy5lbHVuaXZlcnNvLmNvbS9kZXBvcnRlcy9mdXRib2wvYm9ydXNzaWEtZG9ydG11bmQtdnMtYmF5ZXJuLW11bmljaC1ob3Jhcmlvcy15LWNhbmFsZXMtcGFyYS12ZXItZW4tdml2by1sYS1zdXBlcmNvcGEtZGUtYWxlbWFuaWEtbm90YS_SAQA?oc=5	El Universo	2021-08-17	Borussia Dortmund vs. Bayern Munich: horarios y canales para ver en vivo la Supercopa de Alemania
Asamblea de Ecuador inhabilita por dos años al excontralor Pablo Celi tras juicio político - CNN	https://news.google.com/__i/rss/rd/articles/CBMiXmh0dHBzOi8vY25uZXNwYW5vbC5jbm4uY29tLzIwMjEvMDgvMTcvZWN1YWRvci1pbmhhYmlsaXRhLWRvcy1hbm9zLWV4Y29udHJhbG9yLXBhYmxvLWNlbGktb3JpeC_SAWJodHRwczovL2NubmVzcGFub2wuY25uLmNvbS8yMDIxLzA4LzE3L2VjdWFkb3ItaW5oYWJpbGl0YS1kb3MtYW5vcy1leGNvbnRyYWxvci1wYWJsby1jZWxpLW9yaXgvYW1wLw?oc=5	CNN	2021-08-17	Asamblea de Ecuador inhabilita por dos años al excontralor Pablo Celi tras juicio político
