title	link	date	title_corrected	summary
Caravana migrante acelera el paso en México y llega muy cerca de EEUU - La Nación.com.py	https://www.lanacion.com.py/mundo/2018/11/15/caravana-migrante-acelera-el-paso-en-mexico-y-llega-muy-cerca-de-eeuu/	2018-11-15	Caravana migrante acelera el paso en México y llega muy cerca de EEUU	Tijuana, México | AFP | por Yemeli ORTEGA / con Said Betanzos en Tijuana La caravana migrante que salió hace un mes de Honduras siguió acelerando vertiginosamente su paso este miércoles para alcanzar la frontera con Estados Unidos, hacia donde incluso cruzaron unos pocos centroamericanos, desafiando la presencia del secretario de Defensa estadounidense. Al menos nueve migrantes de la caravana cruzaron ilegalmente a Estados Unidos y fueron arrestados por la patrulla fronteriza, constató la AFP. Exhaustos pero determinados, más de 1.000 migrantes pasaron esta tarde por Guaymas, una localidad sobre la costa del Pacífico, donde prolifera el narcotráfico y el crimen organizado. 
Mujeres de caravana migrante, en huelga de hambre para presionar a México y EEUU - La Nación.com.py	https://www.lanacion.com.py/mundo/2018/11/30/mujeres-de-caravana-migrante-en-huelga-de-hambre-para-presionar-a-mexico-y-eeuu/	2018-11-30	Mujeres de caravana migrante, en huelga de hambre para presionar a México y EEUU	"Las mujeres piden al Instituto Nacional de Migración de México ""agilizar las visas humanitarias"" para poder acceder a empleos legales y pagarse una vivienda, dijo Miranda. Este jueves, el refugio se convirtió en un lodazal tras la fuerte lluvia que cayó casi todo el día sobre la ciudad. ""Le recordamos que está firmado ese convenio"" con el gobierno saliente, subrayó Miranda. "
Santa Elena busca reducir migración campo-ciudad - La Nación.com.py	https://www.lanacion.com.py/pais/2018/12/02/santa-elena-busca-reducir-migracion-campo-ciudad/	2018-12-02	Santa Elena busca reducir migración campo-ciudad	Lo que se busca La marca ciudad, estuvo a cargo de la agencia creativa del interior, Brandi Handy, y con ella se representa los atractivos naturales como el túnel de árboles, la laguna sirena, el estilo rústico de la zona y la cordialidad de sus habitantes, con el fin de mostrarse al mundo como un lugar apto para el desarrollo comercial, cultural y tecnológico. La iniciativa busca fomentar la participación ciudadana en diferentes actividades como: poesía, música, canto, días saludables y deportivos, cine, fiestas, ferias y talleres educativos para la introducción a la ciudadanía al mundo digital, a través de convenios con otras instituciones públicas que puedan aportar al crecimiento de Santa Elena. De esta manera, apuntan a desarrollar pilares como fin de la pobreza, hambre cero, salud y bienestar, agua limpia y saneamiento, educación de calidad, igualdad de género, energía asequible y no contaminante, trabajo decente y crecimiento económico, industria, innovación e infraestructura, entre otros. 
"Grupos provida rechazan pacto para recibir a inmigrantes: ""Atenta contra la soberanía"" - Hoy - Noticas de Paraguay y el Mundo."	https://www.hoy.com.py/nacionales/grupos-provida-rechazan-pacto-para-recibir-a-inmigrantes-atenta-contra-la-soberania	2018-12-07	"Grupos provida rechazan pacto para recibir a inmigrantes: ""Atenta contra la soberanía""Hoy"	Al igual que las dos agrupaciones provida citadas anteriormente, desde FRENDEH también se oponen a la suscripción del Pacto Mundial sobre Migración. Vacaciones, mejor antídoto contra estrés: “Igual si te quedás en tu casa a mirar el techo” Tomarse unas vacaciones es el mejor antídoto contra el estrés y no necesariamente hay que salir de la casa durante los días de descanso. La psicóloga Sonia Salazar comentó a radio Monumental que, en términos de salud mental y física, tomarse unas vacaciones es muy importante porque es el mejor antídoto contra el estrés. 
Paraguay se suma a países que protegen a migrantes - La Nación.com.py	https://www.lanacion.com.py/politica/2018/12/08/paraguay-se-suma-a-paises-que-quieren-promocionar-las-migraciones/	2018-12-08	Paraguay se suma a países que protegen a migrantes	El gobierno paraguayo estará representado en la “Conferencia Intergubernamental para el Pacto Mundial sobre Migración”, junto a la mayor cantidad de países del mundo y la región. La delegación será presidida por el Ministro de Relaciones Exteriores, Luis Alberto Castiglioni. Esta adopción del Pacto se efectúa, de conformidad al artículo 143 de la Constitución Nacional, que reza en su parte pertinente: “La República del Paraguay, en sus relaciones internacionales, acepta el derecho internacional y se ajusta a los siguientes principios: ...4. la solidaridad y la cooperación internacional”. 
ONU adopta el pacto mundial para la migración: lo que pasará en Paraguay - Hoy - Noticas de Paraguay y el Mundo.	https://www.hoy.com.py/nacionales/adoptan-el-pacto-mundial-para-la-migracion-lo-que-pasara-en-paraguay	2018-12-10	ONU adopta el pacto mundial para la migración: lo que pasará en ParaguayHoy	"Las organizaciones ""provida"" cuestionan duramente esta alianza y alegan que atentará contra la soberanía e introducirá la ideología de género. Estas últimas palabras hacen suponer a la fiscala Gladys Giménez, quien investiga el hecho, que la mujer actuó por celos. Los aficionados del equipo derrotado estuvieron muy disconformes con la labor arbitral, por lo que invadieron el campo de juego y avanzaron contra los jueces. "
Brasileños, argentinos, coreanos y taiwaneses, encabezan ranking de inmigrantes en Paraguay - Hoy - Noticas de Paraguay y el Mundo.	https://www.hoy.com.py/nacionales/brasilenos-argentinos-coreanos-y-taiwaneses-encabezan-ranking-de-inmigrantes-en-paraguay	2018-12-10	Brasileños, argentinos, coreanos y taiwaneses, encabezan ranking de inmigrantes en ParaguayHoy	"Brasileños, argentinos, coreanos y taiwaneses, encabezan ranking de inmigrantes en Paraguay La polémica sobre migración desatada en torno al pacto global firmado por el gobierno, trajo consigo algunas interrogantes. Asimismo, ambos presidentes firmarán acuerdos bilaterales y Abdo Benítez condecorará a Djukanovic con la Orden Nacional del Mérito en el Grado de Collar ""Mariscal Francisco Solano López"". En ese sentido el concejal Rodrigo Buongermini detalló que se están estudiando diversos mecanismos, primeramente apelando a la conciencia del conductor, ofreciéndole alternativas de estacionamiento en calles transversales y colaterales. "
En Paraguay, la mayor cantidad de extranjeros son brasileños - ÚltimaHora.com	https://www.ultimahora.com/en-paraguay-la-mayor-cantidad-extranjeros-son-brasilenos-n2784510.html	2018-12-10	En Paraguay, la mayor cantidad de extranjeros son brasileños	Otra importante cantidad de foráneos se encuentra en el país sin documentación al día, informó Migraciones. En total son 201.352 ciudadanos brasileños registrados en Paraguay, con documentación al día y residencia temporaria o permanente, confirmó Francisco Acosta, de la Dirección del Gabinete de Migraciones, a Monumental 1080 AM. Lea más: ¿Qué es el Pacto Mundial Migratorio y en qué afecta a Paraguay? 
Colombia adopta pacto migratorio de ONU porque ve necesaria respuesta global - ÚltimaHora.com	https://www.ultimahora.com/colombia-adopta-pacto-migratorio-onu-porque-ve-necesaria-respuesta-global-n2784678.html	2018-12-11	Colombia adopta pacto migratorio de ONU porque ve necesaria respuesta global	"Mundo Colombia adopta pacto migratorio de ONU porque ve necesaria respuesta global Colombia adoptó el Pacto Mundial para una Migración Segura, Ordenada y Regular de Naciones Unidas (ONU) porque considera que ese fenómeno no puede ser respondido por un país sólo, según afirmó este martes el canciller Carlos Holmes Trujillo. Lea más: ""¿Qué es el Pacto Mundial Migratorio y en qué afecta a Paraguay? Países, sobre todo receptores de emigrantes, como Australia, Chile, Italia, Israel y un numeroso grupo de los centroeuropeos se han retirado del pacto en las pasadas semanas y hasta ayer, mientras que Estados Unidos se opuso a él desde el principio. "
BNF no se verá afectado por migración de fondos | Archivo - 5dias.com.py	https://www.5dias.com.py/archivo/bnf-no-se-vera-afectado-por-migracion-de-fondos	2018-12-13	BNF no se verá afectado por migración de fondosArchivo	pvasken&commat;5dias.com.py “La migración de fondos públicos a bancos privados no va a afectar al Banco Nacional de Fomento (BNF), no se van a ir todos los fondos del banco, este ya construyó capacidades para retener lo que le es necesario y lo que no le sea necesario irá a otra entidad de acuerdo al dueño de los fondos”, dijo ayer Benigno López ministro de Hacienda al canal 5días. 
Organizaciones provida y profamilia convocan a debate sobre pacto migratorio - ÚltimaHora.com	https://www.ultimahora.com/organizaciones-provida-y-profamilia-convocan-debate-pacto-migratorio-n2785850.html	2018-12-16	Organizaciones provida y profamilia convocan a debate sobre pacto migratorio	Nacionales Organizaciones provida y profamilia convocan a debate sobre pacto migratorio Unas 15 organizaciones provida y profamilia convocaron al ministro de Relaciones Exteriores, Luis Castiglioni, para un debate público sobre el Pacto Global Migratorio. Ante esta situación, realizaron un llamado al ministro de Relaciones Exteriores, Luis Castiglioni, para un debate público sobre el tema. “El Estado debe priorizar primero a los paraguayos, es decir, proveerles de recursos, para luego pensar en el migrante. 
El número de migrantes muertos en el Mediterráneo bajó en 2018 - La Nación.com.py	https://www.lanacion.com.py/mundo/2019/01/03/el-numero-de-migrantes-muertos-en-el-mediterraneo-bajo-en-2018/	2019-01-03	El número de migrantes muertos en el Mediterráneo bajó en 2018	Son varios los artistas que están haciendo cosas en Twitch u otras plataformas de streamings y ganándose al público ahí. “Las primeras veces salió medio improvisado (lo viral), pero ahora como que apuntamos directamente a TikTok, porque tal vez la gente está esperando nuestro contenido ahí. Así que subimos el video y, por suerte, se hizo re viral”, explica García. 
“Intensos” contactos diplomáticos en la UE sobre migrantes bloqueados frente a Malta - La Nación.com.py	https://www.lanacion.com.py/mundo/2019/01/08/intensos-contactos-diplomaticos-en-la-ue-sobre-migrantes-bloqueados-frente-a-malta/	2019-01-08	“Intensos” contactos diplomáticos en la UE sobre migrantes bloqueados frente a Malta	Son varios los artistas que están haciendo cosas en Twitch u otras plataformas de streamings y ganándose al público ahí. “Las primeras veces salió medio improvisado (lo viral), pero ahora como que apuntamos directamente a TikTok, porque tal vez la gente está esperando nuestro contenido ahí. Así que subimos el video y, por suerte, se hizo re viral”, explica García. 
Arrom y Martí obtuvieron estatus de refugiados en violación a Convención - La Nación.com.py	https://www.lanacion.com.py/politica_edicion_impresa/2019/01/20/arrom-y-marti-obtuvieron-estatus-de-refugiados-en-violacion-a-convencion/	2019-01-20	Arrom y Martí obtuvieron estatus de refugiados en violación a Convención	Sin embargo, representantes del entonces Partido Patria Libre, al momento de comunicar que sus principales líderes fueron beneficiados en el vecino país con dicha medida, mencionaron que la decisión fue tomada basándose en la mencionada Convención. El ministro de Relaciones Exteriores, Luis Alberto Castiglioni, mencionó que en el transcurso de esta semana se pondría nuevamente en contacto con su par brasileño Ernesto Araújo para obtener alguna respuesta con respecto a dicha petición oficial, pero hasta hoy todavía no hay novedades. El gobierno brasileño prefiere no dar declaraciones referentes al tema. 
Venezolanos, primera colonia de extranjeros en Chile - ÚltimaHora.com	https://www.ultimahora.com/venezolanos-primera-colonia-extranjeros-chile-n2798010.html	2019-02-15	Venezolanos, primera colonia de extranjeros en Chile	Los venezolanos se han erigido en la mayor colonia de inmigrantes en Chile, con 288.233 personas, lo que equivale al 23% del total, según un informe oficial. Los venezolanos desplazaron al segundo lugar a los peruanos, que por décadas conformaron la mayor colonia de extranjeros en el país, con 223.923 personas, el 18% del total. En tercer lugar se encuentran los haitianos (179.338), que también llegaron a Chile escapando de la crítica situación económica en su país. 
Unos 67.000 paraguayos migrantes retornaron en la última década - Nacionales - ABC Color	https://www.abc.com.py/nacionales/el-1--de-paraguayos-migrantes-retorno-en-los-ultimos-10-anos-1789002.html	2019-02-21	Unos 67.000 paraguayos migrantes retornaron en la última décadaNacionales	Los investigadores estiman que aproximadamente en los últimos 10 años, más de 67.000 paraguayos migrantes retornaron a nuestro país para reinsertarse laboral y socialmente. Esta cifra equivale al 10 % de los migrantes paraguayos residentes desde el 2010 en los cuatro principales destinos elegidos por nuestros compatriotas para buscar trabajo: Argentina, España, Brasil y Estados Unidos. Los estudios mostraron, entre otras cosas, que la población migrante retornada se asienta mayoritariamente en las áreas urbanas. 
Arrom y Martí, a un paso de perder el estatus de refugiados en Brasil - ÚltimaHora.com	https://www.ultimahora.com/arrom-y-marti-un-paso-perder-el-estatus-refugiados-brasil-n2806543.html	2019-03-12	Arrom y Martí, a un paso de perder el estatus de refugiados en Brasil	Tal parece que la visita oficial del presidente Mario Abdo Benítez a su par brasileño, Jair Bolsonaro, trajo consigo novedades respecto al pedido para revocar el estatus de refugiados políticos a Juan Arrom, Anuncio Martí y Víctor Colmán. Lea más: Arrom y Martí piden indemnización USD 123 millones a Paraguay Según explicó, el pedido está siendo evaluado por la Comisión Nacional de Refugiados y luego deberá ser remitido al ministro de Justicia de Brasil, Sergio Moro, quien tendrá la última palabra. Sobre el crimen trasnacional, comentó que Jair Bolsonaro destacó la labor de Abdo Benítez y las rápidas acciones que se tomaron para combatir la presencia de los grupos Primer Comando Capital (PCC) y Comando Vermelho en el país. 
Sí a los migrantes - Opinión - ABC Color	https://www.abc.com.py/opinion/si-a-los-migrantes-1767965.html	2019-04-22	Sí a los migrantesOpinión	Poco antes o después de la Segunda Guerra Mundial, arribaron aquí expediciones de alemanes, franceses, polacos, ucranianos, japoneses, italianos, turcos, libaneses, etc., que trabajaron duro para impulsar el comercio, la industria, la producción agrícola y la ganadería. José Asunción Flores compuso y grabó sus temas musicales más conocidos en Moscú. Lo importante es el balance final: ¿Los migrantes contribuyen económica y culturalmente a los países que los reciben? 
Paraguay tiene más de 200 refugiados - Nacionales - ABC Color	https://www.abc.com.py/nacionales/paraguay-tiene-mas-de-200-refugiados-1694299.html	2019-04-24	Paraguay tiene más de 200 refugiadosNacionales	Hasta la fecha tenemos pocos venezolanos y colombianos, detalló el director general, Juan Ignacio Livieres. Eso se debe a que, según explicó, en los mayores países de la región tienen muchas facilidades para su radicación, entonces los ciudadanos de dicho país no solicitan refugio sino directamente se radican en las naciones que los reciben. Lea más: Agobiados por la crisis humanitaria, venezolanos optan por Paraguay 
Francisco dona USD 500.000 para ayudar a los migrantes - ÚltimaHora.com	https://www.ultimahora.com/francisco-dona-usd-500000-ayudar-los-migrantes-n2815924.html	2019-04-27	Francisco dona USD 500.000 para ayudar a los migrantes	"Mundo Francisco dona USD 500.000 para ayudar a los migrantes El papa Francisco destinó medio millón de dólares para que la Iglesia de México pueda seguir asistiendo a los inmigrantes que se encuentran bloqueados en ese país en su ruta hacia los Estados Unidos, informó la Santa Sede. Te puede interesar: El zapatero peruano de los papas Benedicto y Juan Pablo II escribe su vida ""Todas estas personas se han quedado bloqueadas al no poder entrar en Estados Unidos, sin casa ni medios. Sin embargo la Santa Sede subraya que ""la cobertura mediática sobre esta emergencia ha ido disminuyendo y como consecuencia se ha reducido también la ayuda a los inmigrantes por parte del Gobierno y de los privados"". "
Argentina es menos atractiva para migración económica, dice experto - ÚltimaHora.com	https://www.ultimahora.com/argentina-es-menos-atractiva-migracion-economica-dice-experto-n2816008.html	2019-04-28	Argentina es menos atractiva para migración económica, dice experto	“Nadie sabe cómo esta crisis de tres, cuatro, seis o siete años afecta a estas poblaciones. Mencionó a la nación rioplatense como el destino predominante de la migración regional en el siglo pasado, mientras que en los últimos años vieron cómo Chile se fue posicionando en la atracción de migrantes, debido a la estabilidad en la economía y la esfera política, al igual que Brasil. En cuanto a otros procesos migratorios protagonizados por la comunidad paraguaya, el oficial de la OIM explicó que, junto con los venezolanos, fueron los únicos latinoamericanos que incrementaron la ida a Estados Unidos y España desde el inicio del nuevo milenio hasta el 2015. 
Sesenta migrantes muertos en naufragio en el Mediterráneo - La Nación.com.py	https://www.lanacion.com.py/mundo/2019/05/11/sesenta-migrantes-muertos-en-naufragio-en-el-mediterraneo/	2019-05-11	Sesenta migrantes muertos en naufragio en el Mediterráneo	"""Luego fueron transferidos a una lancha neumática más pequeña, sobrecargada, que naufragó 10 minutos después, hacia medianoche"" del jueves, agregó. El ministro italiano del Interior, Matteo Salvini, afirmó varias veces en abril que nadie sería autorizado a desembarcar en Italia. A principios de 2019, el ACNUR afirmó que “el Mediterráneo es desde hace varios años la vía marítima más cruenta del mundo para los refugiados y los migrantes (...)”. "
Cepal propone plan de inversión para frenar migración centroamericana - La Nación.com.py	https://www.lanacion.com.py/mundo/2019/05/20/cepal-propone-plan-de-inversion-para-frenar-migracion-centroamericana/	2019-05-20	Cepal propone plan de inversión para frenar migración centroamericana	Bárcena señaló que las principales causas de la emigración masiva desde Centroamérica son el pobre crecimiento económico, la desigualdad, el alto crecimiento demográfico, las sequías e inundaciones que afectan las siembras, así como la incesante violencia criminal y una fuerte diferencia salarial con Estados Unidos. Desde el año pasado, los emigrantes se organizan en multitudinarias caravanas para realizar el peligroso periplo en busca de su objetivo. Por su parte, el presidente mexicano, Andrés Manuel López Obrador, aboga por el desarrollo para frenar la ola de inmigración irregular hacia Estados Unidos. 
Suman seis los menores migrantes fallecidos bajo custodia de Estados Unidos - ÚltimaHora.com	https://www.ultimahora.com/suman-seis-los-menores-migrantes-fallecidos-custodia-estados-unidos-n2821110.html	2019-05-23	Suman seis los menores migrantes fallecidos bajo custodia de Estados Unidos	"Le puede interesar: Muere otro niño inmigrante bajo custodia de Estados Unidos ""Hay un esfuerzo masivo en la frontera para proteger a los niños, y sé que hemos salvado docenas de vidas en los últimos meses"", defendió McAleenan. ""No podemos trasladar tan rápido como nos gustaría a los varones adolescentes para que tengan una situación mejor para sus cuidados"", argumentó el funcionario. Con esas detenciones ascienden ya a 460.294 los arrestos de migrantes en el linde fronterizo desde el inicio del presente año fiscal 2019, que comenzó en octubre pasado. "
Brasil revoca estatus de refugiado a Arrom y Martí - ÚltimaHora.com	https://www.ultimahora.com/brasil-revoca-estatus-refugiado-arrom-y-marti-n2825689.html	2019-06-14	Brasil revoca estatus de refugiado a Arrom y Martí	"Luego de conocerse la sentencia, Paraguay confiaba en que ese fallo iba a favorecer en la decisión del Conare. Los primeros condenados por el caso fueron José Tomás Rosa, su esposa Nidia Espínola y De los Santos Saldívar. El ministro de Inteligencia, Esteban Aquino, sostuvo que esta decisión es ""una lección para quienes justificaron (a los prófugos), les ayudaron, estuvieron y probablemente sigan estando del lado incorrecto"". "
Arrom y Martí pierden estatus de refugiados en Brasil: la extradición será un hecho - Hoy - Noticas de Paraguay y el Mundo.	https://www.hoy.com.py/nacionales/arrom-y-marti-pierden-estatus-de-refugiados-en-brasil-la-extradicion-sera-un-hecho	2019-06-14	Arrom y Martí pierden estatus de refugiados en Brasil: la extradición será un hechoHoy	Arrom, Martí y Colmán son acusados en nuestro país por el secuestro de María Edith Bordón Debernardi, ocurrido en 2001. La agresión se verificó -dice- tras alertar a la propietaria del local sobre un faltante de dinero en caja. Concurrió al Hospital Regional de la ciudad, en donde le indicaron que había perdido el DIU (dispositivo para prevenir embarazo) y tras eso radicó la denuncia policial en la comisaría 50. 
HRW denuncia barbarie nunca antes vista contra niños migrantes en EEUU - ÚltimaHora.com	https://www.ultimahora.com/hrw-denuncia-barbarie-nunca-antes-vista-contra-ninos-migrantes-eeuu-n2828088.html	2019-06-27	HRW denuncia barbarie nunca antes vista contra niños migrantes en EEUU	Mundo HRW denuncia barbarie nunca antes vista contra niños migrantes en EEUU La situación de los niños que están en detención es un estado que fácilmente se puede caracterizar como cruel, inhumana, indigna y violatoria de los estándares internacionales. Los niños migrantes viven una barbarie nunca antes vista en EEUU por la política deliberada del presidente Donald Trump para disuadir la inmigración de centroamericanos, denunció José Miguel Vivanco, director para las Américas de Human Rights Watch (HRW). “Militares, con preparación militar, que les llaman Guardia Nacional, pero son las mismas personas con brazalete distinto. 
Más de 1.600 niños migrantes murieron o desaparecieron en últimos cinco años - ÚltimaHora.com	https://www.ultimahora.com/mas-1600-ninos-migrantes-murieron-o-desaparecieron-ultimos-cinco-anos-n2828317.html	2019-06-28	Más de 1.600 niños migrantes murieron o desaparecieron en últimos cinco años	Mundo Más de 1.600 niños migrantes murieron o desaparecieron en últimos cinco años Más de 1.600 niños murieron o desaparecieron entre 2014 y 2018 cuando intentaban llegar solos o junto a sus familias a un lugar que les ofreciera una vida mejor, según ha registrado en un informe la Organización Internacional para las Migraciones (OIM), que advierte de que la cifra real puede ser mucho mayor. Una vez más, las rutas migratorias del Mediterráneo central y occidental surgen como las que se cobran el mayor número de vidas. Otra arriesgada ruta para los migrantes es la que pasa por la frontera entre México y Estados Unidos, donde 1.907 personas fallecieron en los últimos cinco años, entre ellas 26 niños, aunque solo en la primera mitad de este año hay que sumar otros 13. 
Niegan a demócratas entrar a cárcel de menores inmigrantes en Miami - ÚltimaHora.com	https://www.ultimahora.com/niegan-democratas-entrar-carcel-menores-inmigrantes-miami-n2828516.html	2019-06-29	Niegan a demócratas entrar a cárcel de menores inmigrantes en Miami	Castro recordó la muerte el domingo del salvadoreño Óscar Martínez y su hija Valeria, cuyos cuerpos sin vida fueron hallados en el río Bravo. “Sí se puede”, dijo en español, usando el famoso lema de campaña del ex presidente Barack Obama que acuñó años antes la líder hispana Dolores Huerta. McAleenan atribuyó ese descenso al reciente acuerdo con el Gobierno mexicano, que forzará a quienes solicitan asilo en EEUU a esperar en el país vecino hasta que se resuelvan sus casos. 
ONU cuestiona cómo Gobierno de EEUU trata a migrantes - ÚltimaHora.com	https://www.ultimahora.com/onu-cuestiona-como-gobierno-eeuu-trata-migrantes-n2830531.html	2019-07-09	ONU cuestiona cómo Gobierno de EEUU trata a migrantes	“Como pediatra, pero también como madre y ex jefa de Estado, estoy profundamente impactada de que unos niños sean obligados a dormir en el suelo en instalaciones superpobladas, sin acceso a cuidados de salud o a alimentos adecuados y en malas condiciones sanitarias“, declaró Michelle Bachelet. Piensen en los daños causados cada día si se deja que esta situación alarmante perdure“, agregó. Cuando finalmente creen que llegaron en condiciones de seguridad, se ven separados de sus seres queridos y encerrados en condiciones indignas“, insistió Bachelet. 
