title	link	date	title_corrected	summary
21 migrants get deportation stays - Trinidad Guardian	http://www.guardian.co.tt/news/21-migrants-get-deportation-stays-6.2.1258426.75290bc25f	2020-12-03	21 migrants get deportation stays	Guardian Media understands that last night, Justice Joan Charles granted orders for four of the migrant children. They were then held in custody at several police stations until their deportation two Sundays ago. The group is also being represented by Nafeesa Mohammed, Dayadai Harripaul and Umesh Maharaj. 
How backing V'zuelan migrants is in our selfish interest - TT Newsday	https://newsday.co.tt/2020/12/03/how-backing-vzuelan-migrants-is-in-our-selfish-interest/	2020-12-03	How backing V'zuelan migrants is in our selfish interest	None 
6-month extension for registered migrants likely - TT Newsday	https://newsday.co.tt/2020/12/06/6-month-extension-for-registered-migrants-likely/	2020-12-06	6-month extension for registered migrants likely	None 
82 women, children at ISIS refugee camps want travel documents to return home - TT Newsday	https://newsday.co.tt/2020/12/09/82-women-children-at-isis-refugee-camps-want-travel-documents-to-return-home/	2020-12-09	82 women, children at ISIS refugee camps want travel documents to return home	None 
LATT and the migration issue - TT Newsday	https://newsday.co.tt/2020/12/10/latt-and-the-migration-issue/	2020-12-10	LATT and the migration issue	None 
Living Water Community gets US funds to support Venezuelan refugees - Trinidad Guardian	http://www.guardian.co.tt/news/living-water-community-gets-us-funds-to-support-venezuelan-refugees-6.2.1261904.7d649f62fd	2020-12-10	Living Water Community gets US funds to support Venezuelan refugees	The Living Water Community (LWC) has received a major boost in its effort to help Venezuelan refugees after being awarded special grant funding from the United States Government. For the second year in a row, the LWC is a recipient of a grant from the Julia Taft Refugee Fund, which provides non-governmental organizations with up to $25,000 USD to quickly meet critical needs in refugee protection and assistance. The Embassy release also noted that the United States has provided nearly $10 million USD to assist Venezuelan refugees and displaced persons, as part of its many areas of cooperation with Trinidad and Tobago. 
Human rights body wants details on Venezuelan refugees - TT Newsday	https://newsday.co.tt/2020/12/11/human-rights-body-wants-details-on-venezuelan-refugees/	2020-12-11	Human rights body wants details on Venezuelan refugees	None 
Venezuelan activist accepts Coast Guard report on weekend drowning of 11 migrants - Trinidad Guardian	http://www.guardian.co.tt/news/venezuelan-activist-accepts-coast-guard-report-on-weekend-drowning-of-11-migrants-6.2.1263521.d31acd5607	2020-12-14	Venezuelan activist accepts Coast Guard report on weekend drowning of 11 migrants	Venezuelan activist, Ignacio Smith, told CNC3 News that he believes the Coast Guard’s version of events. “We do have a situation where people are trying to leave, probably to re-join their families here in Trinidad, which is why you see children on these vessels,” he explains. “There are many unscrupulous people who will take money from those persons who wish to come, and then they ride on these unsecure and unstable vessels and try to come across through what we call ‘Los Caminos Verdes’, or The Green Passages,” he said. 
Respect our migrant laws - Trinidad Guardian	http://www.guardian.co.tt/opinion/respect-our-migrant-laws-6.2.1263277.cefaf37709	2020-12-14	Respect our migrant laws	Prime Minister Dr Keith Rowley has made it very clear that while T&T has opened its arms more readily than many others, we are not prepared to accept the continued flouting of our laws, more so, when COVID-19 presents its own challenges. The Venezuelan opposition would better serve its nationals by spreading a message against taking such unnecessary and life-threatening risks. Until then we maintain the position that our laws must be fully respected and reject any attempt to lay blame for this unfortunate incident at the feet of our people. 
20 Venezuelan migrants drown: Boat owner arrested - Trinidad & Tobago Express Newspapers	https://trinidadexpress.com/news/local/20-venezuelan-migrants-drown-boat-owner-arrested/article_b4c77bc4-3e6d-11eb-9017-279bced36c7a.html	2020-12-15	20 Venezuelan migrants drown: Boat owner arrested	According to the Reuters report, Venezuela’s Chief Prosecutor Tarek Saab wrote on Twitter that 56-year-old Luis Martinez had been arrested and the case assigned to prosecutors specialising in human trafficking. Reuters stated the government of President Nicolas Maduro initially said it had found 14 bodies floating off shore from Guiria in the state of Sucre, a frequent departure point for migrants fleeing Venezuela’s economic crisis to Trinidad and Tobago. These persons have not been seen or heard from since that day. 
Venezuelan migrant believes wife, son among 23 drowned in attempt to reach Trinidad - TT Newsday	https://newsday.co.tt/2020/12/16/venezuelan-migrant-believes-wife-son-among-23-drowned-in-attempt-to-reach-trinidad/	2020-12-16	Venezuelan migrant believes wife, son among 23 drowned in attempt to reach Trinidad	None 
Prime Minister defends migration policy: Trinidad and Tobago comes first - TT Newsday	https://newsday.co.tt/2020/12/17/prime-minister-defends-migration-policy-trinidad-and-tobago-comes-first/	2020-12-17	Prime Minister defends migration policy: Trinidad and Tobago comes first	None 
T&T not involved in migrant drowning - Trinidad & Tobago Express Newspapers	https://trinidadexpress.com/news/local/t-t-not-involved-in-migrant-drowning/article_1202147c-40c9-11eb-8e79-e3d749cbf35f.html	2020-12-17	T&T not involved in migrant drowning	He said preliminary information indicated that a vessel had departed Guiria on December 6 with more than 20 persons in board. He said Trinidad and Tobago did not intercept any vessels coming from Guiria on December 6 or anytime thereafter, adding that the Coast Guard dispatched assets to help search for bodies. He said another reality affecting T&T is the “flagrant disregard” of the borders by drug and gun runners, human traffickers and others linked to organised crime in South America. 
Grieving migrant: Help me to help my surviving family - TT Newsday	https://newsday.co.tt/2020/12/17/grieving-migrant-help-me-to-help-my-surviving-family/	2020-12-17	Grieving migrant: Help me to help my surviving family	None 
Time to find solution to migrant crisis - Trinidad Guardian	http://www.guardian.co.tt/opinion/time-to-find-solution-to-migrant-crisis-6.2.1264720.2f874ef361	2020-12-17	Time to find solution to migrant crisis	But no one can deny that our closest neighbour is in trouble, with the collapse of their economy, growing hunger and a regime isolated by most democratic nations. However, once refugees arrive here, we must be guided by the laws of T&T and the various international commitments we signed onto in good faith. It is why fake news that suggests the unfortunate deaths of two dozen Venezuelan occurred after they were turned back at the border can fester and people believe there is some truth to it. 
UN bodies call for migrants to be involved in global COVID-19 recovery efforts - Trinidad Guardian	http://www.guardian.co.tt/news/un-bodies-call-for-migrants-to-be-involved-in-global-covid19-recovery-efforts-6.2.1265271.03567325cb	2020-12-18	UN bodies call for migrants to be involved in global COVID-19 recovery efforts	These are emotions felt by migrants around the world every day,” he points out. As a result of this global experience, Mr Guterres argues that more compassion should be extended to migrants. He added: “The dedication and entrepreneurial spirit we have seen this year reminds us that, as we move from pandemic response to recovery over the coming months, migrants will be an integral part of that return to normal life. 
An uncontrolled migrant crisis can be detrimental to T&T - Trinidad & Tobago Express Newspapers	https://trinidadexpress.com/opinion/letters/an-uncontrolled-migrant-crisis-can-be-detrimental-to-t-t/article_df861952-4191-11eb-8df5-4faae694b6c2.html	2020-12-18	An uncontrolled migrant crisis can be detrimental to T&T	I am very concerned by the latest developments which have taken place regarding our Venezuelan migrant crisis. It appears that international agencies and players have taken to ramping up the pressure on this country to relax its justified stance on the illegal migration of Venezuelans through our borders. Clear untruths, apparent intentional efforts to make this country look bad and questionable actions from international agencies have been revealed. 
Amnesty International urges T&T to help migrants - Trinidad Guardian	http://www.guardian.co.tt/news/amnesty-international-urges-tt-to-help-migrants-6.2.1265115.c901910d4b	2020-12-18	Amnesty International urges T&T to help migrants	In a statement, the body said T&T authorities had failed to condemn the “massive human rights violations in Venezuela” and was instead more focused on protecting its own national security. The group said while information was still unclear about what exactly happened with that wreckage, their initial information suggested that between 14 and 21 children and adults are either dead or are missing. The mass human rights violations and humanitarian crisis in Venezuela don’t end with a pandemic,” Amnesty International said. 
Human rights group: Let Caricom help Trinidad and Tobago with Venezuelan migrants - TT Newsday	https://newsday.co.tt/2020/12/18/human-rights-group-let-caricom-help-trinidad-and-tobago-with-venezuelan-migrants/	2020-12-18	Human rights group: Let Caricom help Trinidad and Tobago with Venezuelan migrants	None 
UNC: Government needs real plan for Venezuelan migrants - TT Newsday	https://newsday.co.tt/2020/12/18/unc-government-needs-real-plan-for-venezuelan-migrants/	2020-12-18	UNC: Government needs real plan for Venezuelan migrants	None 
PM Rowley not backing down on migrant stance - Trinidad Guardian	http://www.guardian.co.tt/news/pm-rowley-not-backing-down-on-migrant-stance-6.2.1265119.58a4baf053	2020-12-18	PM Rowley not backing down on migrant stance	And maybe one day a Venezuelan can speak to the days when her parents came here before she was born in T&T.” Rowley said one of the things Government cannot do is mass deportations. One of the laws being upgraded will make it less attractive for them to do that, he said. • Government will also “get there” on a recommendation for workplaces to be vigilantly regulated and monitored by Government, guarding against exploitation of workers and for abusive employers to be prosecuted. 
Venezuela migrants issue must be resolved - Trinidad Guardian	http://www.guardian.co.tt/opinion/venezuela-migrants-issue-must-be-resolved-6.2.1265607.507e4e6073	2020-12-19	Venezuela migrants issue must be resolved	Trinidad and Tobago has been getting a lot of negative press recently over the situation involving Venezuelan migrants who have been braving the seas to enter this country illegally. It will be interesting to see how the US-Venezuela situation develops under President-elect Joe Biden. On Thursday, Venezuelan Attorney General Tarek Williams Saab said each migrant paid US$150 to a human-trafficking ring as passage. 
Clarity, compassion,co-operation on migrants - TT Newsday	https://newsday.co.tt/2020/12/20/clarity-compassionco-operation-on-migrants/	2020-12-20	Clarity, compassion,co-operation on migrants	None 
MP Charles: Review migrant policy, lock down borders - TT Newsday	https://newsday.co.tt/2020/12/21/mp-charles-review-migrant-policy-lock-down-borders/	2020-12-21	MP Charles: Review migrant policy, lock down borders	None 
MSJ backs Govt on Venezuelan migrant policy - TT Newsday	https://newsday.co.tt/2020/12/22/msj-backs-govt-on-venezuelan-migrant-policy/	2020-12-22	MSJ backs Govt on Venezuelan migrant policy	None 
PM: Who is getting $11m to support migrants in T&T? - Trinidad & Tobago Express Newspapers	https://trinidadexpress.com/news/local/pm-who-is-getting-11m-to-support-migrants-in-t-t/article_f48d8d22-4582-11eb-8bed-bf83d7e45e54.html	2020-12-23	PM: Who is getting $11m to support migrants in T&T?	This is what Prime Minister Dr Keith Rowley would like to know. “If there is $11 million in Trinidad and Tobago to support migrants coming here, as the head of the Government of this country, I would love to know who is getting that money. So it has raised certain questions and we await the answers. 
US donates US$11m to NGOs to help Venezuelan migrants - TT Newsday	https://newsday.co.tt/2020/12/24/us-donates-us11m-to-ngos-to-help-venezuelan-migrants/	2020-12-24	US donates US$11m to NGOs to help Venezuelan migrants	None 
US Embassy reveals exactly where migrant aid $$ went - Trinidad Guardian	http://www.guardian.co.tt/news/us-embassy-reveals-exactly-where-migrant-aid--went-6.2.1267833.782e9674c7	2020-12-25	US Embassy reveals exactly where migrant aid $$ went	When asked about his thoughts on the US Embassy’s statement issued over the weekend Prime Minister Rowley said: “just bear in mind that somebody or bodies are getting and have received $77 million for this purpose. It explains a lot,” he said But yesterday in the information released, it showed the Embassy’s aid sheet included Democracy International, Living Water Community, UNHCR and Unicef. Earlier this month, some 20 Venezuelan nationals boarded a pirogue in Guiria and headed to Trinidad. 
Let's support Govt in the migrant crisis - TT Newsday	https://newsday.co.tt/2020/12/26/lets-support-govt-in-the-migrant-crisis/	2020-12-26	Let's support Govt in the migrant crisis	None 
Young: It's wrong to transport migrants - TT Newsday	https://newsday.co.tt/2020/12/26/its-a-crime-to-transport-migrants/	2020-12-26	Young: It's wrong to transport migrants	None 
New unit could be key to illegal migrant fight - Trinidad Guardian	http://www.guardian.co.tt/article/new-unit-could-be-key-to-illegal-migrant-fight-6.2.1268394.5640cb6c36	2020-12-27	New unit could be key to illegal migrant fight	It seems appropriate then, that Minister Young should turn his attention to a sea-based IATF-styled unit. During Parliamentary debate, Minister Young referred to maritime assets, interceptor vessels and radar systems being augmented by regiment land patrols in the illegal migrant fight. In this regard, we also hope that the latest plan is rolled out sooner rather than later. 
The miserable life of a migrant - Trinidad & Tobago Express Newspapers	https://trinidadexpress.com/newsextra/the-miserable-life-of-a-migrant/article_37d99eb6-48a5-11eb-9da5-b3ea26b0d04d.html	2020-12-28	The miserable life of a migrant	She was a ghost when she got here, undocumented and, like so many others, trying every day to earn money by whatever means —sales, skills, sex—while trying to avoid police attention, detention, and deportation. As of Saturday, six days later, they had not told Angelys’ children that she was dead. Her body is now on a slab at the Forensic Science Centre in Federation Park. 
TT migrant crisis: An epidemiological view - TT Newsday	https://newsday.co.tt/2021/01/02/tt-migrant-crisis-an-epidemiological-view/	2021-01-02	TT migrant crisis: An epidemiological view	None 
9 migrant children released but mothers remain in quarantine - TT Newsday	https://newsday.co.tt/2021/01/03/9-migrant-children-released-but-mothers-remain-in-quarantine/	2021-01-03	9 migrant children released but mothers remain in quarantine	None 
The migrant crisis and its long-term impact - Trinidad & Tobago Express Newspapers	https://trinidadexpress.com/opinion/letters/the-migrant-crisis-and-its-long-term-impact/article_3392ffe2-5079-11eb-b308-2fe880f14b1b.html	2021-01-07	The migrant crisis and its long-term impact	Certainly, there will be long-term demographic, sociological, environmental, economic, political and even national security impacts of this tragedy in the making. As a lecturer in environmental health/public health, I seek to focus on the short- term epidemiological dangers this poses. As patriotic citizens of our beloved land, let’s support the Government in this battle for national survival. 
How embassy's US$11m for Venezuelan migrants was spent - TT Newsday	https://newsday.co.tt/2021/01/08/how-embassys-us11m-for-venezuelan-migrants-was-spent/	2021-01-08	How embassy's US$11m for Venezuelan migrants was spent	None 
6 Venezuelan migrants held in Penal - TT Newsday	https://newsday.co.tt/2021/01/09/6-venezuelan-migrants-held-in-penal/	2021-01-09	6 Venezuelan migrants held in Penal	None 
Tewarie: Big $$ and migrant headache - Trinidad & Tobago Express Newspapers	https://trinidadexpress.com/news/local/tewarie-big-and-migrant-headache/article_0c96565a-52db-11eb-973f-8328a98d7f0e.html	2021-01-10	Tewarie: Big $$ and migrant headache	“That immigration in the Caribbean is mostly intra-Caribbean immigration moving from island to island and this Venezuelan migrant situation, though not as heavy in other islands, is really a new phenomenon for the entire region and for T&T. He said the migrant issue should have been dealt with since 2014, further arguing that there was no clear strategy for integration of Venezuelan migrants. “What I am seeing is an attempt by the State that we have some degree of structure. 
Lawyers for T&T children in ISIS sue Immigration boss - Trinidad Guardian	http://www.guardian.co.tt/news/lawyers-for-tt-children-in-isis-sue-immigration-boss-6.2.1275883.249b368b03	2021-01-14	Lawyers for T&T children in ISIS sue Immigration boss	Samdeo also took aim at the Anti-Terrorism Amendment Bill 2020, which she said seeks to improperly target children. In that lawsuit, the relatives are seeking to compel the ministry through National Security Minister Stuart Young to make a decision on whether they would be allowed or denied admission into T&T at a later date. The group is also being represented Criston J Williams and Jerome Riley. 
Rethink immigration policies - TT Newsday	https://newsday.co.tt/2021/01/14/rethink-immigration-policies/	2021-01-14	Rethink immigration policies	None 
Lawsuit filed for 'TT' children in ISIS refugee camps - TT Newsday	https://newsday.co.tt/2021/01/16/lawsuit-filed-for-tt-children-in-isis-refugee-camps/	2021-01-16	Lawsuit filed for 'TT' children in ISIS refugee camps	None 
Can America can solve migrant crisis? - TT Newsday	https://newsday.co.tt/2021/01/17/can-america-can-solve-migrant-crisis/	2021-01-17	Can America can solve migrant crisis?	None 
UN: Covid19 slows down international migration - TT Newsday	https://newsday.co.tt/2021/01/19/un-covid19-slows-down-international-migration/	2021-01-19	UN: Covid19 slows down international migration	None 
Equal Place prepares 1,000 migrant students for Catholic school - TT Newsday	https://newsday.co.tt/2021/01/20/equal-place-prepares-1000-migrant-students-for-catholic-school/	2021-01-20	Equal Place prepares 1,000 migrant students for Catholic school	None 
Young: Updated migrant policy still being developed - TT Newsday	https://newsday.co.tt/2021/01/23/young-updated-migrant-policy-still-being-developed/	2021-01-23	Young: Updated migrant policy still being developed	None 
'Venezuelan women exploited, disrespected' by Immigration - Trinidad Guardian	http://www.guardian.co.tt/news/venezuelan-women-exploited-disrespected-by-immigration-6.2.1279797.3272d5734b	2021-01-23	'Venezuelan women exploited, disrespected' by Immigration	Venezuelan women have complained of being exploited and disrespected by not only ordinary citizens but also by T&T's immigration officials says Dr Marlene Attzs, lecturer at the University of the West Indies (UWI). They couldn’t be here because they are trying to eke out a decent livelihood for their families back home, but they are here because they want to engage in prostitution,” Attzs said speaking at a virtual forum on Venezuelan migrants hosted by the Trade and Economic Development Unit of the Department of Economics, UWI, St Augustine, on Friday. “Some of the women interviewed have actually said that they are ridiculed by T&T’s immigration officials and state agents in terms of they come here legally and an immigration official would say to them ‘I don’t want to see your Letter of Invitation because I know what you’re here to do.’ Then he or she will use the full brunt of the power that they have to belittle and embarrass that migrant.” Attzs said T&T needs a gender policy for migrants. 
The refugee dogs of Tobago - TT Newsday	https://newsday.co.tt/2021/01/25/the-refugee-dogs-of-tobago/	2021-01-25	The refugee dogs of Tobago	None 
Venezuelan firm helps migrants ship goods from TT - TT Newsday	https://newsday.co.tt/2021/02/04/vzuelan-firm-helps-migrants-ship-goods-from-tt/	2021-02-04	Venezuelan firm helps migrants ship goods from TT	None 
Supermarkets wait and see over migrant re-registration - TT Newsday	https://newsday.co.tt/2021/02/10/supermarkets-wait-and-see-over-migrant-re-registration/	2021-02-10	Supermarkets wait and see over migrant re-registration	None 
Venezuelans welcome plan to vaccinate migrants - TT Newsday	https://newsday.co.tt/2021/02/21/venezuelans-welcome-plan-to-vaccinate-migrants/	2021-02-21	Venezuelans welcome plan to vaccinate migrants	None 
Published inJewel Ali: Moruga girl heads UN migration office - TT Newsday	https://newsday.co.tt/2021/03/07/jewel-ali-moruga-girl-heads-un-migration-office/	2021-03-07	Published inJewel Ali: Moruga girl heads UN migration office	None 
Renewed calls to bring nationals home from ISIS refugee camps - TT Newsday	https://newsday.co.tt/2021/03/22/renewed-calls-to-bring-tt-nationals-home-from-isis-refugee-camps/	2021-03-22	Renewed calls to bring nationals home from ISIS refugee camps	None 
‘Penal Covid hotspot due to migrant inflow’ - Trinidad & Tobago Express Newspapers	https://trinidadexpress.com/newsextra/penal-covid-hotspot-due-to-migrant-inflow/article_c03b8ea8-9220-11eb-899d-cb587bf8a2b8.html	2021-03-31	‘Penal Covid hotspot due to migrant inflow’	Penal/Debe Chamber of Commerce president Rampersad Sieuraj said he was not surprised that Penal has been identified as a hotspot for Covid-19 as illegal Venezuelans have been entering the country through areas in the district. On Sunday, Sieuraj said: “I am not surprised that Penal is a hotspot for Covid-19 simply because of the fact that we have so many illegal immigrants who have entered Trinidad via the southwest, like Morne Diablo and Lamoshell in Penal Rock Road, unchecked over the past year.” He said this has occurred on a daily or weekly basis. Sieuraj believes that had money been spent by the Government last year to purchase PCR and antigen test kits and also to test citizens and conduct contact tracing, the country would have been shut down for four weeks but would have now been in a better position. 
Relatives of Trini refugees let down by court's decision - Trinidad Guardian	http://www.guardian.co.tt/news/relatives-of-trini-refugees-let-down-by-courts-decision-6.2.1308617.115d57c96a	2021-03-31	Relatives of Trini refugees let down by court's decision	The relatives of women and children living in a Syrian refugee camp are saying that they are disappointed that a High Court decision on whether or not they would be granted passports to return to this country was postponed until April 26. When will our loved ones be rescued from this trauma? In an October 2019 update, Minister Young said the government was still doing verification checks. 
Families willing to pay for return of nationals at ISIS refugee camp - TT Newsday	https://newsday.co.tt/2021/03/31/families-willing-to-pay-for-return-of-nationals-at-isis-refugee-camp/	2021-03-31	Families willing to pay for return of nationals at ISIS refugee camp	None 
Venezuelan migrants leaving T&T - Trinidad Guardian	http://www.guardian.co.tt/news/venezuelan-migrants-leaving-tt-6.2.1313184.6847520317	2021-04-11	Venezuelan migrants leaving T&T	He said President of the United States Joe Biden has taken a less hardline approach to migration than his predecessor Donald Trump and it is possible that secret negotiations might be taking place with the Maduro regime. She added that local authorities are looking at Venezuelan migration through the lens of human trafficking. “Unfortunately the xenophobia will not go away any time soon, as we are only registering those that were already registered. 
70 per cent of Venezuelan migrants entered illegally - Trinidad & Tobago Express Newspapers	https://trinidadexpress.com/newsextra/70-per-cent-of-venezuelan-migrants-entered-illegally/article_f1abd424-9c76-11eb-9fea-dff09581e030.html	2021-04-13	70 per cent of Venezuelan migrants entered illegally	Even with borders closed 70 per cent of Venezuelan migrants entered Trinidad through illegal entry points. We know that the largest category of registrants were refugees and asylum seekers in both years”, she said. Meanwhile, an examination of routes showed that there was no significant variation between the two in 2019 and 2020. 
Man gets bail for alleged rape of migrant - Trinidad Guardian	http://www.guardian.co.tt/news/man-gets-bail-for-alleged-rape-of-migrant-6.2.1317524.206be4d5ba	2021-04-21	Man gets bail for alleged rape of migrant	Terrence Robinson, Joel Williams, and Joshua Ramlakhan appeared virtually before Magistrate Adrian Darmanie on Monday. The incident is alleged to have occurred in October, last year. In an unrelated matter, 35-year-old Anil Flemmin was remanded into custody Monday after appearing before a Sangre Grande Magistrate charged with two counts of sexual penetration of a 16-year-old girl. 
