title	link	date	title_corrected	summary
Paraguayos migrantes remesan en promedio USD 1,3 millones por día - ÚltimaHora.com	https://www.ultimahora.com/paraguayos-migrantes-remesan-promedio-usd-13-millones-dia-n528467.html	2012-05-16	Paraguayos migrantes remesan en promedio USD 1,3 millones por día	Solo en los dos primeros meses del año, migrantes paraguayos remesaron un promedio de USD 1.300.000 por día al país. En el 2011 el total de remesas recibidas alcanzó unos USD 450 millones, lo que significó un crecimiento del 65% frente al año anterior. Argentina se presenta como el tercer país en envíos de remesas, con apenas USD 4 millones remitidos en el primer bimestre. 
Paraguayas jóvenes son las que migran más a España - Locales - ABC Color	https://www.abc.com.py/edicion-impresa/locales/paraguayas-jovenes-son-las-que-migran-mas-a-espana-530663.html	2013-01-22	Paraguayas jóvenes son las que migran más a EspañaLocales	El investigador refirió que se suele exagerar con los números, y los datos más fiables son los del censo de ese país. Este crecimiento (que equivale a multiplicar 38 veces la población migrante) tuvo un claro rostro femenino. Siete de cada diez migrantes en España son mujeres, proporción que marca una gran diferencia con el destino tradicional argentino, donde en 2010 el componente femenino representa el 55,6%”, explica Bruno. 
Realizaron jornadas para el migrante en Barcelona - Mundo - ABC Color	https://www.abc.com.py/internacionales/realizaron-jornadas-para-el-migrante-en-barcelona-532796.html	2013-01-28	Realizaron jornadas para el migrante en BarcelonaMundo	Los asistentes también tuvieron turno de preguntas, quejas y expusieron sus ideas para mejorar estas ayudas. Aprovechando la presencia de las autoridades paraguayas también se realizó el lanzamiento del programa televisivo “Ro hechaga'u che reta pora” (Te extraño mi patria hermosa) cuyos presentadores son las periodistas paraguayas Matilde Herrera y Ada Jara, bajo la dirección de Luis de los Angeles. El programa se emite semanalmente por la “TV Integración Canal 37 TV-TDT” en Barcelona y trata temas de interés general para los migrantes, cultura, tradición, arte culinario, intercambio con otras asociaciones de latinos. 
Inmigrantes forman una federación - ÚltimaHora.com	https://www.ultimahora.com/inmigrantes-forman-una-federacion-n702523.html	2013-07-08	Inmigrantes forman una federación	Hallaron un sitio en la Capellanía del Migrante, en el ex Seminario Metropolitano, para reunirse periódicamente, poner en común los problemas de sus respectivas colectividades y buscar soluciones. “Somos todos voluntarios, algunos representan a sus asociaciones o están en carácter personal en la organización. Para nosotros lo que hay que investigar son los antecedentes policiales y penales”, opina Caravedo, peruano y con cerca de 30 años de residencia en el Paraguay. 
Se da vuelta la tortilla: Españoles migran a Paraguay - Paraguay.com	https://www.paraguay.com/nacionales/se-da-vuelta-la-tortilla-espanoles-migran-a-paraguay-99795	2013-12-24	Se da vuelta la tortilla: Españoles migran a Paraguay	"24 de Diciembre, 2013 | Nacionales Se da vuelta la tortilla: Españoles migran a Paraguay Aún no se tienen estadísticas en Migraciones, pero ""es llamativa la cantidad de españoles"" que vienen al país para residir, según el titular del ente. Jorge Kronawetter, Director General de Migraciones, reveló a Cardinal AM que existe un importante flujo migratorio de españoles que solicitan radicarse en Paraguay. ""Lo importante es que la mayoría son gente de nivel universitario, la mayoría técnicos con conocimiento acabado en cuestiones bancarias, son ingenieros, gente que maneja el comercio”, destacó. "
Beber mate, el pequeño placer de los refugiados sirios - ÚltimaHora.com	https://www.ultimahora.com/beber-mate-el-pequeno-placer-los-refugiados-sirios-n785413.html	2014-04-11	Beber mate, el pequeño placer de los refugiados sirios	En la tienda de campaña, mientras algunos beben café preparado al estilo turco, otros toman la infusión. Matan las horas eternas conversando sobre las últimas noticias que llegan de Siria, visitándose los unos a los otros y dándose consuelo. Pero no solo es famosa en Yabrud, sino también en toda la región de Al Qalamún, donde se ubica esta localidad; así como en Homs y Hama, en el centro, y en las provincias costeras, como Tartús, donde es la bebida oficial; aunque también puede encontrarse en otras partes de Siria. 
Puestos migratorios cierran por crecidas - Paraguay.com	https://m.paraguay.com/nacionales/puestos-migratorios-cierran-por-crecidas-110137	2014-06-13	Puestos migratorios cierran por crecidas	Tres puestos migratorios ubicados en puertos en la ribera del río Paraná han sido trasladados, mientras que otros cuatro están cerrados por la suspensión de operaciones en el lado argentino. En el departamento de Itapúa, el río ha inundado los puestos migratorios paraguayos de Mayor Otaño, Capitán Meza y Ape Aimé, que han sido trasladados a la Prefectura Naval o la Marina. El mayor impacto es en Asunción, donde hay 58.300 evacuados, de acuerdo con esa entidad. 
Faltan baños y canillas para refugiados en plaza 14 de Julio - Nacionales - ABC Color	https://www.abc.com.py/nacionales/faltan-banos-y-canillas-para-refugiados-en-plaza-14-de-julio-1259712.html	2014-06-26	Faltan baños y canillas para refugiados en plaza 14 de JulioNacionales	Allí, al menos 50 familias del barrio San Pedro se refugiaron de la crecida del río Paraguay que “inundó completamente nuestro barrio”, según contaron a ABC Color durante un recorrido el martes. Lo principal es la comida, señalan varias señoras cuyos hijos juegan a sus anchas en medio de la plaza. La mayoría de la gente está sin trabajar porque son recicladores de plástico, cartón y demás residuos que se reutilizan, pero como están en una plaza tienen prohibido llevar allí “la basura”. 
Retorno de migrantes obliga a desarrollar nuevas políticas - ÚltimaHora.com	https://www.ultimahora.com/retorno-migrantes-obliga-desarrollar-nuevas-politicas-n808799.html	2014-07-03	Retorno de migrantes obliga a desarrollar nuevas políticas	Carol Dohmen, técnica del área psicosocial de la organización Geam para el proyecto Jaikatu, explica que inicialmente dicha iniciativa buscaba potenciar las remesas enviadas por los migrantes en las familias receptoras, pero luego el trabajo cambió, al incluirse el factor retorno, y ahora buscan que la Secretaría de Repatriados desarrolle el programa a partir de un convenio ya firmado hace poco. “El proyecto empezó con la idea de apoyar a cien familias paraguayas residentes en Madrid que querían poner negocios en su comunidad de origen con sus familiares, entonces trabajamos tanto en España como acá en Paraguay, en 12 departamentos del país”, detalló. Dohmen sostuvo que, al finalizar el proyecto, dieron apertura a un diálogo con la Secretaría de Repatriados y ya se están abriendo rubros para apoyo a microempresas, los cuales antes solo se usaban para traer enseres o cadáveres de connacionales fallecidos. 
Paraguay tiene el mayor nivel de emigración - Paraguay.com	https://www.paraguay.com/nacionales/paraguay-tiene-el-mayor-nivel-de-emigracion-118992	2014-11-12	Paraguay tiene el mayor nivel de emigración	Este índice se obtiene al comparar los compatriotas que viven en el exterior frente a la cantidad de habitantes del país. Los paraguayos han emigrado principalmente a la Argentina, comparando la cantidad de compatriotas en 2000 y 2010 se puede apreciar que se tuvo un incremento del 70,5 por ciento en 10 años. El segundo principal destino de los paraguayos en 2010 era España con casi 80 mil habitantes, mientras que Brasil se ubicaba en el tercer lugar con más de 39 mil. 
Los migrantes marginados - Notas - ABC Color	https://www.abc.com.py/especiales/fin-de-semana/los-marginados-migrantes-1324712.html	2015-01-09	Los migrantes marginadosNotas	Según sondeos, en cada familia hay un migrante o conoce a alguno”, relata Mary Méndez, paraguaya residente desde hace más de una década en España. “Las remesas hoy corresponden al tercer puesto de la economía paraguaya muy cerca de los royalties; fíjate qué importantes tendríamos que ser, pero acá nosotros ni somos escuchados, ni somos conocidos”, lamenta en entrevista con ABC Color. “Porque los sojeros y los ganaderos son muy importantes, pero ese dinero no se ve aquí. 
"""Ser artista y ser migrante es ser realmente un ciudadano del mundo"" - La Nación.com.py"	https://www.lanacion.com.py/2015/06/19/ser-artista-y-ser-migrante-es-ser-realmente-un-ciudadano-del-mundo/	2015-06-19	"""Ser artista y ser migrante es ser realmente un ciudadano del mundo"""	Pienso que los países deberían replantearse políticamente todo lo relacionado a la libre circulación, ya que en un mundo dinámico los seres humanos siempre buscan el bienestar y el proceso migratorio se da buscando mejores oportunidades ya sea de trabajo, de vivienda, salud, educación o de superación personal. -Hace varios años estás en Argentina ¿de qué manera se desarrolla su trabajo artístico allá? Además como artista tenés la responsabilidad de representar en todo momento al país de donde venís, enriquecer con tu discurso artístico el ambiente cultural que te toca vivir y dejar un camino abierto para los que quieran venir después a transitar la misma experiencia. 
Comunidad sirio-libanesa asiste a refugiados sirios en Asunción - Paraguay.com	https://www.paraguay.com/nacionales/comunidad-sirio-libanesa-asiste-a-refugiados-sirios-en-asuncion-133451	2015-09-10	Comunidad sirio-libanesa asiste a refugiados sirios en Asunción	Les faltaban otros cuatro para aterrizar en España, desde donde esperaban poder alcanzar a sus familiares repartidos por Bélgica, Suecia, Alemania y Estados Unidos. Los siete solicitaron formalmente la condición de refugiados, y ahora tramitan una radicación temporal, mientras concluye el proceso judicial abierto tras su entrada irregular al país. El religioso explicó que los recién llegados necesitan poder trabajar y mantenerse antes de partir en algún momento para reunirse con sus familiares en otros países. 
Hungría empieza a rechazar a los refugiados que llegan de Serbia - ÚltimaHora.com	https://www.ultimahora.com/hungria-empieza-rechazar-los-refugiados-que-llegan-serbia-n930366.html	2015-09-14	Hungría empieza a rechazar a los refugiados que llegan de Serbia	Preguntados desde el lado húngaro de la frontera, algunos refugiado dijeron a Efe que la valla no les parará. Según la televisión pública M1, la policía informó a los refugiados de que deben ir caminando un kilómetro más hasta una entrada oficial, donde podrán pedir asilo si así lo desean. Los refugiados hacían largas colas para subirse a los vehículos que partían en cuestión de minutos rumbo al noroeste y oeste del país, hacia la frontera con Austria. 
Las migraciones por el cambio climático ya comenzaron, advierte experto - ÚltimaHora.com	https://www.ultimahora.com/las-migraciones-el-cambio-climatico-ya-comenzaron-advierte-experto-n930938.html	2015-09-16	Las migraciones por el cambio climático ya comenzaron, advierte experto	"Mundo Las migraciones por el cambio climático ya comenzaron, advierte experto Las migraciones como consecuencia del cambio climático ya comenzaron, advirtió este miércoles en Colombia el experto estadounidense John Short, quien aseguró que el mundo no está preparado para los efectos del calentamiento global. En Bangladesh, por ejemplo, existen refugiados del cambio climático que han abandonado sus hogares en lugares rurales debido a que ya no pueden coexistir con un entorno climático tan agresivo"", dijo el especialista en una entrevista con Efe. El camino que señala el profesor estadounidense para enfrentar el cambio climático lo componen la adaptación y la mitigación. "
Ser refugiado en Paraguay - Notas - ABC Color	https://www.abc.com.py/especiales/fin-de-semana/ser-refugiado-en-paraguay-1408514.html	2015-09-18	Ser refugiado en ParaguayNotas	Les faltaban otros cuatro para aterrizar en España, desde donde esperaban poder alcanzar a sus familiares repartidos por Bélgica, Suecia, Alemania y Estados Unidos, señalaba el reportaje de la agencia española. Entre ellos, los ciudadanos cubanos -que totalizan 66- son el grupo mayoritario seguidos hasta hace poco por los colombianos en segundo lugar -puesto que pasará a ser ocupado por los sirios- y los bolivianos. Paraguay no tiene injerencia en la región o interés comercial alguno, pero igual estamos recibiendo gustosos a estos ciudadanos”, acotó el titular de la Conare. 
"Irán, el ""ejemplo para el mundo"" en la atención a los refugiados - ÚltimaHora.com"	https://www.ultimahora.com/iran-el-ejemplo-el-mundo-la-atencion-los-refugiados-n943398.html	2015-11-02	"Irán, el ""ejemplo para el mundo"" en la atención a los refugiados"	"Este año regresarán a su país tan solo unos 2.000"", apuntó el funcionario de ACNUR. Según Dhanapala, esta postura iraní se explica tanto por motivos religiosos como de respeto a los convenios firmados por el país. Esta circunstancia ha favorecido que los refugiados encuentren empleo y se puedan mantener por sí mismos con mayor facilidad. "
Niños refugiados por crecida recibieron a Reyes Magos - Hoy - Noticas de Paraguay y el Mundo.	https://www.hoy.com.py/nacionales/ninos-refugiados-por-crecida-recibieron-a-reyes-magos	2016-01-07	Niños refugiados por crecida recibieron a Reyes MagosHoy	Estas condiciones higiénicas facilitan que los pequeños contraigan enfermedades gastrointestinales, dermatológicas o respiratorias, y el hacinamiento contribuye a su propagación, según Samudio. Por su parte, Juan Carlos Baruja comentó a la misma emisora que ya venía conversando con el mandamás acerca de este cambio. El jueves, a las 09:00 horas, asumirán los nuevos ministros Carla Bacigalupo (Justicia) y Juan C. Baruja (Agricultura). 
Juanes urge humanizar migración y cuestiona negocio de las cárceles privadas - ÚltimaHora.com	https://www.ultimahora.com/juanes-urge-humanizar-migracion-y-cuestiona-negocio-las-carceles-privadas-n961217.html	2016-01-22	Juanes urge humanizar migración y cuestiona negocio de las cárceles privadas	"El cantante de ""A Dios le pido"" señaló que esta ""dura experiencia"" le ayudó a comprender más la crisis migratoria porque pudo ""conectar"" las noticias y estadísticas con ""las caras"" de estos indocumentados y sus dramas ""desgarradores"". Juanes, quien es muy afín a las causas sociales, entre ellas su campaña contra las minas antipersonas, reactivó su llamado al Gobierno estadounidense de luchar por una ""reforma migratoria justa"". Todo está conectado, y no se puede juzgar a los inmigrantes de esa manera"", manifestó Juanes. "
España acogerá a principios de mayo a unos 200 refugiados de Grecia e Italia - ÚltimaHora.com	https://www.ultimahora.com/espana-acogera-principios-mayo-unos-200-refugiados-grecia-e-italia-n985131.html	2016-04-21	España acogerá a principios de mayo a unos 200 refugiados de Grecia e Italia	"Fernández Díaz rehusó indicar una fecha exacta para el traslado, pero señaló que se producirá ""en los primeros días de mayo"". La cifra total que España espera recibir en los próximos meses entre demandantes de asilo desde Grecia e Italia y los refugiados sirios procedentes de Turquía se eleva a 585 personas, pero el ministro explicó que ambos procesos llevan ritmos distintos y que el reasentamiento desde territorio turco tardará más. Fernández Díaz aclaró que en cualquier caso esta no sería la cifra para todo este año, sino solo la del primer cuatrimestre. "
Bedros Ibrahim, el refugiado sirio que murió esperando un pasaporte - ÚltimaHora.com	https://www.ultimahora.com/bedros-ibrahim-el-refugiado-sirio-que-murio-esperando-un-pasaporte-n993300.html	2016-05-22	Bedros Ibrahim, el refugiado sirio que murió esperando un pasaporte	Murió aguardando el pasaporte que la burocracia del Estado paraguayo le gambeteó durante meses. El comisario principal Gilberto Gauto, jefe del Departamento de Identificaciones, responde a la pregunta explicando que los pasaportes para refugiados son especiales. Es un documento que solo cuenta con 12 páginas y en la carátula se cita la Convención sobre el Estatuto de Refugiados, dice. 
Naufragó en el Mediterráneo un barco con cerca de 600 refugiados - La Nación.com.py	https://www.lanacion.com.py/2016/05/26/naufrago-en-el-mediterraneo-un-barco-con-cerca-de-600-refugiados/	2016-05-25	Naufragó en el Mediterráneo un barco con cerca de 600 refugiados	Aún se desconoce el número total de víctimas mortales. Desde comienzos de año, 1.370 migrantes y refugiados perdieron la vida intentando llegar a Europa atravesando el Mediterráneo, un 24% menos que en el mismo periodo del año anterior (1.792), indicó el martes la Organización Internacional para las Migraciones (OIM). Al parecer, el barco lanzó una llamada de socorro, según informó Il Corriere. 
Monseñor criticó abandono a migrantes mientras autoridades hacen politiquería - ÚltimaHora.com	https://www.ultimahora.com/monsenor-critico-abandono-migrantes-mientras-autoridades-hacen-politiqueria-n997342.html	2016-06-06	Monseñor criticó abandono a migrantes mientras autoridades hacen politiquería	Escobar criticó el hecho de que los políticos quieran manipular a los paraguayos residentes en el extranjero. “(...) queremos ir a manipular también en el extranjero a estos hermanos que se han ido, porque no somos capaces de ver políticas dignas para nuestros compatriotas; educación, salud, trabajo sin excepción alguna”, expresó. Tenemos que pensar en todas las clases sociales de un país y no solamente en un grupo determinado”, aseveró. 
Ejecutivo autoriza migración de fondos públicos al BNF - ÚltimaHora.com	https://www.ultimahora.com/ejecutivo-autoriza-migracion-fondos-publicos-al-bnf-n999830.html	2016-06-15	Ejecutivo autoriza migración de fondos públicos al BNF	Los recursos institucionales que no se encuentren en libre disponibilidad deberán dar cumplimiento a lo dispuesto en este artículo de manera gradual, una vez finalizados los respectivos acuerdos contractuales con los bancos de plaza. Ello, atendiendo que Hacienda renovó en octubre del año pasado el contrato con siete entidades bancarias, las cuales brindan servicio sin costo alguno para el pago de sueldos: Continental, BBVA, Itaú, Atlas, Regional y Familiar, entre los privados; y BNF, del sector público. En total, hay 57 organismos y entidades del Estado que operan con el sistema de pagos por red bancaria. 
Ciudades intermedias, una opción para la migración rural - ÚltimaHora.com	https://www.ultimahora.com/ciudades-intermedias-una-opcion-la-migracion-rural-n1014556.html	2016-08-09	Ciudades intermedias, una opción para la migración rural	"En este sector están las familias más empobrecidas y muchas de ellas ven como opción migrar a las ciudades. Esto produce una masiva migración, especialmente a Gran Asunción, Encarnación y Ciudad del Este. ""Si potenciamos el desarrollo urbano en esas 40 ciudades, se crean incentivos para los migrantes para irse allí antes que venir a Gran Asunción"", indicó Molinas. "
Inaugurarán Museo de los Inmigrantes en el Cabildo - Paraguay.com	https://www.paraguay.com/espectaculos/inauguraran-museo-de-los-inmigrantes-en-el-cabildo-149551	2016-08-20	Inaugurarán Museo de los Inmigrantes en el Cabildo	"Objetos, documentos y testimonios serán expuestos en el Museo Foto: Ilustración - colección de Javier Yubi El Museo, que estará ubicado en el edificio de El Cabildo, propondrá ""un paseo imaginario por el rico universo cultural"" que esa inmigración sedimentó en Paraguay, según un comunicado de los organizadores. ""Es nuestra intención instalar esta noción acerca de quiénes fueron los primeros inmigrantes que llegaron a estas tierras, pues la historia del continente americano no se inició en 1492"", explicó el sacerdote italiano José Zanardini, director de estudios antropológicos en la Universidad Católica de Asunción. A lo largo del siglo XX, Paraguay recibió inmigrantes procedentes de diferentes países europeos, como Rusia o Alemania, así como comunidades menonitas llegadas desde Canadá, o inmigrantes de origen japonés, entre otras colectividades, muchas de las cuales fundaron sus propias colonias repartidas por todo el país. "
Iraní y sirio, el equipo de refugiados paralímpico - La Nación.com.py	https://www.lanacion.com.py/2016/08/26/irani-sirio-equipo-refugiados-paralimpico/	2016-08-26	Iraní y sirio, el equipo de refugiados paralímpico	"Añadió que en el GSMP espera incorporar nuevas estrategias para impulsar políticas públicas con miras a lograr una sociedad paraguaya inclusiva. Desde el nivel primario hasta el universitario, las personas no reciben educación al respecto"", lamentó, según se lee en la citada materia periodística. Para que ello suceda, claro está, se debe lograr el último paso: el reconocimiento del Comité Paralímpico Internacional. "
París abrirá centro para refugiados a mediados de octubre - La Nación.com.py	https://www.lanacion.com.py/2016/09/06/paris-abrira-centro-refugiados-mediados-octubre/	2016-09-06	París abrirá centro para refugiados a mediados de octubre	"El centro, instalado en una antigua nave industrial en el norte de París, estará destinado a los hombres solos. Podrá albergar ""hasta 600 personas de aquí al final del año"". Correrá a cargo -dijo- de la asociación caritativa Emmaüs Solidarités. "
Visita de princesa rubrica 80 años de migración japonesa a Paraguay - Paraguay.com	https://www.paraguay.com/nacionales/visita-de-princesa-rubrica-80-anos-de-migracion-japonesa-a-paraguay-150609	2016-09-09	Visita de princesa rubrica 80 años de migración japonesa a Paraguay	Por su parte, el presidente paraguayo, Horacio Cartes, destacó en este acto el trabajo, sacrificio y disciplina de los primeros migrantes japoneses, que se enfrentaron a la agreste selva paraguaya y a la falta de caminos e infraestructuras para cultivar la tierra. Cartes destacó que hoy la colectividad japonesa, integrada por unas 10.000 personas en todo el país, se dedica al comercio y la industria, aunque muchos nikkei (descendientes de japoneses) permanecen todavía en las antiguas colonias campesinas fundadas por los primeros inmigrantes en el interior del país. Supone además el segundo viaje oficial en solitario al extranjero de Mako, tras viajar a El Salvador y Honduras en diciembre del año pasado para conmemorar el 80 aniversario del establecimiento de relaciones diplomáticas entre Japón y esos dos países centroamericanos. 
Con la princesa Mako celebraron los 80 años de la inmigración japonesa - ÚltimaHora.com	https://www.ultimahora.com/con-la-princesa-mako-celebraron-los-80-anos-la-inmigracion-japonesa-n1022842.html	2016-09-10	Con la princesa Mako celebraron los 80 años de la inmigración japonesa	La princesa Mako, de 24 años, pronunció un discurso ante la colectividad nipona y las autoridades invitadas. La nieta del emperador Akihito también agradeció al pueblo paraguayo por haber recibido con los brazos abiertos a los inmigrantes japoneses. Deseó la prosperidad del Paraguay, “esperando que las relaciones amistosas de los países se desarrollen aún más”, expresó. 
Hogar de señoritas busca la promoción de mujer migrante - Locales - ABC Color	https://www.abc.com.py/edicion-impresa/locales/hogar-de-senoritas-busca-la-promocion-de-mujer-migrante-1528719.html	2016-10-16	Hogar de señoritas busca la promoción de mujer migranteLocales	En la actualidad, Kuñataî Róga recibe a chicas que cursan la educación básica, media y la terciaria. Las familias recurren a ella para buscar una asistente y la persona seleccionada accede al puesto que le permite solventar sus estudios. Hacen tareas hogareñas, las que estudian enfermería prestan ese servicio y otras trabajan en administración. 
Congreso de migrantes en sexta versión - ÚltimaHora.com	https://www.ultimahora.com/congreso-migrantes-sexta-version-n1032122.html	2016-10-17	Congreso de migrantes en sexta versión	En ese sentido, ya adelantaron varios puntos que serán abordados en la oportunidad. Por otro lado, la Red de Mujeres Paraguayas tendrá una reunión previa al Congreso, el miércoles. El encuentro de las mujeres migrantes se desarrollará en el local del Cabildo Nacional. 
“Ahora hay más presión del Gobierno argentino para legalizar a migrantes” - ÚltimaHora.com	https://www.ultimahora.com/ahora-hay-mas-presion-del-gobierno-argentino-legalizar-migrantes-n1043166.html	2016-11-27	“Ahora hay más presión del Gobierno argentino para legalizar a migrantes”	Endurecerán los requisitos para los ingresos a través de cuestionarios más exigentes y crearán una policía migratoria. –Sí, usted se imagina que allí casi en forma permanente los niños paraguayos están ocupando en promedio 100 a 120 camas en terapia intensiva. Fue una promesa del presidente Mauricio Macri durante la campaña y está empezando a recibir presión para cumplirla. 
