title	link	date	title_corrected	summary
Infotep ofrecerá capacitación técnica a dominicanos que migrarán a Estados Unidos - Periódico elDinero	https://www.eldinero.com.do/132979/infotep-ofrecera-capacitacion-tecnica-a-dominicanos-que-migraran-a-estados-unidos/	2021-01-05	Infotep ofrecerá capacitación técnica a dominicanos que migrarán a Estados Unidos	La iniciativa se acordó en un encuentro entre el director general del Infotep, Rafael Santos Badía; el director ejecutivo del CONAGEP, Antonio (Tony) Rodríguez; la comisionada de la ciudad de Paterson, New Jersey, Fania Santana, y los directivos del Grupo de Hispanos Unidos de N.J., José Aníbal de Jesús, Martha Rodríguez y Julián Matos. Rodríguez dijo que una vez hayan migrado, las personas formadas recibirán un examen de validación, que les permitirá obtener la licencia para insertarse al mercado de trabajo. El director del Infotep manifestó que preparar a los dominicanos migrantes para que puedan trabajar es una forma de contribuir al incremento de las remesas hacia República Dominicana. 
Detienen 298 haitianos en el país con estatus migratorio irregular - elnuevodiario.com.do	https://elnuevodiario.com.do/detienen-298-haitianos-en-el-pais-con-estatus-migratorio-irregular/	2021-01-06	Detienen 298 haitianos en el país con estatus migratorio irregular	Detienen 298 haitianos en el país con estatus migratorio irregular EL NUEVO DIARIO, DAJABÓN. Informaron que los haitianos están divididos en 253 hombres y 45 mujeres. Además, se retuvieron tres motocicletas, las cuales se encuentran en el Centro de Acogida de Migración en el 10mo. 
"Abinader sobre vacunación a migrantes: ""El compromiso del país es vacunar dominicanos"" - Listín Diario"	https://listindiario.com/la-republica/2021/01/08/651599/abinader-sobre-vacunacion-a-migrantes-el-compromiso-del-pais-es-vacunar-dominicanos	2021-01-08	"Abinader sobre vacunación a migrantes: ""El compromiso del país es vacunar dominicanos"""	Abinader detalló que estas dosis llegarían como un “despacho de emergencia” y que serán inicialmente aplicadas en médicos y grupos vulnerables. Estos pedidos son independientes del acuerdo realizado por el Poder Ejecutivo para adquirir la vacuna fabricada por AstraZeneca y Oxford, cuyo primer lote llegaría en el mes de marzo. Estas informaciones fueron ofrecidas en un almuerzo, que sostuvo el mandatario con directores de medios. 
La pandemia frena la migración cuando estaba en niveles récord, según la ONU - Diario Libre	https://www.diariolibre.com/usa/la-pandemia-frena-la-migracion-cuando-estaba-en-niveles-record-segun-la-onu-DP23797343	2021-01-15	La pandemia frena la migración cuando estaba en niveles récord, según la ONU	La crisis sanitaria, además, puede tener un impacto a más largo plazo en las tendencias migratorias, con cierres fronterizos prolongados o por el destrozo económico que la pandemia ha hecho en sectores como el de los servicios, que habitualmente son fuente de empleo para muchos migrantes. En los últimos años, Arabia Saudí y otros países de la región del golfo Pérsico, junto a algunos Estados asiáticos, también han visto aumentar sus poblaciones inmigrantes de forma muy importante, un fenómeno que está creando un mundo más “multipolar” y “más complejo” en lo que se refiere a la migración, según Menozzi. En 2020, los refugiados representaban un 12 % del total de los migrantes internacionales, frente al 9.5 por ciento que suponían en el año 2000. 
México exhorta a Honduras a atender y contener las caravanas migrantes - Diario Libre	https://www.diariolibre.com/actualidad/internacional/mexico-exhorta-a-honduras-a-atender-y-contener-las-caravanas-migrantes-BL23821101	2021-01-16	México exhorta a Honduras a atender y contener las caravanas migrantes	México, 16 ene (EFE).- México hizo este sábado un 'exhorto respetuoso' a las autoridades de Honduras para que atiendan 'oportunamente' el flujo irregular de personas migrantes 'de tal manera que prevengan nuevos desplazamientos'. La caravana, compuesta por más de 9.000 hondureños, cruzó este sábado el oeste de Guatemala tras superar varios dispositivos policiales que pretendían impedir su paso. “Sin embargo -matizó-, está convencido que solo a través de esquemas migratorios seguros, ordenados y regulares se podrá garantizar la atención efectiva y transversal de estas poblaciones, que se enfrentan a altos riesgos durante su ruta migratoria”. 
Caravana migrante hondureña permanece varada en el este de Guatemala – El Nacional - elnacional.com.do	https://elnacional.com.do/caravana-migrante-hondurena-permanece-varada-en-el-este-de-guatemala/	2021-01-18	Caravana migrante hondureña permanece varada en el este de Guatemala – El Nacional	La multitud había decidido horas antes, con la llegada de la noche, que pernoctarían nuevamente en la carretera tras arrodillarse, rezar e intentar sin éxito avanzar frente la barrera formada por las fuerzas de seguridad, según constató Efe. Los migrantes se rehúsan a dar marcha atrás incluso después de que esta mañana fueran reprimidos con fuerza por el Ejército y la policía al intentar avanzar. Su objetivo es llegar a Estados Unidos para tener mejores condiciones de vida, alejados de la pobreza y la violencia que azotan el istmo centroamericano, especialmente después de la pandemia y los huracanes Eta y Iota, que tocaron tierra en noviembre pasado. 
Guatemala disuelve a la fuerza a la caravana migrante y acorrala a los hondureños - El Dia.com.do	https://eldia.com.do/guatemala-disuelve-a-la-fuerza-a-la-caravana-migrante-y-acorrala-a-los-hondurenos/	2021-01-19	Guatemala disuelve a la fuerza a la caravana migrante y acorrala a los hondureños	El enfrentamiento no reportó heridos de gravedad e hizo retroceder a los migrantes, quienes quedaron desperdigados por el lugar a la espera de encontrar una ruta alterna. Desde la semana pasada, el Gobierno guatemalteco había advertido que no dejaría avanzar a los hondureños sin cumplir con los requisitos migratorios, principalmente una prueba negativa de la covid-19. Los 6.000 migrantes estaban varados en Chiquimula desde el pasado sábado cuando las fuerzas de seguridad impusieron una barrera y detuvieron su paso para evitar que lleguen a México y a Estados Unidos posteriormente. 
Migración multará a los que le alquilen casas a inmigrantes ilegales - Listín Diario	https://listindiario.com/la-republica/2021/01/19/653122/migracion-multara-a-los-que-le-alquilen-casas-a-inmigrantes-ilegales	2021-01-19	Migración multará a los que le alquilen casas a inmigrantes ilegales	Indicó, asimismo, que todos los vehículos sin distinción, cuyos propietarios sean sorprendidos en esa práctica serán incautados por el personal del organismo. Adelantó que en los próximos días el operativo será extendido a Puerto Plata, Samaná y otros lugares turísticos, donde residen muchos extranjeros. Enrique García dijo que esta operación abarcará todo el territorio nacional. 
La migración judía al Caribe en la temprana edad moderna - Periódico El Caribe - El Caribe	https://www.elcaribe.com.do/gente/cultura/la-migracion-judia-al-caribe-en-la-temprana-edad-moderna/	2021-01-22	La migración judía al Caribe en la temprana edad modernaPeriódico 	None 
Emiten resolución que normaliza situación migratoria irregular de venezolanos en el país - El Dia.com.do	https://eldia.com.do/emiten-resolucion-que-normaliza-situacion-migratoria-irregular-de-venezolanos-en-el-pais/	2021-01-22	Emiten resolución que normaliza situación migratoria irregular de venezolanos en el país	La resolución establece en su artículo dos dispone que los nacionales venezolanos que entraron a territorio dominicano haciendo uso de tarjeta de turista o visado concedido por las autoridades dominicanos y que han permanecido en el territorio nacional más allá de la vigencia autorizada, podrán ser beneficiarios de una extensión de permanencia. El documento establece que aplica “la categoría migratoria de no residente el estatus migratorio de los nacionales venezolanos que se encuentren en territorio dominicano y que ingresaron de manera regular a República Dominicana a partir del enero 2014 hasta marzo de 2020, así como sus hijos menores de edad, nacidos o no en República Dominicana, a quienes constitucionalmente no les corresponde la nacionalidad dominicana”. En el caso de los permisos de trabajador temporero y estudiantes tienen carácter temporal, y sus beneficiarios tendrán vocación de radiación definitiva en el país o cambio a la categoría de residente dentro del país, conforme a las disposiciones establecidas en la Ley General de Migración y su Reglamento. 
Desconfianza e idioma dificultan vacunar a migrantes en EEUU - diariolibre.com	https://www.diariolibre.com/usa/actualidad/desconfianza-e-idioma-dificultan-vacunar-a-migrantes-en-eeuu-NN23955459	2021-01-23	Desconfianza e idioma dificultan vacunar a migrantes en EEUU	Los mensajes son en español y purépecha, una lengua indígena del oeste de México que hablan algunos trabajadores agrícolas en California. Sin embargo, al día siguiente Ricketts pareció retractarse e informó mediante su portavoz que la “prueba de ciudadanía no es requerida para la vacunación”, según el periódico Omaha-World Herald. También les preocupa la posibilidad de tener que faltar algunos días al trabajo y posiblemente ser despedidas si sufren efectos secundarios adversos. 
Advierten al presidente Abinader de “grave peligro” si RD permite campamentos de refugiados haitianos - El Nuevo Diario (República Dominicana)	https://elnuevodiario.com.do/advierten-al-presidente-abinader-de-grave-peligro-si-rd-permite-campamentos-de-refugiados-haitianos/	2021-01-24	Advierten al presidente Abinader de “grave peligro” si RD permite campamentos de refugiados haitianos	A continuación, El Nuevo Diario reproduce íntegro el documento leído y entregado por Castillo Pantaleón al presidente de la República: Santo Domingo, D.N. Increíblemente, estas dos últimas instituciones, inutilizadas en sus funciones en la implementación del contenido dichoso Plan de contingencia. Se juega a que nuestro país sea quien absorba esa crisis y hay toda una articulación de iniciativas en ese orden. 
Perverso plan extranjero borrando fronteras - Periódico El Caribe - Mereces verdaderas respuestas - elcaribe.com.do	https://www.elcaribe.com.do/opiniones/perverso-plan-extranjero-borrando-fronteras/	2021-01-25	Perverso plan extranjero borrando fronterasPeriódico El CaribeMereces verdaderas respuestas	None 
Los migrantes y desplazados también tienen derecho a una vacuna contra el COVID-19 - diariohispaniola.com	https://www.diariohispaniola.com/noticia/68904/salud/los-migrantes-y-desplazados-tambien-tienen-derecho-a-una-vacuna-contra-el-covid-19.html	2021-01-26	Los migrantes y desplazados también tienen derecho a una vacuna contra el COVID-19	"Gavi ya ha estado trabajando con la OIM en Sudán del Sur desde 2019 para garantizar que las vacunas lleguen a las poblaciones de difícil acceso en todo el país. Durante décadas, la Organización Internacional para las Migraciones ha sido un actor clave en los esfuerzos mundiales para garantizar que los migrantes y otras personas en movimiento tengan un acceso adecuado a las vacunas en 80 países. Es fundamental para el bienestar de todos no dejar atrás a los que están en mayor riesgo"", dijo Vitorino. "
Satisface decisión RD no aceptar centros refugiados – El Nacional - elnacional.com.do	https://elnacional.com.do/satisface-decision-rd-no-aceptar-centros-refugiados/	2021-01-28	Satisface decisión RD no aceptar centros refugiados – El Nacional	En ese sentido, demandó más coherencia y más firmeza para defender la soberanía nacional, al tiempo que exhortó al Gobierno a renegociar dicho acuerdo para eliminar las cláusulas y el anexo que acusan un claro corte neocolonialista. El exlegislador considera que el Gobierno dominicano debe exhibir una política congruente y consecuente si pretende que sus posiciones oficiales de rechazo a una solución dominicana al problema de Haití, colapsado y abandonado por la comunidad internacional, resulten creíbles y respetadas. Exhortó al Gobierno a tomar medidas extraordinarias para prevenir los efectos desestabilizadores que sobre toda la isla y la región del Caribe tendría la crisis política, social y nacional que se desarrolla en Haití. 
¿Cuál será la suerte migratoria de los dominicanos indocumentados en Estados Unidos en la gestión de Joe Biden? - El Caribe	https://www.elcaribe.com.do/destacado/cual-sera-la-suerte-migratoria-de-los-dominicanos-indocumentados-en-estados-unidos-en-la-gestion-de-joe-biden/	2021-01-28	¿Cuál será la suerte migratoria de los dominicanos indocumentados en Estados Unidos en la gestión de Joe Biden?	None 
EEUU quiere agilizar proceso de pedidos de asilo de migrantes de “Quédate en Mexico” - Diario Libre	https://www.diariolibre.com/usa/actualidad/eeuu-quiere-agilizar-proceso-de-pedidos-de-asilo-de-migrantes-de-quedate-en-mexico-GO24087155	2021-01-29	EEUU quiere agilizar proceso de pedidos de asilo de migrantes de “Quédate en Mexico”	Roberta Jacobson, asesora del presidente Joe Biden para la frontera suroccidental, dijo que “en las próximas semanas” se buscará agilizar la atención de los inscriptos “desde hace meses o años” en los llamados Protocolos de Protección al Migrante (MPP), con especial énfasis en los “más vulnerables”. “Es importante que no lleguen a la frontera de Estados Unidos ahora. No es el momento, es muy peligroso”, enfatizó Jacobson, una diplomática con vasta trayectoria en América Latina que entre 2016 y 2018 fue embajadora en México. 
Gobierno de Biden reafirma compromiso migratorio pero el cambio tomará tiempo – El Nacional - elnacional.com.do	https://elnacional.com.do/gobierno-de-biden-reafirma-compromiso-migratorio-pero-el-cambio-tomara-tiempo/	2021-01-29	Gobierno de Biden reafirma compromiso migratorio pero el cambio tomará tiempo – El Nacional	La decisión, adoptada por la pasada Administración del presidente Donald Trump, se mantiene vigente, anunció el Departamento de Seguridad Nacional (DHS, en inglés) el pasado 20 de enero, el mismo día en que Biden llegó a la Casa Blanca. Y en un mensaje a quienes están inscritos, la encargada de la frontera suroeste les pidió esperar. Actualmente, no hay planes para trasferir personas bajo ninguno de los tres acuerdos”, puntualizó. 
Migración buscará solución a problemas de niños migrantes haitianos - Periódico El Caribe - El Caribe	https://m.elcaribe.com.do/panorama/pais/migracion-buscara-solucion-a-problemas-de-ninos-migrantes-haitianos/	2021-01-29	Migración buscará solución a problemas de niños migrantes haitianosPeriódico 	None 
De la inmigración haitiana debemos hablar con claridad - Periódico El Caribe - El Caribe	https://m.elcaribe.com.do/gente/cultura/de-la-inmigracion-haitiana-debemos-hablar-con-claridad/	2021-01-29	De la inmigración haitiana debemos hablar con claridadPeriódico 	None 
La migración haitiana… Luces y sombras .. - El Nuevo Diario (República Dominicana)	https://elnuevodiario.com.do/la-migracion-haitiana-luces-y-sombras/	2021-01-29	La migración haitiana… Luces y sombras ..	Este horrendo acontecimiento, aún está latente en el pueblo haitiano, ante el abuso sin precedentes, de prejuicios nacionalistas, racismo y xenofobia hacia ellos. Esto nos revela que, a los tantos años de la Masacre del Perejil, el rechazo y el racismo sigue impregnado en el sentimiento dominicano. Las iniciativas para mejorar la estabilidad y fortalecer las infraestructuras en Haití, junto con políticas destinadas a promover la integración comercial, podrían generar importantes beneficios bilaterales. 
Gobierno de Biden reafirma compromiso migratorio pero el cambio tomará tiempo - Periódico elDinero	https://www.eldinero.com.do/135497/gobierno-de-biden-reafirma-compromiso-migratorio-pero-el-cambio-tomara-tiempo/	2021-01-30	Gobierno de Biden reafirma compromiso migratorio pero el cambio tomará tiempo	La decisión, adoptada por la pasada Administración del presidente Donald Trump, se mantiene vigente, anunció el Departamento de Seguridad Nacional (DHS, en inglés) el pasado 20 de enero, el mismo día en que Biden llegó a la Casa Blanca. Y en un mensaje a quienes están inscritos, la encargada de la frontera suroeste les pidió esperar. Reforma migratoria, una propuesta distinta La embajadora se refirió de igual forma a la reforma migratoria que Biden presentó al Congreso en su primer día al frente del Gobierno, y dijo que es más completo y parte del «entendimiento de legalizar las personas que viven en las sombras en los Estados Unidos, 11 millones o más», dijo. 
Canciller de Haití afirma la migración y el comercio son temas primordiales en las relaciones con la República Dominicana - Periódico El Caribe - El Caribe	https://www.elcaribe.com.do/destacado/canciller-de-haiti-afirma-la-migracion-y-el-comercio-son-temas-primordiales-en-las-relaciones-con-la-republica-dominicana/	2021-01-31	Canciller de Haití afirma la migración y el comercio son temas primordiales en las relaciones con la República DominicanaPeriódico 	None 
Canciller de Haití afirma migración y comercio son temas primordiales en las relaciones con República Dominicana - Listín Diario	https://listindiario.com/economia/2021/01/31/654971/canciller-de-haiti-afirma-migracion-y-comercio-son-temas-primordiales-en-las-relaciones-con-republica-dominicana	2021-01-31	Canciller de Haití afirma migración y comercio son temas primordiales en las relaciones con República Dominicana	El Ministro de Relaciones Exteriores y Cultos de Haití, Claude Joseph, afirmó que la migración y el comercio son temas prioritarios en las relaciones con República Dominicana, ya que ambos países avanzan con optimismo en una nueva fase de colaboración y cooperación. El canciller haitiano se pronunció al respecto durante su participación en la celebración de una mesa redonda sobre el tema “Migración y Comercio en el corazón de las relaciones haitiano-dominicanas: análisis, problemáticas y perspectivas”, organizada por la Comisión Mixta Haitiano-Dominicana, que preside Marie-Andrée Amy. La migración y el comercio son dos temas primordiales en las relaciones haitiano-dominicanas, recordó el canciller Claude Joseph en su discurso, y agregó que estos son los dos temas que más marcan las disparidades entre los dos países. 
Claude Joseph: migración y el comercio son primordiales en las relaciones con República Dominicana - Acento	https://acento.com.do/actualidad/claude-joseph-migracion-y-el-comercio-son-primordiales-en-las-relaciones-con-republica-dominicana-8907670.html	2021-01-31	Claude Joseph: migración y el comercio son primordiales en las relaciones con República Dominicana	"La migración y el comercio son dos temas primordiales en las relaciones haitiano-dominicanas, recordó el canciller Claude Joseph en su discurso, y agregó que son dos temas que más marcan las disparidades entre los dos países. Sin embargo, más precisamente, recordó que los temas prioritarios para Haití en la actual agenda bilateral son: ""la regularización del estatus de estudiantes y trabajadores haitianos, la garantía y protección de la integridad de nuestros respectivos territorios, la cooperación en salud, el desarrollo fronterizo y el reequilibrio comercial, incluido un mayor acceso de los productos haitianos al mercado dominicano "". Manifestó sentirse optimista en cuanto a que las relaciones bilaterales se funden sobre una base de valores compartidos que privilegien el equilibrio y la reciprocidad. "
Crisis humanitaria desborda pueblos del norte de Chile por la masiva llegada de migrantes venezolanos - Periódico El Caribe - El Caribe	https://m.elcaribe.com.do/destacado/crisis-humanitaria-desborda-pueblos-del-norte-de-chile-por-la-masiva-llegada-de-migrantes-venezolanos/	2021-02-03	Crisis humanitaria desborda pueblos del norte de Chile por la masiva llegada de migrantes venezolanosPeriódico 	None 
Biden avanza en su promesa de desmontar medidas antiinmigrantes de Trump - Periódico elDinero	https://www.eldinero.com.do/135809/biden-avanza-en-su-promesa-de-desmontar-medidas-antiinmigrantes-de-trump/	2021-02-03	Biden avanza en su promesa de desmontar medidas antiinmigrantes de Trump	«No estoy haciendo una nueva ley, estoy eliminando las malas políticas», afirmó Biden durante un breve acto en el Despacho Oval, en el que aprovechó para felicitar a Mayorkas por su confirmación en el cargo y lo puso al frente del esfuerzo de su Gobierno para lograr la aprobación en el Congreso de su ambiciosa ley de inmigración. Un inmigrante, la mano derecha Para poner en marcha su estrategia migratoria, Biden contará con Mayorkas, un exfiscal y exfuncionario curtido en asuntos migratorios, al frente del Departamento de Seguridad Nacional (DHS, en inglés), la agencia encargada de proteger al país, resguardar fronteras y aplicar las leyes migratorias. «Espero su liderazgo y trabajo con el Congreso en muchos temas, incluido el proyecto de ley de inmigración que creo que tiene un gran apoyo en ambas cámaras», dijo el gobernante al referirse al nuevo funcionario. 
Mediación intercultural para evitar la mutilación genital en niñas migrantes - Diario Libre	https://www.diariolibre.com/usa/actualidad/mediacion-intercultural-para-evitar-la-mutilacion-genital-en-ninas-migrantes-NF24212528	2021-02-05	Mediación intercultural para evitar la mutilación genital en niñas migrantes	En España, 15.562 niñas de entre 0 y 14 años corren este riesgo, según el informe 'La mutilación genital en España', elaborado por la Fundación Wassu-UAB en colaboración con la Delegación del Gobierno contra la Violencia de Género. La mediadora hace hincapié en la importancia de sensibilizar a las dos partes, insistiendo en que desde España muchas veces se ve la ablación como 'una cosa de bárbaros' y no se profundiza en la tradición cultural y religiosa que hay detrás, para entender 'por qué se practica y por qué se mantiene'. Un compromiso por escrito Médicos del Mundo aboga también por la generalización del compromiso preventivo, un documento en el que la familia se compromete a no mutilar a su hija durante su estancia en su país de origen y a permitir que la revise un pediatra al regreso del viaje. 
The Washington Post: Biden suavizará los criterios para deportar inmigrantes - Periódico elDinero	https://www.eldinero.com.do/136207/the-washington-post-biden-suavizara-los-criterios-para-deportar-inmigrantes/	2021-02-07	The Washington Post: Biden suavizará los criterios para deportar inmigrantes	La agencia federal presentará en los próximos días nuevas directrices por las cuales los inmigrantes con cargos menores como conducir bajo los efectos del alcohol no serán deportados y el ICE se centrará en aquellos que puedan representar una amenaza para la seguridad nacional. Esta medida se sumaría a la moratoria de 100 días en las deportaciones ordenada por Biden nada más llegar a la Casa Blanca el pasado 20 de enero, en una decisión que fue bloqueada temporalmente por un juez federal. Y también a otras del líder demócrata, que se quiere distanciar de las duras políticas de Trump, que intentó por numerosos medios reducir la inmigración al país, tanto legal como ilegal, y aumentar las deportaciones haciendo de todos los indocumentados un posible objetivo del ICE. 
José Martí y la migración en los Estados Unidos - Acento	https://acento.com.do/cultura/jose-marti-y-la-migracion-en-los-estados-unidos-8911935.html	2021-02-11	José Martí y la migración en los Estados Unidos	: Para comprender mejor estos análisis, debemos explicar quién es el hombre que está haciéndolos, cuál es la filosofía, la cosmovisión de José Martí. Pero no podemos olvidar que también era abogado, conocía las leyes y, por otra parte, solía tomarse a sí mismo como material de estudio en muchos aspectos. : En resumen, si tuviéramos que definir a grandes rasgos cuáles eran las ideas cardinales de Martí sobre la migración, ¿qué nos diría? 
Presidente asegura que México protege a migrantes pese a masacre en el norte - diariolibre.com	https://www.diariolibre.com/usa/actualidad/presidente-asegura-que-mexico-protege-a-migrantes-pese-a-masacre-en-el-norte-LB24343769	2021-02-11	Presidente asegura que México protege a migrantes pese a masacre en el norte	'Ya hay detenidos, en efecto policías del Estado de Tamaulipas, hay cesados y también están sujetos a proceso funcionarios de migración, servidores públicos y no va a haber impunidad para nadie, y tenemos una relación constante con los familiares de las víctimas', expresó López Obrador. 'Es lamentable decir esto, pero los antecedentes que se tienen es que los migrantes corren más peligro en los estados de la frontera norte, en particular en Tamaulipas, por todo lo que sabemos, entonces fue siempre un argumento de nuestra parte decir: necesitamos cuidarlos, protegerlos', admitió. El mandatario también rechazó ayuda militar de Estados Unidos para combatir al crimen organizado o atender la crisis migratoria. 
Buscan controlar migración ilegal - Listín Diario	https://listindiario.com/la-republica/2021/02/11/656518/buscan-controlar-migracion-ilegal	2021-02-11	Buscan controlar migración ilegal	El encuentro, que se efectuó en la comandancia del Ejército, se abordaron diversos temas relacionados con el control migratorio y la inmigración indocumentada. En la frontera dominico-haitiana se vive desde hace varias semanas un ambiente de tensión. Ayer los altos mandos militares del país, dispusieron reforzar los controles militares y migratorios en la frontera. 
