title	link	date	title_corrected	summary
Search on for illegal Chinese immigrants - Trinidad and Tobago News	http://www.trinidadandtobagonews.com/blog/?p=5267	2011-05-09	Search on for illegal Chinese immigrants	A senior police source, who requested anonymity, revealed that illegal immigrants were coming into T&T through several points in south Trinidad, namely at Puerto Grande, Erin; Buenos Ayres, Erin; Mahawal Trace, Santa Flora; Galfar Point, Cedros; Point Coco, Granville, Morne Diablo, Penal; and Quinam Beach, Siparia. “These boats go with ten big containers of fuel and no fishing nets…What are they going there for?” the officer added. Already more than 14 new casinos, supermarkets and restaurants have mushroomed along the SS Erin Road, Debe, with only a few offering employment opportunities for locals. 
PM disappointed by TT response to refugee invitation - Trinidad and Tobago News	https://www.trinidadandtobagonews.com/blog/?p=10276	2017-09-23	PM disappointed by TT response to refugee invitation	In a television interview, Rowley said Dominica was totally devastated and its people need help. Rowley reiterated that if there were Dominicans who have relatives or friends in TT, who are willing and able to help them, “then we at the level of the State will not be an impediment to those persons’ way.” He continued, “We will allow them to extend that hand for six months.” Rowley said within this specific period, the numbers of Dominicans who may come TT will not be huge. He appealed to these people, “to not see race in every thing that we do in TT.” Rowley said the Immigration Act and this country’s treaty arrangements with Caricom, “allow Dominicans to come here by virtue of being citizens of the Commonwealth of Dominica.” He continued, “When they get here, they can ask for an extension and that extension can be granted.” Source: http://newsday.co.tt/2017/09/23/rowley-trinis-are-caring-people/ 
UNHCR: TT in breach of international refugee law - Trinidad News	https://newsday.co.tt/2018/04/23/unhcr-tt-in-breach-of-international-refugee-law/	2018-04-23	UNHCR: TT in breach of international refugee law	None 
UN probes refugee complaint - Trinidad News	https://newsday.co.tt/2018/05/04/un-probes-refugee-complaint/	2018-05-04	UN probes refugee complaint	None 
Call to stand in solidarity with refugees - Trinidad & Tobago Express	https://trinidadexpress.com/opinion/letters/call-to-stand-in-solidarity-with-refugees/article_2d9099ec-7287-11e8-b906-fbf93659d1f1.html	2018-06-17	Call to stand in solidarity with refugees	ON Wednesday the world will observe World Refugee Day (WRD), a day when “we commemorate the strength, courage and perseverance of millions of refugees” (UN). Archbishop Jason Gordon has launched an Archdiocese’s Ministry for Migrants and Refugees (AMMR). Let’s pray and act to ensure that there is a place at the table of life for all. 
'Migrants, refugees in T&T from 20 countries' - Trinidad & Tobago Express	https://trinidadexpress.com/news/local/migrants-refugees-in-t-t-from-20-countries/article_f699a3fa-7305-11e8-90dc-9bcdc7fb808e.html	2018-06-18	'Migrants, refugees in T&T from 20 countries'	We call on the Government also to develop an efficient and secure asylum system. Let's pray and act to ensure that there is a place at the table of life for all,” he said. “The earth, says Pope Francis, is our common home and we are a universal family. 
Let's do our part to help refugees - Trinidad News	https://newsday.co.tt/2018/06/19/lets-do-our-part-to-help-refugees/	2018-06-19	Let's do our part to help refugees	None 
Are Venezuelan refugees working on the Red House? - Trinidad & Tobago Express	https://trinidadexpress.com/news/local/are-venezuelan-refugees-working-on-the-red-house/article_7f9a21f8-7553-11e8-85a2-8f6fc19852e2.html	2018-06-21	Are Venezuelan refugees working on the Red House?	Make up your mind on whether you want Venezuelans to be given refugee status in Trinidad and Tobago or not. This is what Acting Prime Minister Colm Imbert told the Opposition yesterday as he responded to a question from Couva South, Rudy Indarsingh on whether there were Venezuelans migrants employed on the Red House project. Imbert said UDeCOTT was currently conducting an investigation by making inquiries of all contractors and sub-contractors on the project. 
UNITED STATES-MIGRATION- United States and Cuba hold talks on migration - Trinidad & Tobago Express	https://trinidadexpress.com/news/regional/united-states-migration--united-states-and-cuba-hold-talks-on-migration/article_b41c2c9e-85d1-11e8-85e7-d72ecef79d82.html	2018-07-12	UNITED STATES-MIGRATION- United States and Cuba hold talks on migration	12, CMC – The US Department of State says there was a significant reduction in irregular migration from Cuba since January 2017. Wednesday’s migration talks came a day after both parties held the fourth Law Enforcement Dialogue in Washington. Gala Lopez, and Ministry of Interior Colonel Nestor Borrero Calvo led the Cuban delegation. 
Refugees versus migrants - Trinidad & Tobago Express	https://trinidadexpress.com/opinion/columnists/refugees-versus-migrants/article_5e04c462-8a2f-11e8-a750-b3b6caa892cb.html	2018-07-17	Refugees versus migrants	The Bolivarian Republic of Venezuela continues to dominate headlines, especially with regard to the exodus of its people to different parts of South America and the Caribbean. According to the United Nations Refugee Agency (UNHCR), 5,000 migrants are leaving every day and, at that rate, 1.8 million people would have departed by the end of 2018 (Long & Schipani, Irish Times, April 18, 2018). 
Call to end migration of trained nurses from the region - Trinidad & Tobago Express	https://trinidadexpress.com/news/regional/call-to-end-migration-of-trained-nurses-from-the-region/article_fb416c08-9b37-11e8-9289-a3ff39ab112c.html	2018-08-08	Call to end migration of trained nurses from the region	Addressing the RNB’s 45th annual general meeting here, the Grenada Chief Nursing Officer, said that “experienced nurses are leaving in large numbers. “Chief Nursing Officers (CNOs) can testify to a certain renewed active migration taking place where international agencies are coming in a secretive manner and recruiting our personnel”, she told the gathering of CNOs, representatives of Nursing Councils, universities and international development partners. She also lamented the migration “crisis”, emphasising “something must be done to ensure that the haemorrhaging of our trained people who [governments] borrow to invest in”, is stopped. 
PM: Venezuela refugee rumour mischief-making - Trinidad Guardian	http://www.guardian.co.tt/news/pm-venezuela-refugee-rumour-mischiefmaking-6.2.661955.2786ca65f5	2018-09-08	PM: Venezuela refugee rumour mischief-making	No subject even came up or was discussed far less agreed to,” Rowley said. Rowley and Venezuelan President Nicolás Maduro signed off on a gas deal last month but since then there has been very little information provided to the public on the specific details deal. The PM said this type of misinformation was not even a rumour but an outright “deliberate falsehood”. 
Venezuelan political refugee dies in Trinidad - Trinidad & Tobago Express	https://trinidadexpress.com/news/local/venezuelan-political-refugee-dies-in-trinidad/article_71702302-dc41-11e8-8c82-67eab2605e1f.html	2018-10-30	Venezuelan political refugee dies in Trinidad	Venezuelan national Alberto Carillo was struck and killed on the Manzanilla/Mayaro Road last Thursday. At the Forensic Science Centre in St James on Monday, a friend of 37-year-old said he was a father of three. He got political refugee status,” said the friend. 
Call for migrant camp - Trinidad & Tobago Express	https://trinidadexpress.com/news/local/call-for-migrant-camp/article_266c76e8-e2fa-11e8-9e80-0b3ce9a03665.html	2018-11-07	Call for migrant camp	THERE is a document in the office of the Minister of National Security calling for Red Cross International to set up a migrant camp at Cedros. Councillor for Cedros Shankar Teelucksingh said yesterday it is awaiting approval. Teelucksingh made the comment as he spoke about the influx of Venezuelans into the country even with 11 foreign nationals, including eight Venezuelans, being held in a hotel in Erin on Tuesday morning and four more Venezuelans —including a three-year-old boy— being found in a car in Los Iros yesterday. 
Probe sex trade, illegal immigrants— lawyer - Trinidad Guardian	http://www.guardian.co.tt/news/probe-sex-trade-illegal-immigrants-lawyer-6.2.710604.b4749884c0	2018-11-08	Probe sex trade, illegal immigrants— lawyer	It is based on the 1951 Convention on the status of refugees which guarantees certain rights to persons who are in need of protection, so we should offer assistance to such persons,” Nathu said. He added that there was a need to have sensitivity training for law enforcement officers as many illegal immigrants were forced into prostitution. We have lots of young people graduating with languages who can be hired to assist,” Nathu added. 
Cuban refugee protest grows outside UN House - Trinidad Guardian	http://www.guardian.co.tt/news/cuban-refugee-protest-grows-outside-un-house-6.2.713480.779528519f	2018-11-12	Cuban refugee protest grows outside UN House	“We are sleeping in the street and nobody helping us…nobody care for our lives. The refugee said they ran away from Cuba because of a “political problem,” but have been encountering difficulty because Trinidad and Tobago does not have laws catering to asylum seekers. A UN official has promised to meet with the refugees today. 
No refugee laws in T&T, says AG - Trinidad & Tobago Express	https://trinidadexpress.com/news/local/no-refugee-laws-in-t-t-says-ag/article_3bbab938-ea07-11e8-8465-d75454082f0c.html	2018-11-16	No refugee laws in T&T, says AG	THERE are no laws in Trinidad and Tobago to deal with refugees. And there must be extensive consultation before this step is taken as there could be significant ramifications, says Attorney General Faris Al-Rawi. “The issue of bringing these things into our laws have significant consultation to be engaged in first because you are agreeing to provide economic rights and other benefits to non-citizens of your country, housing, education, medicine, etc. 
Young: TT does not recognise refugee, asylum status - Trinidad News	https://newsday.co.tt/2018/11/17/young-tt-does-not-recognise-refugee-asylum-status/	2018-11-17	Young: TT does not recognise refugee, asylum status	None 
AG: No law for refugees, asylum seekers - Trinidad Guardian	http://www.guardian.co.tt/news/ag-no-law-for-refugees-asylum-seekers-6.2.719051.d3618d40c5	2018-11-19	AG: No law for refugees, asylum seekers	However, he has admitted it is an important discussion for T&T to start having since taxpayers will be the ones to foot the bill eventually when such things are put in place. We’re in constant discussions with all of the entities.” On whether T&T can manage the refugee/asylum situation right now, the AG said, “The math is, are we prepared from a policy perspective to manage this perspective right now, because once you turn that key, then you create rights and obligations which are actionable and then you have to be prepared to operationalise that law. “Most refugees remain for many years in their host country and make significant contributions to its development. 
78 Cuban refugees jailed for 2 days - Trinidad Guardian	http://www.guardian.co.tt/news/78-cuban-refugees-jailed-for-2-days-6.2.719396.a44bf0a162	2018-11-20	78 Cuban refugees jailed for 2 days	However, when they reappeared before Magistrate Sanara Toon-McQuilkin in the Port-of-Spain Magistrate's Court Tuesday morning they were advised by their attorneys to plead guilty to the charge, which carries a maximum sentence of a $200 fine or up to a month in prison. In sentencing the group of men and women of various ages, Toon-McQuilkin considered the fact that they were the second set of asylum seekers to be arrested for such a protest in less than a year. Toon-McQuilkin set a starting point of 12 days in prison, which she reduced by a third because of the group's guilty plea. 
Faris puts refugee policy to the people - Trinidad News	https://newsday.co.tt/2018/11/20/faris-puts-refugee-policy-to-the-people/	2018-11-20	Faris puts refugee policy to the people	None 
AG under fire for refugee statements - Trinidad & Tobago Express	https://trinidadexpress.com/news/local/ag-under-fire-for-refugee-statements/article_c37b78b6-edf5-11e8-811e-372d2c60d473.html	2018-11-21	AG under fire for refugee statements	Attorney General Faris Al-Rawi is being challenged for saying that this country does not have refugee laws. According to an article on the website www.amnesty.org, Americas director at Amnesty International, Erika Guevara-Rosas said the AG is mistaken in his understanding of Trinidad and Tobago’s obligations under international law and is in fact bound by international law to uphold the terms of treaties which state that people cannot be deported to countries to which their lives and freedoms are at risk. Al-Rawi had told the Express that T&T was signatory to two UN Conventions which it had not yet ratified and there were at present no refugee laws. 
Young on TT refugee policy: Amnesty International has 'agenda' - Trinidad News	https://newsday.co.tt/2018/11/22/young-faris-on-tt-refugee-policy-amnesty-international-has-agenda/	2018-11-22	Young on TT refugee policy: Amnesty International has 'agenda'	None 
AG: Where will refugees be housed? - Trinidad News	https://newsday.co.tt/2018/11/23/ag-where-will-refugees-be-housed/	2018-11-23	AG: Where will refugees be housed?	None 
Mayor urges citizens to help Cuban refugees - Trinidad Guardian	http://www.guardian.co.tt/news/mayor-urges-citizens-to-help-cuban-refugees-6.2.728204.5521321648	2018-12-02	Mayor urges citizens to help Cuban refugees	Akaloo was heartbroken after several of the refugees reached out to him when they were released from prison last month. Speaking to Guardian Media Sunday, Akaloo said there are 170-plus Cubans now staying at the warehouse. Akaloo said, “I wondered what they were doing for the last four years in this country.” Akaloo said people who want to contribute clothes and food can do so directly through him rather than going to the refugee camp. 
Emergency plan for refugees and migrants from Venezuela - Trinidad Guardian	http://www.guardian.co.tt/news/emergency-plan-for-refugees-and-migrants-from-venezuela-6.2.737576.69c48fd3ad	2018-12-14	Emergency plan for refugees and migrants from Venezuela	They are families, women alone, children, young boys and girls, all in conditions of extreme vulnerability. According to available estimates, during 2018 an average of 5,500 people have been leaving the country every day. Mexico, the Caribbean and Central American countries have so far witnessed a smaller number of arrivals, either directly or through secondary movements. 
Cuban refugee hero in a jam - Trinidad & Tobago Express	https://trinidadexpress.com/news/local/cuban-refugee-hero-in-a-jam/article_ea9caf0c-00d1-11e9-88b4-23371daa855f.html	2018-12-15	Cuban refugee hero in a jam	LAST month, Central businessman Churchill Akaloo was praised for opening the doors of a warehouse to 78 Cuban refugees who had been sleeping on the streets outside the United Nations Refugee Agency (UNHCR) office in Port of Spain. Using his own money, Akaloo installed additional toilets and a kitchen area to make the warehouse more habitable. But now, one month after making the charitable gesture, Akaloo admits he bit off more than he could chew and he feels like the Cubans are taking advantage of his kindness. 
Cubans dispute refugee numbers at warehouse - Trinidad & Tobago Express	https://trinidadexpress.com/news/local/cubans-dispute-refugee-numbers-at-warehouse/article_62ff99bc-0197-11e9-a3cf-f74525904c0d.html	2018-12-16	Cubans dispute refugee numbers at warehouse	ONE day after businessman Churchill Akaloo expressed frustration over the growing number of Cuban refugees at his warehouse in Warrenville, the Cubans are denying that there are 171 people staying at the location. Last month, Akaloo offered the warehouse as a temporary shelter to the group of refugees who were protesting outside the United Nations Refugee Agency (UNHCR) in Port of Spain. Akaloo has since installed additional toilets, a kitchen area and has been providing food for the group. 
Our migrant/refugee 'problem' - Trinidad News	https://newsday.co.tt/2019/01/05/our-migrant-refugee-problem/	2019-01-05	Our migrant/refugee 'problem'	None 
Face up to the refugee issue - Trinidad & Tobago Express	https://trinidadexpress.com/opinion/letters/face-up-to-the-refugee-issue/article_651c21e2-179b-11e9-bc06-eb1a3f3b06aa.html	2019-01-13	Face up to the refugee issue	What a hypocritical society we live in! That soca parang is on the airwaves every Christmas, with endless Trinbagonians singing along... “Ah want a Spanish woman to marry me”. Who would have thought that some ten years later, as we enter 2019, the atmosphere in Trinidad and Tobago is so negative on allowing our Spanish-speaking Venezuelan neighbours to enter T&T seeking asylum? 
A genuine refugee - Trinidad & Tobago Express	https://trinidadexpress.com/opinion/columnists/a-genuine-refugee/article_e3940c88-1926-11e9-b8d0-afe73a826c41.html	2019-01-15	A genuine refugee	The United Nations has declared that the 18-year-old Saudi who fled from her parents and took a flight from Kuwait to Bangkok last week is a genuine refugee. Rahaf Mohammed Alqunun had barricaded herself in a hotel room in the Thai capital when attempts were made originally to meet with her. She on the other hand expressed fears over any such meeting. 
Venezuelans protest over T&T's refugee policy - Trinidad Guardian	http://www.guardian.co.tt/news/venezuelans-protest-over-tts-refugee-policy-6.2.760423.df5e4c2912	2019-01-19	Venezuelans protest over T&T's refugee policy	On November 23, Attorney General Faris Al-Rawi said T&T was not ready to establish laws here regarding people seeking asylum and refugee status as it cannot afford to, especially with regards to housing and education. He was responding to statements by Amnesty International and attorney Dr Emir Crowne who both pointed out that the country has laws for refugees as a signatory to the 1951 Refugee Convention and its 1967 Protocol. He said T&T was a “dualistic” country and for international law to be established it must be enacted by an act of Parliament, similar with the Foreign Account Tax Compliance Act and Global Forum. 
Venezuelan refugees want respect, dignity - Trinidad News	https://newsday.co.tt/2019/01/19/venezuelan-refugees-want-respect-dignity/	2019-01-19	Venezuelan refugees want respect, dignity	None 
La Guerre: Brace for influx of migrants - Trinidad Guardian	http://www.guardian.co.tt/news/la-guerre-brace-for-influx-of-migrants-6.2.765080.a16256234e	2019-01-24	La Guerre: Brace for influx of migrants	La Guerre was speaking with Guardian Media, as he weighed in on Venezuela's mounting turmoil, following Wednesday's protest action by thousands against President Nicolas Maduro. He also advised that we secure our sea borders, as more Venezuelans would be tempted to come here illegally, given the tense political climate. But that does not mean you would take any and every asylum case as legitimate. 
Addressing the needs of migrants, refugees - Trinidad Guardian	http://www.guardian.co.tt/opinion/addressing-the-needs-of-migrants-refugees-6.2.764599.f929fcdca0	2019-01-25	Addressing the needs of migrants, refugees	Whatever their status, they are human beings, endowed by God with a dignity that is inherent, inalienable and inviolable. Each parish has been charged with responsibility by His Grace to establish a Ministry for Migrants and Refugees. UNICEF and UNHCR are working with Living Water Community to provide limited educational opportunities for children concerned, but this is not an ideal situation. 
Bringing relief to refugees - Trinidad & Tobago Express	https://trinidadexpress.com/opinion/editorials/bringing-relief-to-refugees/article_50bfebd4-235d-11e9-b52f-47105f9a4423.html	2019-01-28	Bringing relief to refugees	IN a move announced last Friday, hesitant and tentative as it may have been, the Prime Minister’s statement on providing special identification cards for Venezuelan nationals in Trinidad and Tobago is a welcome step forward. Dr Rowley made this disclosure as he addressed the hour-by-hour changing situation with our neighbours next door. The report reveals details of complaints by asylum-seekers about having to pay a “security bond” as a condition of release from prison.” There have been questions about whether, in fact, some of those persons should have been detained in prison in the first place, as distinct from the Immigration Detention Centre. 
UNHCR records 6000 refugees from 32 countries - Trinidad Guardian	http://www.guardian.co.tt/news/unhcr-records-6000-refugees-from-32-countries-6.2.769432.5a52fc39c0	2019-01-30	UNHCR records 6000 refugees from 32 countries	Some countries include Sri Lanka, Pakistan, Bangladesh, Congo, Sudan, Haiti, Uganda and Colombia. Questioned how many refugees from across the globe have come to T&T in the last year, Barbado said as of last September they had 6,000 people registered with them. Barbado said his greatest concern was the conditions in which refugees live. 
Mayor wants UNHCR desk in Central for refugees - Trinidad Guardian	http://www.guardian.co.tt/news/mayor-wants-unhcr-desk-in-central-for-refugees-6.2.769906.fd7956fb0a	2019-01-31	Mayor wants UNHCR desk in Central for refugees	Boodhan said there were over 2,000 refugees in Chaguanas and environs. The mayor said he was very concerned about the welfare of refugees and recalled meeting Cubans in Chaguanas who have children that are not in school. Boodhan said he expressed these concerns to the UNHCR representatives. 
Church reaches out to help Cuban refugees - Trinidad Guardian	http://www.guardian.co.tt/news/church-reaches-out-to-help-cuban-refugees-6.2.773704.192eacfc03	2019-02-05	Church reaches out to help Cuban refugees	"For the past four days they have been living in makeshift tents covered by tarpaulins and strips of plastics. Three months ago, 87 Cuban nationals were charged with obstructing a free passageway and removed by police after they camped outside the UN House, in Port-of-Spain seeking the organisation's assitance. ""We are feeling happier and safer now,"" said Andris Gonzalez, one of Cubans who spoke for the group. "
'South, Central Americans posing as refugees in T&T' - Trinidad & Tobago Express	https://trinidadexpress.com/news/local/south-central-americans-posing-as-refugees-in-t-t/article_7ce82d1a-3187-11e9-8695-9739c8c6414d.html	2019-02-15	'South, Central Americans posing as refugees in T&T'	He said there is a significant number of people that cannot be easily identified as they come to this country without any documents. He added that it takes a while to identify these people as they may not be truthful about their country of origin. But he said some 50 per cent of people breach the order and do not report as required. 
Catholic Church to provide schools for migrant children - Trinidad Guardian	http://www.guardian.co.tt/news/catholic-church-to-provide-schools-for-migrant-children-6.2.798954.490e0f33e6	2019-03-11	Catholic Church to provide schools for migrant children	Coordinator of the Church’s Ministry of Migrants, Rochelle Nakhid, told Guardian Media that the schools will be safe spaces for children in what she calls temporal learning centres. The Archbishop recently said in an interview, “While we must do what is right to meet the needs of our own citizens, we must also show compassion and hospitality and ensure that refugees in need of protection and support are treated according to international standards.” He added, “Refugees have been welcome throughout the whole of history. He insisted that this country will do what it has to for the children of refugees and it will be done in keeping with the international agreements governing children of migrants. 
Mark: Possible Venezuelan refugee invasion - Trinidad News	https://newsday.co.tt/2019/03/13/mark-possible-venezuelan-refugee-invasion/	2019-03-13	Mark: Possible Venezuelan refugee invasion	None 
Let refugees tell their stories - Trinidad News	https://newsday.co.tt/2019/03/17/let-refugees-tell-their-stories/	2019-03-17	Let refugees tell their stories	None 
Cabinet to consider register for migrants - Trinidad Guardian	http://www.guardian.co.tt/news/cabinet-to-consider-register-for-migrants-6.2.804827.4c34789086	2019-03-19	Cabinet to consider register for migrants	“No one can tell you with any level of certainty, how many legal or illegal Venezuelans are here so the first thing we need to do is have the registration exercise. Police have reported that some Venezuelans barter drugs and weapons for food or cash to purchase groceries. In fact, when you look out today, you will see one of our Damon vessels off the coastline, so we have been utilising our assets from an intelligence-driven point of view. 
PM: No Venezuelan refugee camp here - Trinidad Guardian	http://www.guardian.co.tt/news/pm-no-venezuelan-refugee-camp-here-6.2.819522.e406be8ac5	2019-04-07	PM: No Venezuelan refugee camp here	Trinidad and Tobago will not open a refugee camp for Venezuelans, Prime Minister Dr. Keith Rowley said during the People National Movement’s public meeting on Saturday evening. And we must apologise for saying no to that?” asked the Prime Minister. He once again defended the country’s no interference stance and said despite comments from some about its impact on T&T’s relationship with the United States, there was no strained relationship there. 
