title	link	date	title_corrected	summary
Monseñor Álvarez “Nos solidarizamos con quiénes vive la migración forzada y el dolor de estar lejos de su patria” - 100% Noticias • Nicaragua	https://100noticias.com.ni/nacionales/97570-nicaragua-monsenor-rolando-alvarez-jornada-oracion/	2020-01-04	Monseñor Álvarez “Nos solidarizamos con quiénes vive la migración forzada y el dolor de estar lejos de su patria”	“El vivir lejos de la patria, el estar fuera del terruño, el sentirse extranjero en tierras que no son las que nos vieron nacer se convierten en víctimas, (por eso) oramos por todos ellos y nos solidarizamos desde el evangelio con sus familiares y parientes” expreso monseñor Álvarez en un video publicado en las redes sociales de esta diócesis. Actualmente se encuentran alrededor de unos 80 mil nicaragüenses exiliados en diferentes partes del mundo, principalmente en Costa Rica, por tal razón monseñor Álvarez ha manifestado que la iglesia siempre ha estado orando para que un día muy cercano puedan regresar a la tierra nicaragüense. “La iglesia es el lugar donde los inmigrantes ilegales son reconocidos y acogidos como hermanos sobre todo como amigos, nos solidarizamos con quién vive la migración, la migración forzada y el dolor de estar lejos de su patria” puntualizo Monseñor Álvarez. 
Caravana de migrantes hondureños llega a Guatemala con futuro incierto - 100% Noticias • Nicaragua	https://100noticias.com.ni/internacionales/97939-caravana-de-migrantes-hondurenos-llega-a-guatemala/	2020-01-16	Caravana de migrantes hondureños llega a Guatemala con futuro incierto	La integran hombres, mujeres, niños y hasta menores en brazos de sus padres. “Construir un futuro, ya que por bajos recursos económicos no pude estudiar y entre lo más triste está dejar a la familia”, declaró. El nuevo presidente guatemalteco indicó que en virtud del convenio de libre movilidad CA4 los hondureños adultos podrán entrar a Guatemala, sin embargo, las autoridades serán exigentes para verificar que los menores viajen con sus padres. 
Nueva caravana de migrantes hondureños cruza Guatemala con destino a EE.UU. - La Prensa (Nicaragua)	https://www.laprensa.com.ni/2020/01/16/internacionales/2630284-nueva-caravana-de-migrantes-hondurenos-cruza-guatemala-con-destino-a-ee-uu	2020-01-16	Nueva caravana de migrantes hondureños cruza Guatemala con destino a EE.UU.	Otra caravana más nutrida también partió un día después del mismo lugar, pero prefirió cubrir otra ruta y así ingresar a Guatemala vía Agua Caliente. Puede interesarle: Caravana de migrantes: agentes lanzaron gases lacrimógenos en la frontera entre EE.UU. y México Guatemala y Honduras tienen un acuerdo mediante el cual sus ciudadanos pueden cruzar las fronteras de ambos países sin inconvenientes, siempre y cuando accedan al registro aduanero con su documento de identificación. La secretaria, de quien depende el Instituto Nacional de Migración, dijo que la caravana que partió de Honduras con destino a Estados Unidos está formada por unas 600 personas, que serán atendidas si desean regularizar su situación en México. 
Presidente de México ofrece empleo a migrantes que viajan en nueva caravana • VosTV - VosTV	https://www.vostv.com.ni/internacionales/12404-presidente-de-mexico-ofrece-empleo-a-migrantes-que/	2020-01-19	Presidente de México ofrece empleo a migrantes que viajan en nueva caravana • 	El Presidente Andrés Manuel López Obrador dijo que México tiene listos más de cuatro mil empleos en la frontera sur, para la caravana migrante que está a punto de entrar a su país. El trabajo o el derecho al trabajo que se garantice”, dijo el mandatario mexicano. Presidente de México ofrece empleo a migrantes que viajan en nueva caravana López Obrador ofrece unos 4,000 empleos para la caravana de migrantes que está en Guatemala El Presidente Andrés Manuel López Obrador dijo que México tiene listos más de cuatro mil empleos en la frontera sur, para la caravana migrante que está a punto de entrar a su país. 
Caravana de migrantes: cientos de centroamericanos cruzan el río Suchiate hacia México en su intento de llegar a EE.UU. - La Prensa (Nicaragua)	https://www.laprensa.com.ni/2020/01/20/internacionales/2631769-caravana-de-migrantes-cientos-de-centroamericanos-cruzan-el-rio-suchiate-hacia-mexico-en-su-intento-de-llegar-a-ee-uu	2020-01-20	Caravana de migrantes: cientos de centroamericanos cruzan el río Suchiate hacia México en su intento de llegar a EE.UU.	México señala que podrían trabajar ahí y solicitar asilo, pero no se les permitirá el paso libre a EE.UU. Ha sido agotador, especialmente para los niños», dijo el inmigrante hondureño Elvis Martínez a la agencia de noticias AFP. El Ministerio del Interior mexicano dice que ya recibió 1.100 inmigrantes en los estados de Chiapas y Tabasco. 
México deportó a más de 2,000 hondureños de caravana migrante - La Prensa (Nicaragua)	https://www.laprensa.com.ni/2020/01/28/internacionales/2634073-mexico-deporto-a-mas-de-2000-hondurenos-de-caravana-migrante	2020-01-28	México deportó a más de 2,000 hondureños de caravana migrante	Lea además: ONU y AI preocupados por trato de México a migrantes El INM detalló que 1,064 migrantes fueron trasladados vía aérea, mientras que otros 1,239 fueron repatriados vía terrestre desde los estados sureños de Chiapas y Tabasco. Honduras confirma casi 1,800 deportados Por su lado, el gobierno de Honduras informó el jueves pasado que hasta esa fecha un total de 1,754 hondureños habían sido deportados desde Guatemala y México. El presidente de México, Andrés Manuel López Obrador, desplegó entonces unos 26,000 militares en sus fronteras norte y sur. 
Hondureños emprenden una nueva caravana de migrantes hacia Estados Unidos • VosTV - VosTV	https://www.vostv.com.ni/internacionales/12538-hondurenos-emprenden-una-nueva-caravana-de-migrant/	2020-01-31	Hondureños emprenden una nueva caravana de migrantes hacia Estados Unidos • 	La pequeña caravana se comenzó a concentrar en las primeras horas del jueves en la terminal de autobuses de San Pedro Sula, donde durmieron unas pocas horas en la noche, para iniciar su viaje este viernes. La inseguridad y el desempleo son los principales motivos para emprender este viaje, donde es posible que puedan encontrar la muerte, como pasa con muchos de sus compañeros. Según la Organización Internacional para las Migraciones (OIM) en 2019 al menos 800 personas perdieron la vida cruzando desiertos, ríos y territorios remotos en diferentes rutas migratorias de América, convirtiéndose en uno de los años más fatales que se hayan registrado. 
Costa Rica destina 4.1 millones de dólares para atender a refugiados • VosTV - VosTV	https://www.vostv.com.ni/nacionales/12608-costa-rica-destina-4-5-millones-de-dolares-para-at/	2020-02-08	Costa Rica destina 4.1 millones de dólares para atender a refugiados • 	"El anuncio de estos nuevos fondos que destinará Costa Rica para atender a los refugiados coincidió con la visita que agendó a ese pais, Kelly T. Clements, Alta Comisionada Adjunta de las Naciones Unidas para los Refugiados. La agencia también ha colaborado con un programa de asistencia humanitaria que Costa Rica ha implementado, dirigido a brindar un subsidio económico por tres meses a 600 familias en extrema pobreza solicitantes de asilo para ""aliviar sus necesidades básicas inmediatas"". Desde el ACNUR, reafirmamos nuestro apoyo al país en la respuesta humanitaria a las personas que han huido para salvar sus vidas”, afirmó la Alta Comisionada Adjunta. "
Campesinos nicaragüenses refugiados en Costa Rica exponen necesidades a ACNUR - 100% Noticias • Nicaragua	https://100noticias.com.ni/nacionales/98539-campesinos-nicaraguenses-refugiados-en-costa-rica-/	2020-02-08	Campesinos nicaragüenses refugiados en Costa Rica exponen necesidades a ACNUR	En la visita la líder campesina Francisca Ramírez le informó sobre las principales necesidades que enfrentan los refugiados nicaragüenses. “Que escuche y pueda ver la necesidad somos miles, pero hemos decidido hacer este campamento que bajo sufrimiento, hay demasiados niños hemos tratado de buscar familias para darles apoyo, pero hay miles que a diario quisieran tener un espacio tan siquiera un plástico donde acampar” le dijo Chica Ramírez a la funcionaria. En respuesta Clements le dijo “Estoy aquí para ver en persona el campamento, quiero ver la granja de cerdos que tienen, para visualizar lo que ustedes están haciendo, acá tenemos muchas ideas para apoyarles me gustaría hablar con la comunidad” ACNUR comenzó apoyar a un grupo de refugiados del campamento de doña Chica desde octubre del 2019. 
Costa Rica recibirá 4.1 millones de dólares para ayudar a refugiados - nicaraguainvestiga.com	https://nicaraguainvestiga.com/mundo/12668-costa-rica-recibira-4-1-millones-de-dolares-par-ayudar-a-refugiados/	2020-02-08	Costa Rica recibirá 4.1 millones de dólares para ayudar a refugiados	La ayuda se autorizó luego de una gira hecha por el presidente costarricense Carlos Alvarado en Ginebra, Suiza, donde participó en el Foro Mundial sobre refugiados en diciembre del año pasado. Además, en diciembre pasado se había firmado un convenio entre la OACNUR y la Caja Costarricense del Seguro Social que permitirá brindar seguro médico por un año a 6 mil personas solicitantes de refugio en estado grave o situación de extrema pobreza por un monto total de 1.8 millones de dólares. Ayudanos a darte la mejor información Suscribete ahora mismo y obten la mejor informacion del acontecer nacional e internacional. 
Asignan 4.1 millones de dólares a Costa Rica para atender a refugiados - Confidencial	https://www.confidencial.com.ni/mundo/acnur-asigna-41-millones-de-dolares-a-costa-rica-para-atender-a-refugiados/	2020-02-08	Asignan 4.1 millones de dólares a Costa Rica para atender a refugiados	El único enfoque tanto ético como práctico es colocar a la persona en el centro de todas las políticas públicas”, dijo Alvarado. Las crisis sociopolíticas en Nicaragua y Venezuela han provocado un incremento exponencial de las solicitudes. Mientras que hay registradas unas 600 familias solicitantes de asilo en pobreza extrema. 
Más de 500 nicaragüenses podrían estar detenidos en los centros migratorios de EE.UU. • VosTV - VosTV	https://www.vostv.com.ni/nacionales/12669-mas-de-500-nicaraguenses-podrian-estar-detenidos-e/	2020-02-17	Más de 500 nicaragüenses podrían estar detenidos en los centros migratorios de EE.UU. • 	"La congresista expresó junto a su equipo ""colaborar con la Comisionada Lacayo en la solución, tramitación y liberación de los nicaragüenses detenidos en esos centros y se tratará de alargar el proceso de deportación para la búsqueda de información, documentos y pruebas que permitan el otorgamiento de asilo político a estos nicaragüenses"". La oficina pide a los familiares que quieran reportar o tener información de algún migrante nicaragüense escribir al correo Sophia@sophialacayo.com y enviar los siguientes requisitos: Nombre completo, número de cédula de Nicaragua o pasaporte, edad , número Alien de EE.UU. (este es un número que se asignan en los centro de detenciones ) y el nombre del centro de detención en EE.UU. ""Nosotros lo que estamos diciendo es que no los deporten porque no hay garantía, no hay seguridad porque el Gobierno de Nicaragua se ha caracterizado por la persecución, el asedio y las amenazas contra todos aquellos que han protestado de una u otra manera"", expresó a Vostv Marcos Carmona, secretario general de la CPDH. En el encuentro estuvieron también presentes activistas comunitarios y organizaciones que luchan por los derechos de los inmigrantes en la Florida Martha Vega Hero, presidente Nacional Community Services y Maritza Rodríguez presidente del Movimiento 19 de Abril Miami. "
De qué países de América Latina son los refugiados que hacen de España la nación con más solicitudes de asilo de la Unión Europea - La Prensa (Nicaragua)	https://www.laprensa.com.ni/2020/02/27/internacionales/2645376-de-que-paises-de-america-latina-son-los-refugiados-que-hacen-de-espana-la-nacion-con-mas-solicitudes-de-asilo-de-la-union-europea	2020-02-27	De qué países de América Latina son los refugiados que hacen de España la nación con más solicitudes de asilo de la Unión Europea	Y es que con EE.UU. endureciendo cada vez más su discurso y políticas para con los migrantes, los latinos también parecen cada vez más dispuestos a aprovechar el hecho de no requerir de visa para viajar a tierras europeas. Pero, como ya se hizo notar, esto no es lo único que está aumentando. Entre el 40% restante, por su parte, se destacan hondureños (5,8%), nicaragüenses (5%), salvadoreños (4%) y peruanos (3,4%), según cifras de la CEAR. 
Autoridades de migración listos para atender a los turistas en la temporada alta del verano en Nicaragua - El 19 Digital	https://www.el19digital.com/articulos/ver/titulo:101336-autoridades-de-migracion-listos-para-atender-a-los-turistas-en-la-temporada-alta-del-verano-en-nicaragua-	2020-03-16	Autoridades de migración listos para atender a los turistas en la temporada alta del verano en Nicaragua	None 
Temen que el sistema de salud se vea colapsado Embajada de Estados Unidos en Managua recomienda a ciudadanos estadounidenses abandonar Nicaragua por coronavirus - articulo66.com	https://www.articulo66.com/2020/03/17/coronavirus-embajada-de-estados-unidos-abandonar-nicaragua-regimen-orteguista/	2020-03-17	Temen que el sistema de salud se vea colapsado Embajada de Estados Unidos en Managua recomienda a ciudadanos estadounidenses abandonar Nicaragua por coronavirus	Analizamos el incremento en el precio del gas y escuchamos la opinión de los lectores. Nota relacionada: Embajada de Estados Unidos en Nicaragua cancela entrevistas para visas por la pandemia del coronavirus La pandemia del coronavirus ha obligado a decenas de países a cerrar sus fronteras y a otros a decretar cuarentenas para evitar el contagio del virus que ha cobrado la vida de 6,470 personas en 146 países y 164, 837 afectadas, según la Organización Mundial de la Salud (OMS). Guatemala, El Salvador, Honduras, Costa Rica y Panamá son los países mejor evaluados por el SICA, después que han cumplido con todos los mecanismos de emergencia. 
"Coronavirus | ""Vamos a terminar en la calle y con hambre"": cómo cambió la vida de los migrantes venezolanos en Colombia por la pandemia - La Prensa (Nicaragua)"	https://www.laprensa.com.ni/2020/03/26/internacionales/2655743-coronavirus-vamos-a-terminar-en-la-calle-y-con-hambre-como-cambio-la-vida-de-los-migrantes-venezolanos-en-colombia-por-la-pandemia	2020-03-26	"Coronavirus""Vamos a terminar en la calle y con hambre"": cómo cambió la vida de los migrantes venezolanos en Colombia por la pandemia"	Sin embargo, el gobierno no ha anunciado medidas asistenciales para los venezolanos (salvo apoyo médico a los que están regularizados). Duque ha sido enfático en que Colombia necesita más recursos internacionales para enfrentar la crisis migratoria. «Eso les impide acceder a los servicios (de asistencia) más rápido», señaló Merkx. 
Temen que el sistema de salud se vea colapsado y que los vuelos ya no estén disponibles Embajada de Estados Unidos en Managua insiste a sus ciudadanos abandonar Nicaragua por el COVID-19 - articulo66.com	https://www.articulo66.com/2020/03/27/coronavirus-nicaragua-embajada-de-estados-unidos-abandonar-nicaragua-regimen-orteguista/	2020-03-27	Temen que el sistema de salud se vea colapsado y que los vuelos ya no estén disponibles Embajada de Estados Unidos en Managua insiste a sus ciudadanos abandonar Nicaragua por el COVID-19	Nota relacionada: Embajada de Estados Unidos en Nicaragua cancela entrevistas para visas por la pandemia del coronavirus También la embajada detalla que están brindando asistencia a los norteamericanos que deseen abandonar Nicaragua. Embassy Managua, Nicaragua (March 26, 2020) https://t.co/H9O8h2qUSW — USEmbassy Nicaragua (@USEmbNicaragua) March 27, 2020 Finalmente insiste a sus ciudadanos que si no hay vuelos comerciales disponibles pueden llenar un formulario en línea disponible en la página web para que sean agregados a una lista para cualquier vuelo organizado por el gobierno norteamericano. !#COVID2019 pic.twitter.com/6WxJZAxoh6 — CEPREDENAC (@CEPREDENAC) March 27, 2020 Los últimas cifras actualizadas por la Secretaria General del Sistema de la Integración Centroamericana (SICA) revela que en Centroamérica y República Dominica se registran 1596 casos positivos por COVID-19, de los que han fallecido 34 centroamericanos. 
Nicaragüense en Panamá dona pan a nicas refugiados que están desamparados ante COVID-19 - 100% Noticias • Nicaragua	https://100noticias.com.ni/nacionales/99728-nicaraguense-dona-pan-exiliados/	2020-03-29	Nicaragüense en Panamá dona pan a nicas refugiados que están desamparados ante COVID-19	El nicaragüense Lázaro Centeno, quien tiene una panadería en Panamá y vive desde hace varios años en dicho país, conmovido por la dura situación que viven nicaragüenses refugiados, decidió donar su venta de pan a hermanos perseguidos políticos del régimen Ortega-Murillo, que están en el país canalero. Miles han quedao en el desempleo, y la condición de solicitantes de refugio no les garantiza las subvenciones estatales para costear alimentación y renta para enfrentar la pandemia del coronavirus. Las autoridades en Panamá han establecido cuarentena en todo el país, ya registran 17 muertos por coronavirus y más de 900 confirmados. 
"ONU: Refugiados y migrantes detenidos ""deberían ser liberados sin demora"" - La Prensa (Nicaragua)"	https://www.laprensa.com.ni/2020/04/01/internacionales/2658003-onu-refugiados-y-migrantes-detenidos-deberian-ser-liberados-sin-demora	2020-04-01	"ONU: Refugiados y migrantes detenidos ""deberían ser liberados sin demora"""	«Teniendo en cuenta las consecuencias letales que tendría un brote de la COVID-19, deberían ser liberadas sin demora. Además,expone que se trata de personas expuestas a la exclusión y la discriminación, aún más si no tienen documentos. Puede interesarle: Cuba cierra totalmente sus fronteras «Los Estados pueden necesitar apoyo financiero adicional. 
ACNUR ausente en apoyo a refugiados nicaragüenses en Costa Rica señalan analistas - 100% Noticias • Nicaragua	https://100noticias.com.ni/nacionales/99861-coronavirus-costa-rica-acnur/	2020-04-02	ACNUR ausente en apoyo a refugiados nicaragüenses en Costa Rica señalan analistas	El analista explicó que la oficina Alto Comisionado de las Naciones Unidas para los Refugiados, (ACNUR) en Costa Rica se encuentra cerrada por la pandemia, colocando algunos números telefónicos los cuales no están siendo atendidos por el personal “llamamos a los números indicados prácticamente es un engaño llaman y te mandan a un buzón que dice está lleno” crítico Sáenz, quien señaló que el impacto de la emergencia y las restricciones, disminuyeron sensiblemente o cancelaron la ayuda humanitaria a los exiliados en el país. “Los exiliados tienen que pagar renta y comprar comida, la gente necesita una respuesta de las autoridades competentes. En Costa Rica se registran casi 200 mil trabajadores en el desempleo a consecuencia del virus. 
Piden garantizar protección a migrantes ante emergencia del coronavirus • VosTV - VosTV	https://www.vostv.com.ni/actualidad/13198-piden-garantizar-proteccion-a-migrantes-ante-emerg/	2020-04-03	Piden garantizar protección a migrantes ante emergencia del coronavirus • 	Esas medidas tendrían que incluir pruebas, tratamiento médico, servicios de salud y asistencia social. “Me preocupa mucho que algunos migrantes y solicitantes de asilo no tengan acceso a una protección mínima contra el contagio, ni siquiera cuentan con agua limpia para lavarse las manos. Algunos trabajan en la agricultura o en los sectores informales sin ninguna medida de protección”, señaló González Morales. 
Señalan ser víctimas de agresiones físicas y verbales y de memes Nicaragüenses exiliados en Costa Rica denuncian que pandemia del COVID-19 aumenta xenofobia - articulo66.com	https://www.articulo66.com/2020/04/07/nicaraguenses-exiliados-en-costa-rica-denuncian-que-pandemia-del-covid-19-aumenta-xenofobia/	2020-04-07	Señalan ser víctimas de agresiones físicas y verbales y de memes Nicaragüenses exiliados en Costa Rica denuncian que pandemia del COVID-19 aumenta xenofobia	Analizamos el incremento en el precio del gas y escuchamos la opinión de los lectores. Jhoswel Antonio Martínez, director del Observatorio de Derechos Humanos de la Asociación Nicaragüense por un Futuro Mejor, menciona que el problema que se vive en Costa Rica a raíz del coronavirus son actos xenofóbicos en contra de los exiliados, justificando la agresión con el cuido que hacen para evitar brotes del COVID-19. Martínez recalcó que “las agresiones en contra de los exiliados en Costa Rica aumentó en un 70% en consideración a octubre del año pasado (2019). 
87.1 % de los refugiados nicaragüenses en Costa Rica están en el desempleo - 100% Noticias • Nicaragua	https://100noticias.com.ni/nacionales/100134-costa-rica-refugiados-desempleo/	2020-04-11	87.1 % de los refugiados nicaragüenses en Costa Rica están en el desempleo	Leer más: Joven nicaragüense de 17 años ingresó a Costa Rica con síntomas de Covid-19 La medición también revela que entre el 83.5 % y 95.6 % tienen limitaciones en alimentos y medicinas, lo cual indica claramente las necesidades que están aquejando a los refugiados. Leer más: Miles de nicaragüenses exiliados en Costa Rica sin dinero para pagar renta y comida por desempleo generado por COVID-19 Leer más: ACNUR ausente en apoyo a refugiados nicaragüenses en Costa Rica señalan analistas El 91.4 %, equivalente a 245 personas de las 268 que contestaron la pregunta dicen tener información del COVID 19. Las restantes 23 personas, equivalentes al 8.6 %, desconocen sobre la pandemia, por lo que se hace necesario desarrollar una campaña más a profundidad con los refugiados nicaragüenses en Costa Rica. 
Coronavirus: cómo la covid-19 facilita la expulsión de EE.UU. de migrantes indocumentados hacia México y Centroamérica - La Prensa (Nicaragua)	https://www.laprensa.com.ni/2020/04/11/internacionales/2661923-coronavirus-como-la-covid-19-facilita-la-expulsion-de-ee-uu-de-migrantes-indocumentados-hacia-mexico-y-centroamerica	2020-04-11	Coronavirus: cómo la covid-19 facilita la expulsión de EE.UU. de migrantes indocumentados hacia México y Centroamérica	«Contrariamente a la ley existente, los individuos, las familias y los niños ahora no pueden presentar solicitudes de asilo o buscar otras formas de protección humanitaria y, en algunos casos, están siendo expulsados a países en los que temen ser procesados», indicaron. El mes pasado, Estados Unidos cerró sus fronteras con Canadá y México a todos los viajes no esenciales. - MAPA: Alcance global del coronavirus - PREGUNTAS CLAVE: Cuáles son los síntomas y cómo se transmite - TRATAMIENTOS: Cómo están combatiendo el coronavirus - PREVENCIÓN: Qué puedes hacer para evitar el contagio Visita nuestra cobertura especial 
200 familias de refugiados nicaragüenses reciben alimentos por Corner of Love - 100% Noticias • Nicaragua	https://100noticias.com.ni/nacionales/100227-coronavirus-refugiados-nicaraguenses-alimentos/	2020-04-15	200 familias de refugiados nicaragüenses reciben alimentos por Corner of Love	Leer más: ACNUR ausente en apoyo a refugiados nicaragüenses en Costa Rica señalan analistas Los exiliados nicaragüenses son perseguidos políticos de la dictadura de Daniel Ortega y Rosario Murillo por participar en marchas o tranques que se levantaron en abril del 2018 en los diferentes departamentos del país. Leer más: Miles de nicaragüenses exiliados en Costa Rica sin dinero para pagar renta y comida por desempleo generado por COVID-19 Una reciente encuesta de la Fundación Arias para la Paz y el Progreso Humano, arrojó que la situación más problemática entre los refugiados nicaragüenses en Costa Rica, es el desempleo. El 87.1 % respondió que NO tienen trabajo, lo cual permite avizorar una situación extremadamente complicada para los mismos, ya que no podrían solventar el pago de alquiler, la compra de alimentos mientras dure la crisis del Covid-19. 
Coronavirus en Guatemala: los contagios de covid-19 entre migrantes que llevaron al país a suspender los vuelos de deportados desde EE.UU. - La Prensa (Nicaragua)	https://www.laprensa.com.ni/2020/04/22/internacionales/2665675-coronavirus-en-guatemala-los-contagios-de-covid-19-entre-migrantes-que-llevaron-al-pais-a-suspender-los-vuelos-de-deportados-desde-ee-uu	2020-04-22	Coronavirus en Guatemala: los contagios de covid-19 entre migrantes que llevaron al país a suspender los vuelos de deportados desde EE.UU.	El desencuentro entre Guatemala y Estados Unidos por la deportación de migrantes en plena pandemia del coronavirus es ya público. Según declaró este domingo el presidente Giammattei, son 50 los deportados desde EE.UU. que dieron positivo a la prueba de coronavirus. Pero conocer esta cifra no fue tarea fácil, debido sobre todo a las continuas contradicciones en el seno del propio Ejecutivo. 
