title	link	date	title_corrected	summary
Boston no deportará a más inmigrantes indocumentados - El Nuevo Diario	https://www.elnuevodiario.com.ni/nacionales/328294-boston-no-deportara-mas-inmigrantes-indocumentados/	2014-08-26	Boston no deportará a más inmigrantes indocumentados	La funcionaria también destacó que, aunque se haya pasado la implementación del Acta de Confianza, a las personas indocumentadas se les pide que tienen que tomar las precauciones necesarias cuando vayan a conducir un vehículo sin licencia de conducir, “ya que si son detenidos por ser reincidentes, los podrían poner a la orden de la Oficina de Inmigración para su respectiva deportación”. “Ojalá podamos resolver eso (la problemática de los niños migrantes) aquí en nuestro país y que nuestros niños no tengan que exponerse a ese sufrimiento y a ese peligro tan grande”, confesó el arzobispo de San Salvador en una conferencia de prensa en la Catedral Metropolitana. Patricia Montes, directora de la organización pro migrante “Centro Presente”. 
Nicaragua es destino para refugiados - El Nuevo Diario	https://www.elnuevodiario.com.ni/nacionales/363263-nicaragua-es-destino-refugiados/	2015-06-26	Nicaragua es destino para refugiados	Aunque no hay datos oficiales sobre la cantidad de centroamericanos que piden refugio o asilo en países del área y en otras latitudes, el Servicio Jesuita para Migrantes reveló que Nicaragua es un país destino para refugiados. “Nicaragua está recibiendo cada vez más peticiones de asilo o refugio, se dice que se han cuadriplicado las solicitudes en lo que hace a salvadoreños y hondureños; entonces hay un flujo hacia Nicaragua, pero es por desplazamiento forzado: son personas con necesidad de protección internacional y que hasta la fecha están encontrando más o menos respuesta en las autoridades nicaragüenses”, apuntó Moisés Gómez, miembro de la Red Jesuita para los Migrantes en El Salvador. Lea Montes Lagos, directora para el Servicio Jesuita para Migrantes (SJM) Nicaragua, indicó que según datos oficiales, 1.2 millones de nicaragüenses han migrado, pero no hay datos sobre los que han pedido refugio. 
Aumentan refugiados salvadoreños en el país - El Nuevo Diario	https://www.elnuevodiario.com.ni/nacionales/369060-aumentan-refugiados-salvadorenos-pais/	2015-08-31	Aumentan refugiados salvadoreños en el país	Según Pelegrín, durante el último año y medio el Servicio ha observado un aumento en las solicitudes de salvadoreños que aspiran a residir en Nicaragua. Sin embargo, el embajador de El Salvador en Nicaragua, Carlos Ascencio, considera que el flujo migratorio entre ambos países se mantiene normal. En realidad el movimiento migratorio entre Centroamérica se mantiene tal cual como ha estado ocurriendo siempre”, asegura el diplomático. 
"Corrupción e impunidad, ""verdaderas causas"" de migración forzada en Honduras - El Nuevo Diario"	https://www.elnuevodiario.com.ni/internacionales/369127-corrupcion-e-impunidad-verdaderas-causas-migracion/	2015-08-31	"Corrupción e impunidad, ""verdaderas causas"" de migración forzada en Honduras"	"No obstante, señaló que todo lo anterior es consecuencia ""de las dos verdaderas causas de (la) emigración forzada: la corrupción e impunidad en todas sus modalidades y niveles"". La organización destacó además que la reunificación familiar ""no es el principal motivo"" por el que los hondureños abandonan su país con la idea de llegar a Estados Unidos. En Honduras ""son millones"" las personas que están ""privadas del derecho a la alimentación, salud, educación, vivienda, propiedad, empleo digno y, el que se ha agravado mucho en los últimos 5 años, derecho a la vida y a la seguridad"", resalta el comunicado. "
Millonario noruego ofrece noches de hotel a refugiados - La Prensa (Nicaragua)	https://www.laprensa.com.ni/2015/09/08/internacionales/1898068-millonario-noruego-ofrece-noches-de-hotel-a-refugiados	2015-09-08	Millonario noruego ofrece noches de hotel a refugiados	El multimillonario noruego Petter Stordalen, que hizo fortuna en el ramo hotelero, ofreció este martes 8 de septiembre 5 mil noches de hotel a refugiados que no hubiesen podido ser alojados en las instalaciones previstas para recibirlos. Lea: ONU: Todos los países, incluidos los latinoamericanos, deben acoger refugiados Noruega recibió en agosto a 2,313 solicitantes de asilo, principalmente de Siria, Eritrea y Afganistán. Se trata del número de demandas mensual más elevado desde los años 90. 
Hungría arresta a 519 refugiados desde el cierre de la frontera - La Prensa (Nicaragua)	https://www.laprensa.com.ni/2015/09/16/internacionales/1902569-hungria-arresta-a-519-refugiados-desde-el-cierre-de-la-frontera	2015-09-16	Hungría arresta a 519 refugiados desde el cierre de la frontera	La Policía húngara informó este miércoles 16 de septiembre de que ha tomado «diferentes medidas» contra 519 refugiados por haber cruzado ilegalmente la frontera desde la medianoche del lunes al martes, cuando cerró su línea divisoria con Serbia y comenzó a aplicar la ley que penaliza con cárcel la entrada irregular en el país. En las últimas 16 horas 94 refugiados han presentado ante las autoridades húngaras solicitudes de asilo, entre ellos sirios, afganos, somalís y 13 menores. Hasta el momento ninguno ha recibido ese estatus, mientras que en 18 casos se han rechazado las peticiones y los solicitantes serán expulsados a Serbia. 
Familia de refugiados sirios pudo conocer a su ídolo Cristiano Ronaldo - El Nuevo Diario	https://www.elnuevodiario.com.ni/elalacran/370882-familia-refugiados-sirios-pudo-conocer-su-idolo-cr/	2015-09-18	Familia de refugiados sirios pudo conocer a su ídolo Cristiano Ronaldo	"El jueves habían sido invitados al estadio Santiago Bernabéu para ver el museo del club blanco y esta vez la familia pudo fotografiarse con los jugadores, especialmente con CR7, al que verán jugar el sábado ante el Granada desde el palco del coliseo blanco. ""El padre de esta familia siria, que fue zancadilleada por una periodista húngara, y sus hijos saludaron a (Rafael) Benítez, al cuerpo técnico y a la plantilla minutos antes de la última sesión previa al partido ante el Granada. El pequeño Zied conoció así a su ídolo, Cristiano Ronaldo"", señaló el Real Madrid en su página web, donde publicó imágenes del encuentro, en el que el pequeño Zied viste la equipación del equipo diez veces campeón de Europa. "
El migrante sufre de una “triple exclusión” - El Nuevo Diario	https://www.elnuevodiario.com.ni/nacionales/373374-migrante-sufre-triple-exclusion/	2015-10-13	El migrante sufre de una “triple exclusión”	El gobierno mexicano ha creado las fiscalías especializadas en delitos contra migrantes, ¿qué tan efectivas han sido? Está siendo expulsado por la exclusión, ahí hay un fracaso puntual y contundente del Estado origen. Luego, cuando ya llega al país que lo recibe, sea en forma o no documentada, el migrante va a sufrir la otra exclusión. 
Aziza, la niña que lleva la escuela a los niños refugiados afganos - El Nuevo Diario	https://www.elnuevodiario.com.ni/especiales/376155-aziza-nina-que-lleva-escuela-ninos-refugiados-afga/	2015-11-07	Aziza, la niña que lleva la escuela a los niños refugiados afganos	"Además, ha recurrido al arte del circo para hacer llegar la escuela a los pequeños y ayuda a que los refugiados puedan ejercer sus derechos en educación, salud y hasta la vida diaria. ""Puedo sentir el dolor de todos los pobres niños refugiados, porque yo misma soy una refugiada y no tuve acceso a una educación regular durante años"", confesó a Efe en el campo en que vive en la capital afgana. Hamid, uno de los responsables de la organización internacional Mini-Circo Móvil para Niños (MMCC, en inglés), vio cómo junto con esa organización y su socio local, el Circo Educacional para Niños Afganos (AECC), Aziza usaba las risas y las habilidades circenses para enseñar asignaturas a los más pequeños. "
Alabama y Michigan se rehúsan a recibir refugiados sirios tras atentados en París - El Nuevo Diario	https://www.elnuevodiario.com.ni/internacionales/377050-alabama-michigan-se-rehusan-recibir-refugiados-sir/	2015-11-16	Alabama y Michigan se rehúsan a recibir refugiados sirios tras atentados en París	"En un comunicado citado el domingo por los medios, Snyder dijo haber dado directivas para suspender ""nuestros esfuerzos que pretendían aceptar a nuevos refugiados, hasta que el departamento estadounidense de Seguridad interior termine con una revisión completa de las medidas de seguridad"". Según el principal diario de Michigan, el Detroit Free Press, entre 1.800 y 2.000 refugiados han sido reinstalados en este Estado durante el año en curso, entre ellos unos 200 sirios. ""No podemos cerrar nuestras puertas a estas personas"", dijo el domingo a la cadena Fox News el consejero nacional adjunto para asuntos de seguridad del presidente Barack Obama, Ben Rhodes. "
Odio orteguista contra migrantes - Confidencial	https://www.confidencial.com.ni/opinion/odio-orteguista-contra-migrantes/	2015-11-23	Odio orteguista contra migrantes	Ante ese ridículo despliegue extremista de fuerzas (del país más atrasado de América que no resulta un destino atractivo para inmigrante alguno), los emigrantes cubanos, como práctica pacífica universal, se sentaron en la carretera Panamericana, y pidieron solidaridad con su éxodo. Los métodos militares le son intrínsecos a una dictadura, dado que también en la actividad antisocial hay una dialéctica necesaria entre medios y fines. La solidaridad real, con los sectores sociales empobrecidos, tiene un significado incomprensible para quien usa el término por demagogia desde la lógica perversa de un poder corrupto. 
Murillo sobre migrantes: “chantaje, presión y amenaza” - Confidencial	https://www.confidencial.com.ni/politica/murillo-sobre-migrantes-chantaje-presion-y-amenaza/	2015-11-24	Murillo sobre migrantes: “chantaje, presión y amenaza”	El Canciller costarricense, Manuel González Sanz, dijo que el encuentro tiene como objetivo fundamental encontrar una solución y pasar de la retórica a la acción. Ningún país se debería arrogar el derecho de bloquear una solución a este problema”, afirmó González. “Ante la crisis humanitaria, creemos que la solución más justa es procurar una salida para los miles de compatriotas atrapados entre Costa Rica y Nicaragua”, dijo Pedro López, director del Partido Liberal Cubano. 
Centroamérica frente a la migración cubana - Confidencial	https://www.confidencial.com.ni/opinion/centroamerica-frente-a-la-migracion-cubana/	2015-12-03	Centroamérica frente a la migración cubana	Este movimiento no es nuevo pero refleja cómo los cubanos está usando las mismas redes migratorias que otras nacionalidades usan para lograr llegar a su destino. Finalmente, manifestó ante el SICA que el país no se prestaba a “legitimar políticas ilegales (migratorias)”. La decisión Ecuatoriana de requerir visa ha sido un paso que si bien cierra parcialmente una puerta, permite en el corto plazo dar un espacio a los países, Costa Rica en particular, para buscar una alternativa para los ya 5,000 cubanos en tránsito. 
Joven y en edad fértil, características del migrante nica - El Nuevo Diario	https://www.elnuevodiario.com.ni/nacionales/381919-joven-edad-fertil-caracteristicas-migrante-nica/	2016-01-12	Joven y en edad fértil, características del migrante nica	“Varía un poco, pero el denominador común es que se trata de gente joven con rango de edades que oscilan entre los 15 y 64 años, esta información está elaborada con base en los censos poblacionales en distintos países. Carmen Paola Zepeda, oficial a cargo de OIM en Nicaragua, destacó que el flujo migratorio del país se ha mantenido estable en los últimos años, debido al llamado flujo circular. “Usualmente están los 90 días en los que les autorizan la entrada y luego se regresan y viajan hacia otro país para trabajar en periodos estacionales en labores agrícolas, es un flujo circular que se maneja estable. 
Una foto que escenifica el drama de los refugiados gana el premio World Press - El Nuevo Diario	https://www.elnuevodiario.com.ni/actualidad/385455-foto-que-escenifica-drama-refugiados-gana-premio-w/	2016-02-18	Una foto que escenifica el drama de los refugiados gana el premio World Press	"""Me di cuenta de que había un bebé en la foto 4 ó 6 días después, cuando la vi en el ordenador a mi vuelta en Budapest"", relató. Otros ganadores Entre los premiados hay además dos españoles, Daniel Ochoa de Olza y Sebastián Lize. En la colorida imagen, una niña pequeña vestida con un manto y ataviada con unos enormes collares posa en un altar rodeado de flores. "
El peregrinaje de los migrantes - Confidencial	https://www.confidencial.com.ni/opinion/el-peregrinaje-de-los-migrantes/	2016-03-16	El peregrinaje de los migrantes	Entre las causas están: crisis económicas, persecuciones políticas, conflictos sociales, étnicos y religiosos, falta de empleos, violencia, epidemias, hambrunas, desastres naturales, guerras, revoluciones. La ruta se inicia con los coyotes, que cobran unos US$5 mil dólares (a veces los estafan, o los delatan ante las autoridades), en la ruta sufren asaltos, violaciones y hasta la muerte, y hasta son convertidos en traficantes o criminales. Los US$1,193 millones de remesas serían más efectivos si se reorientara al ahorro y la inversión. 
Costa Rica no recibirá más inmigrantes cubanos - El 19 Digital	https://www.el19digital.com/articulos/ver/titulo:39906-costa-rica-no-recibira-mas-inmigrantes-cubanos	2016-03-18	Costa Rica no recibirá más inmigrantes cubanos	None 
Papa aboga por refugiados en inicio de Semana Santa - El Nuevo Diario • Nicaragua	https://www.elnuevodiario.com.ni/actualidad/388055-papa-aboga-refugiados-inicio-semana-santa/	2016-03-20	Papa aboga por refugiados en inicio de Semana Santa	"El papa Francisco llegó a la plaza vaticana a pie, con una mitra dorada y una casulla roja, y se acercó hasta el obelisco central para ser testigo de la procesión de las palmas e impartir su bendición. Casi todos los otros huyen y lo abandonan; Pedro lo niega tres veces en el patio del templo"", relató. Pero no solo lidió con esta traición, destacó, sino que sufrió ""en el cuerpo violencias atroces, los golpes, los latigazos y la corona de espinas"" desfiguraron ""su aspecto haciéndolo irreconocible"", y Poncio Pilato lo envió ""posteriormente a Herodes"", quien lo devolvió ""al gobernador romano; mientras"" le fue ""negada toda justicia"". "
Papa Francisco lava pies de 11 refugiados en Jueves Santo - El 19 Digital	https://www.el19digital.com/articulos/ver/titulo:40127-papa-francisco-lava-pies-de-11-refugiados-en-jueves-santo	2016-03-24	Papa Francisco lava pies de 11 refugiados en Jueves Santo	None 
Diputado Jiménez presiona por ley de protección al migrante - El Nuevo Diario • Nicaragua	https://www.elnuevodiario.com.ni/politica/388486-diputado-jimenez-presiona-ley-proteccion-migrante/	2016-03-28	Diputado Jiménez presiona por ley de protección al migrante	Nos urge tener una ley que proteja a los migrantes nicaragüenses tanto en términos administrativos como jurídicos. “Estamos discutiendo el plan estratégico de un año, entre los cuales el principal objetivo es promover el diálogo, la reflexión y promover iniciativas que puedan ayudar a impulsar la protección de nuestros compatriotas en la región”, dijo en esa ocasión el legislador. “Los nicaragüenses en México son menos que los guatemaltecos, hondureños, costarricenses o salvadoreños. 
Más refugiados a Nicaragua - El Nuevo Diario • Nicaragua	https://www.elnuevodiario.com.ni/nacionales/389309-habitantes-ca-huyen-violencia/	2016-04-06	Más refugiados a Nicaragua	Esto queda en evidencia al saber que El Salvador, por ejemplo, es el país con la mayor tasa de homicidios del mundo, agregó. Los refugiados reconocidos como tales que viven en Costa Rica son actualmente 3,616, precisó Acnur. En Belice, país de 400,000 habitantes, 633 personas buscaron asilo el año pasado, diez veces más que en 2014. 
Costa Rica responsabiliza a Estados Unidos por crisis migratoria - El 19 Digital	https://www.el19digital.com/articulos/ver/titulo:40823-costa-rica-responsabiliza-a-estados-unidos-por-crisis-migratoria	2016-04-13	Costa Rica responsabiliza a Estados Unidos por crisis migratoria	None 
EE.UU. evita comparar casos de inmigrantes centroamericanos y refugiados sirios - El Nuevo Diario • Nicaragua	https://www.elnuevodiario.com.ni/internacionales/392971-ee-uu-evita-comparar-casos-inmigrantes-centroameri/	2016-05-18	EE.UU. evita comparar casos de inmigrantes centroamericanos y refugiados sirios	"Obama se comprometió a acoger a 10.000 refugiados sirios en EEUU antes de que acabe septiembre, aunque el proceso está avanzando muy lentamente y, hasta ahora, solo se ha admitido en el país a 1.736 de quienes huyen del conflicto en el país árabe, según indicaron hoy varios senadores demócratas en una carta al mandatario. ""La situación en un lugar como El Salvador u Honduras también es difícil, y hay gente que afronta terribles circunstancias en esos países, pero al menos hay un Gobierno central allí con el que Estados Unidos puede trabajar para remediarlo"", agregó. Earnest defendió que todos los migrantes centroamericanos que van a ser deportados han pasado por un ""debido proceso"" en tribunales de inmigración y ""todos sus reclamos pendientes de asilo o alivio humanitario ya se han agotado"". "
Grecia desaloja el criticado campo de refugiados de Idomeni - El Nuevo Diario • Nicaragua	https://www.elnuevodiario.com.ni/internacionales/393643-grecia-desaloja-criticado-campo-refugiados-idomeni/	2016-05-26	Grecia desaloja el criticado campo de refugiados de Idomeni	"Sin embargo, la mayor parte de las 8.400 personas que se encontraban en Idomeni rechazaron trasladarse a los nuevos campos oficiales. El jueves se le sumaba el grupo International Rescue Committee, criticando que los servicios esenciales eran a todas luces ""insuficientes"". ""Hemos elegido estas instalaciones porque los propios migrantes querían quedarse cerca de la ciudad"", alegó este responsable. "
Ocho migrantes africanos se ahogan en río Sapoá - Confidencial	https://www.confidencial.com.ni/nacion/ocho-migrantes-africanos-se-ahogan-rio-sapoa/	2016-08-02	Ocho migrantes africanos se ahogan en río Sapoá	Los siete hombres y la mujer aparentemente intentaban cruzar el país de forma ilegal. A finales de julio se calculaba que habían unos 1,400 africanos varados en la frontera nicaragüense, incluyendo mujeres embarazadas y niños. Desde finales del año pasado, miembros del Ejército de Nicaragua y la Policía Nacional mantienen un férreo control en el sector fronterizo de Peñas Blancas, para impedir el paso, primero a los cubanos, y ahora a los africanos. 
El horror de las migrantes nicas en España - Confidencial	https://www.confidencial.com.ni/principal/horror-las-migrantes-nicas-espana/	2016-08-09	El horror de las migrantes nicas en España	La deuda, que se incrementaba progresivamente (a un interés que a partir del octavo mes llegaba al 10% mensual) se hacía, en ocasiones, imposible de pagar. Las primeras estadísticas recopiladas en 2006 mostraba que en España se habían registrado 1.990 personas, de las que el 69% eran mujeres y la mayoría del total general correspondía a edades entre los 24 y 44 años. Las estadísticas oficiales muestran que hasta 2013 había registrados en España unos 2,600 nicaragüenses. 
Así es el inhumano trato a los migrantes en cárceles de Estados Unidos (+FOTOS) - El 19 Digital	https://www.el19digital.com/articulos/ver/titulo:45419-asi-es-el-inhumano-trato-a-los-migrantes-en-carceles-de-estados-unidos-fotos	2016-08-18	Así es el inhumano trato a los migrantes en cárceles de Estados Unidos (+FOTOS)	None 
Policía Nacional captura a traficante de migrantes - El 19 Digital	https://www.el19digital.com/articulos/ver/titulo:45549-policia-nacional-captura-a-traficante-de-migrantes	2016-08-22	Policía Nacional captura a traficante de migrantes	None 
El hombre de Ángel González ‘refugiado’ en Nicaragua - Confidencial	https://www.confidencial.com.ni/mundo/centroamerica/el-hombre-de-angel-gonzalez-refugiado-en-nicaragua/	2016-08-26	El hombre de Ángel González ‘refugiado’ en Nicaragua	Ángel González ha transado con todos los políticos desde las dictadoras militares y con el retorno a la democracia en 1986. Así ha transado Ángel González con políticos que van desde el alcalde capitalino Álvaro Arzú hasta Manuel Baldizón. ¿Dónde hablaban el expresidente Otto Pérez, la exvicepresidente Roxana Baldetti y el excandidato Manuel Baldizón cuando querían transmitir mensajes sin cuestionamientos a la población? 
Estados Unidos logra meta de acoger a 10,000 refugiados sirios - La Prensa (Nicaragua)	https://www.laprensa.com.ni/2016/08/28/internacionales/2090860-estados-unidos-logra-meta-de-acoger-a-10000-refugiados-sirios	2016-08-28	Estados Unidos logra meta de acoger a 10,000 refugiados sirios	El candidato republicano, Donald Trump, ha dicho que los sirios desplazados son una amenaza potencial a la seguridad. Se da preferencia a las víctimas de violencia, personas con problemas médicos y niños. Wells dijo que mantener a los estadounidenses seguros y traer algunas de las personas más vulnerables al país no son mutuamente excluyentes. 
Cranshaw: “Política migratoria hipócrita” - Confidencial	https://www.confidencial.com.ni/nacion/cranshaw-politica-migratoria-hipocrita/	2016-09-22	Cranshaw: “Política migratoria hipócrita”	Le han aplicado un delito mucho menor (tráfico imprudente)”, declaró la coordinadora de Nica Migrantes. “Es una persona admirada en San Juan del Sur, una intelectual, todos la conocen y saben que ella no trafica con migrantes. La pena que se impondrá a la profesora Mora Alemán, será conocida el próximo cinco de octubre. 
Metallica y Rihanna cantaron en Nueva York en apoyo a los refugiados - El Nuevo Diario • Nicaragua	https://www.elnuevodiario.com.ni/variedades/405401-metallica-rihanna-cantaron-nueva-york-apoyo-refugi/	2016-09-25	Metallica y Rihanna cantaron en Nueva York en apoyo a los refugiados	"Grandes figuras de la música como Metallica y Rihanna se unieron a otras celebridades en un concierto por el ""Global Citizen Festival"" de Nueva York, que este año puso su acento en ayudar a los refugiados. Durante más de seis horas, los espectadores vieron en escena al dúo electrónico Major Lazer, Demi Lovato, Ellie Goulding y a Rihanna, quien recordó a la multitud que ella misma migró desde Barbados. Los organizadores anunciaron recientemente que realizarán un concierto en Bombay el 19 de noviembre, en el que espera reunir al rapero Jay Z, Coldplay y a la estrella de Bollywood Aamir Khan, entre otros. "
Antimotines reprimen a comunidad por auxiliar a migrantes - Confidencial	https://www.confidencial.com.ni/nacion/antimotines-reprimen-comunidad-auxiliar-migrantes/	2016-10-06	Antimotines reprimen a comunidad por auxiliar a migrantes	Según los relatos de los pobladores, los migrantes se encontraban en condiciones extremas, con llagas en la piel y los pies, algunos sin zapatos o sin camisa. “Golpeados como perros” La iglesia “El Jordán” es una edificación sencilla, compuesta únicamente por un salón grande y oscuro. El conflicto dejó varios heridos, incluyendo a la periodista de Canal 10, Elba Ileana Molina, quien fue impactada en la pierna. 
Protestan en solidaridad a migrantes - Confidencial	https://confidencial.com.ni/nacion/protestan-solidaridad-migrantes/	2016-10-14	Protestan en solidaridad a migrantes	Además, se ha reprimido a ciudadanos nicaragüenses que han intentando solidarizarse con los migrantes. Los protestantes intentaron entregar una carta al canciller Samuel Santos pero se les fue denegada la entrada a la institución estatal. Cinco de los cuerpos fueron reconocidos extraoficialmente por una ciudadana haitiana, Irlande Bien-Aime, que asegura que corresponden a sus familiares: Romane Fatjam Domani, de 26 años; Derisma Olgins Fatjam, Skeezy Civil, Claudy Djoudjou Joseph y Viergeline Valery. 
El infierno de los migrantes en Nicaragua - Confidencial - Confidencial	https://www.confidencial.com.ni/nacion/infierno-los-migrantes-nicaragua/	2016-12-26	El infierno de los migrantes en Nicaragua	El gobierno costarricense les ha colocado servicios sanitarios portátiles y unos toldos gigantescos de color blanco que cubren gran parte del lugar. En Nicaragua, su dominio del idioma español le permitió moverse fácilmente, pero al llegar a Las Manos, frontera con Honduras, su sueño se vio nuevamente truncado. Esta coordinación les ha permitido ejecutar planes conjuntos y tener el mayor control posible de las personas que entran a sus territorios. 
La fiesta de fin de año que no olvidó los refugiados - El Nuevo Diario • Nicaragua	https://www.elnuevodiario.com.ni/internacionales/414458-fiesta-fin-ano-que-no-olvido-refugiados/	2017-01-01	La fiesta de fin de año que no olvidó los refugiados	"""Buenas noches a todo el mundo"", saludó el menor en portugués y fue recibido por atronadores aplausos. El deseo por un 2017 de recuperación también fue común entre los practicantes de las religiones afrobrasileñas que despidieron el año arrojando flores al mar para pedirle bendiciones a la diosa Iemanjá o en los pequeños altares que cavaron en las arenas para encender velas y hacer ofrendas. Según el balance divulgado por la alcaldía, los puestos médicos instalados en Copacabana atendieron a 578 personas pero ninguna por asuntos de gravedad y en su gran mayoría por intoxicación alcohólica o por malestares provocados por las altas temperaturas. "
