title	link	date	title_corrected	summary
Caravana migrante pisa el acelerador en México para llegar a Estados Unidos - El Nuevo Diario • Nicaragua	https://www.elnuevodiario.com.ni/internacionales/479391-caravana-migrante-pisa-acelerador-mexico-llegar-es/	2018-11-14	Caravana migrante pisa el acelerador en México para llegar a Estados Unidos	"Vistiendo camiseta y gorra en vez de sotana, el religioso comentó que todos quieren llegar a Tijuana. Así, tras recorrer unos 2.500 km desde Honduras, los migrantes amanecieron el miércoles sobre los buses que salieron toda la noche desde La Concha. Se va a hacer un cuello de botella en Tijuana, y no están preparados para recibir tanta gente"". "
Estrenan documental sobre historia de migrante nicaragüense en Nueva York - El Nuevo Diario • Nicaragua	https://www.elnuevodiario.com.ni/variedades/479506-documental-historia-migrantes-nicaraguense-nora-sa/	2018-11-15	Estrenan documental sobre historia de migrante nicaragüense en Nueva York	"Cualquier niño o familia inmigrante que lo necesite"", cuenta Sandigo en una entrevista con Efe. Es el caso de Valerie y Matthew Travi, hijos del matrimonio colombiano formado por Julio y Olga, que se vio forzado a pedir que la activista acogiera a los adolescentes después de que un juez les ordenara abandonar Estados Unidos tras más de 11 años intentando legalizar su situación. Niños que están llorando constantemente, teniendo problemas de alimentación por diferentes causas"", agregó. "
Asaltan a familia de nicaragüenses que se unió a caravana de migrantes - 100% Noticias - Nicaragua	https://100noticias.com.ni/nacionales/94642-familia-nicaraguense-caravana-eeuu/	2018-11-16	Asaltan a familia de nicaragüenses que se unió a caravana de migrantes100% Noticias	Por su parte, el periodista Tim Rogers, señaló que la familia nicaragüense fue asaltada en México, “les robaron su dinero y algunas pertenencias, pero están bien. Para poder completar el viaje, ahora están pidiendo dinero en la calle para poder llegar a Tijuana, adonde ya está llegando la primera oleada de la caravana, reportó Tim. Ha sido duro este camino, pero gracias a Dios mi hijo va enyesado”, dijo Molina, cuyo hijo fue herido en su pie derecho por el charnelazo de una bomba molotov lanzada por los paramilitares en Diriamba el pasado 8 de julio. 
"México debe aplicar un ""plan de emergencia"" para caravana migrante, según ONG - El Nuevo Diario • Nicaragua"	https://www.elnuevodiario.com.ni/internacionales/479641-mexico-caravana-migrante-honduras/	2018-11-17	"México debe aplicar un ""plan de emergencia"" para caravana migrante, según ONG"	"El Gobierno mexicano debe aplicar un ""plan de emergencia"" para las caravanas migrantes, un fenómeno que no ha atendido con celeridad obligando a las autoridades locales e instituciones privadas a redoblar esfuerzos ante esta crisis humanitaria, denunció hoy la ONG Sin Fronteras. No obstante, de acuerdo con esta ONG, que ofrece ayuda integral a familias migrantes desde 1996, el Gobierno mexicano del presidente Enrique Peña Nieto ha sido negligente, ""recargando en gobiernos municipales y estatales"" la ayuda recibida por los migrantes a lo largo de este peligroso periplo. Esta medida, en apariencia positiva y a la que se habrían adherido más de 3.000 personas, es para la ONG ""incluso regresiva, una trampa"" porque es poco clara, parece ""limitar la movilidad"" y en esencia, recoge unos derechos que ya se contemplaban en la ley. "
Sale otra caravana de migrantes de El Salvador - El Nuevo Diario • Nicaragua	https://www.elnuevodiario.com.ni/nacionales/479750-sale-otra-caravana-migrantes-salvador/	2018-11-19	Sale otra caravana de migrantes de El Salvador	Protestas pro y contra caravana migrante se registran en frontera México-EEUU Este sería el tercer grupo de salvadoreños que busca llegar a los EE. Los salvadoreños salieron alrededor de las 08.00 hora local de la Plaza Salvador del Mundo, en San Salvador, y se dirigieron a la terminal de occidente en donde abordaron autobuses para llegar a la frontera San Cristóbal, que conecta a El Salvador con Guatemala. UU. que se encuentra militarizada por órdenes del presidente Trump. 
ONG española lanza campaña para evitar migración de niños - El Nuevo Diario • Nicaragua	https://www.elnuevodiario.com.ni/nacionales/479843-ong-espanola-lanza-campana-evitar-migracion-ninos/	2018-11-20	ONG española lanza campaña para evitar migración de niños	Con motivo de la celebración este martes del Día Universal del Niño, la ONG recordó que hay 50 millones de niños en el mundo que tienen que migrar a otro país o a otra comunidad, acompañados por familiares o incluso, muchas veces, solos. La responsable de Protección Infantil de Educo, Laurence Cambianica, advirtió, durante la presentación de la campaña, que estos menores son doblemente vulnerables “por ser niños y niñas y por ser refugiados o migrantes”. Según Educo, en los últimos años, el número de menores no acompañados (MENA) que cruzan la frontera entre México y EE. 
ONU insiste en la importancia de establecer un pacto mundial sobre migración - El Nuevo Diario • Nicaragua	https://www.elnuevodiario.com.ni/internacionales/479939-onu-pacto-mundial-migracion/	2018-11-21	ONU insiste en la importancia de establecer un pacto mundial sobre migración	"La presidenta de la Asamblea General de la ONU, María Fernanda Espinosa, insistió hoy en la importancia del Pacto Mundial para una Migración Segura, Ordenada y Regular para el establecimiento de un marco ""mundial amplio y equilibrado que aliente la cooperación"" ante el fenómeno ""transfronterizo"". El texto, que no es vinculante, fue acordado el pasado julio en la ONU, con la excepción de Estados Unidos, y será aprobado en la cumbre internacional de Marrakesh (Marruecos) sobre Migración, prevista para los próximos 10 y 11 de diciembre. Por otra parte, Espinosa hizo también hincapié en la importancia de la cumbre sobre el Cambio Climático prevista en Katowice (Polonia) entre los días 2 y 14 de diciembre, para que se elabore ""un programa de trabajo que sea verdaderamente viable"". "
Sequías y caída de precios causan migración según la FAO - El Nuevo Diario • Nicaragua	https://www.elnuevodiario.com.ni/economia/479904-fao-sequias-caida-precios-causan-migracion/	2018-11-21	Sequías y caída de precios causan migración según la FAO	“Tenemos cuatro millones de campesinos en el corredor seco que perdieron sus cosechas. Sin embargo, en la misma América Latina y el Caribe, según el representante de la FAO, 39 millones de personas sufren hambre y es una cifra que en los últimos tres años “viene aumentando”. Eso a pesar de que, como dice Berdegué, la región es como un “jardín del Edén”, donde se producen cereales, oleaginosas, carnes, café, cacao, verduras, frutas, jugos, vinos, azúcar, “que se venden en cada rincón del planeta”. 
Caravana migrante de centroamericanos se reagrupa en Tijuana - El Nuevo Diario • Nicaragua	https://www.elnuevodiario.com.ni/internacionales/479966-caravana-migrante-centroamericanos-se-reagrupa-tij/	2018-11-21	Caravana migrante de centroamericanos se reagrupa en Tijuana	Afuera del sitio, cientos se remolinaban para obtener algún alimento que llevan activistas y asociaciones religiosas. Al menos dos caravanas más recorren territorio mexicano rumbo a Estados Unidos. Según la policía, 57 centroamericanos fueron detenidos por cometer distintas faltas, de los cuales 40 han sido deportados. 
Trump asegura que migrantes que pidan asilo seguirán en México mientras EEUU procesa pedidos - El Nuevo Diario • Nicaragua	https://www.elnuevodiario.com.ni/internacionales/480196-solicitudes-asilo-migrantes-estados-unidos/	2018-11-25	Trump asegura que migrantes que pidan asilo seguirán en México mientras EEUU procesa pedidos	"""Migrantes en la frontera sur no tendrán permitido entrar a Estados Unidos hasta que sus pedidos sean aprobados de manera individual en la corte"", escribió Trump en Twitter. Un acuerdo bilateral para que los solicitantes de asilo permanezcan en México mientras la justicia estadounidense examina sus peticiones, representaría una importante victoria para Trump. - ""Nos ve como un bicho"" - Entre tanto, unos 5.000 migrantes, en su mayoría hondureños, esperan hacinados en un albergue en la ciudad mexicana de Tijuana, tras el agotador viaje. "
Gobierno cita en migración a Ana Quirós, feminista nacionalizada nicaragüense - nicaraguainvestiga.com	https://nicaraguainvestiga.com/nacion/2837-dictadura-cita-en-migracion-a-ana-quiroz-feminista-nacionalizada-nicaraguense/	2018-11-26	Gobierno cita en migración a Ana Quirós, feminista nacionalizada nicaragüense	El Centro Nicaragüense de Derechos Humanos (Cenidh), que calificó la cita como una «persecución», reveleó el citatorio a Quiroz. La cita a Quirós se da en medio de la más grave crisis sociopolítica que vive Nicaragua desde la guerra. Según archivos, en el año 2000 el Gobierno de Arnoldo Alemán también intentó retirar la nacionalidad a la feminista, sin éxito. 
"Peña Nieto exalta labor de la Policía en frontera y pide ""migración ordenada"" - El Nuevo Diario • Nicaragua"	https://www.elnuevodiario.com.ni/internacionales/480291-pena-nieto-pide-migracion-ordenada/	2018-11-26	"Peña Nieto exalta labor de la Policía en frontera y pide ""migración ordenada"""	"Lea: México deporta a 98 migrantes centroamericanos tras fallido intento de cruzar a EEUU Peña Nieto, quien cederá el poder al izquierdista Andrés Manuel López Obrador este sábado, señaló que el Gobierno de México aboga por una ""migración ordenada y respetuosa del marco legal"" tras los altercados entre policías y migrantes suscitados la víspera en Tijuana, donde 7,000 personas aguardan para cruzar la frontera. El mandatario aprovechó la ocasión para mandar un saludo y dar ""especial reconocimiento"" a Manelich Castilla, comisionado general de la Policía Federal. Como resultado, México deportó a 98 migrantes que presuntamente participaron en los enfrentamientos con la Policía, informó hoy el Instituto Nacional de Migración (INM). "
Unos 7.136 hondureños que dejaron caravana de migrantes han retornado al país - El Nuevo Diario • Nicaragua	https://www.elnuevodiario.com.ni/internacionales/centroamerica/480527-honduras-retorno-caravana-migrante/	2018-11-29	Unos 7.136 hondureños que dejaron caravana de migrantes han retornado al país	"Unos 7.136 hondureños que decidieron no seguir en la caravana que salió el 13 de octubre hacia Estados Unidos han regresaron a su país de manera voluntaria a través del plan ""Retorno Seguro"" que impulsan Honduras, México y Guatemala, informó hoy a Efe una fuente oficial. Los que retornan, según autoridades hondureñas, reciben asistencia de un equipo interinstitucional que les facilita alimentación, revisión médica y transporte a sus comunidades de origen, entre otros servicios. En el albergue instalado en la unidad deportiva Benito Juárez de Tijuana, las autoridades municipales señalaron en su último registro que había 6.062 personas, 516 niñas, 542 niños, 1.127 mujeres y 3.877 hombres. "
La ONU ayuda a volver a sus países a cientos de migrantes centroamericanos - El Nuevo Diario • Nicaragua	https://www.elnuevodiario.com.ni/internacionales/480571-onu-ayuda-centroamericanos-migrantes-volver-casa/	2018-11-30	La ONU ayuda a volver a sus países a cientos de migrantes centroamericanos	"La Organización Internacional para las Migraciones (OIM) afirmó que hasta el miércoles han sido ayudados 453 migrantes, incluidos niños no acompañados, que expresaron el deseo de retornar a sus países de origen. ""Veinticinco niños no acompañados regresaron a sus casas en avión"", precisó el portavoz. El presidente estadounidense Donald Trump, que desplegó miles de militares en la frontera con México, amenazó con cerrarla por completo si la situación se complicaba. "
Guatemala espera plan regional ante migración para primer trimestre de 2019 - El Nuevo Diario • Nicaragua	https://www.elnuevodiario.com.ni/internacionales/centroamerica/480735-guatemala-plan-regional-migracion/	2018-12-03	Guatemala espera plan regional ante migración para primer trimestre de 2019	"Lea: Unos 7.136 hondureños que dejaron caravana de migrantes han retornado al país El plan, dijo, debe impulsar acciones que generen desarrollo a nivel local para contribuir a frenar la migración y combatir sus causas estructurales. De interés: Hondureños escapan de la miseria pero hallan la muerte en caravana migratoria ""Esta alianza la maneja Estados Unidos con sus agencias establecidas en cada país"", y el nuevo plan será solo entre los cuatro países (Triángulo Norte y México), subrayó. Jovel agregó que ya tiene programadas reuniones entre las partes para comenzar a identificar las prioridades para el Plan de Desarrollo Integral. "
crisis migratoria centroamérica - nicaraguainvestiga.com	https://www.nicaraguainvestiga.com/tag/crisis-migratoria-centroamerica/	2018-12-07	crisis migratoria centroamérica	crisis migratoria centroamérica ACNUR pide solidaridad internacional para la acogida de nicaragüenses que huyen Las solicitudes de refugio a Costa Rica han superado la capacidad de las autoridades La Agencia de la ONU para los Refugiados (ACNUR) pidió hoy a la comunidad internacional «solidaridad»… Jul 31, 2018 
MigApp, la aplicación móvil que todo migrante debe tener • VosTV - VosTV	https://www.vostv.com.ni/nacionales/9163-migapp-la-aplicacion-movil-que-todo-migrante-debe/	2018-12-07	MigApp, la aplicación móvil que todo migrante debe tener • 	La Organización Internacional para las Migraciones (OIM) ha desarrollado esta app cuyo objetivo es darle información y herramientas básicas a las personas que deciden migrar para hacer de su tránsito un proceso más seguro. Lea: Depresión y ansiedad, el otro rostro de la migración Paola Zepeda, jefa de Oficina OIM en Nicaragua, explicó que esta aplicación es gratuita, disponible en todos los idiomas, además, una vez descargada a su teléfono móvil no requiere de internet para funcionar. Dentro de las funciones que tiene la app es que el migrante antes de viajar puede saber si requiere visa u otro documento para viajar al país destino, la aplicación facilita además información sobre la dirección del consulado de su país de origen o embajada en cada país que visite, la referencia de hospitales y refugios a los que puede acudir en cada territorio en caso de una emergencia y le permite mantener informado a sus familiares en tiempo real sobre la ruta o tránsito que lleva el migrante. 
Países con fuertes medidas contra los migrantes - El Nuevo Diario • Nicaragua	https://www.elnuevodiario.com.ni/internacionales/481024-crisis-migrantes-fronteras-medidas-controversia/	2018-12-07	Países con fuertes medidas contra los migrantes	Varios países adoptaron en los últimos años medidas draconianas y controvertidas para frenar la llegada de migrantes. Este año, llegó al poder una coalición de la ultraderecha y un movimiento antisistema. Canberra asegura que salva vidas al disuadir a los migrantes de emprender un viaje peligroso. 
Nicaragua sufre cuarta ola migratoria - El Nuevo Diario • Nicaragua	https://www.elnuevodiario.com.ni/nacionales/481560-nicaragua-sufre-cuarta-ola-migratoria/	2018-12-16	Nicaragua sufre cuarta ola migratoria	Estudiantes y profesionales son los principales grupos que han salido de Nicaragua debido a la crisis social y política, de acuerdo con un estudio que realiza el investigador Alfredo Ruíz García para el Servicio Jesuita para Migrantes (SJM), quien cifra en 80 mil las personas que han abandonado este país desde abril, cuando estalló la crisis. El autor del estudio reveló en una entrevista con Radio Universidad que, aunque los datos no son tan precisos, estima que el total de nicaragüenses que han salido del país por la crisis de este año son 80,000 o más, y solo en Costa Rica la Organización Internacional de las Migraciones (OIM) registra 52,000. Ruíz García asegura, refiriéndose a datos de la OIM, que las migraciones que ocurrieron en las décadas del 90 y luego en el nuevo milenio fueron “por razones laborales y la búsqueda de mejores ingresos”. 
Nicaragüenses migran por temor a ser apresados • VosTV - VosTV	https://www.vostv.com.ni/nacionales/9232-migracion-nicaragua-crisis-politica/	2018-12-17	Nicaragüenses migran por temor a ser apresados • 	"La migración de miles de nicaragüenses ya no es por problemas económicos sino por la situación sociopolítica que vive el país, así lo refleja una investigación realizada por el servicio jesuita a migrantes titulado “Migración en el contexto de crisis sociopolítica y violación de los derechos humanos en Nicaragua"". El estudio refleja que un 20% de los encuestados “salen por temor a ser apresados, luego un 18.6% se va por la incertidumbre del país, la inestabilidad política,la crisis económica y la continuidad de la represión, un 14% temen que en el país se vuelva a generar condiciones para un enfrentamiento armando y por lo tanto es mejor huir”, reza parte de los hallazgos de esta investigación. Conozca más detalles de este estudio en la siguiente entrevista: "
México y EEUU pactan plan de inversión en Centroamérica para frenar migración - El Nuevo Diario • Nicaragua	https://www.elnuevodiario.com.ni/internacionales/481734-mexico-eeuu-plan-freno-migracion/	2018-12-18	México y EEUU pactan plan de inversión en Centroamérica para frenar migración	"Trump dice que si no separa a familias migrantes, mucha más gente irá a EEUU Al leer la declaración conjunta, el canciller dijo estar ""optimista"" con este plan conjunto que buscará además una Centroamérica ""más próspera y segura"" detonando la inversión, tanto pública como privada, en estas regiones tradicionalmente emisoras de migración. Trump insiste en que México va a pagar por el muro en la frontera con EEUU Detalló que Estados Unidos se comprometió a otorgar 5.800 millones de dólares para ""reformas institucionales y desarrollo económico en el Triángulo del Norte por medio de fuentes privadas y públicas"". Mientras que Estados Unidos buscará ampliar la inversión privada y pública en México hasta 4.800 millones de dólares. "
Fundación Barça propone su programa de ayuda a refugiados en ACNUR - 100% Noticias - Nicaragua	https://100noticias.com.ni/deportes/95447-fundacion-barca-refugiados-acnur/	2018-12-19	Fundación Barça propone su programa de ayuda a refugiados en ACNUR100% Noticias	"El vicepresidente primero del FC Barcelona y de la Fundación, Jordi Cardoner, indicó que en respuesta ""al compromiso con la población refugiada"", la Fundación Barça ha puesto en marcha un programa que utiliza la metodología futbolnet, que usa el fútbol y la actividad física como una herramienta para dar apoyo psicosocial a niños y jóvenes para así favorecer su integración en las comunidades de acogida, especialmente en Grecia, Italia y el Líbano. Los diferentes ponentes se han referido al papel positivo que juega el deporte en la integración de niños y jóvenes traumatizados por situaciones de guerra y exclusión. Con la Fundación Barça promovemos conjuntamente los valores del deporte y nos beneficiamos de su poder para llegar a miles de niños y niñas a los diferentes programas que tenemos en África"", insistió. "
refugiados nicaragüenses en Costa Rica - nicaraguainvestiga.com	https://nicaraguainvestiga.com/tag/refugiados-nicaraguenses-en-costa-rica/	2018-12-20	refugiados nicaragüenses en Costa Rica	refugiados nicaragüenses en Costa Rica Ortega llama a los refugiados en Costa Rica que regresen y no habrá represalias Ortega dice que pedirá listado oficial al Gobierno tico para informarles quienes son «criminales» Daniel Ortega aseguró este miércoles a los nicaragüenses que se fueron refugiados a Costa Rica… Ago 30, 2018 
Nicaragua, Venezuela y El Salvador: naciones donde repuntó la migración • VosTV - VosTV	https://www.vostv.com.ni/actualidad/9271-nicaragua-venezuela-y-el-salvador-naciones-donde-r/	2018-12-24	Nicaragua, Venezuela y El Salvador: naciones donde repuntó la migración • 	La mayor concentración de la emigración venezolana se encuentra en Colombia, Perú, y Chile. Aunque la caravana no tuvo el éxito esperado por las restricciones en las fronteras para llegar a su destino Estado Unidos, se le sumó una segunda, esta vez con menos migrantes y por último se realizó una tercera donde los obstáculos fueron mayores en su intento de alcanzar el llamado “Sueño Americano”. Este 2018 tuvimos demasiadas migraciones como lo sigue siendo en el caso de Venezuela donde su situación se agudiza año con año, en El salvador ha sido la inseguridad y la pobreza y en Nicaragua el fenómeno ha sido la represión gubernamental donde sus ciudadanos han buscado refugio en otros países, expresa Ricardo De León, experto en temas internacionales. 
Experto de ONU sostiene detención niños migrantes viola derecho internacional - El Nuevo Diario • Nicaragua	https://www.elnuevodiario.com.ni/internacionales/482078-onu-detencion-migrantes-derechos-humanos/	2018-12-24	Experto de ONU sostiene detención niños migrantes viola derecho internacional	"Se considera que la detención va contra el bienestar de cualquier niño y le genera efectos adversos a largo plazo al empeorar el trauma que los pequeños migrantes ya sufren durante sus travesías. ""La detención de niños nunca debe usarse para disuadir la migración"", recalcó el chileno González. Unas ocho horas después de su detención, Jakelin empezó a convulsionar y fue trasladada con fiebre altísima a un hospital, donde llegó con un paro cardíaco y falleció. "
La caravana migrante anhela cumplir el sueño americano en 2019 - El Nuevo Diario • Nicaragua	https://www.elnuevodiario.com.ni/internacionales/482429-caravana-migrantes-estados-unido-sueno-americano/	2018-12-31	La caravana migrante anhela cumplir el sueño americano en 2019	"Pese al infortunio y la incertidumbre que padece la caravana migrante en el municipio mexicano de Tijuana, centenares esperan cumplir su particular sueño americano el próximo 2019. ""El sueño americano desde que salimos de Centroamérica siempre lo hemos tenido, salir adelante, dar estudio a nuestros hijos y pasar una vida mejor"", dijo hoy a Efe el salvadoreño Ramón Torres, quien ya había vivido con anterioridad en Estados Unidos y regresó al país centroamericano por ""razones personales"". Los alimentos harán las delicias de los hondureños esta Nochevieja y, según bromean las cocineras, son mucho menos picantes que la comida mexicana. "
Los refugiados climáticos, esclavos modernos de fábricas de ladrillos en Camboya - El Nuevo Diario • Nicaragua	https://www.elnuevodiario.com.ni/internacionales/482501-refugiados-climaticos-esclavos-modernos-fabricas-c/	2019-01-02	Los refugiados climáticos, esclavos modernos de fábricas de ladrillos en Camboya	"Como ganan muy poco, con frecuencia los obreros son incapaces de reembolsar el dinero y la deuda va aumentando con los años. Los obreros trabajan sin guantes ni mascarillas, cerca de unos hornos que escupen una espesa humareda negra. Sok Kin lo tiene claro: ""Hay que tomar medidas urgentemente, establecer un salario mínimo, lanzar investigaciones anticorrupción y una campaña de información a escala nacional para que los obreros conozcan sus derechos"". "
Honduras asegura frontera con Guatemala para evitar paso de caravana migrante - El Nuevo Diario • Nicaragua	https://www.elnuevodiario.com.ni/internacionales/centroamerica/483480-honduras-asegura-forntera-caravana-migrante/	2019-01-15	Honduras asegura frontera con Guatemala para evitar paso de caravana migrante	"La caravana migrante anhela cumplir el sueño americano en 2019 ""Está reforzada la frontera y los pasos ilegales, si la gente va a salir que salga por los puestos legales autorizados"", afirmó el ministro hondureño en una rueda de prensa en Tegucigalpa. Un primer grupo de la caravana que comenzó la movilización este lunes está por llegar a Agua Caliente, según los medios hondureños. Al menos once hondureños de esas primeras caravanas murieron en su intento por llegar a Estados Unidos, mientras miles más pidieron asilo tanto en ese país como en México, un trámite que las autoridades han señalado es largo. "
Guatemala “reprueba” uso de fuerza de migrantes hondureños y salvadoreños - El Nuevo Diario • Nicaragua	https://www.elnuevodiario.com.ni/internacionales/centroamerica/483646-guatemala-reprueba-uso-fuerza-migrantes-hondurenos/	2019-01-17	Guatemala “reprueba” uso de fuerza de migrantes hondureños y salvadoreños	Sin embargo, recordó que todos los centroamericanos “pueden entrar libremente” a Guatemala, “siempre y cuando cumplan con todos los requisitos contenidos en el Código de Migración”. Migración reiteró que las personas que intenten continuar su camino deben “demostrar su identidad”, incluyendo a los menores de edad, pues de lo contrario no les permitirá el acceso. También instó a los padres de familia para que “cumplan con proteger y salvaguardar la integridad física, mental y material” de sus hijos menores de edad y les recomendó evitar exponerlos a “riesgos totalmente innecesarios”. 
