title	link	date	title_corrected	summary
"531 días: el caso de la niña migrante que ""más tiempo"" lleva detenida por el gobierno de Estados Unidos - La Prensa (Nicaragua)"	https://www.laprensa.com.ni/2021/02/02/internacionales/2779643-531-dias-el-caso-de-la-nina-migrante-que-mas-tiempo-lleva-detenida-por-el-gobierno-de-estados-unidos	2021-02-02	"531 días: el caso de la niña migrante que ""más tiempo"" lleva detenida por el gobierno de Estados Unidos"	Si bien Luisa habría podido salir del centro para estar con algún familiar en EE.UU., ella y su mamá han preferido no separarse mientras luchan por evitar su deportación. Otra jueza federal falló en contra de liberar a los adultos y ICE, que tiene la discreción para hacerlo, también declinó. No las terminan de deportar porque sus abogados sostienen una batalla legal desde varios frentes y han conseguido evitarlo en el último minuto. 
Biden solicita agilizar naturalización de 9 millones de inmigrantes • VosTV - VosTV	https://www.vostv.com.ni/internacionales/16233-joe-biden-plan-inmigrantes-ciudadania-decretos/	2021-02-02	Biden solicita agilizar naturalización de 9 millones de inmigrantes • 	“La estrategia del presidente Biden se centra en la premisa básica de que nuestro país es más seguro, más fuerte y más próspero con un sistema de inmigración sano, ordenado y humano”, confirmó uno de los funcionarios a periodistas. Biden también busca revisar la “regla de carga pública” que en la administración de Trump no otorgaba la residencia permanente (Green card o ciudadanía) a quienes reciben algún tipo de asistencia social. Para esto se hará “una evaluación individual de los factores para cada familia”, indicaron representantes de Gobierno y agregaron que Biden prevé también firmar una orden ejecutiva para atender las razones que impulsan la migración irregular hacia Estados Unidos. 
Biden firmará decretos sobre inmigración con mira en cooperación con Centroamérica - ipnicaragua.com	https://ipnicaragua.com/joe-biden-estados-unidos-centraoemerica-migracion/	2021-02-02	Biden firmará decretos sobre inmigración con mira en cooperación con Centroamérica	Los anuncios están previstos para el mismo día que está planeada la votación en el Senado para confirmar a Alejandro Mayorkas, el nominado del presidente Biden para liderar el Departamento de Seguridad Nacional. Cooperación con Centroamérica El segundo decreto que firmará Biden se centrará en una estrategia de tres partes para generar una migración “segura, legal y ordenada [desde] la región”. Bajo esta medida se le exige a las personas que quieran migrar a Estados Unidos que sean “autosuficientes” para vivir en el país, bajo el argumento de “proteger los programas de beneficios públicos” estadounidenses, según la medida publicada por DHS. 
¿Por qué emigran los centroamericanos? - ipnicaragua.com	https://ipnicaragua.com/migracion-estados-unidos-centraomerica/	2021-02-02	¿Por qué emigran los centroamericanos?	Otro de los factores, en su opinión, más relevantes es “tener vínculos transnacionales con un familiar y recibir remesas”. Violencia e inseguridad, factor detonante Honduras, El Salvador y Guatemala tienen tasas de homicidios que constantemente han sido clasificadas como las más altas a nivel mundial. “Atacar ese flagelo porque al final, a la gente, se le pone en riesgo (…) los coyotes y estos activistas políticos no están previendo el enorme riesgo al que están sometiendo a la gente y si lo están previendo no les importa”, aseguró en entrevista a la VOA. 
Biden: el presidente de EE.UU. firma órdenes ejecutivas que buscan reunir a los niños separados de sus padres en la frontera y modificar la política migratoria de Trump - La Prensa (Nicaragua)	https://www.laprensa.com.ni/2021/02/03/internacionales/2779979-biden-el-presidente-de-ee-uu-firma-ordenes-ejecutivas-que-buscan-reunir-a-los-ninos-separados-de-sus-padres-en-la-frontera-y-modificar-la-politica-migratoria-de-trump	2021-02-03	Biden: el presidente de EE.UU. firma órdenes ejecutivas que buscan reunir a los niños separados de sus padres en la frontera y modificar la política migratoria de Trump	«Vamos a trabajar para deshacer la vergüenza moral y nacional del gobierno anterior que literalmente, no figurativamente, arrancó a los niños de los brazos de sus familias, sus madres y padres, en la frontera», dijo Biden. - Estados Unidos sigue sin encontrar a los padres de 545 niños separados de ellos hace 2 años en la frontera con México «Presentará informes periódicos al presidente y recomendará medidas orientadas a evitar que esas tragedias vuelvan a ocurrir», indicó el Departamento de Estado en un comunicado. Pero hasta que eso llegue, agregó, «no es el momento de venir a Estados Unidos». 
Nicaragua bloquea ingreso a ciudadanos que permanecen varados en Panamá - ipnicaragua.com	https://ipnicaragua.com/nicas-migrantes-panama-costa-rica-frontera/	2021-02-04	Nicaragua bloquea ingreso a ciudadanos que permanecen varados en Panamá	Los organizadores del viaje responsabilizan al Gobierno de Nicaragua por esta situación. “Por la pandemia el trabajo esta escaso y hay que pagar el cuarto, comida, transporte, esto es asfixiante, la única opción es retornar”, dijo con resignación Andino. En este periodo, representantes de la Defensoría del Pueblo se comunicaron con la directora del Servicio Nacional de Migración, Samira Gozaine, quien les confirmó que si Costa Rica, al igual que Nicaragua aceptaban a los migrantes pinoleros, Panamá les otorgaba la salida. 
El éxodo de los migrantes nicas varados en la frontera Costa Rica-Panamá • VosTV - VosTV	https://www.vostv.com.ni/nacionales/16257-migrantes-nicas-panama-costa-rica-caravana/	2021-02-04	El éxodo de los migrantes nicas varados en la frontera Costa Rica-Panamá • 	“Esperamos desde hace casi un mes para que nos dejaran pasar y ahora no lo hacen, viene una persona de la nada, sin que esperara como nosotros todo este tiempo, y los dejan cruzar con normalidad, no nos parece justo”, agregó el migrante. Según las autoridades costarricenses, los nicaragüenses abordarán los transportes previamente contratados y pagados por ellos mismos, los que además estarán debidamente rotulados para ser identificados como parte de este paso humanitario. “Al llegar a Peñas Blancas, puesto migratorio por donde realizarán la salida, se volverán a verificar las listas, y se procederá con el proceso de control migratorio de salida, concluyendo con el tránsito”, finalizó el comunicado. 
"Colombia y Venezuela: por qué Duque se ""arriesga"" ahora con la ambiciosa medida de regularizar a los migrantes venezolanos - La Prensa (Nicaragua)"	https://www.laprensa.com.ni/2021/02/09/internacionales/2782535-colombia-y-venezuela-por-que-duque-se-arriesga-ahora-con-la-ambiciosa-medida-de-regularizar-a-los-migrantes-venezolanos	2021-02-09	"Colombia y Venezuela: por qué Duque se ""arriesga"" ahora con la ambiciosa medida de regularizar a los migrantes venezolanos"	Y, de paso, archivar, al menos por un tiempo, la discusión sobre si Colombia ha sido o no generosa con los «hermanos venezolanos». La percepción de los colombianos sobre la migración venezolana fue cambiando: en diversas encuestas son mayoría los que rechazan medidas como esta para acoger a los migrantes del vecino país. We commend @IvanDuque's announcement of temporary protected status for the more than 1.7M Venezuelan migrants in Colombia. 
Migración y extranjería de Panamá – Nicaragua Actual - nicaraguaactual.tv	https://nicaraguaactual.tv/tag/migracion-y-extranjeria-de-panama/	2021-02-10	Migración y extranjería de Panamá – Nicaragua Actual	InicioEtiquetasMigración y extranjería de Panamá Migración y extranjería de Panamá - Advertisement - - Advertisement - 
"La migración, un ""arma de doble filo"" para la economía nicaragüense • VosTV - VosTV"	https://www.vostv.com.ni/economia/16325-la-migracion-el-arma-de-doble-filo-para-la-economi/	2021-02-10	"La migración, un ""arma de doble filo"" para la economía nicaragüense • "	La incorporación de migrantes nicaragüenses en las actividades económicas de otros países, como Estados Unidos, Canadá, España y Costa Rica, donde la mayoría decide buscar mejores oportunidades de vida, puede estar generando en la economía nacional ciertos beneficios, pero también tiene sus desventajas, explica el economista Luis Murillo. En materia laboral y de crecimiento en la productividad, la economía local lo resiente. En cuanto a la parte positiva, es la captación de remesas para Nicaragua. 
Cinco migrantes nicaragüenses dan positivo por Covid-19 en frontera de Paso Canoas • VosTV - VosTV	https://www.vostv.com.ni/nacionales/16311-migrantes-nicaraguenses-varados-en-frontera-de-pan/	2021-02-10	Cinco migrantes nicaragüenses dan positivo por Covid-19 en frontera de Paso Canoas • 	Debido a que no contaban con los recursos financieron para hacerse este trámite, los migrantes recibieron apoyo del personal de salud del país canalero que realizó las pruebas sin ningún costo. En una reunión, las autoridades de Nicaragua, Panamá y Costa Rica acordaron que pasarían por día 200 migrantes nicaragüenses. Si el Migob no autoriza el paso de estos migrantes a más tardar el viernes, los migrantes podrían quedar varados una vez más, ya que los cruces de caravanas humanitarias solo se realizan de martes a viernes. 
Gobierno de Costa Rica y ACNUR firman acuerdo para garantizar seguro social a 10 mil refugiados - 100% Noticias • Nicaragua	https://100noticias.com.ni/nacionales/105401-refugiados-acnur-seguro-costa-rica-nicaragua/	2021-02-11	Gobierno de Costa Rica y ACNUR firman acuerdo para garantizar seguro social a 10 mil refugiados	"El acuerdo fue anunciado tras una reunión entre el presidente costarricense, Carlos Alvarado, y el jefe del ACNUR, Filippo Grandi, quien se encuentra de visita oficial en el país centroamericano, donde se reunió con diversas autoridades y visitó una oficina del organismo en la zona fronteriza con Nicaragua. Protegerlos en tiempos de COVID-19 incluyéndolos en las respuestas nacionales, como lo está haciendo este país, debe ser el camino por seguir para todos"", afirmó, por su parte, Filippo Grandi. El alto comisionado dijo en una entrevista con Efe que ""Costa Rica es un país muy aliado al ACNUR desde hace muchos años y muy comprometido con los derechos humanos"". "
80 migrantes hacinados en un camión cisterna en Texas claman por ayuda al 911 - nicaraguaactual.tv	https://nicaraguaactual.tv/80-migrantes-hacinados-en-un-camion-cisterna-en-texas-claman-por-ayuda-al-911/	2021-02-12	80 migrantes hacinados en un camión cisterna en Texas claman por ayuda al 911	“No tenemos oxígeno, el camión está parado, se me hace que, a lado de la carretera, porque se escuchan los carros, ¿Ochenta personas?, pregunta la operadora. “Sí, un aproximado”, revela el audio difundido en donde el hombre se escucha muy conmocionado. LEER TAMBIÉN: Cinco nicaragüenses varados en Paso Canoas resultan positivos con Covid-19, entre ellos un menor de edad 
Biden: EE.UU. admitirá a miles de migrantes solicitantes de asilo que esperan en México - La Prensa (Nicaragua)	https://www.laprensa.com.ni/2021/02/14/internacionales/2784801-biden-ee-uu-admitira-a-miles-de-migrantes-solicitantes-de-asilo-que-esperan-en-mexico	2021-02-14	Biden: EE.UU. admitirá a miles de migrantes solicitantes de asilo que esperan en México	Los migrantes serán admitidos y estarán en libertad mientras son citados para comparecer ante los tribunales en ciudades cercanas o en donde tengan familiares que los acojan. «¡La verdad no tengo palabras para expresar cómo me siento ahora!», dijo a la agencia Reuters una mujer salvadoreña, Sandra Andrade, que ha estado esperando en México durante más de un año. «Muchos han sufrido secuestros, ataques, agresiones sexuales, amenazas y otras crueldades increíbles», señaló la organización humanitaria. 
Papa Francisco elogia a presidente de Colombia por regularización de migrantes venezolanos • VosTV - VosTV	https://www.vostv.com.ni/actualidad/16362-papa-francisco-elogia-a-presidente-de-colombia-por/	2021-02-14	Papa Francisco elogia a presidente de Colombia por regularización de migrantes venezolanos • 	El Papa Francisco durante la misa dominical en Roma, agradeció que el gobierno del presidente Iván Duque implementará en Colombia el Estatuto de Protección Social para Migrantes provenientes de Venezuela. Por otra parte, añadió que esta iniciativa no la han tomado países ricos, ni desarrollados. De igual manera, Juan Guaidó, líder opositor en Venezuela expresó al presidente Iván Duque su agradecimiento por la nueva política y las oportunidades que brindarán a su nación. 
La decisión de emigrar: si el país no cambia, cambia de país - Confidencial	https://confidencial.com.ni/opinion/la-decision-de-emigrar-si-el-pais-no-cambia-cambia-de-pais/	2021-02-19	La decisión de emigrar: si el país no cambia, cambia de país	Cuando uno emigra de manera ilegal es uno el que le impone al país donde llega las condiciones, o bueno, pretende imponérselas, obligando de facto al país a donde uno llega, que lo acepten. La segunda parte depende del beneficiario de la solicitud, sea pariente o empleado. Pasados los filtros de ‘eligibility’ y ‘admisibility’ no quiere decir que el beneficiario de una solicitud aprobada esté obligado a seguir exactamente lo que se había propuesto previo a emigrar. 
Juez asesta a Biden su primera derrota migratoria - La Prensa (Nicaragua)	https://www.laprensa.com.ni/2021/02/24/internacionales/2789003-juez-asesta-a-biden-su-primera-derrota-migratoria	2021-02-24	Juez asesta a Biden su primera derrota migratoria	La política migratoria del presidente de Estados Unidos, Joe Biden, sufrió su primer revés judicial en Texas, donde un juez federal nombrado por el expresidente Donald Trump bloqueó, por tiempo indefinido y a nivel nacional, la suspensión de las deportaciones durante cien días decretada por el mandatario demócrata. La orden del juez Drew Tipton, en Corpus Christi, que se debe aplicar en todo el país, puede ser recurrida ante el tribunal de apelaciones de Nueva Orleans, de tendencia conservadora. En su decisión, Tipton afirmó que el decreto de Biden es arbitrario y excedió las atribuciones presidenciales al suspender o alterar una ley federal que requiere la deportación dentro de los 90 días desde que la orden de expulsión se haya firmado. 
Biden revoca medida que veta ingreso a migrantes por riesgo laboral - La Prensa (Nicaragua)	https://www.laprensa.com.ni/2021/02/25/internacionales/2789294-biden-revoca-medida-que-veta-ingreso-a-migrantes-por-riesgo-laboral	2021-02-25	Biden revoca medida que veta ingreso a migrantes por riesgo laboral	Con otra proclamación publicada hoy por la Casa Blanca, Biden dio marcha atrás con efecto inmediato a la decisión que Trump anunció el 22 de abril del año pasado en los primeros meses de la pandemia del coronavirus, que golpeó duramente la economía estadounidense y frenó la generación de empleos. «Por el contrario, perjudica a Estados Unidos, incluso al impedir que ciertos familiares de ciudadanos estadounidenses y residentes permanente legales se reúnan con sus familias aquí». Biden revoca medida de Trump que vetaba a #migrantes por riesgo laboralhttps://t.co/iJKk5HHmYF — EFE USA (@EFEUSA) February 25, 2021 También perjudica la industria de EE.UU. 
“Paciencia”: palabra de orden para miles de inmigrantes que aspiran hacia EE.UU. - ipnicaragua.com	https://ipnicaragua.com/paciencia-palabra-de-orden-para-miles-de-inmigrantes-que-aspiran-hacia-ee-uu/	2021-03-01	“Paciencia”: palabra de orden para miles de inmigrantes que aspiran hacia EE.UU.	En diciembre unos 4.855 menores no acompañados fueron encontrados por CBP mientras en enero, el último mes reportado, se registraron 5.707 niños y adolescentes que cruzaron la frontera sin un familiar. Sin embargo la Directora Ejecutiva de Servicios diocesanos para Migrantes y Refugiados, Melissa López, afirmó: “Eso es una cosa que está ahorita en las cortes, el título 42. Así mismo el diario Miami Herald reportó que se esta analizando la reapertura de un centro similar para menores, usado durante la administración Trump, en Homestead, Florida. 
Guatemala y EEUU acuerdan combatir narcotráfico y migración irregular • VosTV - VosTV	https://www.vostv.com.ni/internacionales/16655-guatemala-y-eeuu-acuerdan-combatir-narcotrafico-y/	2021-03-05	Guatemala y EEUU acuerdan combatir narcotráfico y migración irregular • 	"El presidente de Guatemala, Alejandro Giammattei, informó este jueves que conversó telefónicamente con su par estadounidense, Joe Biden, con quien abordó asuntos sobre la lucha contra el narcotráfico y la migración, temas clave en Centroamérica. ""Conversamos sobre la importancia de estrechar los lazos de cooperación como aliados estratégicos para generar prosperidad en Guatemala, combatir el narcotráfico, la corrupción y disminuir así la migración irregular"", indicó Giammattei en redes sociales, sin dar más detalles. Los denominados acuerdos ACA, impulsados por Trump, permiten que los migrantes extranjeros que solicitan asilo en la frontera de Estados Unidos sean enviados a esperar la resolución de su trámites en esas naciones centroamericanas. "
Más de 100 mil personas en el extranjero deberían votar para comicios de noviembre. ¿Qué dice la Ley? - nicaraguainvestiga.com	https://nicaraguainvestiga.com/politica/47234-mas-de-100-mil-personas-en-el-extranjero-deberian-votar-para-comicios-de-noviembre-que-dice-la-ley/	2021-03-09	Más de 100 mil personas en el extranjero deberían votar para comicios de noviembre. ¿Qué dice la Ley?	De hecho, durante los últimos días se viralizó en redes sociales una campaña fomentando el voto desde el extranjero. La ley electoral 331 permite determinar e inscribir el número de ciudadanos nicaragüenses en el exterior con derecho al voto. El experto destaca que el voto en el exterior representa un impacto de poco más del 10%. 
Iglesia en Nicaragua preocupada por restricciones migratorias - ipnicaragua.com	https://ipnicaragua.com/iglesia-catolica-nicaragua-migracion/	2021-03-09	Iglesia en Nicaragua preocupada por restricciones migratorias	Así mismo se ha conocido que a los religiosos no nicaragüenses se les hace presentarse con frecuencia a las instalaciones de la Dirección de Migración y Extranjería, donde les han reducido su permanencia en algunos casos de 10 años a 3 meses. “Nos preocupa que a varios hermanos de otros países que prestan valiosos servicios en el nuestro, se les afecte limitándolos en su permanencia en Nicaragua” dice parte del comunicado. El obispo auxiliar de Managua Monseñor Silvio José Báez, respaldó el comunicado, quien escribió en su cuenta de twitter “Preocupación por restricciones migratorias y solidaridad con presos políticos”. 
EE. UU. tiene en custodia a más de 3.200 niñas y niños migrantes - La Prensa (Nicaragua)	https://www.laprensa.com.ni/2021/03/09/internacionales/2794883-en-febrero-la-patrulla-fronteriza-transfirio-a-mas-de-7-000-ninas-y-ninos-migrantes-no-acompanados-al-departamento-de-salud	2021-03-09	EE. UU. tiene en custodia a más de 3.200 niñas y niños migrantes	Más de 3,200 niñas y niños migrantes que han llegado a Estados Unidos sin la compañía de sus familiares permanecen bajo custodia de la Patrulla Fronteriza -y, de ese total, casi 1.400 han estado detenidos más allá del límite legal de tres días- según informaron este martes (09.03.2021) medios locales. En febrero, la Patrulla Fronteriza transfirió más de 7.000 niñas y niños migrantes al Departamento de Salud -la cifra más alta registrada en un febrero- y aunque ahora hay aproximadamente 2.600 a la espera de llegar a tales albergues solo se tienen 500 camas disponibles. Trump optó por devolver a México a quienes llegaban pidiendo asilo y Biden ha elegido por empezar a cumplir con la ley que obliga a recibir a las personas solicitantes de asilo y darles amparo hasta que tengan una audiencia que determine su estatus migratorio. 
Repatrían los restos de los 16 migrantes guatemaltecos calcinados en México - 100% Noticias • Nicaragua	https://100noticias.com.ni/internacionales/105927-repatrian-restos-migrantes-calcinados-guatemala/	2021-03-12	Repatrían los restos de los 16 migrantes guatemaltecos calcinados en México	- Puede leer: Cristiana Chamorro, Félix Maradiaga, Luis Fley, George Henríquez no participarán en convocatoria de Alianza Ciudadana Además, funcionarios mexicanos se reunieron con el ministro del Exterior de Guatemala, Pedro Brolo Vila, para precisar detalles de la repatriación. Pero tras un enfrentamiento, los sicarios del CDN encontraron a las 19 personas y las asesinaron. La masacre avivó en México el trágico recuerdo del asesinato en 2010, en la misma región, en el que 72 migrantes, 58 hombres y 14 mujeres, fueron asesinados y sus restos abandonados a la intemperie. 
Otra vez la “crisis migratoria” con Estados Unidos - Confidencial Nicaragua - Confidencial	https://confidencial.com.ni/opinion/otra-vez-la-crisis-migratoria-con-estados-unidos/	2021-03-17	Otra vez la “crisis migratoria” con Estados Unidos Nicaragua	La segunda vertiente son los solicitantes de asilo, en familias con niños y jóvenes, o adultos individuales. Inicialmente eran unos 70 000; nadie sabe hoy cuántos permanecen en la frontera mexicana, pero deben ser entre 25 000 —los inscritos con las autoridades estadounidenses— y los 70 000 que hubo al principio. En el tema de los niños, López Obrador puede ayudar a Biden en mantenerlos en albergues sanos, decentes, humanitarios, generosos, mientras Estados Unidos los recibe. 
Centroamericanos aumentan búsqueda de información sobre empleo, inmigración y servicios, revela informe - ipnicaragua.com	https://ipnicaragua.com/centroamerica-migracion-pobreza-desempleo/	2021-03-17	Centroamericanos aumentan búsqueda de información sobre empleo, inmigración y servicios, revela informe	Por medio de su programa interactivo CuéntaNos, el IRC asegura tener datos –desde 2020 a la fecha- que demuestran que estos criterios de búsqueda “muestran un creciente desplazamiento desde Centroamérica debido a COVID, cambio climático y conflicto”. “Los expertos del IRC creen que la mayor demanda de información se debe a que el norte de Centroamérica enfrenta una creciente crisis humanitaria sin precedentes, agravada por la desaceleración económica inducida por el cierre pandémico, la creciente violencia en las calles y en los hogares y los desastres naturales”, asegura el dictamen. Debido a las necesidades agravantes, más y más personas se ven, y se verán, obligadas a huir este año”, concluyó. 
Más inmigrantes “que en los últimos 20 años” podrían llegar a la frontera, alerta EE. UU. - ipnicaragua.com	https://ipnicaragua.com/migrantes-estados-unidos-joe-biden-pobreza/	2021-03-17	Más inmigrantes “que en los últimos 20 años” podrían llegar a la frontera, alerta EE. UU.	Mayorkas afirmó en el texto que el gobierno está creando un centro de procesamiento conjunto para transferir a niños tan pequeños como de seis años a la custodia del Departamento de Salud y Recursos Humanos (HHS por sus siglas en inglés) y está intentando encontrar refugios adicionales para ellos. Mayorkas reconoció además que las instalaciones de la Patrulla Fronteriza están abarrotadas y que el plazo de 72 horas para su traslado al HHS no siempre se cumple. El gobierno federal está estableciendo instalaciones adicionales en Texas y Arizona para albergar a niños no acompañados y familias, además de trabajar con México para aumentar su capacidad de recibir familias, señaló. 
"Gobierno de Biden reitera que la frontera ""no está abierta"" ante alza de llegada de migrantes • VosTV - VosTV"	https://www.vostv.com.ni/actualidad/16850-gobierno-de-biden-reitera-que-la-frontera-no-esta/	2021-03-18	"Gobierno de Biden reitera que la frontera ""no está abierta"" ante alza de llegada de migrantes • "	"Mayorkas -el primer latino y el primer inmigrante en encabezar el DHS- compareció después de reconocer el martes que Estados Unidos se encamina a registrar el mayor número de migrantes en la frontera sur en 20 años. En febrero fueron arrestadas unas 100.000 personas en la frontera sur, entre ellas 9.457 menores no acompañados, un aumento del 28% respecto a enero, según las autoridades. El alto funcionario se negó a calificar la situación de ""crisis"", pero si admitió que hay un ""desafío"". "
"""Uno tiene que arriesgarse a todo"": en la carretera con los miles de familias y niños migrantes que intentan llegar a EE.UU. - La Prensa (Nicaragua)"	https://www.laprensa.com.ni/2021/03/18/internacionales/2798748-uno-tiene-que-arriesgarse-a-todo-en-la-carretera-con-los-miles-de-familias-y-ninos-migrantes-que-intentan-llegar-a-ee-uu	2021-03-18	"""Uno tiene que arriesgarse a todo"": en la carretera con los miles de familias y niños migrantes que intentan llegar a EE.UU."	Según Washington, esa política del anterior ejecutivo basada en una orden de salud pública por el covid-19 era «inhumana» hacia los menores. Pero pese no arrepentirse en absoluto de haber emprendido este viaje, Michael alerta a quienes estén planeando hacer lo mismo. Aunque Michael y sus compañeros pensaban llegar al próximo albergue durante la noche, no lo hicieron hasta las 8:00 de la mañana. 
