title	link	date	title_corrected	summary
Haití saca a refugiados de aparcamiento de estadio - elnacional.com.do	https://elnacional.com.do/haiti-saca-a-refugiados-de-aparcamiento-de-estadio/	2011-07-16	Haití saca a refugiados de aparcamiento de estadio	AP.- El gobierno haitiano ha comenzado a sacar a las 30 familias del aparcamiento de un estadio, donde habían vivido desde que el terremoto del año pasado las dejó sin hogar, informó el viernes un funcionario. El asesor presidencial Pierre Richard Duplan dijo que el gobierno está pagando 250 dólares a cada una de las 30 familias a cambio de que deje el estacionamiento. Patrick Rouzier, asesor de vivienda y reconstrucción del presidente Michel Martelly, informó que el esfuerzo de reubicación del gobierno incluye al estadio, pero agregó que no había comenzado oficialmente. 
¡Intentó escapar! Autoridades de migración impiden salida del país de Karim Abu Naba`a - ultimasnoticias.com.do	https://www.ultimasnoticias.com.do/2013/11/13/autoridades-de-migracion-impiden-salida-del-pais-de-karim-abu-nabaa/	2013-11-13	¡Intentó escapar! Autoridades de migración impiden salida del país de Karim Abu Naba`a	Luego de que los inspectores de Migración dijeran a Abu Naba que tenía impedimento de salida del país y que tenía que canalizar su situación en la Procuraduría General de la República, el mismo realizo varias llamadas en tonos molestos. Entre los cargos que pesan contra el ciudadano estadounidense de origen árabe-dominicano, figura la sustracción de un lujoso vehículo marca Ferraro Enzo, valorado en l.3 millones de dólares. De acuerdo a las autoridades judiciales para apoderarse del vehículo, Karin Abu Naba, supuestamente falsificó la firma del propietario del automóvil de lujo, logrando retirarlo de las aduanas. 
Nacionalistas dominicanos dicen en RD los extranjeros reciben «trato VIP» - remolacha.net	https://remolacha.net/2015/01/nacionalistas-dominicanos-dicen-en-rd-los-extranjeros-reciben-trato-vip/	2015-01-19	Nacionalistas dominicanos dicen en RD los extranjeros reciben «trato VIP»	Privacidad y cookies: este sitio utiliza cookies. Al continuar utilizando esta web, aceptas su uso. Para obtener más información, incluido cómo controlar las cookies, consulta aquí: Política de cookies 
700 muertos por naufragio de barco con migrantes - remolacha.net	https://remolacha.net/2015/04/700-muertos-por-naufragio-de-barco-con-migrantes/	2015-04-19	700 muertos por naufragio de barco con migrantes	En lo que se considera la peor tragedia en el Mediterráneo de los últimos tiempos, un pesquero con 700 migrantes naufragó esta madrugada en el Canal de Sicilia, a unos 100 kilómetros al norte de las costas de Libia…. 
Sentencia 168-13 impulsó una profunda reforma migratoria - El Dia.com.do	https://eldia.com.do/sentencia-168-13-impulso-una-profunda-reforma-migratoria/	2015-06-01	Sentencia 168-13 impulsó una profunda reforma migratoria	La citada sentencia esclareció los criterios para conceder la nacionalidad dominicana mediante el jus solis (nacimiento), los cuales estaban vigentes desde 1929, pero como al igual que otros temas había una dualidad de interpretación y no fue sino hasta 2013 cuando el órgano llamado para hacerlo puso la casa en orden en materia de interpretación jurídica. La sentencia señala que la excepción del tránsito incluye a todos los nacidos aquí hijos de extranjeros que residen de manera ilegal, pues sus padres no tienen residencia en República Dominicana conforme a las leyes nacionales. Antes del tiempo previsto por la sentencia, la Junta Central Electoral culminó el trabajo, procesó todos los casos detectados y procedieron a regularizarse conforme disponía la ley 169-14 a todos los que estaban inscritos de manera irregular sin haber cometido fraude. 
La regularización de extranjeros: Costosa y compleja - elDinero	https://www.eldinero.com.do/13392/la-regularizacion-de-extranjeros-costosa-y-compleja/	2015-06-15	La regularización de extranjeros: Costosa y compleja	Gracias a Dios tengo el papel y ahora espero que me llamen para darme todo. Asimismo, Wilmer Yean lamenta el abuso y a su entender las autoridades manejan un negocio sucio detrás del proceso. Además, indican, deben comer y los vendedores se aprovechan al fijar precios más altos de lo normal. 
La religión no pregunta por condición migratoria de haitianos - elDinero	https://www.eldinero.com.do/14484/la-religion-no-pregunta-por-condicion-migratoria-de-haitianos/	2015-07-20	La religión no pregunta por condición migratoria de haitianos	Las 80 iglesias restantes se congregan de manera independiente, es decir, que no están incorporadas ni afiliadas al Codue, aunque institucionalmente reciben asistencia. Esta costumbre caracteriza a una gran parte de la población haitiana, aunque la mayoría son cristianos católicos. La migración de sus nacionales hacia República Dominicana ha hecho que esta práctica a menudo confronte las tradiciones religiosas del país, ya que cada vez más inmigrantes consideran su orientación religiosa como una opción, no como una tradición familiar o cultural, tratando de alejarse del vudú. 
Despiden periodista por darle patada a refugiado en Hungría - remolacha.net	https://remolacha.net/2015/09/zumban-periodista-hacia-zancadillas-a-refugiados-en-hungria/	2015-09-08	Despiden periodista por darle patada a refugiado en Hungría	La azarosa periodista Petra Laszlo, quien fue captada haciéndole zancadillas a refugiados que salían juyendo de la policía, fue botada de la cadena NT1 [Seguir leyendo…] Remolacha – Noticias Republica Dominicana El Blog #1 de los dominicanos Internacional 
Miedo lleva a migrantes a asumir los riesgos | Metro Republica Dominicana - Metrord	https://www.metrord.do/do/mundo/2015/10/22/miedo-lleva-migrantes-asumir-riesgos.html	2015-10-22	Miedo lleva a migrantes a asumir los riesgosMetro Republica Dominicana	“Pasé hambre, fui torturado, robado… En un momento consideré saltar desde un camión en el Sahara porque pensé que estaba muriendo”, recordó Friew, de 39 años. Ahora soy muy feliz en Noruega, pero aún tengo pesadillas sobre la policía, el mar y el hijo de Khaddafi, quien nos obligó a cruzar la frontera en 2011”, narra Friew. Desde la semana pasada, en Sicilia y Calabria, la Cruz Roja Italiana ha llevado ayuda humanitaria a más de siete mil personas rescatadas”, sostuvo Bastianetto. 
Instalarán nuevos equipos de controles migratorios en aeropuertos - Metrord	https://www.metrord.do/do/noticias/2015/10/28/instalaran-nuevos-equipos-controles-migratorios-aeropuertos.html	2015-10-28	Instalarán nuevos equipos de controles migratorios en aeropuertos	El director general de Migración, Rubén Darío Paulino Sem, anunció este martes la instalación de nuevos equipos en los aeropuertos de República Dominicana con los cuales busca facilitar el ingreso al país y reforzar los controles migratorios a nivel nacional. Durante un recorrido por el Aeropuerto Internacional de Las Américas (AILA), Paulino Sem informó que los nuevos equipos llegan al país en noviembre, cuando comenzarán a trabajar 32 nuevos inspectores bilingües, entrenados por la DGM para dar eficiencia al trabajo en los aeropuertos del país. Agregó, que con el auto gate “los dominicanos no tendrán que trabajar con los inspectores, porque si están registrados en la base de datos biométricos de la DGM podrán hacer su entrada y salida mediante ese mecanismo”. 
La migración económica en el contexto del desarrollo - elDinero	https://www.eldinero.com.do/17654/la-migracion-economica-en-el-contexto-del-desarrollo/	2015-11-02	La migración económica en el contexto del desarrollo	Cabe destacar que esas cifras no toman en cuenta los descendientes de dominicanos nacidos en esos países. Mientras haya capacidad de proveer empleos formales e informales controlados, recibir inmigrantes no es problema para los países receptores, sino más bien un impulso a su fuerza y aparato productivo. Las migraciones (inmigraciones y emigraciones) deben ser evaluadas en términos de su impacto económico, cultural, político o social. 
Puertorriqueños migran a Dominicana por un mejor futuro - Metrord	https://www.metrord.do/do/noticias/2016/01/25/puertorriquenos-migran-dominicana-mejor-futuro.html	2016-01-25	Puertorriqueños migran a Dominicana por un mejor futuro	Pero la profunda crisis económica por la que atraviesa Puerto Rico ha revertido la tendencia y cada vez más puertorriqueños abrumados por problemas económicos van al país vecino para abrir negocios y escaparle al caos, que está ahuyentando incluso a muchos inmigrantes dominicanos. La mayoría de los puertorriqueños que buscan visa son jóvenes o estudiantes de mediana edad y muchos piden permiso para trabajar en el sector turístico porque hablan inglés y les resulta relativamente fácil conseguir trabajo en ese sector, según Grullón. Ahora, son los puertorriqueños los que se van de nuevo a Dominicana, atraídos por su fuerte economía y su mercado laboral. 
¿Cómo tratan a los refugiados en la UE? - Listín Diario	https://listindiario.com/las-mundiales/2016/01/31/405914/como-tratan-a-los-refugiados-en-la-ue	2016-01-31	¿Cómo tratan a los refugiados en la UE?	Decidió introducir controles en el puente de Öresund, poniendo fin a ese cordón umbilical antaño tan celebrado. Mediante la reducción de prestaciones y mayores exigencias para la reunificación familiar el país escandinavo aspira a perder atractivo para los refugiados. Como los refugiados que entraban desde Rusia lo hacían en bicicleta, del mismo modo se les mandaba de vuelta. 
Chiqui vicioso revela Consuelo Despradel es nieta de un inmigrante haitiano ilegal - DiarioDigitalRD	https://www.diariodigital.com.do/2016/02/04/chiqui-vicioso-revela-consuelo-despradel-nieta-inmigrante-haitiano-ilegal.html	2016-02-04	Chiqui vicioso revela Consuelo Despradel es nieta de un inmigrante haitiano ilegal	El texto completo de su comentario, colgado en la página www.robertocavada.com es el que sigue: Ya compramos las sombrillas y allí estaremos. ¿Qué escribió una carta denunciando el fascismo implícito en una resolución que solo le ha provocado al Estado dominicano dolores de cabeza? Vargas Llosa no hizo más que repetir lo que dijimos muchos aquí en el país: Que no nos correspondía a nosotros, como país de emigrantes (dos millones para ser exactos) con dominican@s en todo el mundo, desarrollar una actitud xenofóbica contra inmigrantes haitianos, porque ello le restaba legitimidad a cualquier reclamo contra el racismo y la discriminación a nuestra gente en el exterior. 
Hallan 45 extranjeras en cabaret Santiago | Hoy Digital - Hoy Digital (República Dominicana)	https://hoy.com.do/hallan-45-extranjeras-en-cabaret-santiago/	2016-05-07	Hallan 45 extranjeras en cabaret SantiagoHoy Digital	Juan Antonio Fernández Fernández, Magdalena Batista, Jairo Carrera Castillo y el venezolano Jolvert José Ramírez, sindicados como los supuestos miembros de la red, fueron arrestados en el Night Club Casa Blanca, localizado en el municipio de Licey al Medio, donde pernoctaban las 45 mujeres de nacionalidades colombiana y venezolana. Informó que continúan las investigaciones para determinar si hay otras personas vinculadas con ese caso. El procurador general, Francisco Domínguez Brito, dijo el jueves que procurarán por todos los medios evitar que el país siga siendo utilizado como destino turístico sexual, y que ciudadanas y ciudadanos sean víctimas de ese tipo de delito, especialmente en los polos turísticos. 
Actores de Game Of Thrones repudian maltrato a refugiados sirios - Metrord	https://www.metrord.do/do/entretencion/2016/07/03/actores-game-of-thrones-repudian-maltrato-refugiados-sirios.html	2016-07-03	Actores de Game Of Thrones repudian maltrato a refugiados sirios	Las celebridades relataron que conversaron con decenas de refugiados y sus historias son muy conmovedoras. “Son personas inteligentes, con educación y oficios que no les estamos permitiendo ejercer. Pero la crítica más fuerte viento del veterano actor Liam Cunningham, quien encarna a Davos Seaworth. 
Haitianos generan crisis migratoria en Panamá - DiarioDigitalRD - DiarioDigitalRD	https://www.diariodigital.com.do/2016/08/12/haitianos-generan-crisis-migratoria-panama.html	2016-08-12	Haitianos generan crisis migratoria en Panamá	Los caribeños no buscan quedarse en Panamá, sino solo esperan recibir dinero enviado por su familia para continuar viajea Estados Unidos y Canadá. Estos migrantes que ingresaron al país ya atravesaron otros, donde buscaron igualmente la manera de evadir los controles, señaló. Recordó que ya anteriormente se hicieron dos puentes aéreos con Ciudad Juárez, en México, para trasladar a cubanos que ingresaron por ese punto a Panamá, y el presidente Juan Carlos Varela tomó la decisión de no permitirles más el paso. 
La migración de RD es más femenina | Metro Republica Dominicana - Metrord	https://www.metrord.do/do/noticias/2016/09/08/migracion-rd-mas-femenina.html	2016-09-08	La migración de RD es más femeninaMetro Republica Dominicana	Estas estadísticas, recopiladas de distintos informes, quedaron evidenciadas en el taller “Periodismo y migración”, que organizó el Instituto Nacional de Migración, un organismo creado en 2004 por la Ley de Migración y que apenas entró en función en enero del año pasado. El programa, que busca fortalecer la documentación de los medios y orientar nuevas miradas hacia las migraciones, contó también con la coordinación de la Organización Internacional para las Migraciones (OIM). El corredor RD-Estados Unidos es el cuarto en América, luego de México, El Salvador y Cuba, todos con la gran nación del norte. 
Acusan de vandalismo a la reportera húngara que zancadilleó a refugiados - Listín Diario	https://listindiario.com/las-mundiales/2016/09/08/434302/acusan-de-vandalismo-a-la-reportera-hungara-que-zancadilleo-a-refugiados	2016-09-08	Acusan de vandalismo a la reportera húngara que zancadilleó a refugiados	La reportera húngara que se hizo famosa hace un año por patear y poner zancadillas a varios refugiados, entre ellos niños, en la frontera con Serbia, ha sido acusada de vandalismo por la Fiscalía, un delito penado con hasta cinco años de prisión. Petra László, que trabajaba para la televisión N1, cercana al partido de extrema derecha Jobbik, fue despedida y después pidió perdón por sus actos. El caso sucedió antes de que Hungría sellase su frontera con Serbia y cuando todavía entraban al país miles de refugiados a diario. 
La ONU quiere repartir la carga en la atención a los millones de refugiados - Listín Diario	https://listindiario.com/las-mundiales/2016/09/19/435698/la-onu-quiere-repartir-la-carga-en-la-atencion-a-los-millones-de-refugiados	2016-09-19	La ONU quiere repartir la carga en la atención a los millones de refugiados	"""Debemos responder no cerrando las puertas, sino abriendo nuestros corazones con unidad, tolerancia, pluralismo y compasión"", afirmó entonces el dirigente de la ONU, y desde entonces ha venido insistiendo en buscar el éxito de la cumbre. ""Esto no es justo"", afirmó este jueves Karen AbuZaid, a quien Ban le encargó trabajar con las distintas agencias de la ONU y con los países miembros para preparar la cumbre y asegurar que tenga éxito. Pero la ONU ha querido incluir en esta cumbre también el problema de los migrantes, un flujo que, según cálculos oficiales, el año pasado afectaba a 244 millones de personas, frente a los 173 millones que había en el año 2000. "
Cambio climático trae “refugiados” haitianos a RD - Periódico El Caribe - El Caribe	https://www.elcaribe.com.do/sin-categoria/cambio-climatico-trae-haitianos/	2016-11-09	Cambio climático trae “refugiados” haitianos a RDPeriódico 	None 
Denuncian vulneración de los derechos de inmigrantes en R. Dominicana - Metrord	https://www.metrord.do/do/noticias/2016/12/11/denuncian-vulneracion-derechos-inmigrantes-r-dominicana.html	2016-12-11	Denuncian vulneración de los derechos de inmigrantes en R. Dominicana	“Los derechos de las personas son inherentes a ellas, por eso viajan a su lado y deben ser respetados sin importar donde estén”, subrayó el informe. Con relación al tema de la salud, las organizaciones deploraron que mientras los países de la región destinan un promedio el 3 % de su Producto Interno Bruto (PIB) a este sector, en la República Dominicana no se ha superado el 2 % a pesar de los insistentes reclamos para que esta inversión llegue al 5 %. También lamentaron las agresiones que sufrieron este año varios defensores de los derechos humanos, así como activistas del Movimiento Reconocido, que defiende los derechos de los dominicanos de ascendencia haitiana. 
¿Hacia cuáles países emigraron los dominicanos? - Periódico elDinero	https://eldinero.com.do/34935/hacia-cuales-paises-emigraron-los-dominicanos/	2017-01-09	¿Hacia cuáles países emigraron los dominicanos?	“La respuestas tiene que ver con las desigualdades, que siguen dificultando el ascenso social para gran parte de la población”, reflexiona Eddy Tejeda, coautor del estudio junto a Adriana Salcedo, Allison J. Petrozziello, Bridget Wooding y Vita Randazzo. Hasta octubre de este 2016 ingresaron al país por ese concepto US$4,351.9 millones, según el Banco Central. Delito Obmica recoge que en 2015, según la Dirección General de Migración, Estados Unidos deportó 2,717 personas dominicanas (2,314 hombres y 403 mujeres). 
La migración del campo a la ciudad - El Dia.com.do	https://eldia.com.do/la-migracion-del-campo-a-la-ciudad/	2017-01-20	La migración del campo a la ciudad	Sin embargo, cuando estos movimientos humanos se dan en territorios pobres agravan más la miseria que los envuelve. Comunidades enteras se han quedado vacías, trasladándose de una manera u otra sus moradores hacia zonas urbanas, lo que hace daño a la unidad territorial, pero también a todos los elementos que componen la producción agrícola de una región. Todavía en estos momentos, donde se supone que tenemos un crecimiento económico de primer orden y donde debería haber menos pobres, vemos como nadie quiere vivir en zonas rurales, instalándose en territorios urbanos en busca de una supuesta mejor vida que nunca está por llegar. 
Presidente de migrantes en Cataluña se pronuncia contra alza consular en España - ultimasnoticias.com.do	https://www.ultimasnoticias.com.do/2017/01/25/presidente-migrantes-catalunya-se-pronuncia-alza-consular-espana/	2017-01-25	Presidente de migrantes en Cataluña se pronuncia contra alza consular en España	Dijo no entender cómo es posible y dada la casualidad que el coste de vida en Cataluña es muy superior al de resto de España, y al cónsul General en Barcelona no se le ocurre otra cosa que el alza en el importe en los servicios consulares, cuando pensamos que debería actualizarlos pero a la baja. Respondió que el cónsul general de Barcelona y la cúpula política del PLD en Cataluña, en la última campaña presidenciales 2016, estos garantizaron a la comunidad dominicana mejorar las tramitaciones y darían facilidades a todos los ciudadanos para que de esa manera se sientan protegidos y apoyados por la diplomacia cosa que no ha sucedido. Por otra parte; Ignacio Duran; hizo un llamado a la sociedad, así como al excelentísimo Sr. 
migracion . DiarioHispaniola l Un digital a tu alcance - diariohispaniola.com	https://www.diariohispaniola.com/tag/migracion-	2017-06-21	migracion . DiarioHispaniola l Un digital a tu alcance	"La alta comisionada adjunta de las Naciones Unidas para los Refugiados (Acnur), Kelly T. Clements, pidió este sábado ""apoyo urgente para un millón de desplazados centroamericanos"", tras una visita a Honduras, Guatemala y México. Representantes de los países de América Latina y el Caribe se comprometieron este lunes a observar la migración como una contribución a la democracia, la diversidad y el desarrollo sostenible, durante la sesión inaugural de una reunión virtual que mantuvieron para la revisión del Pacto Mundial para la Migración Segura, Ordenada y Regular. República Dominicana pondrá en marcha un carné para facilitar la entrada en el país de los comerciantes haitianos que viven en la zona fronteriza, dijo este viernes a Efe el director general de Migración, Enrique García. "
Abogados migratorios saludan medidas tomas por Dirección de Migración - diariohispaniola.com	https://www.diariohispaniola.com/movil/cambiar_completa.php?uri=%2Fmovil%2Fnoticia%2F31433%2Fnacional%2Fabogados-migratorios-saludan-medidas-tomas-por-direccion-de-migracion.html	2017-06-24	Abogados migratorios saludan medidas tomas por Dirección de Migración	La medida adoptada por la Dirección General de Migración de que solo los usuarios y abogados están autorizados para hacer gestiones en esa dependencia del Estado fue aplaudida y calificada como buena por abogados migratorios. Santo Domingo.- El abogado migratorio William Alcántara califico de atinada y una excelente decisión del Director General de Migración, Teniente General (R)Máximo William Muñoz Delgado, porque con la misma se busca darle más seguridad a los extranjeros que requieren el servicio. “Se le da más garantía a los extranjeros, porque tendrán que auxiliarse de abogados competentes que le darán un servicio de calidad en sus gestiones para estar legal en el país” apunto el experto en asuntos migratorios William Alcántara. 
Estiman que 1.3 millones de dominicanos viven en el extranjero - Periódico elDinero	https://eldinero.com.do/44222/el-12-de-los-dominicanos-vive-en-el-extranjero/	2017-07-07	Estiman que 1.3 millones de dominicanos viven en el extranjero	Recuerda que el país mantiene una frontera “excesivamente permeable”, cuya debilidad en su vigilancia exige sobreesfuerzo de inteligencia. “El hecho de que China sea una potencia mundial y con una gran población tampoco ayuda”, añade. “Tampoco a nadie es ajeno que las mafias chinas y la delincuencia organizada representa un problema más para nuestro país. 
Alcalde de Santiago se atribuye autoridad de Migración y ordena desalojar inmigrantes - Acento	https://acento.com.do/actualidad/alcalde-de-santiago-se-atribuye-autoridad-de-migracion-y-ordena-desalojar-inmigrantes-8473405.html	2017-07-11	Alcalde de Santiago se atribuye autoridad de Migración y ordena desalojar inmigrantes	Aunque la medida que no fue discutida en el Concejo de Regidores, ha sido apoyada por algunas voces. No obstante, otros ciudadanos entienden que se trata de una medida arbitraria y racista. El alcalde ordenó un cerco militar y policial para impedir que los haitianos se acerquen al vertedero. 
RD amplía vigencia de carné para extranjeros en Plan de Migración - Periódico elDinero	https://www.eldinero.com.do/45079/republica-dominicana-amplia-vigencia-de-carne-para-extranjeros-en-plan-de-migracion/	2017-07-25	RD amplía vigencia de carné para extranjeros en Plan de Migración	En caso de no realizar su renovación se declarará la caducidad de los documentos que les hayan sido expedidos y quedarán sujetos a lo que disponen la normativa ordinaria y las leyes migratorias dominicanas al respecto. Amarante Baret aseguró que Migración no maltrata a ningún extranjero sorprendido sin sus documentos legales, tal y como vienen denunciando algunas organizaciones de derechos humanos sobre las deportaciones, principalmente, de ciudadanos haitianos. También tendrá validez un documento que pueda ser verificado como legítimo por la autoridad y que sirva para la identificación del extranjero solicitante y un carne o adhesivo recibido a través del programa Nacional de Regulación. 
Migración informó que el país ha repatriado más de 38,000 extranjeros en lo que va de año - diariohispaniola.com	https://www.diariohispaniola.com/movil/cambiar_completa.php?uri=%2Fmovil%2Fnoticia%2F32473%2F	2017-08-02	Migración informó que el país ha repatriado más de 38,000 extranjeros en lo que va de año	Santo Domingo - Solo en julio, cuando distintos sectores denunciaron una supuesta entrada masiva de haitianos, las autoridades devolvieron a sus países de origen a 13.446 extranjeros que se encontraban en situación migratoria irregular. En cuanto a los movimientos migratorios por la frontera con Haití la institución informó de que fueron registradas 21.403 entradas y 18.447 salidas. Respecto a la vía marítima, los datos estadísticos señalan 60.504 entradas y 60.292 salidas, principalmente por los puertos turísticos de La Romana (este) y Maimón (norte), donde llega la mayor cantidad de cruceros. 
Migración laboral: Cada año más empresas contratan a extranjeros - Periódico elDinero	https://eldinero.com.do/45801/migracion-laboral-cada-ano-mas-empresas-contratan-a-extranjeros/	2017-08-10	Migración laboral: Cada año más empresas contratan a extranjeros	[dropcap]E[/dropcap]migrar siempre ha sido considerada una opción para progresar y buscar nuevas oportunidades laborales en otras naciones. En los últimos años República Dominicana se ha convertido en un destino para ciudadanos que por diversas razones deciden abandonar su país de origen. Migración hacia RD En su memoria del año pasado, la Dirección General de Migración menciona algunos de los aspectos que influyen para que los cubanos y venezolanos emigren hacia República Dominicana. 
