title	link	date	title_corrected	summary
Allanan lugar por presencia de extranjeros sin control sanitario - independiente.com.py	https://independiente.com.py/allanan-lugar-por-presencia-de-extranjeros-sin-control-sanitario/	2020-03-22	Allanan lugar por presencia de extranjeros sin control sanitario	Según los detalles brindados por la fiscal, el lugar estaría en proceso de constituirse como Colonia. El día 20 se realizó una primera constitución por la agente fiscal donde en conversación con el dueño, el mismo negó dicha denuncia. En la tarde ayer, llegaron nuevamente hasta el lugar personal sanitario con la Policía Nacional, hubo una reticencia al control por parte del propietario, por lo cual el personal médico no tuvo acceso. 
Documentan migraciones de peces a 1.400 metros de profundidad - ÚltimaHora.com	https://www.ultimahora.com/documentan-migraciones-peces-1400-metros-profundidad-n2877326.html	2020-03-28	Documentan migraciones de peces a 1.400 metros de profundidad	"""Hemos visto por primera vez un claro patrón estacional en los movimientos de los peces del fondo marino gracias a las plataformas acuáticas"", indicó este viernes a EFE la investigadora Rosanna Milligan, de la Universidad Nova Sureste, cuyo campus está en Miami, Florida (EEUU). ""Ha sido una oportunidad para entender un poco más esta parte del océano durante un largo periodo de tiempo"", dijo Milligan. ""Ahora mismo, la explicación más plausible es que probablemente están siguiendo la fuente de alimentación a lo largo del mar. "
ONG alertan sobre migrantes desaparecidos en el Mediterráneo - La Nación.com.py	https://www.lanacion.com.py/ahora/2020/04/12/ong-alertan-sobre-migrantes-desaparecidos-en-el-mediterraneo/	2020-04-12	ONG alertan sobre migrantes desaparecidos en el Mediterráneo	La agencia aseguró que había informado del asunto a las autoridades competentes, italianas, maltesas, libias y tunecinas. Te puede interesar: Educación virtual es inviable a nivel nacional, sostienen Preguntados por la AFP, las autoridades de Malta y los guardacostas italianos no ofrecieron ninguna reacción. Por su parte, el Alto Comisionado de lasNaciones Unidas para los Refugiados (ACNUR) y la Organización Internacional para las Migraciones (OIM) expresaron su preocupación. 
Migraciones prorroga validez de documentos de extranjeros - La Nación.com.py	https://www.lanacion.com.py/politica/2020/04/19/migraciones-prorroga-validez-de-documentos-de-extranjeros/	2020-04-19	Migraciones prorroga validez de documentos de extranjeros	Los ciudadanos extranjeros de cualquier nacionalidad cuyas radicaciones precarias o temporarias hayan vencido a partir del 13/03/20. Por otro lado, recordó que solo el vacunatorio del autódromo Rubén Dumot (ex-Aratirí) aplicará este sábado y domingo la segunda dosis de la vacuna Pfizer durante las 24 horas. “Acordamos con los colegas que la próxima reunión vamos a estar compartiendo también con los representantes del Ministerio de Hacienda para ahondar en este planteamiento”, puntualizó. 
Trump suspende la inmigración legal a Estados Unidos - Hoy - Noticas de Paraguay y el Mundo.	https://www.hoy.com.py/mundo/trump-suspende-la-inmigracion-legal-a-estados-unidos	2020-04-22	Trump suspende la inmigración legal a Estados UnidosHoy	"""Pausando la inmigración, ayudaremos a que los estadounidenses desempleados sean los primeros en la búsqueda de empleos mientras Estados Unidos reabre. ""Algunas publicaciones en la última semana o dos han arrojado dudas sobre si la hidroxicloroquina es beneficiosa"", dijo el doctor Jeremy Falk, especialista pulmonar del Centro Médico Cedars-Sinai en Los Ángeles, que no participó en el estudio. Días atrás, un asesor del gobierno británico había confirmado que las pruebas clínicas podrían estar completadas en el mes de agosto. "
Mujeres paraguayas migrantes y pandemia - Sociales - ABC Color	https://www.abc.com.py/edicion-impresa/sociales/2020/05/04/mujeres-paraguayas-migrantes-y-pandemia/	2020-05-04	Mujeres paraguayas migrantes y pandemiaSociales	Susana Martínez es madre, viajó a la Argentina hace 20 años en busca de mejores condiciones. Por suerte las mujeres luchamos, acá existen buenas leyes pero falta presupuesto para que se combata de verdad la violencia. Igual queremos que se sepa que el pueblo argentino es solidario con la comunidad paraguaya, somos más de un millón acá, somos parte de la sociedad argentina, se nos respeta, se nos quiere, lastimosamente estamos pasando mal como todos los trabajadores y el pueblo a causa de que la cuarentena, vino a empeorar la crisis económica, pero vamos a ayudar al pueblo argentino a pelear, a que se organice como con los comedores y los trabajadores de la salud que exigen mejores condiciones de vida y de trabajo, haciendo respetar todos nuestros derechos laborales y derechos humanos. 
El actor Alfonso Herrera envía SOS por los refugiados en época del COVID-19 - Hoy - Noticas de Paraguay y el Mundo.	https://www.hoy.com.py/cine/el-actor-alfonso-herrera-envia-sos-por-los-refugiados-en-epoca-del-covid-19	2020-05-06	El actor Alfonso Herrera envía SOS por los refugiados en época del COVID-19Hoy	"En los últimos dos años, México experimentó además un incremento de flujos migratorios con destino a Estados Unidos, lo que derivó en graves tensiones con Donald Trump. A partir de allí despegó su carrera en cine, teatro y televisión en producciones como ""Pillowman"" (2008) o ""La dictadura perfecta"" (2014). A diferencia de otras actrices que estaban como enseñando sus tetas e intentando ser muy sexis, ella era como: '¡Me da igual! "
Ciudadanía debería recibir a los migrantes con los brazos abiertos - ÚltimaHora.com	https://www.ultimahora.com/ciudadania-deberia-recibir-los-migrantes-los-brazos-abiertos-n2884616.html	2020-05-11	Ciudadanía debería recibir a los migrantes con los brazos abiertos	Ojalá que esta experiencia nos enseñe a ser un país más solidario y respetuoso de los derechos. Los nuevos desempleados se ven obligados a retornar por la imposibilidad de mantenerse en el exterior sin trabajo y por la incertidumbre de volver a encontrar empleo una vez que se levanten las restricciones. El Gobierno en un primer momento se dejó llevar por la reacción negativa y no solo retrasó acciones para ayudar a los compatriotas en el exterior, sino que algunos de sus representantes alimentaron el rechazo con expresiones públicas fuera de lugar. 
Migraciones prorroga validez de documentos vencidos de extranjeros - ÚltimaHora.com	https://www.ultimahora.com/migraciones-prorroga-validez-documentos-vencidos-extranjeros-n2885784.html	2020-05-18	Migraciones prorroga validez de documentos vencidos de extranjeros	En un comunicado, la institución refirió que serán admitidas como válidas las documentaciones que hayan caducado a partir del pasado 13 de marzo y a ser recepcionadas para los trámites migratorios en nuestro país. “Esta disposición se fundamenta en la imposibilidad de iniciar o dar continuidad a los trámites realizados por los ciudadanos extranjeros ante la institución”, puntualizó el documento. Los beneficiados con esta prórroga son aquellos extranjeros cuyas radicaciones precarias o temporarias hayan vencido en ese plazo, al igual que los que tengan pendiente la presentación de documentos para trámites migratorios. 
Semana del Inmigrante: “Que la migración no sea motivo de estigmatización” - La Nación	https://www.lanacion.com.py/pais/2020/06/04/semana-del-inmigrante-que-la-migracion-no-sea-motivo-de-estigmatizacion/	2020-06-04	Semana del Inmigrante: “Que la migración no sea motivo de estigmatización”	"""Que la migración no sea motivo de estigmatización” es el lema con el cual se conmemora la Semana Nacional del Inmigrante desde la Dirección General de Migraciones. Leé también: “Migrar es un derecho, regresar también” es la consigna de paraguayos en el exterior Por ello, desde la Dirección General de Migraciones hacen un llamado a reflexionar desde la empatía y la solidaridad hacia las personas migrantes que hoy se encuentran con dificultades o en situación de vulnerabilidad. Instan a la ciudadanía a recordar, ante todo, que la migración es un derecho humano y, muchas veces, constituye una oportunidad de desarrollo social, económico y cultural, tanto para los migrantes y sus familiares como para la sociedad que los recibe. "
Casi 80 millones de desplazados en el mundo, más del 1% de la humanidad - Mundo - ABC Color	https://www.abc.com.py/internacionales/2020/06/18/casi-80-millones-de-desplazados-en-el-mundo-mas-del-1-de-la-humanidad/	2020-06-18	Casi 80 millones de desplazados en el mundo, más del 1% de la humanidadMundo	"""Y eso significa que las soluciones políticas han sido insuficientes"". ""Lo que hemos visto realmente aumentar espectacularmente es la pobreza"", explicó el responsable de la agencia. “Una actividad que no se ha visto frenada por la pandemia (del coronavirus) es la guerra, el conflicto o la violencia”, resumió. "
La cruda historia de los inmigrantes - independiente.com.py	https://independiente.com.py/la-cruda-historia-de-los-inmigrantes/	2020-06-29	La cruda historia de los inmigrantes	“Desplazados” es la nueva miniserie que llegará a la plataforma el miércoles 8 del mes que viene, con seis capítulos en su haber. Tal parece que Cate Blanchett le ha agarrado el gusto a la pantalla chica, ya que esta ficción es nuevamente cocreada por la ganadora del Óscar, en conjunto con Tom Ayres y Elise McCredie, basándose en el caso real de Cornelia Rau, quien fue encerrada en un centro de psiquiatría bajo las órdenes del sistema hace más de 15 años. En el reparto principal se destacan Yvonne Strahovski, Jai Courtney, Asher Keddie, Fayssal Bazzi, Dominic West, Marta Dusseldorp y por supuesto, Cate Blanchett, quien interpreta un papel secundario. 
Migraciones elimina multa para extranjeros varados en Paraguay - Nacionales - ABC Color	https://www.abc.com.py/nacionales/2020/06/30/migraciones-elimina-multa-para-extranjeros-varados-en-paraguay/	2020-06-30	Migraciones elimina multa para extranjeros varados en ParaguayNacionales	“La exoneración se dará siempre y cuando el extranjero conserve el comprobante de entrada al país para poder presentarlo en la ventanilla migratoria al momento de su salida (sello migratorio en el pasaporte o boleta de entrada expedida y sellada por Migraciones Paraguay), ya que este es un requisito legal establecido en la Ley N° 978/96 y su decreto reglamentario”, refiere la nota de prensa dada a conocer este martes por la dependencia estatal. Estas personas también habían sido beneficiadas con una resolución de la DGM, pero al abrirse las oficinas ya pueden tramitar sus documentos. Las oficinas regionales y de documentación, ubicadas en el interior del país, atienden mediante agendamiento vía telefónica. 
Migraciones exonera de multas a extranjeros con permanencia vencida - ÚltimaHora.com	https://www.ultimahora.com/migraciones-exonera-multas-extranjeros-permanencia-vencida-n2892753.html	2020-06-30	Migraciones exonera de multas a extranjeros con permanencia vencida	La institución explica que todos los extranjeros que hayan ingresado al país como turistas y no residentes, a partir del 13 de marzo, serán exonerados de cualquier pago de multas al momento de abandonar el país y en tanto tengan restricciones para volver a sus países de origen. Migraciones aclaró que esta exoneración será aplicada siempre y cuando los extranjeros conserven su comprobante de ingreso al país, debido a que este es un requisito legal vigente. Por otro lado, los ciudadanos extranjeros con trámites migratorios pendientes de radicación ya tienen la posibilidad de regularizar sus trámites pendientes con total normalidad. 
Un “gato migrante” sobrevive con su dueño a la travesía y estará en cuarentena en Italia - La Nación	https://www.lanacion.com.py/estilodevida/2020/07/08/un-gato-migrante-sobrevive-con-su-dueno-a-la-travesia-y-estara-en-cuarentena-en-italia/	2020-07-08	Un “gato migrante” sobrevive con su dueño a la travesía y estará en cuarentena en Italia	Ese mismo pragmatismo se confirma con los renunciamientos a favor del candidato de la Alianza “Juntos por Asunción”, Eduardo Hirohito Nakayama. Hasta antes de las internas para renovar su directorio, ese papel parecía indisputable a su reelegido presidente, Efraín Alegre. Al punto que una inamistosa expresión del entonces presidente de la República, Fernando Lugo, mereció un título catástrofe en un diario: “Estos liberales no se llenan nunca”. 
Migrantes y refugiados repudian fácil ingreso de Macri al Paraguay - Nacionales - ABC Color	https://www.abc.com.py/nacionales/2020/07/13/migrantes-y-refugiados-repudian-facil-ingreso-de-macri-a-paraguay/	2020-07-13	Migrantes y refugiados repudian fácil ingreso de Macri al ParaguayNacionales	“La presencia del Mauricio Macri en Paraguay evidencia el nivel de impunidad que tiene la clase privilegiada en Paraguay, y la complicidad de las instituciones del Estado paraguayo ante la mafia organizada, ya que esta ¨visita¨ que se realiza por intereses y negocios personales, fue gestionada por José Alderete en nombre del expresidente Horacio Cartes”, indica el manifiesto. En ese sentido, reiteró el repudio de los connacionales que esperan volver al país a los privilegios que se da a ciertos sectores, mientras que en Argentina más de 3.000 paraguayos aún no tienen respuestas certeras de cómo y cuándo podrán volver al país. Firmaron el comunicado, la Secretaría de Trabajadores Migrantes y Refugiados/as (TEP), la Asamblea de Trabajadores Inmigrantes Paraguayos (ATIP), Kuña Aty Caba, Organización Guaraní y el Partido Comunista Paraguayo (Buenos Aires). 
Pirapó, cuna de inmigrantes japoneses cumple 6 décadas - ÚltimaHora.com	https://www.ultimahora.com/pirapo-cuna-inmigrantes-japoneses-cumple-6-decadas-n2897849.html	2020-08-02	Pirapó, cuna de inmigrantes japoneses cumple 6 décadas	“Nací en Pirapó y por ende ya tengo más incorporadas las costumbres de los paraguayos que con el tiempo fueron viniendo a poblar junto a los japoneses nuestra colonia, aunque debo decir que mantengo las costumbres y tradiciones de mis ancestros”, cuenta Nagami. Gracias al esfuerzo que pusieron ellos junto a otras familias provenientes del Japón salieron adelante”. Estimativamente, 420 familias formaron parte de la primera inmigración japonesa que fundó Pirapó en 1960. 
Plan de migración de funcionarios públicos al IPS no fue analizado | Economía y Finanzas - 5dias.com.py	https://www.5dias.com.py/2020/08/plan-de-migracion-de-funcionarios-publicos-al-ips-no-fue-analizado	2020-08-07	Plan de migración de funcionarios públicos al IPS no fue analizadoEconomía y Finanzas	La Cámara de Senadores postergó ayer el análisis del proyecto de Ley que plantea la migración de funcionarios públicos al sistema de seguro de salud del Instituto de Previsión Social (IPS). La iniciativa no fue estudiada porque no contaba con dictámenes de las diferentes comisiones del cuerpo legislativo. El documento que fue presentado por los senadores de la oposición busca modificar y ampliar los artículos 2°, 7°, 17°, 22° Y 76° de la Ley Nº 375/56 que aprueba el decreto Ley Nº 1.860/50 (Carta Orgánica del IPS) en el sistema de seguros médicos de todos los funcionarios públicos del Estado y su migración gradual al Instituto de Previsión Social. 
Evanhy cuestiona migración masiva de asuncenos - independiente.com.py	https://independiente.com.py/evanhy-cuestiona-migracion-masiva-de-asuncenos/	2020-08-18	Evanhy cuestiona migración masiva de asuncenos	“Cuando el actual intendente (Óscar Nenecho Rodríguez), era concejal propuso congelar por 10 años el pago de los impuestos inmobiliarios. Esto, para evitar que más personas sigan migrando, pero Ferreiro no lo aceptó porque representaría menos ingresos”, recordó. López pagan ese impuesto y eso se retribuye a mantener en condiciones la ruta”, culminó. 
Escenificando a la migración - Espectáculos - ABC Color	https://www.abc.com.py/espectaculos/2020/08/24/escenificando-a-la-migracion/	2020-08-24	Escenificando a la migraciónEspectáculos	“Yo decido empezar esta obra con tres paraguayos migrantes”, detalló Fátima acerca del primer capítulo de este proyecto que se inició en Argentina, en el año 2014, cuando ella también estaba experimentando la migración. “No llegué jamás”, comentó, relatando que fue acogida por una familia peruana y se quedó por casi seis meses. En la obra, según comentó Fátima, ambas estarán representando a personajes, pero basados en sus propios relatos. 
Aháta Aju, Capítulo Paraguay: Teatro documental sobre la migración tendrá su estreno vía streaming - Hoy - Noticas de Paraguay y el Mundo.	https://www.hoy.com.py/teatro/ahata-aju-capitulo-paraguay-teatro-documental-sobre-la-migracion-tendra-su-estreno-via-streaming	2020-08-29	Aháta Aju, Capítulo Paraguay: Teatro documental sobre la migración tendrá su estreno vía streamingHoy	Fuente: Aizar Arar (@AizarArar) Aquella mirada fija a los ojos en cada encuentro, el latido acelerado del corazón en cada beso hasta quedar sin aliento. La propuesta consiste en escuchar una voz durante 14 días a través de WhatsApp, que con audios, imágenes y videos intenta un acercamiento con su antiguo amor. Sí, una expareja regresa del pasado motivada por los recuerdos que toman forma en confinamiento, y por alguna razón sienten la necesidad de búsqueda. 
Barco de Banksy en el Mediterráneo pide ayuda tras rescate masivo de migrantes - La Nación.com.py	https://www.lanacion.com.py/mundo/2020/08/29/barco-de-banksy-en-el-mediterraneo-pide-ayuda-tras-rescate-masivo-de-migrantes/	2020-08-29	Barco de Banksy en el Mediterráneo pide ayuda tras rescate masivo de migrantes	La tripulación está formada por una decena de miembros, “activistas europeos con una larga experiencia en búsqueda y rescates en mar”. Su capitana es Pia Klemp, una militante alemana por los derechos humanos conocida por haber pilotado otros barcos de rescate, como el “Sea-Watch 3”. Te puede interear: Anuncian edición online del seminario #ContarElArte “Convergencia de luchas” Los diez marinos del “Louise Michel” se declaran todos “activistas antirracistas y antifascistas partidarios de cambios políticos radicales”, precisa The Guardian. 
Caminos cruzados por la migración - Espectáculos - ABC Color	https://www.abc.com.py/espectaculos/2020/09/02/caminos-cruzados-por-la-migracion/	2020-09-02	Caminos cruzados por la migraciónEspectáculos	En distintas escenas, Carolina Ronquillo recuerda su niñez en Lima, Perú, y su casi inexorable destino de convertirse en médica, como sus padres. Cartas, fotografías y más acompañan las escenas con proyecciones en una estructura giratoria, la que también se aprovecha para jugar con sombras. Así como dice su nombre, ojalá que “Aháta Aju” vuelva a venir pronto, para contarnos estas u otras historias. 
Aves migratorias: un viaje que la pandemia no podrá detener - La Nación.com.py	https://foco.lanacion.com.py/2020/09/05/aves-migratorias-un-viaje-que-la-pandemia-no-podra-detener/	2020-09-05	Aves migratorias: un viaje que la pandemia no podrá detener	Mientras pasan por el país, las aves migratorias pueden ser avistadas en todo el territorio nacional, merodeando en orillas de ríos o lagunas, a veces hasta en nuestros jardines. Esta pequeña ave recibe su particular nombre por el color de su plumaje, que es totalmente canela. “Hoy las condiciones del terreno no les están dando a las aves para que se posen en la bahía”, sentencia. 
Instalan 13.000 sillas frente al Reichstag en Berlín por los migrantes de Lesbos - ÚltimaHora.com	https://www.ultimahora.com/instalan-13000-sillas-frente-al-reichstag-berlin-los-migrantes-lesbos-n2903720.html	2020-09-07	Instalan 13.000 sillas frente al Reichstag en Berlín por los migrantes de Lesbos	"""El Bundestag estuvo en pausa este verano, pero la catástrofe humanitaria aguda en las fronteras exteriores de la UE no"", deploraron las ONG. Desde el inicio del año solo 465 migrantes fueron evacuados de esos campos hacia Alemania, en particular niños enfermos y sus familias. ""Es totalmente absurdo cuando se ve el sufrimiento allá y la buena voluntad que hay en Alemania para acogerlos"", agregaron. "
Paraguay propone estricto plan de control migratorio en frontera Este - ÚltimaHora.com	https://www.ultimahora.com/paraguay-propone-estricto-plan-control-migratorio-frontera-este-n2907487.html	2020-10-02	Paraguay propone estricto plan de control migratorio en frontera Este	Refiere que, luego de este horario, se procederá al cierre del puente en el sector de entrada y las personas que ingresan bajo este régimen deberán abandonar el país el mismo día de su ingreso. El reporte de Migraciones dice que los representantes del lado brasileño manifestaron su deseo de que el paso sea habilitado, en principio, solo para vehículos, no así para peatones, pero no discreparon con los demás puntos planteados por los representantes nacionales, que serán informados a las autoridades correspondientes del vecino país en el marco del proceso de acuerdo entre las partes. Paraguay propone también un fuerte control migratorio perimetral, de forma permanente, en los principales accesos del Departamento de Alto Paraná. 
217 compatriotas y extranjeros retornan al país mediante vuelo especial - ÚltimaHora.com	https://www.ultimahora.com/217-compatriotas-y-extranjeros-retornan-al-pais-vuelo-especial-n2907596.html	2020-10-02	217 compatriotas y extranjeros retornan al país mediante vuelo especial	"Los viajeros son procedentes de toda España, Alemania, Corea, Francia, Italia, Países Bajos, Portugal, Reino Unido, Senegal, Suiza, Sudáfrica y Turquía, informó la periodista del Última Hora Susana Oviedo. Esta embajada realizó todos los esfuerzos necesarios para garantizar la continuidad del distanciamiento social e higiene durante el operativo"", menciona la misiva. Según la embajada y el Consulado General en Madrid el despegue del vuelo a las se dio las 23.54, de este viernes. "
Covid-19: Brasil extiende restricción de entrada de extranjeros, excepto en ciudades gemelas - ÚltimaHora.com	https://www.ultimahora.com/covid-19-brasil-extiende-restriccion-entrada-extranjeros-ciudades-gemelas-n2907922.html	2020-10-05	Covid-19: Brasil extiende restricción de entrada de extranjeros, excepto en ciudades gemelas	Brasil informó sobre una ordenanza que prorroga por 30 días el ingreso de extranjeros debido a la pandemia del coronavirus. Lea más: Abdo y Bolsonaro acuerdan abrir la frontera antes del 15 de octubre La ordenanza permite acuerdos entre ciudades fronterizas gemelas para que los ciudadanos que residen en estas regiones puedan moverse. El presidente Abdo Benítez expresó que en el lado paraguayo está todo listo para proceder a la apertura. 
OIM: la pandemia dejó varados a 2,75 millones de migrantes en todo el mundo - Mundo - ABC Color	https://www.abc.com.py/internacionales/2020/10/09/oim-la-pandemia-dejo-varados-a-275-millones-de-migrantes-en-todo-el-mundo/	2020-10-09	OIM: la pandemia dejó varados a 2,75 millones de migrantes en todo el mundoMundo	OIM recordó que ha pedido repetidamente a los gobiernos que el colectivo migrante sea incluido en los planes de respuesta y recuperación ante la pandemia, aunque con frecuencia son olvidados en estos programas, e incluso en ocasiones sufren estigmatización y discriminación. “La violencia que hemos visto contra migrantes y otras comunidades vulnerables no tiene excusa. Es esencial criminalizar toda forma de discurso del odio”, comentó al respecto Vitorino. 
Niños migrantes de Paraguay en retorno gradual - Mundo - ABC Color	https://www.abc.com.py/internacionales/2020/10/12/ninos-migrantes-de-paraguay-en-retorno-gradual/	2020-10-12	Niños migrantes de Paraguay en retorno gradualMundo	La brecha digital, como se llama la diferencia de acceso o conocimiento que tienen las personas a la tecnología, ha marcado el inicio del curso escolar 2020 en España. Son parte de la comunidad de Sant’Egidio, un espacio donde los niños aprenden a convivir y reciben apoyo en las matemáticas e idiomas, con una enseñanza más personalizada, según explica a EFE su coordinadora, Beatriz Goméz. Así lo definiría Beatriz hoy y para el futuro: “Amistad en tiempos de pandemia significa mucho, porque es justamente lo contrario a la soledad”, asegura. 
Migraciones asegura tránsito libre para los paraguayos y extranjeros residentes - ÚltimaHora.com	https://www.ultimahora.com/migraciones-asegura-transito-libre-los-paraguayos-y-extranjeros-residentes-n2909704.html	2020-10-17	Migraciones asegura tránsito libre para los paraguayos y extranjeros residentes	Con la modificación se dispone el ingreso bajo el régimen de tránsito libre durante las 24 horas para connacionales y extranjeros residentes. La noticia fue celebrada por los trabajadores del volante y del manubrio que ahora podrán transportar pasajeros hasta Foz de Yguazú (Brasil) y no tener que preocuparse por el horario de regreso. “Como no se puede ingresar a pie, entonces muchos brasileños lo hacen en taxis y mototaxis y al regresar utilizan nuestros servicios, por eso es que celebramos esta decisión que nos parece la más justa. 
