title	link	date	title_corrected	summary
'Some criminals are among migrants' - Trinidad Guardian	http://www.guardian.co.tt/news/some-criminals-are-among-migrants-6.2.823765.e216452b60	2019-04-12	'Some criminals are among migrants'	In an exclusive Guardian interview, several Venezuelan nationals issued a call for security agencies to conduct thorough background checks on the criminal records of all Venezuelans applying to be registered in T&T next month. His friend added, “Most of the law abiding Venezuelans cannot afford to buy food or pay rent. Let’s say the conditions changed in my country and we can go back. 
Priest appeals for help for refugees - Trinidad Guardian	http://www.guardian.co.tt/news/priest-appeals-for-help-for-refugees-6.2.828304.fd2ab0e6f3	2019-04-20	Priest appeals for help for refugees	“Our destination for our nation as citizens of Trinidad and Tobago is here every creed race will find an equal place and in order for this to take place, we need to work together. Asked to comment on reports that a Venezuelan gang, Evande, had formed alliances with T&T gangs, Mitchell said he has confidence in Police Commissioner Gary Griffith and national intelligence units. Asked whether he is in favour of citizens opening up their homes to Venezuelans, Mitchell said citizens should follow the teaching of Jesus Christ and do what is right. 
Presbyterian church may open doors to migrants - Trinidad Guardian	http://www.guardian.co.tt/news/presbyterian-church-may-open-doors-to-migrants-6.2.832275.184f1a8a89	2019-04-25	Presbyterian church may open doors to migrants	Asked whether she planned to take a stance on the issue of equal rights for the LGBTQ community, Abdul-Mohan said a task force had been appointed to look at this. People need to be educated to understand what affects the life of an individual whether it is for women, the underprivileged or those of a different sexual orientation,” she added. Our principles are based on the gospel of unconditional love,” she added. 
PAHO gives guidance on improving migrants' health - Trinidad Guardian	http://www.guardian.co.tt/news/paho-gives-guidance-on-improving-migrants-health-6.2.833976.f98a743e15	2019-04-28	PAHO gives guidance on improving migrants' health	The Pan American Health Organisation (PAHO) has published a guidance document on migration and health that suggests five areas of action countries should take top improve the health of migrants and the populations that receive them. “We need to have a short-term response, with medium- and long-term planning that addresses the health needs of migrants,” said PAHO assistant director Jarbas Barbosa. The guidance and web portal are both part of a commitment PAHO made in November 2018 in response to a series of priority actions identified by ministries of health from throughout the Americas for improving the health system response to mass migrations that have been occurring in the region. 
Where is refugee law? - Trinidad News	https://newsday.co.tt/2019/05/01/where-is-refugee-law/	2019-05-01	Where is refugee law?	None 
PM: We have to limit exposure to migrants - Trinidad Guardian	http://www.guardian.co.tt/news/pm-we-have-to-limit-exposure-to-migrants-6.2.852686.958b1191f0	2019-05-23	PM: We have to limit exposure to migrants	Prime Minister Dr Keith Rowley said on Thursday this country cannot be a solution to millions of Venezuelan migrants fleeing their country due to economic hardship nor could T&T be converted into a refugee camp. “But as things got worse, more of them came and we kept our doors opened. “When people come here illegally,” Rowley said, “they could possibly remain which was not a healthy situation for us.” Rowley drew reference to the 101 Venezuelan migrants who were arrested on Wednesday by police during a crackdown in Palo Seco, Erin and Cedros. 
No refugee camps in TT - Trinidad News	https://newsday.co.tt/2019/05/25/no-refugee-camps-in-tt/	2019-05-25	No refugee camps in TT	None 
Panday: T&T needs help with Venezuelan migration - Trinidad Guardian	http://www.guardian.co.tt/news/panday-tt-needs-help-with-venezuelan-migration-6.2.853831.b713f30434	2019-05-25	Panday: T&T needs help with Venezuelan migration	Panday, who is a former foreign affairs minister, said that T&T needs to join with other Caricom and Latin American countries to deal with the flow of Venezuelans fleeing their country's socio-economic struggle. Among them were nine females, one of whom is pregnant, a baby and seven men. They took refuge at Irwin Park, Siparia but left as the venue was used for a sports day. 
'The Presbyterians will help Venezuelan migrants' - Trinidad & Tobago Express	https://trinidadexpress.com/news/local/the-presbyterians-will-help-venezuelan-migrants/article_e5edbbee-807f-11e9-928b-fb17253bb5ca.html	2019-05-27	'The Presbyterians will help Venezuelan migrants'	Another long-term measure she said was having language and educational programmes to be conducted by members of the Church and volunteers to help educate Venezuelans children who would not be initially integrated into the school system. When asked whether the Presbyterian schools will open its doors to migrants children, Abdul-Mohan said this was a decision to be discussed by the Presbyterian Primary School Board of Education as there are many legal certifications required for entry into schools. So that while they are with us we can assist them in understanding our language and we understand theirs so that they will not be taken advantage of…If they are going to be here for a year we need to teach them family life, education and treat with them in terms of language barriers and to encourage spirituality,” she said. 
Police report slowdown of migrant arrivals - Trinidad Guardian	http://www.guardian.co.tt/news/police-report-slowdown-of-migrant-arrivals-6.2.856535.104155b143	2019-05-29	Police report slowdown of migrant arrivals	Although it’s only a day until Government grants amnesty to Venezuelans in T&T who have fled their country’s economic woes, South Western Division police say there has been no increase in illegal immigrants entering the country. On Tuesday, Venezuelan migrants: three woman and two men, were found hiding out at Beach Road, Palo Seco. He said that it was even responsible for the heavy “Spanish influence” in places like Moruga. 
All set for migrant registrations - Trinidad Guardian	http://www.guardian.co.tt/news/all-set-for-migrant-registrations-6.2.857398.fea0997106	2019-05-30	All set for migrant registrations	An official, who spoke on condition of anonymity, said the staff were expected to be present from 6 am. He was unable to say exactly how many officers would be taking part “Basically, we have officers from all different agencies who will be performing different functions, but as part of one exercise,” he said The official expressed confidence that proper security protocols were in place ahead of today’s start of registration “I understand a lot of people have been attempting to go online and register but we can’t average how many people will be here,” he said. Interpreters have been recruited on a volunteer basis to assist migrants at all locations. 
Amnesty International: Educate migrant children - Trinidad Guardian	http://www.guardian.co.tt/news/amnesty-international-educate-migrant-children-6.2.857394.76ff104266	2019-05-30	Amnesty International: Educate migrant children	Amnesty International has expressed concern about the unavailability of public education for Venezuelan children in this country. Offering its recommendation on this matter, Amnesty International said in line with T&T’s own Refugee Policy 14, Amnesty International strongly recommends that this country facilitate Venezuelan and other refugee children with access to public school. However, she noted children coming from Venezuela would be at a disadvantage by the language barrier. 
The eternal refugee - Trinidad & Tobago Express	https://trinidadexpress.com/opinion/columnists/the-eternal-refugee/article_18bf66c8-833f-11e9-b56b-f35861622a3b.html	2019-05-30	The eternal refugee	Apart from our runaway crime rate, failing economy, endemic corruption and the fact that KFC’s bacon double down sandwich is a huge seller, some Trinidadians like my uncle Varun express an open contempt for Venezuelans. Last week I learned he spent all day abusing the new barman at Double R bar, saying “allyuh kind coming here to take my job”. Though when you consider Minister Khan does not seem to know what’s going on in the Ministry of Energy, that might actually be true. 
Long, wet wait for migrants - Trinidad & Tobago Express	https://trinidadexpress.com/news/local/long-wet-wait-for-migrants/article_7956e8b0-8599-11e9-8a30-638769b97557.html	2019-06-02	Long, wet wait for migrants	SOME taxi-drivers decided to capitalise on the bad weather and the Venezuelan migrant registration and charge more than three times the fare to Achievors Banquet Hall in San Fernando yesterday. The usual fare of $6 went up to $20. Many Venezuelan nationals were forced to pay the inflated taxi fare since there were few La Romaine cars on the taxi stand. 
Unmasking the trauma of migrant children - Trinidad Guardian	http://www.guardian.co.tt/news/unmasking-the-trauma-of-migrant-children-6.2.859030.af23340582	2019-06-03	Unmasking the trauma of migrant children	Rincon who came to Trinidad four years ago has been working as a specialist in child trauma. During an interview with Guardian Media, Rincon said she and a couple of friends have formed the La Romaine Migrant Support group (LAMS) to assist Venezuelan families. “This costs us $7,000 but thankfully the driver has not asked for his money up front,” Perreira said. 
Body of Nicaraguan migrant found with T&T phone number in pocket - Trinidad Guardian	http://www.guardian.co.tt/article/body-of-nicaraguan-migrant-found-with-tt-phone-number-in-pocket-6.2.859186.81e736b291	2019-06-04	Body of Nicaraguan migrant found with T&T phone number in pocket	US authorities who discovered the body of a Nicaraguan migrant into Texas this week, say that among the things they found on him was a phone number for someone in Trinidad and Tobago. Brooks County Sheriff’s Office Commander Jorge Esparza reportedly found two identification cards from Nicaragua and Mexico. It's not been revealed who the Trinidad and Tobago number belonged to. 
Garcia: Educating refugee children not a priority - Trinidad News	https://newsday.co.tt/2019/06/06/garcia-educating-refugee-children-not-a-priority/	2019-06-06	Garcia: Educating refugee children not a priority	None 
CDB could help TT with migrant issues - Trinidad News	https://newsday.co.tt/2019/06/06/cdb-could-help-tt-with-migrant-issues/	2019-06-06	CDB could help TT with migrant issues	None 
Set up refugee camps for the Venezuelans - Trinidad News	https://newsday.co.tt/2019/06/07/set-up-refugee-camps-for-the-venezuelans/	2019-06-07	Set up refugee camps for the Venezuelans	None 
AG: Rise in murders due to 'migration issues' - Trinidad News	https://newsday.co.tt/2019/06/11/ag-rise-in-murders-due-to-migration-issues/	2019-06-11	AG: Rise in murders due to 'migration issues'	None 
Ghana willing to help with migrant crisis - Trinidad Guardian	http://www.guardian.co.tt/news/ghana-willing-to-help-with-migrant-crisis-6.2.862940.d9c3f323d8	2019-06-13	Ghana willing to help with migrant crisis	Touching on Venezuela’s ongoing crisis, Rowley said the matter required international attention. “I think it is our moral duty to do so.” Rowley said there was also move to break up the African Pacific Nations (APC) as a block so that our negotiating power would be diminished. The Caribbean, Rowley said relies on Ghana and “our colleagues elsewhere to agree with us on this position and let that be our diplomatic response.” Rowley said attempts were being made by individuals and some quarters to break up the APC block “by those who believe that it will serve their purpose.” 
Riot Squad called out for anti-migrant protesters - Trinidad & Tobago Express	https://trinidadexpress.com/news/local/riot-squad-called-out-for-anti-migrant-protesters/article_937640ee-8ea2-11e9-b893-379108b93c4a.html	2019-06-14	Riot Squad called out for anti-migrant protesters	"""What I would say to people who see this as xenophobic is charity starts at home. ""It is no more than about 700 registering per day and only a few hundred overlap. The Commissioner cautioned against fear-mongering saying while there have been incidents of Venezuelan migrants involved in criminal activities, people ought not to target or profile Venezuelans as a whole. "
Rowley: 13900 migrant registered so far - Trinidad Guardian	http://www.guardian.co.tt/news/rowley-13900-migrant-registered-so-far-6.2.863327.764cfc4584	2019-06-14	Rowley: 13900 migrant registered so far	"Today is the culmination of a two-week registration period in which Venezuelan migrants have been mandated by Government to declare their presence, in exchange for a special registration card and clearance to work for one year. ""These are matters that persons in Trinidad and Tobago must understand require a balancing act and Madame Speaker, the energy coming to me from the other side is in keeping with statements that they have been making that there are 40,000 and 60,000 migrants here,"" Rowley said, as he slammed the UNC Opposition for spreading ""misinformation."" He accused the Opposition of being part of a pressure campaign, along with international organisations, to make Trinidad and Tobago into a migration camp. "
For uncounted refugee masses, just four plastic bathrooms - Trinidad & Tobago Express	https://trinidadexpress.com/opinion/columnists/for-uncounted-refugee-masses-just-four-plastic-bathrooms/article_b4be61a4-8fd9-11e9-9906-c7d8d1cba181.html	2019-06-15	For uncounted refugee masses, just four plastic bathrooms	BY last Thursday, when that ugly big word, “xenophobia”, was falling from common mouths, about 14,000 Venezuelans had passed the government’s registration test, thereby qualifying for temporary if not permanent residence. By 2019, the Venezuelan invasion, improvised in short-order small boatloads, did not make landfall here as an inrush coming out of some unknown nowhere. Last week, as the Government claimed a total of 14,000 registered incomers, one nameless official was estimating 20,000. 
Registered migrants say jobs hard to find - Trinidad Guardian	http://www.guardian.co.tt/news/registered-migrants-say-jobs-hard-to-find-6.2.864266.e238d2b200	2019-06-15	Registered migrants say jobs hard to find	It is competitive and very hard for us because we have to help out our families back in Venezuela,” Moya said. The Tucupita native arrived in Trinidad two weeks ago and showed up for registration on Wednesday. However, he said that the online system was not working properly and by 11 am on Thursday, it had completely shut down. 
PM accuses US of hypocrisy on migrant policy - Trinidad Guardian	http://www.guardian.co.tt/news/pm-accuses-us-of-hypocrisy-on-migrant-policy-6.2.869407.1e2c711922	2019-06-21	PM accuses US of hypocrisy on migrant policy	A new visa policy went into effect but the details have not yet been made public. They also took note that a new intelligence task force was started to improve investigations, while a new memorandum of understanding between its children’s authority and an anti-trafficking unit was put in place to better protect child victims. The Trafficking in Persons Report 2019, Young said, recognised that this country had increased anti-trafficking training for public officials; initiated investigations against three potentially complicit officials; initiated more prosecutions; established a new intelligence task force to improve investigations; and established a new Memorandum of Understanding between Government’s Counter Trafficking Unit (CTU) and The Children’s Authority to better protect child victims. 
Deyalsingh spells out health policy on migrants - Trinidad & Tobago Express	https://trinidadexpress.com/news/local/deyalsingh-spells-out-health-policy-on-migrants/article_29420740-948c-11e9-a6a5-cf5c4a11ae65.html	2019-06-21	Deyalsingh spells out health policy on migrants	Migrants can access healthcare at public hospitals but they will not be allowed to donate blood for a period of time. The Ministry of Health sought to make its policy on the treatment of non-nationals clear in a statement issued yesterday. This includes initial treatment, stabilisation and discharge for acute medical conditions. 
16523 migrants registered in two weeks - Trinidad Guardian	http://www.guardian.co.tt/news/16523-migrants-registered-in-two-weeks-6.2.872276.48a91166b4	2019-06-25	16523 migrants registered in two weeks	National Security Minister Stuart Young gave the updated figure in Tuesday night’s Senate debate. This focused on an Opposition motion seeking to annul Government’s Immigration regulations. The regulations are geared to allow the Venezuelans who are registered to work for a year in T&T without having to apply for a work permit separately. 
A safe place for migrant children - Trinidad & Tobago Express	https://trinidadexpress.com/news/local/a-safe-place-for-migrant-children/article_8d7561ee-9874-11e9-8f99-2beb2d641ac9.html	2019-06-26	A safe place for migrant children	The parish grounds of St Benedict’s Church in La Romaine now serves as an activity centre for Venezuelan migrant children. She said: “On March 26, six of us sat down on my porch and we wanted to help with the Venezuelan migrants in any way possible. Three people in the group were teachers and one was a clinical psychologist. 
CoP dismisses 'rumshop talk' of mass migration - Trinidad News	https://newsday.co.tt/2019/06/26/cop-dismisses-rumshop-talk-of-mass-migration/	2019-06-26	CoP dismisses 'rumshop talk' of mass migration	None 
ECA wants labour policy for migrants - Trinidad Guardian	http://www.guardian.co.tt/news/eca-wants-labour-policy-for-migrants-6.2.874195.cddfa712eb	2019-06-27	ECA wants labour policy for migrants	Ali said he was recently part of a discussion hosted by the ECA’s parent body, the International Organization for Employers (IOE), in Geneva where presentations were made by a number of countries who are grappling with mass migration. Even though the Venezuelan migrant registration policy has ended and many are already working, Ali said the Government still had time to formulate a policy that will benefit both employees and employers. Both Fingal and Ali said they believe an expansion of the labour force will augur well for this country’s competitiveness competence. 
Young: No TT citizens confirmed at Syrian refugee camp - Trinidad News	https://newsday.co.tt/2019/07/03/young-no-tt-citizens-confirmed-at-syrian-refugee-camp/	2019-07-03	Young: No TT citizens confirmed at Syrian refugee camp	None 
Female migrant abuse alive - Trinidad News	https://newsday.co.tt/2019/07/07/female-migrant-abuse-alive/	2019-07-07	Female migrant abuse alive	None 
Miss World T&T brings hope to migrant children - Trinidad & Tobago Express	https://trinidadexpress.com/news/local/miss-world-t-t-brings-hope-to-migrant-children/article_1e03af3a-a582-11e9-b9ce-5f5a60e7c496.html	2019-07-13	Miss World T&T brings hope to migrant children	It is a cause which is very close to Ramey’s heart and through her foundation, Esperanza, she will present a documentary to the Miss World Organisation at the competition in December. They have managed to create a model that allows this centre, that was so generously offered by Fr Pereira, to be a hub for love and safety. This will be carried out in the form of music, sport, theatre, dance and agriculture,” she said. 
Of migrants and refugees - Trinidad News	https://newsday.co.tt/2019/07/16/of-migrants-and-refugees/	2019-07-16	Of migrants and refugees	None 
The unending refugee saga - Trinidad & Tobago Express	https://trinidadexpress.com/opinion/editorials/the-unending-refugee-saga/article_50192d1c-ae77-11e9-b48a-eb6578ab10bd.html	2019-07-24	The unending refugee saga	Threatened with legal action by a group of 248 unregistered Venezuelan migrants, Prime Minister Dr Keith Rowley has responded by digging in his heels and instructing his National Security Minister to deport all unregistered Venezuelans. Dr Rowley’s tough stance is consistent with his position on illegal Venezuelan immigrants. Despite Dr Rowley’s invoking of the spectre of refugee camps in Trinidad, Venezuelans who have been slipping into Trinidad show no interest in being marginalised into the camps. 
Venezuelan migrants start collecting 'work permits' - Trinidad Guardian	http://www.guardian.co.tt/news/venezuelan-migrants-start-collecting-work-permits-6.2.895627.98e957255a	2019-07-27	Venezuelan migrants start collecting 'work permits'	Young said Immigration Division had to ensure that the information provided on the application forms was accurate with Interpol and other intelligence agencies, with some registrants failing this “due diligence” exercise. Holders of the cards will be granted an additional six months once successfully assessed. “But there are safeguards within this card that we can verify at any given point in time.” She said the cards will not allow Venezuelans to vote, become a citizen or grant them permanent residency but for them to work legally for six months in the first instance. 
ITNAC opens school for migrant children... - Trinidad Guardian	http://www.guardian.co.tt/news/itnac-opens-school-for-migrant-children-6.2.902997.8c6d75c094	2019-08-06	ITNAC opens school for migrant children...	“The Learning Space” as it is called, would be schooling some 100 children from toddlers to teenagers. Very importantly, our friend here, she (Greisy Gonzalez) would be helping us in terms of assessing the children on where they are at emotionally, psychologically. The parents were also briefed by TTPS Road Coordinator, Brent Batson on how to stay safe. 
Rowley : T&T no refugee camp - Trinidad & Tobago Express	https://trinidadexpress.com/news/local/rowley-t-t-no-refugee-camp/article_6dd9715e-49ba-11e8-9025-ab1f5c0af9fc.html	2019-08-15	Rowley : T&T no refugee camp	Prime Minister Dr Keith Rowley yesterday stressed Trinidad and Tobago will not be converted into a “refugee camp” by United Nations (UN) spokespersons, and condemned the attempt by UN (and Amnesty International) public servants to tarnish the image of this country, based on “misinformation”. Addressing the media at the Diplomatic Centre, St Ann’s, at the post-Cabinet news conference following his return from the Commonwealth Heads of Government Meeting (CHOGM) in London, England, the prime minister also sought to put in context the difference between economic migrants and political refugees. He was responding to objections from international and domestic critics to T&T’s repatriation of 82 Venezuelans. 
The Venezuelan migrant crisis - Trinidad & Tobago Express	https://trinidadexpress.com/opinion/columnists/the-venezuelan-migrant-crisis/article_10dd8f5e-22f8-11e9-86e1-d739d30637a9.html	2019-08-16	The Venezuelan migrant crisis	The Attorney General has recently revealed that legislation which seeks to treat with asylum requests from foreign nationals is being prepared. While the Government’s action was certainly both heavy-handed and shortsighted; since it was not a solution which could be repeated indefinitely; to see the migrant problem simply in terms only of humanitarian concerns is itself short sighted. And genuine refugees or not this country had better find a modus operandi for dealing with them humanely but realistically given our circumstances. 
What Trump’s new immigration rule means for us - Trinidad & Tobago Express	https://trinidadexpress.com/opinion/columnists/what-trump-s-new-immigration-rule-means-for-us/article_ae65253a-c3a6-11e9-aaa4-8fdf1b923bec.html	2019-08-20	What Trump’s new immigration rule means for us	The Guyana possibility apart, Trump’s new immigration rules should cause all Caribbean governments to consider how they cope with an increased population resulting from greatly restricted emigration. Even the present categories of workers that are allowed free movement within Caricom should be reviewed considering current developments. Caricom countries should collectively address the issue and determine how best they could jointly deal with it. 
Embracing the migrant community - Trinidad & Tobago Express	https://trinidadexpress.com/features/local/embracing-the-migrant-community/article_98e92ae2-d1d1-11e9-ae3f-b74ba0b5c87b.html	2019-09-07	Embracing the migrant community	2019 will undoubtedly be known as the year when the ongoing political and economic crisis in Venezuela spilled onto our shores here in T&T. In a matter of two weeks (May 31-June 14) more than 14,000 Venezuelans registered to live and work in Trinidad and Tobago for one year. LARMS is a relatively new organisation which was established less than six months ago with the aim of giving migrants and their young children some semblance of a normal life. 
Venezuelan migrant shot dead in Point Fortin - Trinidad Guardian	http://www.guardian.co.tt/news/venezuelan-migrant-shot-dead-in-point-fortin-6.2.934413.6ab6ef5ac3	2019-09-13	Venezuelan migrant shot dead in Point Fortin	Investigators are probing whether a lovers' quarrel may have led to the death of Venezuelan migrant Daniel Vasquez, who was shot in Point Fortin on Thursday night. Witnesses said the gunman then ran onto School Road and disappeared. While a few of them believe that Vasquez had owed money to someone. 
Labour Minister: 'Consider V'zuelans on new migrant policy - Trinidad News	https://newsday.co.tt/2019/09/13/labour-minister-consider-vzuelans-on-new-migrant-policy/	2019-09-13	Labour Minister: 'Consider V'zuelans on new migrant policy	None 
