title	link	date	title_corrected	summary
ONU insta a Chile a suspender “de inmediato” expulsiones de migrantes - El Nuevo Diario (República Dominicana)	https://elnuevodiario.com.do/onu-insta-a-chile-a-suspender-de-inmediato-expulsiones-de-migrantes/	2021-05-20	ONU insta a Chile a suspender “de inmediato” expulsiones de migrantes	Previo a su expulsión, “muchas de las personas habrían permanecido detenidas, en situación de incomunicación y sin acceso a asistencia legal”, alertaron desde la institución. “Las deportaciones no se pueden llevar a cabo de manera sumaria, sino que requieren una evaluación individual teniendo en cuenta las consideraciones humanitarias de arraigo”, destacó el relator especial sobre los Derechos Humanos de los Migrantes Felipe González Morales. Mientras que para el oficialismo la nueva norma es una vía para enfrentar el creciente fenómeno migratorio, la oposición y las organizaciones promigrantes han criticado ampliamente la ley y estiman que el endurecimiento de las fronteras desembocará en un aumento de migrantes que cruzan por pasos no habilitados. 
Ceuta: la historia de la imagen que captura la crisis migratoria (y la violenta reacción que generó en redes sociales) - Acento	https://acento.com.do/bbc-news-mundo/ceuta-la-historia-de-la-imagen-que-captura-la-crisis-migratoria-(y-la-violenta-reaccion-que-genero-en-redes-sociales)-8946458.html	2021-05-21	Ceuta: la historia de la imagen que captura la crisis migratoria (y la violenta reacción que generó en redes sociales)	"Ceuta: la historia de la imagen que captura la crisis migratoria (y la violenta reacción que generó en redes sociales) Las imágenes muestran cómo una voluntaria de la Cruz Roja, se afana por ayudar a un inmigrante subsahariano, le da agua, lo abraza y lo acaricia. Pero minutos después fue ella quien asumió su cuidado, se lo llevó hacia unas piedras grandes, donde lo sentó y le empezó a dar agua.Allí las cámaras captaron una foto que se ha vuelto icónica: el abrazo conmovedor entre el joven subsahariano y la voluntaria Luna Reyes. ""Uno no se espera o uno no concibe que después de hacer ese trabajo, llegues a tu casa y veas que en tus redes sociales te están criticando por lo que has hecho, cuando es una labor digna de elogio, cuando para nosotros forma parte del día a día y lo volveremos a hacer y Luna, cuando se recupere, lo seguirá haciendo"". "
Prevén mano de obra extranjera en construcción seguirá aumentando - Periódico elDinero	https://eldinero.com.do/161457/preven-mano-de-obra-extranjera-en-construccion-seguira-aumentando/	2021-05-22	Prevén mano de obra extranjera en construcción seguirá aumentando	La construcción aporta un dinamismo importante en la economía nacional y puede ser fundamental para mitigar los efectos de la pandemia del covid-19. En República Dominicana la mano de obra extranjera, especialmente haitiana, representa la mayor parte en el sector construcción. También exhorta a realizar estudios similares en otros sectores económicos, entre ellos, hoteles, bares y restaurantes, comercio y agropecuario, ya que cuentan con una cantidad importante de mano de obra extranjera durante los últimos años. 
¿Cuáles cambios migratorios hechos por Trump todavía están activos? - Diario Libre	https://www.diariolibre.com/usa/blogs/consultorio-de-migracion/cuales-cambios-migratorios-hechos-por-trump-todavia-estan-activos-AH26475511	2021-05-25	¿Cuáles cambios migratorios hechos por Trump todavía están activos?	La experta en asuntos migratorios hacia los Estados Unidos Karina Pérez Rojas te orienta sobre cuáles disposiciones asumidas por el ex presidente Donald Trump en materia de migración todavía siguen vigentes y cómo pueden afectar una solicitud de visa o residencia. 
Doce países renuevan compromisos para atender crisis migratoria de Venezuela – El Nacional - elnacional.com.do	https://elnacional.com.do/doce-paises-renuevan-compromisos-para-atender-crisis-migratoria-de-venezuela/	2021-05-28	Doce países renuevan compromisos para atender crisis migratoria de Venezuela – El Nacional	Brasil hizo referencia a su compromiso de seguir impulsando todos los temas que se vienen discutiendo en los grupos de trabajo con un enfoque regional orientado a la cooperación internacional. Entre los países miembros están Argentina, Bolivia, Brasil, Chile, Colombia, Costa Rica, Ecuador, Guyana, México, Paraguay, Panamá, República Dominicana, Perú y Uruguay. En la séptima reunión fue establecido un Grupo de Amigos conformado por ocho países de la Comunidad Internacional que participan en las reuniones plenarias y en los espacios técnicos. 
Continúa búsqueda de 10 migrantes cubanos tras naufragio en costa de Florida - Diario Libre	https://www.diariolibre.com/usa/actualidad/continua-busqueda-de-10-migrantes-cubanos-tras-naufragio-en-costa-de-florida-NE26557956	2021-05-28	Continúa búsqueda de 10 migrantes cubanos tras naufragio en costa de Florida	Para localizar a los migrantes, que partieron en una embarcación rústica el domingo pasado del Puerto de Mariel (Cuba) y zozobró el miércoles en la noche, se han cubierto 6.552 millas cuadradas (10.544 kilómetros cuadrados), una medida aproximadamente del tamaño de Hawaii, señaló la Guardia Costera. La institución informó anoche que los ocho rescatados permanecen a bordo de uno de sus barcos, donde reciben alimentos, agua y atención médica básica. Las autoridades han solicitado además a los marineros de la zona que si ven o escuchan algo en alguna embarcación lo comuniquen a la Guardia Costera. 
Naufraga bote de migrantes cubanos ante Florida; 2 muertos - Listín Diario	https://listindiario.com/las-mundiales/2021/05/28/672448/naufraga-bote-de-migrantes-cubanos-ante-florida-2-muertos	2021-05-28	Naufraga bote de migrantes cubanos ante Florida; 2 muertos	Las tripulaciones rescataron a ocho personas y retiraron dos cadáveres del agua, dijo el suboficial José Hernández. Dos goletas guardacostas y varias embarcaciones menores siguieron buscando a los desaparecidos el jueves por la noche. “Seguiremos buscando a los desaparecidos durante la noche y si algún marinero ve o escucha algo, denles ayuda si es posible y llamen a la Guardia Costera”, dijo el supervisor del centro de mando de Cayo Hueso, Seth Haynes. 
¿Para qué sirven los records migratorios de EE.UU. y cómo se solicitan? - El Caribe	https://m.elcaribe.com.do/panorama/caribe-migracion/para-que-sirven-los-records-migratorios-de-ee-uu-y-como-se-solicitan/	2021-05-31	¿Para qué sirven los records migratorios de EE.UU. y cómo se solicitan?	None 
EEUU planea dar más facilidades para la inmigración legal al país - elnuevodiario.com.do	https://elnuevodiario.com.do/eeuu-planea-dar-mas-facilidades-para-la-inmigracion-legal-al-pais/	2021-05-31	EEUU planea dar más facilidades para la inmigración legal al país	EEUU planea dar más facilidades para la inmigración legal al país EL NUEVO DIARIO, NUEVA YORK.- El Gobierno de Estados Unidos quiere facilitar la inmigración legal al país, dando marcha atrás a numerosas medidas de la Administración de Donald Trump y expandiendo las vías de acceso para ciudadanos extranjeros, según informó este lunes The New York Times con base en un documento al que ha tenido acceso. Entre otras cosas, Biden busca restaurar las oportunidades para trabajadores cualificados extranjeros a través del programa de visados H-1B, crear nuevas vías para empresarios que quieran invertir en EE.UU. y facilitar asilo a víctimas de violencia doméstica. Ese plan, presentado por Biden en su primer día en el cargo, debe ser aprobado por las dos cámaras del Congreso y cuenta con la oposición de los republicanos. 
EE.UU. planea dar más facilidades para la inmigración legal al país - Periódico elDinero	https://eldinero.com.do/162382/ee-uu-planea-dar-mas-facilidades-para-la-inmigracion-legal-al-pais/	2021-05-31	EE.UU. planea dar más facilidades para la inmigración legal al país	Entre otras cosas, Biden busca restaurar las oportunidades para trabajadores cualificados extranjeros a través del programa de visados H-1B, crear nuevas vías para empresarios que quieran invertir en EE.UU. y facilitar asilo a víctimas de violencia doméstica. Para reducir las barreras de acceso, se plantean opciones como reducir las tasas para los aspirantes que presenten sus solicitudes de forma digital y dar respuesta a las largas listas de espera que hay actualmente, acelerando los procedimientos, requiriendo menos documentación y ofreciendo entrevistas virtuales. Ese plan, presentado por Biden en su primer día en el cargo, debe ser aprobado por las dos cámaras del Congreso y cuenta con la oposición de los republicanos. 
Inicia juicio sobre salario para migrantes detenidos en EEUU - Diario Libre	https://www.diariolibre.com/usa/actualidad/inicia-juicio-sobre-salario-para-migrantes-detenidos-en-eeuu-EB26631126	2021-06-01	Inicia juicio sobre salario para migrantes detenidos en EEUU	“Estos casos tampoco son sobre la política inmigratoria de Estados Unidos o temas fronterizos”. Actualmente tiene cupo para 1.575 detenidos, aunque debido a preocupaciones relacionadas con la pandemia la población era de unas 250 personas recientemente. De cualquier forma, los detenidos no son “empleados” con derecho a salario mínimo, argumenta. 
EE.UU. pide a Centroamérica compromiso democrático y atacar raíz de migración - Diario Libre	https://www.diariolibre.com/usa/actualidad/ee-uu-pide-a-centroamerica-compromiso-democratico-y-atacar-raiz-de-migracion-EB26633061	2021-06-02	EE.UU. pide a Centroamérica compromiso democrático y atacar raíz de migración	En este sentido, reafirmaron su compromiso con una la migración ordenada, segura y regular, indicó la Cancillería costarricense. En la reunión participaron los cancilleres: Eamon Courtenay (Belice), Alexandra Hill Tinoco (El Salvador), Pedro Brolo Vila (Guatemala), Lisandro Rosales Banegas (Honduras), Marcelo Ebrard Casaubon (México), Denis Moncada Colindres (Nicaragua), Roberto Álvarez Gil (República Dominicana), y la viceministra de Relaciones Exteriores de Panamá, Dayra Carrizo Castillero. Esta es la primera visita de Blinken a un país latinoamericano desde que asumió el cargo. 
México pedirá a EEUU inversiones para contener migración - Diario Libre	https://www.diariolibre.com/usa/actualidad/mexico-pedira-a-eeuu-inversiones-para-contener-migracion-JL26692487	2021-06-04	México pedirá a EEUU inversiones para contener migración	Ebrard indicó que durante la reunión, que se desarrollará en el palacio de gobierno, se insistirá en la búsqueda de un acuerdo para “acelerar el crecimiento de la inversión y el bienestar social” en el sur de México y los países del llamado Triángulo Norte -Guatemala, El Salvador y Honduras-, para que la migración “sea opcional y no obligada por la pobreza o por la inseguridad”. Durante los últimos meses Biden ha intensificado las acciones para contener el flujo migratorio hacia Estados Unidos y designó en marzo a Harris para dirigir las medidas y los contactos directos con los gobiernos de la región para atender el problema. En los últimos meses se ha registrado un creciente flujo de migrantes hacia la frontera sur de Estados Unidos provenientes en parte de Guatemala, Honduras y El Salvador, que en último año se han visto golpeados por la crisis económica agudizada por la pandemia del coronavirus, la corrupción, la violencia y más recientemente por dos devastadores huracanes. 
Exdirigentes de Centro y Norteamérica buscarán soluciones para la migración - Diario Libre	https://www.diariolibre.com/usa/actualidad/exdirigentes-de-centro-y-norteamerica-buscaran-soluciones-para-la-migracion-DK26685143	2021-06-04	Exdirigentes de Centro y Norteamérica buscarán soluciones para la migración	'Ha llegado el momento de hacer un esfuerzo integral, unificado y regional que atienda los problemas mayores de refugiados y migrantes en las Américas', indicó en un comunicado del recién creado Grupo de Trabajo Norteamericano y Centroamericano sobre Migración. 'La visión que guía este nuevo Grupo de Trabajo es importante: sólo con la participación de quienes impulsan cambios en todo nuestro vecindario compartido en la región se logrará una realidad en la cual la migración sea más regular, predecible y segura', añadió Selee. Desde mayo de 2020 se ha producido un incesante incremento en la llegada de inmigrantes a Estados Unidos, tendencia que se acentuó con la llegada de Joe Biden a la Casa Blanca, y en abril pasado se superaron los 178.000 detenidos en la frontera sureste de este país, una cifra no vista en 20 años. 
Harris visita América Latina para abordar la migración y la corrupción - Listín Diario	https://listindiario.com/las-mundiales/2021/06/07/673773/harris-visita-america-latina-para-abordar-la-migracion-y-la-corrupcion	2021-06-07	Harris visita América Latina para abordar la migración y la corrupción	Harris busca asegurar compromisos de Guatemala y México para una mayor cooperación en seguridad fronteriza e inversión económica, pero la corrupción en la región, un desafío mucho más intratable, complicará sus esfuerzos. “Parte de dar esperanza a la gente es tener un compromiso muy específico para erradicar la corrupción en la región”, dijo. Cuando Gloria Porras, una fuerza respetada contra la corrupción, fue elegida para un segundo mandato, el congreso controlado por el partido de Giammattei se negó a colocarla. 
Alcalde a ciudadanos: ‘No entreguen sus armas’ - remolacha.net	https://remolacha.net/2021/06/abel-martinez-armas-de-fuego/	2021-06-07	Alcalde a ciudadanos: ‘No entreguen sus armas’	Abel Martínez pidió a los ciudadanos que cuentan con armas de fuego para su defensa personal y para la protección de sus bienes, a que no las entreguen, al tiempo de recordarles que las mismas deben estar en completo orden con los requerimientos de ley, para su porte y tenencia. (Seguir leyendo…) 
¿Quiénes pueden ser patrocidanores en un proceso de migración? - El Caribe	https://www.elcaribe.com.do/panorama/caribe-migracion/quienes-pueden-ser-patrocidanores-en-un-proceso-de-migracion/	2021-06-07	¿Quiénes pueden ser patrocidanores en un proceso de migración?	None 
¡Esa es mi hija!”, dice mujer al ver niña migrante en la TV - Listín Diario	https://listindiario.com/las-mundiales/2021/06/08/674045/esa-es-mi-hija-dice-mujer-al-ver-nina-migrante-en-la-tv	2021-06-08	¡Esa es mi hija!”, dice mujer al ver niña migrante en la TV	Foto AP Habían pasado seis años desde que Glenda Valdez se despidió de su pequeña hija con un beso y partió hacia Estados Unidos. Fue un final de película —por lo menos hasta ahora— para una compleja historia, que comenzó en Honduras, con una relación mala, según Valdez, quien tiene hoy 26 años. Casi 19.000 llegaron en marzo, lo que constituye una cifra mensual sin precedentes, y cerca de 17.200 en abril (la segunda más alta). 
Más de 3.900 niños migrantes separados de sus familias por el Gobierno Trump – El Nacional - elnacional.com.do	https://elnacional.com.do/mas-de-3-900-ninos-migrantes-separados-de-sus-familias-por-el-gobierno-trump/	2021-06-08	Más de 3.900 niños migrantes separados de sus familias por el Gobierno Trump – El Nacional	“Cuando reunificamos a las primeras siete familias el mes pasado, dije que eso era sólo el comienzo”, añadió Mayorkas. La directora ejecutiva del Grupo de Trabajo, Michelle Brané, dijo que el Gobierno proveerá a estas familias “el apoyo y los servicios para que reconstituyan sus vidas». En los últimos 30 días, indicó el comunicado, 7 menores de edad se reunieron con sus padres o madres, llevando el total de niños que se han reencontrado con sus familias a 1.786. 
Asistensi: una plataforma que lleva salud a los migrantes - Periódico elDinero	https://eldinero.com.do/163237/asistensi-una-plataforma-que-lleva-salud-a-los-migrantes/	2021-06-08	Asistensi: una plataforma que lleva salud a los migrantes	El presidente ejecutivo y cofundador de Asistensi, Andrés Simón González-Silén, explicó que la plataforma, que está disponible para República Dominicana, México y Venezuela, permite a los interesados contratar el servicio desde cualquier parte del mundo. El presidente ejecutivo del Grupo Venemergencia indicó que, aunque tienen mayor énfasis en migrantes, los dominicanos residentes en el país puedan afiliarse y recibir el servicio. “Está disponible para los residentes y la diáspora que desea mantener la salud asegurada de sus seres queridos, aun estando a distancia”. 
Kamala Harris visita Guatemala y pide a migrantes no viajar a EEUU - diariolibre.com	https://www.diariolibre.com/usa/actualidad/kamala-harris-visita-guatemala-y-pide-a-migrantes-no-viajar-a-eeuu-JH26747079	2021-06-08	Kamala Harris visita Guatemala y pide a migrantes no viajar a EEUU	La vicepresidenta estadounidense Kamala Harris ofreció una visión optimista para una mayor cooperación con Guatemala para hacer frente al aumento en la migración hacia Estados Unidos después de sostener una reunión con el presidente guatemalteco Alejandro Giammattei el lunes. Harris también prometió un nuevo programa que estará enfocado en crear oportunidades educativas y económicas para las niñas de la región, entre otras iniciativas. Cuando Gloria Porras, una respetada fuerza en la lucha contra la corrupción, fue elegida para un segundo periodo, el Congreso —dominado por el partido de Giammattei— se negó a aceptarla. 
Un boxeador venezolano en equipo olímpico de refugiados - Diario Libre	https://www.diariolibre.com/deportes/un-boxeador-venezolano-en-equipo-olimpico-de-refugiados-IE26777258	2021-06-09	Un boxeador venezolano en equipo olímpico de refugiados	Participó en un torneo invitacional en Trinidad y decidió quedarse en condición de refugiado. Competirán en natación, atletismo, bádminton, boxeo, canotaje, ciclismo, judo, karate, tiro deportivo, taekwondo, halterofilia y lucha grecorromana. La nadadora Yusra Mardini se convertirá en dos veces olímpica tras participar en los 100 metros libres y mariposa en Río. 
India: Choque de autobús con migrantes deja 17 muertos - Listín Diario	https://listindiario.com/las-mundiales/2021/06/09/674190/india-choque-de-autobus-con-migrantes-deja-17-muertos	2021-06-09	India: Choque de autobús con migrantes deja 17 muertos	Los migrantes se dirigían a Ahmedabad, una ciudad en el estado occidental de Guajarat, para reanudar sus labores en industrias que reabrieron tras levantarse las restricciones relacionadas con la pandemia. “Los pasajeros se quejaron de que el conductor del autobús iba muy rápido”, dijo Agarwal. Cada año mueren más de 110.000 personas en accidentes viales en la India, según la policía. 
Estados Unidos repatría a 20 migrantes haitianos interceptados en la costa de Florida - Diario Libre	https://www.diariolibre.com/usa/actualidad/estados-unidos-repatria-a-20-migrantes-haitianos-interceptados-en-la-costa-de-florida-NM26808207	2021-06-10	Estados Unidos repatría a 20 migrantes haitianos interceptados en la costa de Florida	“El ciudadano colombiano fue trasladado a tierra para interrogarle, al igual que uno de los haitianos para una inspección adicional”, agregó. “La Guardia Costera y nuestros socios continuamos vigilando el Caribe y las aguas circundantes en busca de migración ilegal e insegura”, dijo el teniente Edwin Valentin, enlace de la Guardia Costera en Haití. La Guardia Costera ha interceptado a unos 271 inmigrantes haitianos en el año fiscal 2021, que comenzó el pasado 1 de octubre, en comparación con los 418 haitianos detenidos en 2020 y los 932 en el año fiscal 2019. 
Texas endurece medidas contra migrantes y mantendrá la construcción del muro - El Caribe	https://www.elcaribe.com.do/destacado/texas-endurece-medidas-contra-migrantes-y-mantendra-la-construccion-del-muro/	2021-06-10	Texas endurece medidas contra migrantes y mantendrá la construcción del muro	None 
Invertirán US$110 MM para contribuir a detener migraciones - Listín Diario	https://listindiario.com/las-mundiales/2021/06/11/674464/invertiran-us-110-mm-para-contribuir-a-detener-migraciones	2021-06-11	Invertirán US$110 MM para contribuir a detener migraciones	En el evento del jueves realizado en Costa Rica, Estados Unidos anunció que donaba 57 millones de dólares de asistencia humanitaria para apoyar a los desplazados en Centroamérica y México, que se suman a otros 310 millones anunciados previamente. Los países miembros del mecanismo son Belize, Costa Rica, El Salvador, Guatemala, Honduras, México y Panamá. “Encontramos siempre la piedra en el zapato del cambio climático, y la poca solidaridad de los países que la han causado”, sostuvo, tras destacar que la única forma de detener a los migrantes es crear mejores oportunidades para ellos en sus países. 
La CE lanza una iniciativa para atraer migración laboral cualificada a la Unión Europea - Diario Libre	https://www.diariolibre.com/economia/la-ce-lanza-una-iniciativa-para-atraer-migracion-laboral-cualificada-a-la-union-europea-BO26823156	2021-06-11	La CE lanza una iniciativa para atraer migración laboral cualificada a la Unión Europea	"“La migración laboral también puede desempeñar un papel importante en la reducción del déficit de cualificaciones y en el impulso del potencial de innovación de la UE”, señaló el vicepresidente y comisario europeo para la Promoción del estilo de Vida Europeo, Margaritis Schinas, quien consideró que la iniciativa brindará un “triple beneficio” para los Estados miembros, los países asociados y los propios inmigrantes. En este sentido, la comisaria europea de Interior, Ylva Johansson, remarcó que la UE necesita “migración legal” por lo que estas asociaciones “ayudarán a adaptar las competencias de los candidatos a trabajar en Europa a las necesidades del mercado laboral”. “Las Asociaciones de Talentos también darán a Europa una gran herramienta para trabajar junto con nuestros países socios en todos los aspectos de la migración, algo que se ha echado en falta hasta ahora"", apostilló. "
Tratan frenar en PP la migración ilegal – El Nacional - elnacional.com.do	https://elnacional.com.do/tratan-frenar-en-pp-la-migracion-ilegal/	2021-06-12	Tratan frenar en PP la migración ilegal – El Nacional	Así lo afirmó el coordinador provincial de Migración, Luis Henry Coste, el cual afirmó que se le está dando continuidad a los operativos de interdicción con la finalidad de evitar que la migración ilegal continúe y se desarrolle en esta demarcación. Explicó que a principio de la semana que concluye, fue realizado un amplio operativo en los sectores Padre Granero, Los Domínguez, Cafemba y Muñoz, en donde resultaron detenidos numerosos ciudadanos extranjeros ilegales. Aclaró que de forma frecuente la población denuncia la presencia de haitianos en barriadas de Puerto Plata, Sosúa y Cabarete, pero en su gran mayoría se encuentran regularizados. 
Investigadora holandesa pone en circulación libro sobre la cultura e inmigración dominicana - El Caribe	https://www.elcaribe.com.do/destacado/investigadora-holandesa-pone-en-circulacion-libro-sobre-la-cultura-e-inmigracion-dominicana/	2021-06-13	Investigadora holandesa pone en circulación libro sobre la cultura e inmigración dominicana	None 
Recuperan cuerpos de decenas de migrantes tras zozobra de barco en costas de Yemen - DiarioDigitalRD	https://www.diariodigital.com.do/2021/06/14/recuperan-cuerpos-de-decenas-de-migrantes-tras-zozobra-de-barco-en-costas-de-yemen.html	2021-06-14	Recuperan cuerpos de decenas de migrantes tras zozobra de barco en costas de Yemen	Las autoridades yemeníes locales, incluidas las tropas de los guardacostas, siguen trabajando para recuperar más cuerpos, indicó el funcionario. En la mayoría de los casos, los desesperados migrantes de África Oriental intentaron cruzar la peligrosa ruta para llegar a Medio Oriente, principalmente a Arabia Saudí, a través de Yemen devastado por la guerra. La Organización Internacional para las Migraciones informó que 5.100 inmigrantes han llegado a Yemen en lo que va de año, en comparación con los 35.000 en 2020 y los 127.000 en 2019 antes del brote del coronavirus, que redujo la demanda de mano de obra en los estados del Golfo. 
EEUU: Jurado debate salario mínimo para migrantes detenidos - Diario Libre	https://www.diariolibre.com/usa/actualidad/eeuu-jurado-debate-salario-minimo-para-migrantes-detenidos-CM26918813	2021-06-15	EEUU: Jurado debate salario mínimo para migrantes detenidos	El juez federal con sede en Tacoma Robert Bryan, quien rechazó varias solicitudes de GEO para desestimar las querellas, consolidó los casos para el juicio, que presidió vía Zoom debido a la pandemia. “Lo que GEO está haciendo para explotar a los trabajadores cautivos en el centro de detención Northwest es real y a una enorme escala”, dijo el martes la fiscal general asistente Andrea Brenneke al jurado durante sus argumentos de cierre. Además, GEO supervisó los turnos y el desempeño del trabajo tal como lo haría cualquier empleador, aseguraron. 
