title	link	date	title_corrected
Honduras y Estados Unidos firman histórico acuerdo en temas de migración y seguridad - elmundo.hn	https://elmundo.hn/honduras-y-estados-unidos-firman-historico-acuerdo-en-temas-de-migracion-y-seguridad/	2019-09-25	Honduras y Estados Unidos firman histórico acuerdo en temas de migración y seguridad
Trump propone recortar programa de acogida de refugiados en EEUU - Diario El Heraldo - ElHeraldo.hn	https://www.elheraldo.hn/mundo/1322172-466/trump-propone-recortar-programa-de-acogida-de-refugiados-en-eeuu	2019-09-26	Trump propone recortar programa de acogida de refugiados en EEUUDiario El Heraldo
Arrestan 136 inmigrantes en Nueva York y Nueva Jersey, entre ellos hondureños - Diez.hn	https://www.diez.hn/noticiasdelmundo/1322162-498/arresto-inmigrantes-estados-unidos-ice-hondurenos-nueva-york-nueva-jersey	2019-09-26	Arrestan 136 inmigrantes en Nueva York y Nueva Jersey, entre ellos hondureños
Ministro de Trabajo: Columna vertebral del acuerdo con EEUU es la migración laboral ordenada El Sol De Honduras - elsoldehonduras.com	http://www.elsoldehonduras.com/nacionales/ministro-de-trabajo-columna-vertebral-del-acuerdo-con-eeuu-es-la-migracion-laboral-ordenada/	2019-09-27	Ministro de Trabajo: Columna vertebral del acuerdo con EEUU es la migración laboral ordenada El Sol De Honduras
Acnur pide a México agilizar integración de migrantes para evitar xenofobia - La Tribuna.hn	https://www.latribuna.hn/2019/10/01/acnur-pide-a-mexico-agilizar-integracion-de-migrantes-para-evitar-xenofobia/	2019-10-01	Acnur pide a México agilizar integración de migrantes para evitar xenofobia
EE UU reanuda ayuda a Centroamérica tras alcanzar acuerdos de migración - dinero.hn	https://dinero.hn/ee-uu-reanuda-ayuda-a-centroamerica-tras-alcanzar-acuerdos-de-migracion/	2019-10-16	EE UU reanuda ayuda a Centroamérica tras alcanzar acuerdos de migración
Abogada de la UE: Hungría, Polonia y Chequia violan ley al no reubicar a los refugiados - paradigma.hn	https://paradigma.hn/abogada-de-la-ue-hungria-polonia-y-chequia-violan-ley-al-no-reubicar-a-los-refugiados/	2019-10-31	Abogada de la UE: Hungría, Polonia y Chequia violan ley al no reubicar a los refugiados
EE.UU. extenderá TPS por un año más a migrantes hondureños — - confidencialhn.com	https://confidencialhn.com/ee-uu-extendera-tps-por-un-ano-mas-a-migrantes-hondurenos/	2019-11-01	EE.UU. extenderá TPS por un año más a migrantes hondureños —
La CIDH expresa preocupación por la recolección de ADN de los migrantes en EEUU — - confidencialhn.com	https://confidencialhn.com/la-cidh-expresa-preocupacion-por-la-recoleccion-de-adn-de-los-migrantes-en-eeuu/	2019-11-01	La CIDH expresa preocupación por la recolección de ADN de los migrantes en EEUU —
México, capital Hollywood: migrantes lideran el Día de los Muertos en Los Ángeles - paradigma.hn	https://paradigma.hn/mexico-capital-hollywood-migrantes-lideran-el-dia-de-los-muertos-en-los-angeles/	2019-11-03	México, capital Hollywood: migrantes lideran el Día de los Muertos en Los Ángeles
La justicia suspende orden de Trump de denegar visados a migrantes sin seguro - paradigma.hn	https://paradigma.hn/la-justicia-suspende-orden-de-trump-de-denegar-visados-a-migrantes-sin-seguro/	2019-11-03	La justicia suspende orden de Trump de denegar visados a migrantes sin seguro
Acnur dice que «siempre abogara por fronteras abiertas» en caso de refugiados - paradigma.hn	https://paradigma.hn/acnur-dice-que-siempre-abogara-por-fronteras-abiertas-en-caso-de-refugiados/	2019-11-08	Acnur dice que «siempre abogara por fronteras abiertas» en caso de refugiados
México y Centroamérica acuerdan respuesta conjunta a situación de refugiados - La Tribuna.hn	https://www.latribuna.hn/2019/11/09/mexico-y-centroamerica-acuerdan-respuesta-conjunta-a-situacion-de-refugiados/	2019-11-09	México y Centroamérica acuerdan respuesta conjunta a situación de refugiados
El número de desplazados en Honduras subió a 270 mil personas - paradigma.hn	https://paradigma.hn/el-numero-de-desplazados-en-honduras-subio-a-270-mil-personas/	2019-11-11	El número de desplazados en Honduras subió a 270 mil personas
Alarma a congresistas racismo que enfrentan migrantes africanos en México - paradigma.hn	https://paradigma.hn/alarma-a-congresistas-racismo-que-enfrentan-migrantes-africanos-en-mexico/	2019-11-23	Alarma a congresistas racismo que enfrentan migrantes africanos en México
Embajada de Honduras en México entrega ayuda humanitaria a migrantes en Matamoros - elmundo.hn	https://elmundo.hn/embajada-de-honduras-en-mexico-entrega-ayuda-humanitaria-a-migrantes-en-matamoros/	2019-11-27	Embajada de Honduras en México entrega ayuda humanitaria a migrantes en Matamoros
Embajada de Honduras en México entrega ayuda humanitaria a migrantes en Matamoros El Sol De Honduras - elsoldehonduras.com	http://www.elsoldehonduras.com/internacionales/embajada-de-honduras-en-mexico-entrega-ayuda-humanitaria-a-migrantes-en-matamoros/	2019-11-28	Embajada de Honduras en México entrega ayuda humanitaria a migrantes en Matamoros El Sol De Honduras
Violencia principal causa de migración - La Tribuna.hn	https://www.latribuna.hn/2019/11/30/violencia-principal-causa-de-migracion/	2019-11-30	Violencia principal causa de migración
Captan felinos y otra fauna refugiada en la montaña Mico Quemado, Yoro (Galería) - La Tribuna.hn	https://www.latribuna.hn/2019/12/05/camaras-ocultas-captan-felinos-y-otra-fauna-en-refugio-mico-quemado-yoro-galeria/	2019-12-05	Captan felinos y otra fauna refugiada en la montaña Mico Quemado, Yoro (Galería)
Pesebre en California ilustra separación de familias migrantes - paradigma.hn	https://paradigma.hn/pesebre-en-california-ilustra-separacion-de-familias-migrantes/	2019-12-09	Pesebre en California ilustra separación de familias migrantes
Acuerdo de asilo de Triángulo Norte y EEUU puede frenar tráfico de migrantes - paradigma.hn	https://paradigma.hn/acuerdo-de-asilo-de-triangulo-norte-y-eeuu-puede-frenar-trafico-de-migrantes/	2019-12-10	Acuerdo de asilo de Triángulo Norte y EEUU puede frenar tráfico de migrantes
Solo el 0,1 % de los migrantes regresados a México obtienen asilo en EE.UU. - paradigma.hn	https://paradigma.hn/solo-el-01-de-los-migrantes-regresados-a-mexico-obtienen-asilo-en-ee-uu/	2019-12-16	Solo el 0,1 % de los migrantes regresados a México obtienen asilo en EE.UU.
La UE debe prestar atención a la migración en América Latina, dicen expertos - paradigma.hn	https://paradigma.hn/la-ue-debe-prestar-atencion-a-la-migracion-en-america-latina-dicen-expertos/	2019-12-16	La UE debe prestar atención a la migración en América Latina, dicen expertos
Falta de políticas eficaces agrava crisis humanitaria de migrantes en México - paradigma.hn	https://paradigma.hn/falta-de-politicas-eficaces-agrava-crisis-humanitaria-de-migrantes-en-mexico/	2019-12-17	Falta de políticas eficaces agrava crisis humanitaria de migrantes en México
Un fotógrafo crea arte y conciencia en EE.UU. con objetos decomisados a migrantes - paradigma.hn	https://paradigma.hn/un-fotografo-crea-arte-y-conciencia-en-ee-uu-con-objetos-decomisados-a-migrantes/	2019-12-17	Un fotógrafo crea arte y conciencia en EE.UU. con objetos decomisados a migrantes
En el día internacional del migrante - enaltavoz.com	https://enaltavoz.com/en-el-dia-internacional-del-migrante/	2019-12-18	En el día internacional del migrante
EE.UU, México y Centroamérica fallan en su obligación de proteger a los y las migrantes » Criterio.hn - criterio.hn	https://criterio.hn/ee-uu-mexico-y-centroamerica-fallan-en-su-obligacion-de-proteger-a-los-y-las-migrantes/	2019-12-18	EE.UU, México y Centroamérica fallan en su obligación de proteger a los y las migrantes » Criterio.hn
Pobreza y pandillas, males persistentes que motivan migración centroamericana - paradigma.hn	https://paradigma.hn/pobreza-y-pandillas-males-persistentes-que-motivan-migracion-centroamericana/	2019-12-19	Pobreza y pandillas, males persistentes que motivan migración centroamericana
Honduras alcanza cifra “récord” de migrantes deportados - elmundo.hn	https://elmundo.hn/honduras-alcanza-cifra-record-de-migrantes-deportados/	2019-12-19	Honduras alcanza cifra “récord” de migrantes deportados
Honduras cerrará 2019 con cifra récord de casi 105.000 migrantes deportados - paradigma.hn	https://paradigma.hn/honduras-cerrara-2019-con-cifra-record-de-casi-105-000-migrantes-deportados/	2019-12-20	Honduras cerrará 2019 con cifra récord de casi 105.000 migrantes deportados
"Éxodo migrante centroamericano creció en 2019 a pesar del ""muro"" mexicano — - confidencialhn.com"	https://confidencialhn.com/exodo-migrante-centroamericano-crecio-en-2019-a-pesar-del-muro-mexicano/	2019-12-21	"Éxodo migrante centroamericano creció en 2019 a pesar del ""muro"" mexicano —"
La migración y el tercer país seguro nublaron panorama hondureño en 2019 » Criterio.hn - criterio.hn	https://criterio.hn/la-migracion-y-el-tercer-pais-seguro-nublaron-panorama-hondureno-en-2019/	2019-12-31	La migración y el tercer país seguro nublaron panorama hondureño en 2019 » Criterio.hn
En 15.4 % aumentó en 2019 la migración de hondureños hacia España - elmundo.hn	https://elmundo.hn/en-15-4-aumento-en-2019-la-migracion-de-hondurenos-hacia-espana/	2020-01-08	En 15.4 % aumentó en 2019 la migración de hondureños hacia España
Autoridades mexicanas advierten que capturaran y deportaran migrantes irregulares - Hondudiario	https://hondudiario.com/nacionales/autoridades-mexicanas-advierten-que-capturaran-y-deportaran-migrantes-irregulares/	2020-01-11	Autoridades mexicanas advierten que capturaran y deportaran migrantes irregulares
Panorama económico de Honduras deja dos caminos: migración o suicidio (vídeo) » Criterio.hn - criterio.hn	https://criterio.hn/panorama-economico-de-honduras-deja-dos-caminos-migracion-o-suicidio-video/	2020-01-13	Panorama económico de Honduras deja dos caminos: migración o suicidio (vídeo) » Criterio.hn
Numerosa caravana de migrantes hondureños se alista para partir la madrugada del miércoles » Criterio.hn - criterio.hn	https://criterio.hn/numerosa-caravana-de-migrantes-hondurenos-se-alista-para-partir-la-madrugada-del-miercoles/	2020-01-14	Numerosa caravana de migrantes hondureños se alista para partir la madrugada del miércoles » Criterio.hn
Refuerzan puntos fronterizos por “migración de feligreses” - Hondudiario	https://hondudiario.com/nacionales/refuerzan-puntos-fronterizos-por-migracion-de-feligreses/	2020-01-14	Refuerzan puntos fronterizos por “migración de feligreses”
Influyente entidad de migrantes respalda a Sanders para Presidencia de EE.UU. - paradigma.hn	https://paradigma.hn/influyente-entidad-de-migrantes-respalda-a-sanders-para-presidencia-de-ee-uu/	2020-01-15	Influyente entidad de migrantes respalda a Sanders para Presidencia de EE.UU.
Giammattei: Gobierno de México no dejará pasar la caravana de migrantes que partió de Honduras — - confidencialhn.com	https://confidencialhn.com/giammattei-gobierno-de-mexico-no-dejara-pasar-la-caravana-de-migrantes-que-partio-de-honduras/	2020-01-15	Giammattei: Gobierno de México no dejará pasar la caravana de migrantes que partió de Honduras —
Policía trabaja para «desenmascarar» a promotores de caravanas de migrantes - Hondudiario	https://hondudiario.com/nacionales/policia-trabaja-para-desenmascarar-a-promotores-de-caravanas-de-migrantes/	2020-01-15	Policía trabaja para «desenmascarar» a promotores de caravanas de migrantes
Juez EEUU avala que migrantes que teman ser enviados a México tengan abogado - paradigma.hn	https://paradigma.hn/juez-eeuu-avala-que-migrantes-que-teman-ser-enviados-a-mexico-tengan-abogado/	2020-01-15	Juez EEUU avala que migrantes que teman ser enviados a México tengan abogado
EEUU: Juez bloquea orden de Trump para rechazar a refugiados - La Tribuna.hn	https://www.latribuna.hn/2020/01/16/eeuu-juez-bloquea-orden-de-trump-para-rechazar-a-refugiados/	2020-01-16	EEUU: Juez bloquea orden de Trump para rechazar a refugiados
Cardenal Rodríguez advierte a migrantes de la caravana que “a nada van” - elmundo.hn	https://elmundo.hn/cardenal-rodriguez-advierte-a-migrantes-de-la-caravana-que-a-nada-van/	2020-01-16	Cardenal Rodríguez advierte a migrantes de la caravana que “a nada van”
Kensy López y su hijo de 3 años, el rostro de la caravana de migrantes que cruza Guatemala - paradigma.hn	https://paradigma.hn/kensy-lopez-y-su-hijo-de-3-anos-el-rostro-de-la-caravana-de-migrantes-que-cruza-guatemala/	2020-01-17	Kensy López y su hijo de 3 años, el rostro de la caravana de migrantes que cruza Guatemala
Fiscales apoyan a Washington para frenar arrestos de inmigrantes en cortes - paradigma.hn	https://paradigma.hn/fiscales-apoyan-a-washington-para-frenar-arrestos-de-inmigrantes-en-cortes/	2020-01-17	Fiscales apoyan a Washington para frenar arrestos de inmigrantes en cortes
Una prueba para México: caravana migrante se acerca a su frontera, que ha sido reforzada para evitar el paso - elmundo.hn	https://elmundo.hn/una-prueba-para-mexico-caravana-migrante-se-acerca-a-su-frontera-que-ha-sido-reforzada-para-evitar-el-paso/	2020-01-17	Una prueba para México: caravana migrante se acerca a su frontera, que ha sido reforzada para evitar el paso
Caravana migrante aguarda en campamentos en la frontera para cruzar a México - paradigma.hn	https://paradigma.hn/caravana-migrante-aguarda-en-campamentos-en-la-frontera-para-cruzar-a-mexico/	2020-01-19	Caravana migrante aguarda en campamentos en la frontera para cruzar a México
La caravana migrante posterga su entrada a México para duplicar su tamaño - paradigma.hn	https://paradigma.hn/la-caravana-migrante-posterga-su-entrada-a-mexico-para-duplicar-su-tamano/	2020-01-19	La caravana migrante posterga su entrada a México para duplicar su tamaño
La incertidumbre reina entre los migrantes varados en la frontera de Guatemala y México - paradigma.hn	https://paradigma.hn/la-incertidumbre-reina-entre-los-migrantes-varados-en-la-frontera-de-guatemala-y-mexico/	2020-01-20	La incertidumbre reina entre los migrantes varados en la frontera de Guatemala y México
Policía mexicana detienen a unos 400 integrantes de caravana de migrantes que cruzaron el río Suchiate - dinero.hn	https://dinero.hn/policia-mexicana-detienen-a-unos-400-integrantes-de-caravana-de-migrantes-que-cruzaron-el-rio-suchiate/	2020-01-21	Policía mexicana detienen a unos 400 integrantes de caravana de migrantes que cruzaron el río Suchiate
Atribuyen migración a política neoliberal e injerencista de EE. UU. » Criterio.hn - criterio.hn	https://criterio.hn/atribuyen-migracion-a-politica-neoliberal-e-injerencista-de-ee-uu/	2020-01-21	Atribuyen migración a política neoliberal e injerencista de EE. UU. » Criterio.hn
"Unos 1.000 integrantes de la caravana migrante solicitan el ""retorno asistido"" a Honduras — - confidencialhn.com"	https://confidencialhn.com/unos-1-000-integrantes-de-la-caravana-migrante-solicitan-el-retorno-asistido-a-honduras/	2020-01-21	"Unos 1.000 integrantes de la caravana migrante solicitan el ""retorno asistido"" a Honduras —"
Retornan 532 migrantes hondureños desde México y Guatemala - elmundo.hn	https://elmundo.hn/retornan-532-migrantes-hondurenos-desde-mexico-y-guatemala/	2020-01-22	Retornan 532 migrantes hondureños desde México y Guatemala
Cientos de migrantes detenidos por agentes migratorios y guardias en sur de México — - confidencialhn.com	https://confidencialhn.com/cientos-de-migrantes-detenidos-por-agentes-migratorios-y-guardias-en-sur-de-mexico/	2020-01-23	Cientos de migrantes detenidos por agentes migratorios y guardias en sur de México —
México frena caravana migrantes y muchos anticipan su final - paradigma.hn	https://paradigma.hn/mexico-frena-caravana-migrantes-y-muchos-anticipan-su-final/	2020-01-24	México frena caravana migrantes y muchos anticipan su final
México suspende visitas de activistas a centros de migrantes - paradigma.hn	https://paradigma.hn/mexico-suspende-visitas-de-activistas-a-centros-de-migrantes/	2020-01-29	México suspende visitas de activistas a centros de migrantes
La historia se repite y una nueva caravana migrante sale mañana desde San Pedro Sula » Criterio.hn - criterio.hn	https://criterio.hn/la-historia-se-repite-y-una-nueva-caravana-migrante-sale-manana-desde-san-pedro-sula/	2020-01-30	La historia se repite y una nueva caravana migrante sale mañana desde San Pedro Sula » Criterio.hn
EE.UU. declara emergencia y prohíbe ingreso a extranjeros que visitas en China - paradigma.hn	https://paradigma.hn/ee-uu-declara-emergencia-y-prohibe-ingreso-a-extranjeros-que-visitas-en-china/	2020-01-31	EE.UU. declara emergencia y prohíbe ingreso a extranjeros que visitas en China
Segunda caravana con 170 migrantes hondureños cruza a Guatemala rumbo a EEUU - paradigma.hn	https://paradigma.hn/segunda-caravana-con-170-migrantes-hondurenos-cruza-a-guatemala-rumbo-a-eeuu/	2020-02-01	Segunda caravana con 170 migrantes hondureños cruza a Guatemala rumbo a EEUU
"Defensores de migrantes denuncian que México cumple el ""sueño xenófobo"" de Trump — - confidencialhn.com"	https://confidencialhn.com/defensores-de-migrantes-denuncian-que-mexico-cumple-el-sueno-xenofobo-de-trump/	2020-02-01	"Defensores de migrantes denuncian que México cumple el ""sueño xenófobo"" de Trump —"
Renuncia de Alden Rivera, un duro golpe a migrantes - dinero.hn	https://dinero.hn/renuncia-de-alden-rivera-un-duro-golpe-a-migrantes/	2020-02-04	Renuncia de Alden Rivera, un duro golpe a migrantes
La deportación de migrantes hondureños aumentó 73,9 % en enero de 2020 - paradigma.hn	https://paradigma.hn/la-deportacion-de-migrantes-hondurenos-aumento-739-en-enero-de-2020/	2020-02-06	La deportación de migrantes hondureños aumentó 73,9 % en enero de 2020
Más de 5 mil migrantes hondureños han optado por retorno voluntario - paradigma.hn	https://paradigma.hn/mas-de-5-mil-migrantes-hondurenos-han-optado-por-retorno-voluntario/	2020-02-06	Más de 5 mil migrantes hondureños han optado por retorno voluntario
ACNUR: México pasó de ser país de tránsito a destino de refugiados — - confidencialhn.com	https://confidencialhn.com/acnur-mexico-paso-de-ser-pais-de-transito-a-destino-de-refugiados/	2020-02-06	ACNUR: México pasó de ser país de tránsito a destino de refugiados —
Deportación de migrantes hondureños incrementó un 73.9 por ciento en enero - elmundo.hn	https://elmundo.hn/deportacion-de-migrantes-hondurenos-incremento-un-73-9-por-ciento-en-enero/	2020-02-06	Deportación de migrantes hondureños incrementó un 73.9 por ciento en enero
Los costos de la migración de los que nadie habla - enaltavoz.com	https://enaltavoz.com/los-costos-de-la-migracion-de-los-que-nadie-habla/	2020-02-09	Los costos de la migración de los que nadie habla
Consejo Noruego pide proteger a los migrantes centroamericanos » Criterio.hn - criterio.hn	https://criterio.hn/consejo-noruego-pide-proteger-a-los-migrantes-centroamericanos/	2020-02-10	Consejo Noruego pide proteger a los migrantes centroamericanos » Criterio.hn
EEUU insta a Centroamérica a reducir migración con crecimiento económico — - confidencialhn.com	https://confidencialhn.com/eeuu-insta-a-centroamerica-a-reducir-migracion-con-crecimiento-economico/	2020-02-10	EEUU insta a Centroamérica a reducir migración con crecimiento económico —
Médicos sin Fronteras alerta de crisis humanitaria de migrantes centroamericanos hacinados en México - elmundo.hn	https://elmundo.hn/medicos-sin-fronteras-alerta-de-crisis-humanitaria-de-migrantes-centroamericanos-hacinados-en-mexico/	2020-02-12	Médicos sin Fronteras alerta de crisis humanitaria de migrantes centroamericanos hacinados en México
UE aportó 4 millones de euros a proyecto de ONU para refugiados en México — - confidencialhn.com	https://confidencialhn.com/ue-aporto-4-millones-de-euros-a-proyecto-de-onu-para-refugiados-en-mexico/	2020-02-14	UE aportó 4 millones de euros a proyecto de ONU para refugiados en México —
Desaparece en el Mediterráneo una balsa con 91 migrantes - paradigma.hn	https://paradigma.hn/desaparece-en-el-mediterraneo-una-balsa-con-91-migrantes/	2020-02-20	Desaparece en el Mediterráneo una balsa con 91 migrantes
Los refugiados y las remesas - La Tribuna.hn	https://www.latribuna.hn/2020/02/25/los-refugiados-y-las-remesas/	2020-02-25	Los refugiados y las remesas
Los refugiados y las remesas - enaltavoz.com	https://enaltavoz.com/los-refugiados-y-las-remesas/	2020-02-25	Los refugiados y las remesas
Gobierno de Trump deberá cuidar salud mental de familias migrantes separadas - paradigma.hn	https://paradigma.hn/gobierno-de-trump-debera-cuidar-salud-mental-de-familias-migrantes-separadas/	2020-02-26	Gobierno de Trump deberá cuidar salud mental de familias migrantes separadas
Foro internacional de la migración pide un alto a la indiferencia contra los migrantes » Criterio.hn - criterio.hn	https://criterio.hn/foro-internacional-de-la-migracion-pide-un-alto-a-la-indiferencia-contra-los-migrantes/	2020-02-29	Foro internacional de la migración pide un alto a la indiferencia contra los migrantes » Criterio.hn
La fundación de Thiago y Rafinha trabajará en proyectos para refugiados - diariomas.hn	https://www.diariomas.hn/2020/03/03/la-fundacion-de-thiago-y-rafinha-trabajara-en-proyectos-para-refugiados/	2020-03-03	La fundación de Thiago y Rafinha trabajará en proyectos para refugiados
TESTIGO OCULAR: En los cuatro puntos cardinales de Honduras, la historia es la misma; la discriminación contra la juventud incentiva la migración. - enaltavoz.com	https://enaltavoz.com/testigo-ocular-en-los-cuatro-puntos-cardinales-de-honduras-la-historia-es-la-misma-la-discriminacion-contra-la-juventud-incentiva-la-migracion/	2020-03-04	TESTIGO OCULAR: En los cuatro puntos cardinales de Honduras, la historia es la misma; la discriminación contra la juventud incentiva la migración.
Se fugan migrantes hondureños puestos en cuarentena luego que llegaron deportados a SPS - elmundo.hn	https://elmundo.hn/se-fugan-migrantes-hondurenos-puestos-en-cuarentena-luego-que-llegaron-deportados-a-sps/	2020-03-22	Se fugan migrantes hondureños puestos en cuarentena luego que llegaron deportados a SPS
Honduras y Nicaragua acuerdan proteger a migrantes extranjeros del coronavirus - elmundo.hn	https://elmundo.hn/honduras-y-nicaragua-acuerdan-proteger-a-migrantes-extranjeros-del-coronavirus/	2020-03-26	Honduras y Nicaragua acuerdan proteger a migrantes extranjeros del coronavirus
Donald Trump está deportando a niños inmigrantes no acompañados aprovechando el coronavirus - Diez.hn	https://www.diez.hn/coronavirus/1368385-441/administracion-donald-trump-ninos-deportados-centroamerica-coronavirus-estados-unidos	2020-03-30	Donald Trump está deportando a niños inmigrantes no acompañados aprovechando el coronavirus
Coronavirus: Aumentan los casos en prisiones para inmigrantes en Estados Unidos - Diez.hn	https://www.diez.hn/coronavirus/1370986-441/coronavirus-prisiones-inmigrantes-estados-unidos-covid-19-pandemia-nueva-york	2020-04-08	Coronavirus: Aumentan los casos en prisiones para inmigrantes en Estados Unidos
Desde España: la pandemia pone en riesgo el refugio de los inmigrantes - enaltavoz.com	https://enaltavoz.com/desde-espana-la-pandemia-pone-en-riesgo-el-refugio-de-los-inmigrantes/	2020-04-09	Desde España: la pandemia pone en riesgo el refugio de los inmigrantes
México admite riesgo por hacinamiento en estaciones migratorias ante pandemia - paradigma.hn	https://paradigma.hn/mexico-admite-riesgo-por-hacinamiento-en-estaciones-migratorias-ante-pandemia/	2020-04-12	México admite riesgo por hacinamiento en estaciones migratorias ante pandemia
Apostolado de Lousiana trabajando con los inmigrantes hispanos en Nueva Orleans » Criterio.hn - criterio.hn	https://criterio.hn/apostolado-de-lousiana-trabajando-con-los-inmigrantes-hispanos-en-nueva-orleans/	2020-04-14	Apostolado de Lousiana trabajando con los inmigrantes hispanos en Nueva Orleans » Criterio.hn
Copeco asiste a 244 migrantes retornados aislados en la Villa Olímpica de Tegucigalpa - elmundo.hn	https://elmundo.hn/copeco-asiste-a-244-migrantes-retornados-aislados-en-la-villa-olimpica-de-tegucigalpa/	2020-04-17	Copeco asiste a 244 migrantes retornados aislados en la Villa Olímpica de Tegucigalpa
FOTOS: Alemania acoge a niños refugiados procedentes de países en guerra - Diario El Heraldo - ElHeraldo.hn	https://www.elheraldo.hn/fotogalerias/1373579-468/fotos-alemania-acoge-a-ni%C3%B1os-refugiados-procedentes-de-pa%C3%ADses-en-guerra	2020-04-19	FOTOS: Alemania acoge a niños refugiados procedentes de países en guerraDiario El Heraldo
Trump suspende la emisión de permisos de residencia permanente para migrantes - paradigma.hn	https://paradigma.hn/trump-suspende-la-emision-de-permisos-de-residencia-permanente-para-migrantes/	2020-04-21	Trump suspende la emisión de permisos de residencia permanente para migrantes
Donald Trump anuncia suspensión de inmigración hacia Estados Unidos por al menos 60 días - Diez.hn	https://www.diez.hn/coronavirus/1374278-441/donald-trump-60-dias-inmigracion-estados-unidos-coronavirus-covid-19	2020-04-21	Donald Trump anuncia suspensión de inmigración hacia Estados Unidos por al menos 60 días
Trump recurre a restricciones migratorias para contentar a sus votantes - paradigma.hn	https://paradigma.hn/trump-recurre-a-restricciones-migratorias-para-contentar-a-sus-votantes/	2020-04-21	Trump recurre a restricciones migratorias para contentar a sus votantes
Trump firma una orden que suspende la inmigración legal a EE.UU. - paradigma.hn	https://paradigma.hn/trump-firma-una-orden-que-suspende-la-inmigracion-legal-a-ee-uu/	2020-04-22	Trump firma una orden que suspende la inmigración legal a EE.UU.
