title	link	date	title_corrected
"Apoyará a migrantes el filme ""Patrulla 81, La verdadera historia..."" - La Crónica de Hoy"	http://www.cronica.com.mx/notas/2007/307757.html	2007-06-20	"Apoyará a migrantes el filme ""Patrulla 81, La verdadera historia..."""
Suerte de migrantes - Leopoldo Mendívil - La Crónica de Hoy	http://www.cronica.com.mx/notas/2009/458953.html	2009-09-22	Suerte de migrantesLeopoldo Mendívil
Angelina Jolie visita a refugiados africanos en Malta - unam.mx	https://www.jornada.unam.mx/2011/06/20/mundo/028n4mun	2011-06-20	Angelina Jolie visita a refugiados africanos en Malta
Reestrenan Zoot suit, una crítica al racismo contra migrantes en EU - La Crónica de Hoy	https://www.cronica.com.mx/notas/2013/739957.html	2013-03-24	Reestrenan Zoot suit, una crítica al racismo contra migrantes en EU
Los pobladores de América llegaron en varias migraciones simultáneas - La Crónica de Hoy	https://www.cronica.com.mx/notas/2013/746992.html	2013-04-22	Los pobladores de América llegaron en varias migraciones simultáneas
Los pobladores de América llegaron en varias migraciones simultáneas - La Crónica de Hoy	http://www.cronica.com.mx/notas/2013/746992.html	2013-04-22	Los pobladores de América llegaron en varias migraciones simultáneas
Muere el pintor y escultor Alejandro Santiago; fue un defensor de migrantes - La Crónica de Hoy	https://www.cronica.com.mx/notas/2013/770429.html	2013-07-23	Muere el pintor y escultor Alejandro Santiago; fue un defensor de migrantes
Tiburones, los refugiados que habitan un parque marino - Milenio.com	https://www.milenio.com/estados/tiburones-los-refugiados-que-habitan-un-parque-marino	2015-03-20	Tiburones, los refugiados que habitan un parque marino
El arte mural de pequeños refugiados sirios | El Universal - El Universal	https://www.eluniversal.com.mx/articulo/cultura/artes-visuales/2015/07/9/el-arte-mural-de-pequenos-refugiados-sirios	2015-07-09	El arte mural de pequeños refugiados sirios
Hungría responsabiliza a la UE de muerte de 71 refugiados | El Universal - El Universal	https://www.eluniversal.com.mx/articulo/mundo/2015/08/28/hungria-responsabiliza-la-ue-de-muerte-de-71-refugiados	2015-08-28	Hungría responsabiliza a la UE de muerte de 71 refugiados
Nueva tragedia cobra vida de 34 refugiados – El Financiero - El Financiero	https://www.elfinanciero.com.mx/mundo/mueren-28-refugiados-en-nuevo-naufragio-en-isla-de-grecia/	2015-09-13	Nueva tragedia cobra vida de 34 refugiados – 
Policía dispara gases y cañones de agua contra refugiados en Hungría - El Universal	https://www.eluniversal.com.mx/galeria/mundo/2015/09/16/policia-dispara-gases-y-canones-de-agua-contra-refugiados-en-hungria	2015-09-16	Policía dispara gases y cañones de agua contra refugiados en Hungría
Más de un millón de refugiados llegarán a Alemania | El Universal - El Universal	https://www.eluniversal.com.mx/articulo/mundo/2015/10/5/mas-de-un-millon-de-refugiados-llegaran-alemania	2015-10-05	Más de un millón de refugiados llegarán a Alemania
Imagine Dragons y SAP se unen en pro de refugiados - El Financiero	https://www.elfinanciero.com.mx/after-office/imagine-dragons-y-sap-en-pro-de-refugiados/	2015-10-12	Imagine Dragons y SAP se unen en pro de refugiados
Rescatan a 949 migrantes en costas italianas - Excélsior	https://www.excelsior.com.mx/global/2015/11/06/1055669?utm_source=1055669&utm_medium=contentrelated&utm_campaign=main	2015-11-06	Rescatan a 949 migrantes en costas italianas
Ministro del Interior alemán aboga por fijar tope de refugiados - Excélsior	https://www.excelsior.com.mx/global/2015/11/26/1059707?utm_source=1059707&utm_medium=contentrelated&utm_campaign=main	2015-11-26	Ministro del Interior alemán aboga por fijar tope de refugiados
Ataques a refugiados en Alemania aumentaron en 2015 | El Universal - El Universal	https://www.eluniversal.com.mx/articulo/mundo/2016/01/14/ataques-refugiados-en-alemania-aumentaron-en-2015	2016-01-14	Ataques a refugiados en Alemania aumentaron en 2015
Miles condenan en Alemania la violencia contra refugiados - Excélsior	https://www.excelsior.com.mx/global/2016/01/16/1069224	2016-01-16	Miles condenan en Alemania la violencia contra refugiados
Ai Weiwei creará arte con chalecos salvavidas de refugiados | El Universal - El Universal	https://www.eluniversal.com.mx/articulo/cultura/artes-visuales/2016/02/2/ai-weiwei-creara-arte-con-chalecos-salvavidas-de	2016-02-02	Ai Weiwei creará arte con chalecos salvavidas de refugiados
México dará 3 mdd para los refugiados sirios - El Economista	https://www.eleconomista.com.mx/politica/Mexico-dara-3-mdd-para-los-refugiados-sirios-20160204-0014.html	2016-02-04	México dará 3 mdd para los refugiados sirios
Ai Weiwei despliega chalecos salvavidas por refugiados | El Universal - El Universal	https://www.eluniversal.com.mx/articulo/cultura/artes-visuales/2016/02/13/ai-weiwei-despliega-chalecos-salvavidas-por-refugiados	2016-02-13	Ai Weiwei despliega chalecos salvavidas por refugiados
Así es como el aeropuerto de Hitler se transforma para recibir a refugiados - El Financiero	https://elfinanciero.com.mx/new-york-times-syndicate/asi-es-como-el-aeropuerto-de-hitler-se-transforma-para-recibir-a-refugiados	2016-02-20	Así es como el aeropuerto de Hitler se transforma para recibir a refugiados
Hallan piezas arqueológicas en centro de refugiados | El Universal - El Universal	https://www.eluniversal.com.mx/articulo/cultura/patrimonio/2016/03/3/hallan-piezas-arqueologicas-en-centro-de-refugiados	2016-03-03	Hallan piezas arqueológicas en centro de refugiados
Inicia en Tampico construcción de centro de atención a menores migrantes - La Crónica de Hoy	http://www.cronica.com.mx/notas/2016/950880.html	2016-03-18	Inicia en Tampico construcción de centro de atención a menores migrantes
Mika, contra los muros y a favor de los refugiados | El Universal - El Universal	https://www.eluniversal.com.mx/articulo/espectaculos/musica/2016/04/1/mika-contra-los-muros-y-favor-de-los-refugiados	2016-04-01	Mika, contra los muros y a favor de los refugiados
¿Qué pasa con los niños migrantes que llegan a EU? - Publimetro Mexico	https://www.publimetro.com.mx/mx/noticias/2016/04/19/que-pasa-ninos-migrantes-que-llegan-eu.html	2016-04-19	¿Qué pasa con los niños migrantes que llegan a EU?
Policías de Tepotzotlán detienen a 11 migrantes indocumentados - La Crónica de Hoy	http://www.cronica.com.mx/notas/2016/964235.html	2016-06-01	Policías de Tepotzotlán detienen a 11 migrantes indocumentados
Ricky Martin visita y juega con niños refugiados sirios - Milenio.com	https://www.milenio.com/espectaculos/ricky-martin-visita-juega-ninos-refugiados-sirios	2016-06-03	Ricky Martin visita y juega con niños refugiados sirios
México y sus refugiados | El Universal - El Universal	https://www.eluniversal.com.mx/entrada-de-opinion/articulo/santiago-corcuera/nacion/2016/07/2/mexico-y-sus-refugiados	2016-07-02	México y sus refugiados
Malala visita campamento de refugiados en Kenia - Milenio.com	https://www.milenio.com/internacional/malala-visita-campamento-de-refugiados-en-kenia	2016-07-12	Malala visita campamento de refugiados en Kenia
Ai Weiwei lleva a Viena instalación flotante por refugiados | El Universal - El Universal	https://www.eluniversal.com.mx/articulo/cultura/artes-visuales/2016/07/13/ai-weiwei-lleva-viena-instalacion-flotante-por-refugiados	2016-07-13	Ai Weiwei lleva a Viena instalación flotante por refugiados
Claudia Ruiz Massieu pide garantizar derechos de migrantes - El Financiero	https://www.elfinanciero.com.mx/nacional/claudia-ruiz-massieu-pide-garantizar-derechos-de-migrantes/	2016-09-18	Claudia Ruiz Massieu pide garantizar derechos de migrantes
Drama de refugiados protagoniza exposición de Ai Weiwei en Italia | El Universal - El Universal	https://www.eluniversal.com.mx/articulo/cultura/artes-visuales/2016/09/21/drama-de-refugiados-protagoniza-exposicion-de-ai-weiwei	2016-09-21	Drama de refugiados protagoniza exposición de Ai Weiwei en Italia
Lindsay Lohan visita a refugiados sirios | El Universal - El Universal	https://www.eluniversal.com.mx/articulo/espectaculos/farandula/2016/09/26/lindsay-lohan-visita-refugiados-sirios	2016-09-26	Lindsay Lohan visita a refugiados sirios
Voluntaria de centro de apoyo a migrantes se casará con un haitiano en Mexicali - La Crónica de Hoy	https://www.cronica.com.mx/notas/2016/993890.html	2016-11-06	Voluntaria de centro de apoyo a migrantes se casará con un haitiano en Mexicali
Mujeres víctimas de violencia, ¿pueden ser refugiadas? | El Universal - El Universal	https://www.eluniversal.com.mx/entrada-de-opinion/colaboracion/mark-manly/nacion/2016/12/14/mujeres-victimas-de-violencia-pueden	2016-12-14	Mujeres víctimas de violencia, ¿pueden ser refugiadas?
Expertos impugnan las órdenes migratorias de Trump - Excélsior	https://www.excelsior.com.mx/global/2017/01/28/1142792?utm_source=1142792&utm_medium=contentrelated&utm_campaign=main	2017-01-28	Expertos impugnan las órdenes migratorias de Trump
"Malala, con ""el corazón roto"" por decisión de Trump de cerrar puertas a refugiados | El Universal - El Universal"	https://www.eluniversal.com.mx/articulo/mundo/2017/01/28/malala-critica-decision-de-donald-trump-al-cerrar-las-puertas-refugiados	2017-01-28	"Malala, con ""el corazón roto"" por decisión de Trump de cerrar puertas a refugiados"
Estos son los estados donde más emigran las personas - Publimetro México	https://www.publimetro.com.mx/mx/noticias/2017/01/30/estos-estados-mas-emigran-personas.html	2017-01-30	Estos son los estados donde más emigran las personas
Preocupa a Conapred discriminación a migrantes y refugiados - El Economista.com.mx	https://www.eleconomista.com.mx/politica/Preocupa-a-Conapred-discriminacion-a-migrantes-y-refugiados-20170130-0048.html	2017-01-30	Preocupa a Conapred discriminación a migrantes y refugiados
“Desinfección” de EU a migrantes provocó primera protesta mexicana - La Crónica de Hoy	https://www.cronica.com.mx/notas/2017/1007520.html	2017-01-30	“Desinfección” de EU a migrantes provocó primera protesta mexicana
¿Cómo se puede ser migrante con estatus legal en EU? - El Financiero	https://www.elfinanciero.com.mx/mundo/como-se-puede-ser-migrante-con-estatus-legal-en-eu/	2017-01-31	¿Cómo se puede ser migrante con estatus legal en EU?
¿Qué se necesita para ser migrante legal en EU? | El Universal - El Universal	https://www.eluniversal.com.mx/articulo/mundo/2017/01/31/que-se-necesita-para-ser-migrante-legal-en-eu	2017-01-31	¿Qué se necesita para ser migrante legal en EU?
México recibe a primer mujer refugiada de Líbano - Diario Deportivo Record	https://www.record.com.mx/contra/mexico-recibe-primer-mujer-refugiada-de-libano	2017-02-03	México recibe a primer mujer refugiada de Líbano
Caso de migrante deportada, realidad de mexicanos en EU: SRE - Excélsior	https://www.excelsior.com.mx/nacional/2017/02/09/1145426	2017-02-09	Caso de migrante deportada, realidad de mexicanos en EU: SRE
Zonas Económicas Especiales generarán empleos para enfrentar regreso de migrantes: PAN - La Crónica de Hoy	https://www.cronica.com.mx/notas/2017/1009683.html	2017-02-12	Zonas Económicas Especiales generarán empleos para enfrentar regreso de migrantes: PAN
Otorgarán a migrantes recursos de desertores de Prepa Sí - La Crónica de Hoy	https://www.cronica.com.mx/notas/2017/1010586.html	2017-02-18	Otorgarán a migrantes recursos de desertores de Prepa Sí
7 organizaciones en pro de los migrantes - El Economista	https://www.eleconomista.com.mx/internacionales/7-organizaciones-en-pro-de-los-migrantes-20170304-0012.html	2017-03-04	7 organizaciones en pro de los migrantes
Tapachula, el principal foco de migración que entra a México: ONU - El Financiero	https://www.elfinanciero.com.mx/nacional/tapachula-el-principal-foco-de-migracion-que-entra-a-mexico-onu/	2017-03-14	Tapachula, el principal foco de migración que entra a México: ONU
Estos son los principales trabajos que desempeñan los inmigrantes en EU - Publimetro México	https://www.publimetro.com.mx/mx/noticias/2017/03/16/estos-principales-trabajos-migrantes-eu.html	2017-03-16	Estos son los principales trabajos que desempeñan los inmigrantes en EU
[Video] Con biogás, el ITAM buscará mejorar la salud de refugiados - El Sol de México	https://www.elsoldemexico.com.mx/finanzas/tecnologia/video-con-biogas-el-itam-buscara-mejorar-la-salud-de-refugiados-220544.html	2017-04-03	[Video] Con biogás, el ITAM buscará mejorar la salud de refugiados
La Mara domina ruta de migrantes CA-México - La Crónica de Hoy	https://www.cronica.com.mx/notas/2017/1020640.html	2017-04-25	La Mara domina ruta de migrantes CA-México
Los 10 estados 'friendly' con los migrantes en EU - El Financiero	https://www.elfinanciero.com.mx/rankings/los-10-mejores-estados-de-eu-para-los-migrantes/	2017-05-06	Los 10 estados 'friendly' con los migrantes en EU
Hay 65.6 millones de personas desplazadas en el mundo: ACNUR - La Crónica de Hoy	http://www.cronica.com.mx/notas/2017/1029308.html	2017-06-19	Hay 65.6 millones de personas desplazadas en el mundo: ACNUR
Instala Canadá carpas para refugiados haitianos - Excélsior	https://www.excelsior.com.mx/global/2017/08/09/1180657	2017-08-09	Instala Canadá carpas para refugiados haitianos
Facilitan el acceso a las Afore a los trabajadores informales y migrantes - La Crónica de Hoy	https://www.cronica.com.mx/notas/2017/1042875.html	2017-09-12	Facilitan el acceso a las Afore a los trabajadores informales y migrantes
“Al otro lado del muro”, un documental que habla de la migración [VIDEO] - Diario de México	https://www.diariodemexico.com/escena/al-otro-lado-del-muro-un-documental-que-habla-de-la-migracion-video	2017-10-19	“Al otro lado del muro”, un documental que habla de la migración [VIDEO]
"Calibre 50 narra la travesía migrante en el ""Corrido de Juanito"" [VIDEO] - Diario de México"	https://www.diariodemexico.com/index.php/escena/calibre-50-narra-la-travesia-migrante-en-el-corrido-de-juanito-video	2017-11-06	"Calibre 50 narra la travesía migrante en el ""Corrido de Juanito"" [VIDEO]"
EU pone fin a programa de niños refugiados este jueves - El Financiero	https://www.elfinanciero.com.mx/mundo/eu-terminara-este-jueves-programa-de-ninos-refugiados/	2017-11-08	EU pone fin a programa de niños refugiados este jueves
Colegio de Sonora abre sus puertas a refugiada siria | El Universal - El Universal	https://www.eluniversal.com.mx/estados/colegio-de-sonora-abre-sus-puertas-refugiada-siria	2017-11-13	Colegio de Sonora abre sus puertas a refugiada siria
María y José también fueron migrantes: Papa Francisco - El Financiero	https://www.elfinanciero.com.mx/mundo/maria-y-jose-tambien-fueron-migrantes-papa-francisco/	2017-12-24	María y José también fueron migrantes: Papa Francisco
En 10 años aumentará la migración de jubilados de EU a México - La Crónica de Hoy	https://www.cronica.com.mx/notas/2018/1060640.html	2018-01-15	En 10 años aumentará la migración de jubilados de EU a México
Mauricio Vila Dosal se reúne con líderes migrantes de California - 24-horas	https://www.24-horas.mx/2018/03/19/mauricio-vila-dosal-se-reune-lideres-migrantes-california/	2018-03-19	Mauricio Vila Dosal se reúne con líderes migrantes de California
Crece 580% migración a México - El Sol de México	https://www.elsoldemexico.com.mx/mexico/crece-580-migracion-a-mexico-1534027.html	2018-03-25	Crece 580% migración a México
El cantante venezolano Nacho viaja en calidad de refugiado - El Sol de México	https://www.elsoldemexico.com.mx/gossip/el-cantante-venezolano-nacho-viaja-en-calidad-de-refugiado-1587228.html	2018-04-04	El cantante venezolano Nacho viaja en calidad de refugiado
Aseguran a 25 migrantes hacinados en un tráiler en Coahuila; hay dos detenidos - 24-horas	https://www.24-horas.mx/2018/04/26/aseguran-a-25-migrantes-hacinados-en-trailer-en-coahuila-dos-detenidos/	2018-04-26	Aseguran a 25 migrantes hacinados en un tráiler en Coahuila; hay dos detenidos
Kim Jong-un y Moon Jae-in: El heredero nacido para reinar y el hijo de refugiados | El Universal - El Universal	https://www.eluniversal.com.mx/mundo/kim-jong-un-y-moon-jae-el-heredero-nacido-para-reinar-y-el-hijo-de-refugiados	2018-04-27	Kim Jong-un y Moon Jae-in: El heredero nacido para reinar y el hijo de refugiados
Caravana migrante solicita asilo a EU - Heraldo de México	https://heraldodemexico.com.mx/mundo/2018/5/1/caravana-migrante-solicita-asilo-eu-39151.html	2018-05-01	Caravana migrante solicita asilo a EU
Indignan jaulas de niños migrantes; EU justifica tolerancia cero - Periódico Excélsior	https://www.excelsior.com.mx/global/indignan-jaulas-de-ninos-migrantes-eu-justifica-tolerancia-cero/1246377	2018-06-19	Indignan jaulas de niños migrantes; EU justifica tolerancia cero
Aumenta cifra de solicitudes de refugiados en México - Milenio.com	https://www.milenio.com/politica/aumenta-cifra-de-solicitudes-de-refugiados-en-mexico	2018-06-19	Aumenta cifra de solicitudes de refugiados en México
EU no pedirá perdón por separaciones de niños y padres migrantes - El Sol de México	https://www.elsoldemexico.com.mx/mundo/eu-no-pedira-perdon-por-separaciones-de-ninos-y-padres-migrantes-1774430.html	2018-06-19	EU no pedirá perdón por separaciones de niños y padres migrantes
1 de cada 110 personas en el mundo está desplazada - ElEconomista	https://www.eleconomista.com.mx/internacionales/1-de-cada-110-personas-en-el-mundo-esta-desplazada-20180619-0055.html	2018-06-19	1 de cada 110 personas en el mundo está desplazada
Wua wua, ex jefe de campaña de Trump se burla de niña migrante con sindrome de Down (+video) - 24-horas	https://www.24-horas.mx/2018/06/20/wua-wua-ex-jefe-de-campana-de-trump-se-burla-de-nina-migrante-con-sindrome-de-down-video/	2018-06-20	Wua wua, ex jefe de campaña de Trump se burla de niña migrante con sindrome de Down (+video)
Banksy reaparece en París; critica crisis de refugiados - Milenio.com	https://www.milenio.com/cultura/banksy-reaparece-paris-critica-crisis-refugiados	2018-06-24	Banksy reaparece en París; critica crisis de refugiados
Banksy reaparece con obras sobre refugiados en París - El Sol de México	https://www.elsoldemexico.com.mx/cultura/banksy-reaparece-con-obras-sobre-refugiados-en-paris-1790971.html	2018-06-25	Banksy reaparece con obras sobre refugiados en París
Modric y Mandzukic, de refugiados a figuras del Mundial | El Universal - El Universal	https://www.eluniversal.com.mx/rusia-2018/modric-y-mandzukic-de-refugiados-figuras-del-mundial	2018-07-11	Modric y Mandzukic, de refugiados a figuras del Mundial
Arrestan a centenar de migrantes centroamericanos en desierto de Arizona - 24-horas.mx	https://www.24-horas.mx/2018/07/31/arrestan-a-centenar-de-migrantes-centroamericanos-en-desierto-de-arizona/	2018-07-31	Arrestan a centenar de migrantes centroamericanos en desierto de Arizona
Muere migrante mexicana en jaulas de la Migra gringa - Pásala	https://www.pasala.com.mx/noticias/muere-migrante-mexicana-en-jaulas-de-la-migra-gringa	2018-07-31	Muere migrante mexicana en jaulas de la Migra gringa
Gobierno checo cierra la puerta a migrantes - El Financiero	https://www.elfinanciero.com.mx/mundo/gobierno-checo-cierra-la-puerta-a-migrantes/	2018-08-28	Gobierno checo cierra la puerta a migrantes
Y la clave de Suecia para crecer más que la UE son… sus inmigrantes - El Financiero	https://www.elfinanciero.com.mx/bloomberg-businessweek/y-la-clave-de-suecia-para-crecer-mas-que-la-ue-son-sus-inmigrantes/	2018-09-17	Y la clave de Suecia para crecer más que la UE son… sus inmigrantes
Migrantes, desplazados y apátridas – El Financiero - El Financiero	https://www.elfinanciero.com.mx/opinion/jacques-rogozinski/migrantes-desplazados-y-apatridas/	2018-10-15	Migrantes, desplazados y apátridas – 
Denuncian venta de niñas rohingya en campos de refugiados de Bangladesh - 24-horas	https://www.24-horas.mx/2018/10/17/denuncian-venta-de-ninas-rohingya-en-campos-de-refugiados-de-bangladesh/	2018-10-17	Denuncian venta de niñas rohingya en campos de refugiados de Bangladesh
Esta es la ruta migrante que pasa por México rumbo a EU: MAPA - Heraldo de México	https://heraldodemexico.com.mx/mundo/2018/10/18/esta-es-la-ruta-migrante-que-pasa-por-mexico-rumbo-eu-mapa-61427.html	2018-10-18	Esta es la ruta migrante que pasa por México rumbo a EU: MAPA
¿Caravana Migrante disparó xenofobia de algunos mexicanos? Ellos piensan que sí - Reporte Indigo	https://www.reporteindigo.com/reporte/caravana-migrante-disparo-xenofobia-algunos-mexicanos-piensan/	2018-10-19	¿Caravana Migrante disparó xenofobia de algunos mexicanos? Ellos piensan que sí
Angelina Jolie viajará a Perú para evaluar las necesidades de los refugiados venezolanos | El Universal - El Universal	https://www.eluniversal.com.mx/espectaculos/angelina-jolie-viajara-peru-para-evaluar-las-necesidades-de-los-refugiados-venezolanos	2018-10-21	Angelina Jolie viajará a Perú para evaluar las necesidades de los refugiados venezolanos
Angelina Jolie visita Perú para reunirse con refugiados venezolanos - El Sol de México	https://www.elsoldemexico.com.mx/gossip/celebridades/angelina-jolie-visita-peru-para-reunirse-con-refugiados-venezolanos-2185474.html	2018-10-21	Angelina Jolie visita Perú para reunirse con refugiados venezolanos
Albergues, comedores y organizaciones de ayuda para migrantes en México - Reporte Indigo	https://www.reporteindigo.com/reporte/albergues-comedores-organizaciones-ayuda-migrantes-en-mexico/	2018-10-21	Albergues, comedores y organizaciones de ayuda para migrantes en México
Llega oleada migrante a Tapachula; suman 6 mil centroamericanos - Periódico Excélsior	https://www.excelsior.com.mx/nacional/llega-oleada-migrante-a-tapachula-suman-6-mil-centroamericanos/1273216	2018-10-22	Llega oleada migrante a Tapachula; suman 6 mil centroamericanos
Este texto de José Saramago te hará ver a los migrantes de otra forma - La Razon	https://www.razon.com.mx/cultura/este-texto-de-jose-saramago-te-hara-ver-a-los-migrantes-de-otra-forma/	2018-10-22	Este texto de José Saramago te hará ver a los migrantes de otra forma
Caravana de migrantes: perder humanidad | El Universal - El Universal	https://www.eluniversal.com.mx/columna/leon-krauze/nacion/caravana-de-migrantes-perder-humanidad	2018-10-22	Caravana de migrantes: perder humanidad
Mapa: En estos lugares reciben ayuda para los migrantes hondureños - Publimetro México	https://www.publimetro.com.mx/mx/nacional/2018/10/23/en-estos-lugares-reciben-ayuda-para-los-migrantes-hondurenos.html	2018-10-23	Mapa: En estos lugares reciben ayuda para los migrantes hondureños
Ellos son los líderes detrás de la caravana migrante - Reporte Indigo	https://www.reporteindigo.com/reporte/ellos-son-los-lideres-detras-de-la-caravana-migrante/	2018-10-24	Ellos son los líderes detrás de la caravana migrante
Luis Gerardo Méndez y Kyzza Terrazas piden comprensión para migrantes - Heraldo de México	https://heraldodemexico.com.mx/espectaculos/2018/10/25/luis-gerardo-mendez-kyzza-terrazas-piden-comprension-para-migrantes-62488.html	2018-10-25	Luis Gerardo Méndez y Kyzza Terrazas piden comprensión para migrantes
Alcaldía de Miguel Hidalgo, se prepara para recibir a caravana migrante - contrareplica.mx	https://www.contrareplica.mx/nota-alcaldia-de-miguel-hidalgo-se-prepara-para-recibir-a-caravana-migrante2018241048	2018-10-25	Alcaldía de Miguel Hidalgo, se prepara para recibir a caravana migrante
Peña Nieto lanza plan para apoyar a migrantes centroamericanos - Reporte Indigo	https://www.reporteindigo.com/reporte/pena-nieto-lanza-plan-para-apoyar-a-migrantes-centroamericanos/	2018-10-26	Peña Nieto lanza plan para apoyar a migrantes centroamericanos
Violencia contra mujeres migrantes - Reporte Indigo	https://www.reporteindigo.com/latitud/violencia-contra-mujeres-migrantes-riesgos-agresiones-paso-mexico-origen-estados-unidos/	2018-10-26	Violencia contra mujeres migrantes
¿Qué pasó con los migrantes haitianos en Tijuana? - Heraldo de México	https://heraldodemexico.com.mx/tendencias/2018/10/27/que-paso-con-los-migrantes-haitianos-en-tijuana-62705.html	2018-10-27	¿Qué pasó con los migrantes haitianos en Tijuana?
Sheinbaum, Amieva y la CDHDF envían brigadistas para ayudar a migrantes - La Crónica de Hoy	http://www.cronica.com.mx/notas/2018/1098894.html	2018-10-29	Sheinbaum, Amieva y la CDHDF envían brigadistas para ayudar a migrantes
Pasos para solicitar el reconocimiento de la condición de refugiado en México - ElEconomista	https://www.eleconomista.com.mx/politica/Pasos-para-solicitar-el-reconocimiento-de-la-condicion-de-refugiado-en-Mexico-20181030-0071.html	2018-10-30	Pasos para solicitar el reconocimiento de la condición de refugiado en México
Hondureño de caravana migrante intenta entrar a Final de Copa MX - Diario Deportivo Record	https://www.record.com.mx/futbol-futbol-nacional-cruz-azul-monterrey-copa-mx/hondureno-de-caravana-migrante-intenta-entrar-a	2018-10-31	Hondureño de caravana migrante intenta entrar a Final de Copa MX
La violencia contra las mujeres migrantes se acentúa: Berenice Valdez - ElEconomista	https://www.eleconomista.com.mx/politica/La-violencia-contra-las-mujeres-migrantes-se-acentua-Berenice-Valdez-20181103-0017.html	2018-11-03	La violencia contra las mujeres migrantes se acentúa: Berenice Valdez
Segunda caravana migrante llega a Ciudad de México en la Magdalena Mixhuca - Reporte Indigo	https://www.reporteindigo.com/reporte/segunda-caravana-migrante-llega-a-ciudad-de-mexico-en-la-magdalena-mixhuca/	2018-11-08	Segunda caravana migrante llega a Ciudad de México en la Magdalena Mixhuca
Caravana migrante continúa su ruta hacia Querétaro - Diario de México	https://www.diariodemexico.com/mi-nacion/caravana-migrante-continua-su-ruta-hacia-queretaro	2018-11-09	Caravana migrante continúa su ruta hacia Querétaro
