title	link	date	title_corrected
México ha identificado a 20 mil 459 migrantes guatemaltecos, entre ellos cinco mil 674 niños, en lo que va del año - Prensa Libre	https://www.prensalibre.com/guatemala/migrantes/mexico-ha-identificado-a-20-mil-459-migrantes-guatemaltecos-entre-ellos-cinco-mil-674-ninos-en-lo-que-va-del-ano/	2021-06-07	México ha identificado a 20 mil 459 migrantes guatemaltecos, entre ellos cinco mil 674 niños, en lo que va del año
Con o sin Coyotes habrá migración - La Hora	https://lahora.gt/con-o-sin-coyotes-habra-migracion/	2021-06-07	Con o sin Coyotes habrá migración
"""No vengan... nuestra prioridad es desalentar la migración irregular"", dice Kamala Harris a los migrantes - republica.gt"	https://republica.gt/2021/06/07/no-vengan-nuestra-prioridad-es-desalentar-la-migracion-irregular-dice-kamala-harris-a-los-migrantes/	2021-06-07	"""No vengan... nuestra prioridad es desalentar la migración irregular"", dice Kamala Harris a los migrantes"
Organizaciones: Mientras no mejore la situación de la niñez, la migración no se detendrá - La Hora	https://lahora.gt/organizaciones-mientras-no-mejore-la-situacion-de-la-ninez-la-migracion-no-se-detendra/	2021-06-07	Organizaciones: Mientras no mejore la situación de la niñez, la migración no se detendrá
Organizaciones presentan a Harris propuestas de fondo para frenar la migración - Publinews Guatemala	https://www.publinews.gt/gt/noticias/2021/06/07/recomendaciones-a-kamala-harris-para-frenar-migracion-guatemala-centroamerica.html	2021-06-07	Organizaciones presentan a Harris propuestas de fondo para frenar la migración
Kamala Harris llega a México para discutir migración ilegal - Publinews Guatemala	https://www.publinews.gt/gt/noticias/2021/06/07/kamala-harris-llega-mexico.html	2021-06-07	Kamala Harris llega a México para discutir migración ilegal
Centro de migrantes retornados será instalado en el occidente del país según Giammattei - elPeriódico (Guatemala)	https://elperiodico.com.gt/nacionales/2021/06/07/centro-de-migrantes-retornados-sera-instalado-en-el-occidente-del-pais-segun-giammattei/	2021-06-07	Centro de migrantes retornados será instalado en el occidente del país según Giammattei
Giammattei pide a Harris “regularizar” migrantes guatemaltecos para aliviar economía - elPeriódico (Guatemala)	https://elperiodico.com.gt/nacionales/2021/06/08/giammattei-pide-a-harris-regularizar-migrantes-guatemaltecos-para-aliviar-economia/	2021-06-08	Giammattei pide a Harris “regularizar” migrantes guatemaltecos para aliviar economía
En su gira sobre migración, Harris se enfoca en México - La Hora	https://lahora.gt/en-su-gira-sobre-migracion-harris-se-enfoca-en-mexico/	2021-06-08	En su gira sobre migración, Harris se enfoca en México
EE.UU. reunirá a 29 menores migrantes con sus familias - Soy502	https://www.soy502.com/articulo/eeuu-reunira-29-menores-migrantes-sus-familias-24039	2021-06-08	EE.UU. reunirá a 29 menores migrantes con sus familias
Detener la migración es nuestra responsabilidad - elPeriódico (Guatemala)	https://elperiodico.com.gt/opinion/opiniones-de-hoy/2021/06/08/detener-la-migracion-es-nuestra-responsabilidad/	2021-06-08	Detener la migración es nuestra responsabilidad
Cumbre entre Centroamérica y España abordará temas de economía, migración y ambiente - Prensa Libre	https://www.prensalibre.com/internacional/cumbre-entre-centroamerica-y-espana-abordara-temas-de-economia-migracion-y-ambiente/	2021-06-08	Cumbre entre Centroamérica y España abordará temas de economía, migración y ambiente
Descartan que Guatemala tendrá un centro de migrantes solicitantes de asilo - republica.gt	https://republica.gt/2021/06/08/descartan-que-guatemala-tendra-un-centro-de-migrantes-solicitantes-de-asilo/	2021-06-08	Descartan que Guatemala tendrá un centro de migrantes solicitantes de asilo
Kamala Harris finaliza visita a Guatemala con el compromiso de luchar contra la corrupción, migración irregular y apoyo económico - Spanish Version - Periódico Digital Centroamericano y del Caribe	https://newsinamerica.com/pdcc/generales/2021/kamala-harris-finaliza-visita-a-guatemala-con-el-compromiso-de-luchar-contra-la-corrupcion-trata-de-personas-y-apoyo-economico/	2021-06-08	Kamala Harris finaliza visita a Guatemala con el compromiso de luchar contra la corrupción, migración irregular y apoyo económicoSpanish Version
Los migrantes mantienen el flujo de dinero a casa mientras las economías ricas se recuperan | Republica.gt - republica.gt	https://republica.gt/2021/06/08/wall-street-journal-migrantes-flujo-dinero-remesas/	2021-06-08	Los migrantes mantienen el flujo de dinero a casa mientras las economías ricas se recuperanRepublica.gt
La corrupción aleja al capital, el empleo e incentiva la migración - elPeriódico (Guatemala)	https://elperiodico.com.gt/noticias/economia/2021/06/09/la-corrupcion-aleja-al-capital-el-empleo-e-incentiva-la-migracion/	2021-06-09	La corrupción aleja al capital, el empleo e incentiva la migración
LAWG pide a EE.UU. decisivas contra la corrupción, derechos humanos y protección a migrantes - La Hora	https://lahora.gt/lawg-pide-a-ee-uu-decisivas-contra-la-corrupcion-derechos-humanos-y-proteccion-a-migrantes/	2021-06-09	LAWG pide a EE.UU. decisivas contra la corrupción, derechos humanos y protección a migrantes
Matemática, escritura y hasta yoga: cómo surgió la asociación que da clases virtuales a niños migrantes en la frontera con EE. UU. - Prensa Libre	https://www.prensalibre.com/internacional/matematica-escritura-y-hasta-yoga-como-surgio-la-asociacion-que-da-clases-virtuales-a-ninos-migrantes-en-la-frontera-con-ee-uu/	2021-06-09	Matemática, escritura y hasta yoga: cómo surgió la asociación que da clases virtuales a niños migrantes en la frontera con EE. UU.
¿Qué les depara el futuro a los migrantes, que se han convertido en parte de las comunidades de EE.UU.? | Republica.gt - republica.gt	https://republica.gt/2021/06/09/que-les-depara-el-futuro-a-los-migrantes-que-se-han-convertido-en-parte-de-las-comunidades-de-ee-uu/	2021-06-09	¿Qué les depara el futuro a los migrantes, que se han convertido en parte de las comunidades de EE.UU.?Republica.gt
Mirna Funes, una enfermera migrante que ha incidido positivamente hasta en 400 pacientes - La Hora	https://lahora.gt/mirna-funes-una-enfermera-migrante-que-ha-incidido-positivamente-hasta-en-400-pacientes/	2021-06-09	Mirna Funes, una enfermera migrante que ha incidido positivamente hasta en 400 pacientes
Verzeletti concuerda con Harris: Sin acceso a servicios, migraciones continuarán - La Hora	https://lahora.gt/verzeletti-concuerda-con-harris-sin-acceso-a-servicios-migraciones-continuaran/	2021-06-09	Verzeletti concuerda con Harris: Sin acceso a servicios, migraciones continuarán
“No solo es de soplar y hacer botellas”: Giammattei habla de migración, integración y vulnerabilidad en Centroamérica - Prensa Libre	https://www.prensalibre.com/guatemala/politica/no-solo-es-de-soplar-y-hacer-botellas-giammattei-habla-de-migracion-integracion-y-vulnerabilidad-en-centroamerica-breaking/	2021-06-10	“No solo es de soplar y hacer botellas”: Giammattei habla de migración, integración y vulnerabilidad en Centroamérica
"""Hemos sido incapaces de generar soluciones para nuestra gente"" dice Giammattei sobre la migración - republica.gt"	https://republica.gt/2021/06/10/alejandro-giammattei-sobre-migracion-hemos-sido-incapaces-de-generar-soluciones-para-nuestra-gente/	2021-06-10	"""Hemos sido incapaces de generar soluciones para nuestra gente"" dice Giammattei sobre la migración"
Rescatan en México a 140 migrantes secuestrados cerca de la frontera con EEUU | Republica.gt - republica.gt	https://republica.gt/2021/06/10/rescatan-en-mexico-a-140-migrantes-secuestrados-cerca-de-la-frontera-con-eeuu/	2021-06-10	Rescatan en México a 140 migrantes secuestrados cerca de la frontera con EEUURepublica.gt
Policía halla a más de 200 migrantes hacinados en el norte de México; entre el grupo hay guatemaltecos - Prensa Libre	https://www.prensalibre.com/guatemala/migrantes/policia-halla-a-mas-de-200-migrantes-hacinados-en-el-norte-de-mexico-entre-el-grupo-hay-guatemaltecos/	2021-06-10	Policía halla a más de 200 migrantes hacinados en el norte de México; entre el grupo hay guatemaltecos
¿Qué viene tras gira de Kamala Harris? La Casa Blanca planea presentar estrategia migratoria - Prensa Libre	https://www.prensalibre.com/internacional/que-viene-tras-gira-de-kamala-harris-la-casa-blanca-planea-presentar-estrategia-migratoria/	2021-06-10	¿Qué viene tras gira de Kamala Harris? La Casa Blanca planea presentar estrategia migratoria
Canadá ofrece a Estados Unidos reasentar a inmigrantes centroamericanos - Prensa Libre	https://www.prensalibre.com/internacional/canada-ofrece-a-estados-unidos-reasentar-a-inmigrantes-centroamericanos/	2021-06-10	Canadá ofrece a Estados Unidos reasentar a inmigrantes centroamericanos
La cumbre con el SICA y encuentro sobre migración, platos fuertes de la visita de Sánchez a Costa Rica - La Hora	https://lahora.gt/la-cumbre-con-el-sica-y-encuentro-sobre-migracion-platos-fuertes-de-la-visita-de-sanchez-a-costa-rica/	2021-06-10	La cumbre con el SICA y encuentro sobre migración, platos fuertes de la visita de Sánchez a Costa Rica
EE. UU. anuncia disponibilidad de US $57 millones para asistencia a desplazados - lahora.gt	https://lahora.gt/ee-uu-anuncia-disponibilidad-de-us-57-millones-para-asistencia-a-desplazados/	2021-06-10	EE. UU. anuncia disponibilidad de US $57 millones para asistencia a desplazados
Giammattei por migración: Hemos sido incapaces de dar soluciones - Soy502	https://www.soy502.com/articulo/giammattei-gente-no-va-porque-quiere-63338	2021-06-10	Giammattei por migración: Hemos sido incapaces de dar soluciones
Giammattei pide firmeza para desalentar migración irregular y responsabiliza a gobierno de Biden por creciente afluencia de migrantes - Prensa Libre	https://www.prensalibre.com/guatemala/migrantes/giammattei-pide-firmeza-para-desalentar-migracion-irregular-y-responsabiliza-a-gobierno-de-biden-por-creciente-afluencia-de-migrantes-breaking/	2021-06-10	Giammattei pide firmeza para desalentar migración irregular y responsabiliza a gobierno de Biden por creciente afluencia de migrantes
Giammattei exige a EE.UU. firmeza para desalentar migración - Soy502	https://www.soy502.com/articulo/giammattei-pide-eeuu-firmeza-desalentar-migracion-32419	2021-06-10	Giammattei exige a EE.UU. firmeza para desalentar migración
Giammattei pide a EE.UU. firmeza para desalentar la migración irregular - elPeriódico (Guatemala)	https://elperiodico.com.gt/nacionales/2021/06/10/giammattei-pide-a-ee-uu-firmeza-para-desalentar-la-migracion-irregular/	2021-06-10	Giammattei pide a EE.UU. firmeza para desalentar la migración irregular
La UE acusa a Marruecos de poner en riesgo vida de migrantes - La Hora	https://lahora.gt/la-ue-acusa-a-marruecos-de-poner-en-riesgo-vida-de-migrantes/	2021-06-11	La UE acusa a Marruecos de poner en riesgo vida de migrantes
Jefa de USAID viajará a Centroamérica para abordar migración - Publinews Guatemala	https://www.publinews.gt/gt/noticias/2021/06/11/jefa-de-usaid-viaje-a-centroamerica.html	2021-06-11	Jefa de USAID viajará a Centroamérica para abordar migración
Combatiendo la pobreza y la migración con Trabajo | Republica.gt - republica.gt	https://republica.gt/2021/06/11/combatiendo-la-pobreza-y-la-migracion-con-trabajo/	2021-06-11	Combatiendo la pobreza y la migración con TrabajoRepublica.gt
Jefa de Usaid visitará Guatemala para abordar las causas de la migración - republica.gt	https://republica.gt/2021/06/12/jefa-de-usaid-visitara-guatemala-para-abordar-las-causas-de-la-migracion/	2021-06-12	Jefa de Usaid visitará Guatemala para abordar las causas de la migración
Familias de migrantes de Comitancillo aún esperan ofrecimientos - elPeriódico (Guatemala)	https://elperiodico.com.gt/nacionales/2021/06/12/familias-de-migrantes-de-comitancillo-aun-esperan-ofrecimientos/	2021-06-12	Familias de migrantes de Comitancillo aún esperan ofrecimientos
"Estados Unidos explica su plan para una migración ""más humana"" - Soy502"	https://www.soy502.com/articulo/eeuu-migracion-debe-ser-manejada-perspectiva-mas-humana-101476	2021-06-12	"Estados Unidos explica su plan para una migración ""más humana"""
Universitaria celebra graduación con homenaje a sus padres migrantes | PERSPECTIVA - perspectiva.gt	https://www.perspectiva.gt/lifestyle/universitaria-celebra-graduacion-con-homenaje-a-sus-padres-migrantes/	2021-06-13	Universitaria celebra graduación con homenaje a sus padres migrantesPERSPECTIVA
Después de la visita de Kamala Harris: El reto es crear un plan de desarrollo integral que disminuya la migración - elPeriódico (Guatemala)	https://elperiodico.com.gt/noticias/domingo/2021/06/13/despues-de-la-visita-de-kamala-harris-el-reto-es-crear-un-plan-de-desarrollo-integral-que-disminuya-la-migracion/	2021-06-13	Después de la visita de Kamala Harris: El reto es crear un plan de desarrollo integral que disminuya la migración
Corrupción y migración – Prensa Libre - Prensa Libre	https://www.prensalibre.com/opinion/columnasdiarias/corrupcion-y-migracion/	2021-06-14	Corrupción y migración – 
Calor extremo amenaza a migrantes al sur de Estados Unidos - Soy502	https://www.soy502.com/articulo/calor-extremo-puede-afectar-paso-migrantes-sur-est-153	2021-06-14	Calor extremo amenaza a migrantes al sur de Estados Unidos
Honró a sus padres migrantes con fotos de graduación en el campo - Soy502	https://www.soy502.com/articulo/honro-sus-padres-migrantes-tras-graduarse-fotos-campo-153	2021-06-14	Honró a sus padres migrantes con fotos de graduación en el campo
Nueva ola de calor en EE. UU. podría causar la muerte a migrantes, según autoridades - republica.gt	https://republica.gt/2021/06/14/nueva-ola-de-calor-en-ee-uu-podria-causar-la-muerte-a-migrantes-segun-autoridades/	2021-06-14	Nueva ola de calor en EE. UU. podría causar la muerte a migrantes, según autoridades
La migración como llave del desarrollo - elPeriódico (Guatemala)	https://elperiodico.com.gt/opinion/opiniones-de-hoy/2021/06/14/la-migracion-como-llave-del-desarrollo/	2021-06-14	La migración como llave del desarrollo
Ola de calor en el desierto podría provocar muerte de migrantes según el MINEX - elPeriódico (Guatemala)	https://elperiodico.com.gt/nacionales/2021/06/14/ola-de-calor-en-el-desierto-podria-provocar-muerte-de-migrantes-segun-el-minex/	2021-06-14	Ola de calor en el desierto podría provocar muerte de migrantes según el MINEX
La migración como problema doméstico - La Hora	https://lahora.gt/la-migracion-como-problema-domestico/	2021-06-14	La migración como problema doméstico
Castro pide al Renap otorgar DPI gratuito a migrantes retornados vía terrestre - La Hora	https://lahora.gt/castro-pide-al-renap-otorgar-dpi-gratuito-a-migrantes-retornados-via-terrestre/	2021-06-14	Castro pide al Renap otorgar DPI gratuito a migrantes retornados vía terrestre
TSE alista el camino para empadronar a migrantes en EE.UU. y así puedan votar en 2023 - republica.gt	https://republica.gt/2021/06/15/tse-alista-camino-para-empadronar-a-migrantes-en-eeuu-y-puedan-votar-en-2023/	2021-06-15	TSE alista el camino para empadronar a migrantes en EE.UU. y así puedan votar en 2023
La propuesta de Guatemala a EE. UU. para atender la migración irregular - dca.gob.gt	https://dca.gob.gt/noticias-guatemala-diario-centro-america/la-propuesta-de-guatemala-a-ee-uu-para-atender-la-migracion-irregular/	2021-06-15	La propuesta de Guatemala a EE. UU. para atender la migración irregular
Desde Filadelfia, migrantes piden mejoras en sistema de emisión de pasaportes - La Hora	https://lahora.gt/desde-filadelfia-migrantes-piden-mejoras-en-sistema-de-emision-de-pasaportes/	2021-06-15	Desde Filadelfia, migrantes piden mejoras en sistema de emisión de pasaportes
Jennifer Rocha, migrante que se robó el corazón de todo Estados Unidos - Publinews Guatemala	https://www.publinews.gt/gt/noticias/2021/06/16/jennifer-rocha-la-migrante-que-se-robo-el-corazon-de-todo-estados-unidos.html	2021-06-16	Jennifer Rocha, migrante que se robó el corazón de todo Estados Unidos
La administración de Biden amplía el programa que permite la inmigración legal para menores centroamericanos | Republica.gt - republica.gt	https://republica.gt/2021/06/17/wall-street-journal-biden-programa-inmigracion-legal-centroamerica/	2021-06-16	La administración de Biden amplía el programa que permite la inmigración legal para menores centroamericanosRepublica.gt
Arrestan a 12 sospechosos de tráfico de migrantes y lavado de dinero | Republica.gt - republica.gt	https://republica.gt/2021/06/16/arrestan-a-12-sospechosos-de-trafico-de-migrantes-y-lavado-de-dinero/	2021-06-16	Arrestan a 12 sospechosos de tráfico de migrantes y lavado de dineroRepublica.gt
“Se despidió, me dijo adiós”: el dramático relato del hermano de migrante guatemalteco que murió en un lago de Nueva Jersey - Prensa Libre	https://www.prensalibre.com/guatemala/migrantes/se-despidio-me-dijo-adios-el-dramatico-relato-del-hermano-de-migrante-guatemalteco-que-murio-en-un-lago-de-nueva-jersey-breaking/	2021-06-16	“Se despidió, me dijo adiós”: el dramático relato del hermano de migrante guatemalteco que murió en un lago de Nueva Jersey
Se hunde barco con migrantes frente a Canarias; 4 muertos - La Hora	https://lahora.gt/se-hunde-barco-con-migrantes-frente-a-canarias-4-muertos/	2021-06-18	Se hunde barco con migrantes frente a Canarias; 4 muertos
Deportivo Xejuyup apuesta por frenar la migración - Soy502	https://www.soy502.com/articulo/futbol-maya-frenar-migracion-101476	2021-06-19	Deportivo Xejuyup apuesta por frenar la migración
Pese a su aporte crucial migrantes son relegados - Prensa Libre	https://www.prensalibre.com/opinion/editorial/pese-a-su-aporte-crucial-migrantes-son-relegados/	2021-06-19	Pese a su aporte crucial migrantes son relegados
Joven migrante guatemalteco se gradúa con honores en Nueva York - Soy502	https://www.soy502.com/articulo/migrante-guatemalteco-brilla-nueva-york-gradua-5313	2021-06-19	Joven migrante guatemalteco se gradúa con honores en Nueva York
Vacunarán a migrantes con visa temporal de trabajo en EE.UU. - Soy502	https://www.soy502.com/articulo/visas-temporales-empleadores-piden-vacunacion-optar-plaza-63338	2021-06-21	Vacunarán a migrantes con visa temporal de trabajo en EE.UU.
Panamá pide ayuda a EE.UU. para atender masivo ingreso de migrantes - elPeriódico (Guatemala)	https://elperiodico.com.gt/noticias/internacionales/2021/06/21/panama-pide-ayuda-a-ee-uu-para-atender-masivo-ingreso-de-migrantes/	2021-06-21	Panamá pide ayuda a EE.UU. para atender masivo ingreso de migrantes
Gobierno presenta estudio sobre migración – Noticias Última Hora de Guatemala - dca.gob.gt	https://dca.gob.gt/noticias-guatemala-diario-centro-america/gobierno-presenta-estudio-sobre-migracion/	2021-06-23	Gobierno presenta estudio sobre migración – Noticias Última Hora de Guatemala
Detienen en México a 240 migrantes indocumentados, 61 menores - Soy502	https://www.soy502.com/articulo/detienen-mexico-240-migrantes-indocumentados-61-menores-101475	2021-06-23	Detienen en México a 240 migrantes indocumentados, 61 menores
Melisa una migrante que busca promover la comida en casa desde YouTube - La Hora	https://lahora.gt/melisa-una-migrante-que-busca-promover-la-comida-en-casa-desde-youtube/	2021-06-23	Melisa una migrante que busca promover la comida en casa desde YouTube
Kamala Harris irá a un centro de detención de inmigrantes en su visita a la frontera de Texas | Republica.gt - republica.gt	https://republica.gt/2021/06/24/kamala-harris-va-a-centro-de-detencion-de-migrantes-en-texas/	2021-06-24	Kamala Harris irá a un centro de detención de inmigrantes en su visita a la frontera de TexasRepublica.gt
LA HORA SALUD: Desarrollo, salud y migración - La Hora	https://lahora.gt/desarrollo-salud-y-migracion/	2021-06-24	LA HORA SALUD: Desarrollo, salud y migración
Guatemala consolida la protección a los menores migrantes - dca.gob.gt	https://dca.gob.gt/noticias-guatemala-diario-centro-america/guatemala-consolida-la-proteccion-a-los-menores-migrantes/	2021-06-24	Guatemala consolida la protección a los menores migrantes
Kamala Harris se reúne con niñas migrantes de Centroamérica en un centro de detención en la frontera sur de EE. UU. - Prensa Libre	https://www.prensalibre.com/guatemala/migrantes/kamala-harris-se-reune-con-ninas-migrantes-de-centroamerica-en-un-centro-de-detencion-en-la-frontera-sur-de-ee-uu-breaking/	2021-06-25	Kamala Harris se reúne con niñas migrantes de Centroamérica en un centro de detención en la frontera sur de EE. UU.
Patrulla Fronteriza localiza a migrante guatemalteco inconsciente en Tucson - La Hora	https://lahora.gt/patrulla-fronteriza-localiza-a-migrante-guatemalteco-inconsciente-en-tucson/	2021-06-25	Patrulla Fronteriza localiza a migrante guatemalteco inconsciente en Tucson
"En frontera, Harris lamenta ""lucha interna"" por la migración - La Hora"	https://lahora.gt/en-frontera-harris-lamenta-lucha-interna-por-la-migracion/	2021-06-25	"En frontera, Harris lamenta ""lucha interna"" por la migración"
historias-de-migrantes-cruzando-la-frontera-con-Estados Unidos - republica.gt	https://republica.gt/2021/06/27/historias-de-migrantes-cruzando-la-frontera-con-ee-uu/	2021-06-27	historias-de-migrantes-cruzando-la-frontera-con-Estados Unidos
13 migrantes hondureños son detenidos en la zona 1 de la Ciudad | - republica.gt	https://republica.gt/2021/06/27/13-migrantes-hondurenos-son-detenidos-en-la-zona-1-de-la-ciudad/	2021-06-27	13 migrantes hondureños son detenidos en la zona 1 de la Ciudad |
Ubican a 12 migrantes hondureños que viajaban de manera irregular hacia EE. UU. - La Hora	https://lahora.gt/ubican-a-12-migrantes-hondurenos-que-viajaban-de-manera-irregular-hacia-ee-uu/	2021-06-27	Ubican a 12 migrantes hondureños que viajaban de manera irregular hacia EE. UU.
Interceptan a 13 migrantes hondureños en la zona 1 - elPeriódico (Guatemala)	https://elperiodico.com.gt/nacionales/2021/06/27/interceptan-a-13-migrantes-hondurenos-en-la-zona-1/	2021-06-27	Interceptan a 13 migrantes hondureños en la zona 1
Rescatan a 13 migrantes hondureños; hay dos guatemaltecos capturados - Publinews Guatemala	https://www.publinews.gt/gt/noticias/2021/06/27/rescatan-a-13-migrantes-hondurenos.html	2021-06-27	Rescatan a 13 migrantes hondureños; hay dos guatemaltecos capturados
Narcotráfico, maras, migración y pandemia – Prensa Libre - Prensa Libre	https://www.prensalibre.com/opinion/columnasdiarias/narcotrafico-maras-migracion-y-pandemia/	2021-06-28	Narcotráfico, maras, migración y pandemia – 
Se reduce cifra de niños migrantes en albergue más grande de Estados Unidos - La Hora	https://lahora.gt/se-reduce-cifra-de-ninos-migrantes-en-albergue-mas-grande-de-estados-unidos/	2021-06-28	Se reduce cifra de niños migrantes en albergue más grande de Estados Unidos
Guatemala de nuevo rompe récord de niños migrantes detenidos en la frontera sur de EE. UU. - Prensa Libre	https://www.prensalibre.com/guatemala/migrantes/guatemala-de-nuevo-rompe-record-de-ninos-migrantes-detenidos-en-la-frontera-sur-de-ee-uu/	2021-06-28	Guatemala de nuevo rompe récord de niños migrantes detenidos en la frontera sur de EE. UU.
El contenedor con donaciones de migrantes que perdió el Minex - Soy502	https://www.soy502.com/articulo/donacion-pidio-guatemala-termino-manos-iglesia-100931	2021-06-29	El contenedor con donaciones de migrantes que perdió el Minex
Estados Unidos cerrará 4 albergues de emergencia para niños migrantes - La Hora	https://lahora.gt/estados-unidos-cerrara-4-albergues-de-emergencia-para-ninos-migrantes/	2021-06-29	Estados Unidos cerrará 4 albergues de emergencia para niños migrantes
Campaña para luchar contra la migración forzada - Soy502	https://www.soy502.com/articulo/campana-luchar-contra-migracion-forzada-101337	2021-06-30	Campaña para luchar contra la migración forzada
Interceptan en Petén a 14 migrantes entre ellos cinco niños - elPeriódico (Guatemala)	https://elperiodico.com.gt/nacionales/2021/07/01/interceptan-en-peten-a-14-migrantes-entre-ellos-cinco-ninos/	2021-07-01	Interceptan en Petén a 14 migrantes entre ellos cinco niños
Casa de migrantes cierra por covid-19 y pone a cien en cuarentena en México | Republica.gt - republica.gt	https://republica.gt/2021/07/02/casa-de-migrantes-cierra-por-covid-19-y-pone-a-cien-en-cuarentena-en-mexico/	2021-07-02	Casa de migrantes cierra por covid-19 y pone a cien en cuarentena en MéxicoRepublica.gt
"Estados Unidos: Niños migrantes juegan y ven TV en albergue ""modelo"" - La Hora"	https://lahora.gt/estados-unidos-ninos-migrantes-juegan-y-ven-tv-en-albergue-modelo/	2021-07-02	"Estados Unidos: Niños migrantes juegan y ven TV en albergue ""modelo"""
México arresta a 53 migrantes en una vivienda en la frontera con EE.UU. | Republica.gt - republica.gt	https://republica.gt/2021/07/04/mexico-arresta-a-53-migrantes-en-una-vivienda-en-la-frontera-con-ee-uu/	2021-07-04	México arresta a 53 migrantes en una vivienda en la frontera con EE.UU.Republica.gt
Alejandro Mayorkas resalta que se debe combatir la corrupción, crimen organizado y trabajar por la migración lícita - Prensa Libre	https://www.prensalibre.com/guatemala/politica/alejandro-mayorkas-resalta-que-se-debe-combatir-la-corrupcion-crimen-organizado-y-trabajar-por-la-migracion-licita-breaking/	2021-07-06	Alejandro Mayorkas resalta que se debe combatir la corrupción, crimen organizado y trabajar por la migración lícita
SOSEP asiste a 380 familias migrantes – Noticias Última Hora de Guatemala - dca.gob.gt	https://dca.gob.gt/noticias-guatemala-diario-centro-america/sosep-asiste-a-380-familias-migrantes/	2021-07-06	SOSEP asiste a 380 familias migrantes – Noticias Última Hora de Guatemala
