title	link	date	title_corrected
Los trabajadores migrantes en el mundo aumentan un 3%, hasta 169 millones | Internacionales - 5dias.com.py	https://www.5dias.com.py/internacionales/los-trabajadores-migrantes-en-el-mundo-aumentan-un-3-hasta-169-millones	2021-06-30	Los trabajadores migrantes en el mundo aumentan un 3%, hasta 169 millonesInternacionales
Vacunación a extranjeros: deben tener tres meses de estancia en el país - Hoy	https://www.hoy.com.py/nacionales/vacunacion-a-extranjeros-deben-tener-tres-meses-de-estancia-en-el-pais	2021-07-01	Vacunación a extranjeros: deben tener tres meses de estancia en el país
Casa de migrantes cierra por covid-19 y pone a 100 en cuarentena en México - Mundo - ABC Color	https://www.abc.com.py/internacionales/2021/07/01/casa-de-migrantes-cierra-por-covid-19-y-pone-a-100-en-cuarentena-en-mexico/	2021-07-01	Casa de migrantes cierra por covid-19 y pone a 100 en cuarentena en MéxicoMundo
El sirio que huyó de la guerra y encontró desdicha en un campo de refugiados - Mundo - ABC Color	https://www.abc.com.py/internacionales/2021/07/03/el-sirio-que-huyo-de-la-guerra-y-encontro-desdicha-en-un-campo-de-refugiados/	2021-07-03	El sirio que huyó de la guerra y encontró desdicha en un campo de refugiadosMundo
Reino Unido endurecerá las penas contra los migrantes ilegales - La Nación	https://www.lanacion.com.py/mundo/2021/07/04/reino-unido-endurecera-las-penas-contra-los-migrantes-ilegales/	2021-07-04	Reino Unido endurecerá las penas contra los migrantes ilegales
El sueño roto de la nueva Ley Trans para los migrantes transgénero en España - Mundo - ABC Color	https://www.abc.com.py/internacionales/2021/07/04/el-sueno-roto-de-la-nueva-ley-trans-para-los-migrantes-transgenero-en-espana/	2021-07-04	El sueño roto de la nueva Ley Trans para los migrantes transgénero en EspañaMundo
El Ocean Viking, con 572 migrantes a bordo tras último y complicado rescate - Mundo - ABC Color	https://www.abc.com.py/internacionales/2021/07/05/el-ocean-viking-con-572-migrantes-a-bordo-tras-ultimo-y-complicado-rescate/	2021-07-05	El Ocean Viking, con 572 migrantes a bordo tras último y complicado rescateMundo
Aceleran procesos de validación de extranjeros para vacunación anticovid - Hoy	https://www.hoy.com.py/nacionales/aceleran-procesos-de-validacion-de-extranjeros-para-vacunacion-anticovid	2021-07-06	Aceleran procesos de validación de extranjeros para vacunación anticovid
Al menos doce migrantes mueren en Turquía en el accidente de un microbús - Mundo - ABC Color	https://www.abc.com.py/internacionales/2021/07/11/al-menos-doce-migrantes-mueren-en-turquia-en-el-accidente-de-un-microbus/	2021-07-11	Al menos doce migrantes mueren en Turquía en el accidente de un microbúsMundo
Guatemala se prepara para posible caravana migrante a finales de julio - Mundo - ABC Color	https://www.abc.com.py/internacionales/2021/07/13/guatemala-se-prepara-para-posible-caravana-migrante-a-finales-de-julio/	2021-07-13	Guatemala se prepara para posible caravana migrante a finales de julioMundo
El equipo olímpico de refugiados, una “fuente de inspiración” - La Nación.com.py	https://www.lanacion.com.py/reportaje/2021/07/14/el-equipo-olimpico-de-refugiados-una-fuente-de-inspiracion/	2021-07-14	El equipo olímpico de refugiados, una “fuente de inspiración”
Unos 2.000 migrantes, muchos haitianos, siguen varados en sureste de México - Mundo - ABC Color	https://www.abc.com.py/internacionales/2021/07/15/unos-2000-migrantes-muchos-haitianos-siguen-varados-en-sureste-de-mexico/	2021-07-15	Unos 2.000 migrantes, muchos haitianos, siguen varados en sureste de MéxicoMundo
Exigirán 5 días de cuarentena más PCR negativa a toda persona que llegue del extranjero - La Nación	https://www.lanacion.com.py/pais/2021/07/17/exigiran-5-dias-de-cuarentena-mas-pcr-negativa-a-toda-persona-que-llegue-del-extranjero/	2021-07-17	Exigirán 5 días de cuarentena más PCR negativa a toda persona que llegue del extranjero
Policía de Guatemala localiza en contenedor a 145 migrantes con rumbo a EEUU - Mundo - ABC Color	https://www.abc.com.py/internacionales/2021/07/17/policia-de-guatemala-localiza-en-contenedor-a-145-migrantes-con-rumbo-a-eeuu/	2021-07-17	Policía de Guatemala localiza en contenedor a 145 migrantes con rumbo a EEUUMundo
Lukashenko dice no está obligado a proteger a la UE de flujo de inmigrantes - Mundo - ABC Color	https://www.abc.com.py/internacionales/2021/07/20/lukashenko-dice-no-esta-obligado-a-proteger-a-la-ue-de-flujo-de-inmigrantes/	2021-07-20	Lukashenko dice no está obligado a proteger a la UE de flujo de inmigrantesMundo
Los refugiados de la salud pública - independiente.com.py	https://independiente.com.py/los-refugiados-de-la-salud-publica/	2021-07-20	Los refugiados de la salud pública
Vacunación: habilitan registro para extranjeros y certificado para adolescentes - La Nación.com.py	https://www.lanacion.com.py/pais/2021/07/20/vacunacion-habilitan-registro-para-extranjeros-y-certificado-para-adolescentes/	2021-07-20	Vacunación: habilitan registro para extranjeros y certificado para adolescentes
Alertan de un barco con unos cien migrantes en riesgo cerca de Malta - Mundo - ABC Color	https://www.abc.com.py/internacionales/2021/07/21/alertan-de-un-barco-con-unos-cien-migrantes-en-riesgo-cerca-de-malta/	2021-07-21	Alertan de un barco con unos cien migrantes en riesgo cerca de MaltaMundo
Delegación extranjera dice que se retira tras expulsión, pero advierten a Abdo que volverán - Nacionales - ABC Color	https://www.abc.com.py/nacionales/2021/07/23/delegacion-extranjera-dice-que-se-retira-tras-expulsion-pero-advierten-a-abdo-que-volveran/	2021-07-23	Delegación extranjera dice que se retira tras expulsión, pero advierten a Abdo que volveránNacionales
Expulsan a activistas extranjeros por intentar ingresar a zona EPP - independiente.com.py	https://independiente.com.py/expulsan-a-activistas-extranjeros-por-intentar-ingresar-a-zona-epp/	2021-07-24	Expulsan a activistas extranjeros por intentar ingresar a zona EPP
Expulsan a activistas extranjeros del país, pero ellos adelantan que regresarán - ÚltimaHora.com	https://www.ultimahora.com/expulsan-activistas-extranjeros-del-pais-pero-ellos-adelantan-que-regresaran-n2952672.html	2021-07-24	Expulsan a activistas extranjeros del país, pero ellos adelantan que regresarán
Arrestados 286 sospechosos de traficar con migrantes en operación de interpol - Mundo - ABC Color	https://www.abc.com.py/internacionales/2021/07/26/arrestados-286-sospechosos-de-traficar-con-migrantes-en-operacion-de-interpol/	2021-07-26	Arrestados 286 sospechosos de traficar con migrantes en operación de interpolMundo
EEUU atribuye inmigración indocumentada a violencia, pobreza, y desastres - Mundo - ABC Color	https://www.abc.com.py/internacionales/2021/07/27/eeuu-atribuye-inmigracion-indocumentada-a-violencia-pobreza-y-desastres/	2021-07-27	EEUU atribuye inmigración indocumentada a violencia, pobreza, y desastresMundo
Las lluvias dejan 14 muertos y 5.000 rohinyás desplazados en Bangladesh - Mundo - ABC Color	https://www.abc.com.py/internacionales/2021/07/28/las-lluvias-dejan-14-muertos-y-5000-rohinyas-desplazados-en-bangladesh/	2021-07-28	Las lluvias dejan 14 muertos y 5.000 rohinyás desplazados en BangladeshMundo
Turquía blinda su frontera con Irán para detener a refugiados afganos - Mundo - ABC Color	https://www.abc.com.py/internacionales/2021/07/28/turquia-blinda-su-frontera-con-iran-para-detener-a-refugiados-afganos/	2021-07-28	Turquía blinda su frontera con Irán para detener a refugiados afganosMundo
Congreso de EE.UU. aprueba 2.100 millones para seguridad y refugiados afganos - Mundo - abc.com.py	https://www.abc.com.py/internacionales/2021/07/29/congreso-de-eeuu-aprueba-2100-millones-para-seguridad-y-refugiados-afganos/	2021-07-29	Congreso de EE.UU. aprueba 2.100 millones para seguridad y refugiados afganosMundo
Colombia considera obligación epidemiológica vacunar a migrantes venezolanos - Mundo - abc.com.py	https://www.abc.com.py/internacionales/2021/07/29/colombia-considera-obligacion-epidemiologica-vacunar-a-migrantes-venezolanos/	2021-07-29	Colombia considera obligación epidemiológica vacunar a migrantes venezolanosMundo
La población extranjera en Chile aumentó un 0,8 % en 2020 - Mundo - abc.com.py	https://www.abc.com.py/internacionales/2021/07/29/la-poblacion-extranjera-en-chile-aumento-un-08-en-2020/	2021-07-29	La población extranjera en Chile aumentó un 0,8 % en 2020Mundo
Consideran justa la medida de admitir extranjeros sin visa por 90 días | Locales - 5dias.com.py	https://www.5dias.com.py/locales/consideran-justa-la-medida-de-admitir-extranjeros-sin-visa-por-90-dias	2021-07-29	Consideran justa la medida de admitir extranjeros sin visa por 90 díasLocales
Colombia pide acción regional ante crisis migratoria en frontera con Panamá - Mundo - ABC Color	https://www.abc.com.py/internacionales/2021/07/29/colombia-pide-accion-regional-ante-crisis-migratoria-en-frontera-con-panama/	2021-07-29	Colombia pide acción regional ante crisis migratoria en frontera con PanamáMundo
Realizan jornada de regularización migratoria en PJC - Hoy - Noticas de Paraguay y el Mundo.	https://www.hoy.com.py/nacionales/migraciones-realiza-jornada-de-regularizacion-migratoria-en-pjc	2021-07-29	Realizan jornada de regularización migratoria en PJCHoy
Casa Blanca presenta plan para abordar la migración desde Centroamérica - Mundo - ABC Color	https://www.abc.com.py/internacionales/2021/07/29/casa-blanca-presenta-plan-para-abordar-la-migracion-desde-centroamerica/	2021-07-29	Casa Blanca presenta plan para abordar la migración desde CentroaméricaMundo
La OEA advierte que la migración venezolana puede superar la de Siria en 2022 - Mundo - ABC Color	https://www.abc.com.py/internacionales/2021/07/29/la-oea-advierte-que-la-migracion-venezolana-puede-superar-la-de-siria-en-2022/	2021-07-29	La OEA advierte que la migración venezolana puede superar la de Siria en 2022Mundo
Sancionan proyecto que suprime visas para extranjeros - independiente.com.py	https://independiente.com.py/sancionan-proyecto-que-suprime-visas-para-extranjeros/	2021-07-29	Sancionan proyecto que suprime visas para extranjeros
Blinken agradece a Ebrard esfuerzos de México ante la inmigración irregular - Mundo - ABC Color	https://www.abc.com.py/internacionales/2021/07/29/blinken-agradece-a-ebrard-esfuerzos-de-mexico-ante-la-inmigracion-irregular/	2021-07-29	Blinken agradece a Ebrard esfuerzos de México ante la inmigración irregularMundo
Opositor venezolano pide a Canadá acoger a boxeador de equipo de refugiados - Polideportivo - ABC Color	https://www.abc.com.py/deportes/polideportivo/2021/07/28/opositor-venezolano-pide-a-canada-acoger-a-boxeador-de-equipo-de-refugiados/	2021-07-29	Opositor venezolano pide a Canadá acoger a boxeador de equipo de refugiadosPolideportivo
Defensor de migrantes: Guatemala se ha convertido en un muro contra caravanas - Mundo - ABC Color	https://www.abc.com.py/internacionales/2021/07/30/defensor-de-migrantes-guatemala-se-ha-convertido-en-un-muro-contra-caravanas/	2021-07-30	Defensor de migrantes: Guatemala se ha convertido en un muro contra caravanasMundo
Piden a Honduras sancionar la trata de personas, ligada a la migración - Mundo - ABC Color	https://www.abc.com.py/internacionales/2021/07/30/piden-a-honduras-sancionar-la-trata-de-personas-ligada-a-la-migracion/	2021-07-30	Piden a Honduras sancionar la trata de personas, ligada a la migraciónMundo
Venezolana Carmen Navas hace visibles a migrantes en pasarela de Colombiamoda - Mundo - ABC Color	https://www.abc.com.py/internacionales/2021/07/29/venezolana-carmen-navas-hace-visibles-a-migrantes-en-pasarela-de-colombiamoda/	2021-07-30	Venezolana Carmen Navas hace visibles a migrantes en pasarela de ColombiamodaMundo
"Opositores venezolanos piden ""mayor esfuerzo"" en la protección de migrantes - Mundo - ABC Color"	https://www.abc.com.py/internacionales/2021/07/30/opositores-venezolanos-piden-mayor-esfuerzo-en-la-proteccion-de-migrantes/	2021-07-30	"Opositores venezolanos piden ""mayor esfuerzo"" en la protección de migrantesMundo"
El Gobierno de EEUU demanda a Texas por prohibir transportar a inmigrantes - Mundo - ABC Color	https://www.abc.com.py/internacionales/2021/07/30/el-gobierno-de-eeuu-demanda-a-texas-por-prohibir-transportar-a-inmigrantes/	2021-07-30	El Gobierno de EEUU demanda a Texas por prohibir transportar a inmigrantesMundo
Panamá y Colombia hablan sobre la necesidad de coordinar paso de migrantes - Mundo - ABC Color	https://www.abc.com.py/internacionales/2021/07/29/panama-y-colombia-hablan-sobre-la-necesidad-de-coordinar-paso-de-migrantes/	2021-07-30	Panamá y Colombia hablan sobre la necesidad de coordinar paso de migrantesMundo
Llega a EE.UU. un primer grupo de refugiados afganos en riesgo tras la guerra - Mundo - ABC Color	https://www.abc.com.py/internacionales/2021/07/30/llega-a-eeuu-un-primer-grupo-de-refugiados-afganos-en-riesgo-tras-la-guerra/	2021-07-30	Llega a EE.UU. un primer grupo de refugiados afganos en riesgo tras la guerraMundo
Los refugiados se suben a un tatami olímpico con sueños y denuncias - Polideportivo - ABC Color	https://www.abc.com.py/deportes/polideportivo/2021/07/30/los-refugiados-se-suben-a-un-tatami-olimpico-con-suenos-y-denuncias/	2021-07-30	Los refugiados se suben a un tatami olímpico con sueños y denunciasPolideportivo
Los migrantes haitianos, los rezagados en vacunación en el sureste de México - Mundo - ABC Color	https://www.abc.com.py/internacionales/2021/07/30/los-migrantes-haitianos-los-rezagados-en-vacunacion-en-el-sureste-de-mexico/	2021-07-31	Los migrantes haitianos, los rezagados en vacunación en el sureste de MéxicoMundo
La frontera colombo-panameña: un problema de fondo para la migración - Mundo - ABC Color	https://www.abc.com.py/internacionales/2021/07/31/la-frontera-colombo-panamena-un-problema-de-fondo-para-la-migracion/	2021-07-31	La frontera colombo-panameña: un problema de fondo para la migraciónMundo
ICE asumirá casos de migrantes por saturación en centros fronterizos de EEUU - Mundo - ABC Color	https://www.abc.com.py/internacionales/2021/08/01/ice-asumira-casos-de-migrantes-por-saturacion-en-centros-fronterizos-de-eeuu/	2021-08-01	ICE asumirá casos de migrantes por saturación en centros fronterizos de EEUUMundo
Presidente de Colombia insta a Panamá a resolver juntos la crisis migratoria - Mundo - ABC Color	https://www.abc.com.py/internacionales/2021/08/01/presidente-de-colombia-insta-a-panama-a-resolver-juntos-la-crisis-migratoria/	2021-08-01	Presidente de Colombia insta a Panamá a resolver juntos la crisis migratoriaMundo
Más de 400 migrantes rescatados en el Mediterráneo - La Nación	https://www.lanacion.com.py/mundo/2021/08/01/mas-de-400-migrantes-rescatados-en-el-mediterraneo/	2021-08-01	Más de 400 migrantes rescatados en el Mediterráneo
EE.UU. amplía su programa de refugiados afganos, pero con muchas limitaciones - Mundo - ABC Color	https://www.abc.com.py/internacionales/2021/08/02/eeuu-amplia-su-programa-de-refugiados-afganos-pero-con-muchas-limitaciones/	2021-08-02	EE.UU. amplía su programa de refugiados afganos, pero con muchas limitacionesMundo
Interceptados 1.111 migrantes frente a la costa libia en la última semana - Mundo - abc.com.py	https://www.abc.com.py/internacionales/2021/08/02/interceptados-1111-migrantes-frente-a-la-costa-libia-en-la-ultima-semana/	2021-08-02	Interceptados 1.111 migrantes frente a la costa libia en la última semanaMundo
Policía colombiana captura a 5 personas por tráfico de 99 migrantes haitianos - Mundo - ABC Color	https://www.abc.com.py/internacionales/2021/08/02/policia-colombiana-captura-a-5-personas-por-trafico-de-99-migrantes-haitianos/	2021-08-02	Policía colombiana captura a 5 personas por tráfico de 99 migrantes haitianosMundo
Panamá convoca reunión regional para abordar creciente ola migratoria - Mundo - ABC Color	https://www.abc.com.py/internacionales/2021/08/02/panama-convoca-reunion-regional-para-abordar-creciente-ola-migratoria/	2021-08-02	Panamá convoca reunión regional para abordar creciente ola migratoriaMundo
El plan de EEUU para Centroamérica abarca gestión y vías legales de migración - Mundo - ABC Color	https://www.abc.com.py/internacionales/2021/08/03/el-plan-de-eeuu-para-centroamerica-abarca-gestion-y-vias-legales-de-migracion/	2021-08-03	El plan de EEUU para Centroamérica abarca gestión y vías legales de migraciónMundo
Primera dama de Honduras viajó a EEUU para conocer situación de migrantes - Mundo - ABC Color	https://www.abc.com.py/internacionales/2021/08/02/primera-dama-de-honduras-viajo-a-eeuu-para-conocer-situacion-de-migrantes/	2021-08-03	Primera dama de Honduras viajó a EEUU para conocer situación de migrantesMundo
Llegan a Lampedusa 424 migrantes mientras más de 800 esperan en barcos de ONG - Mundo - ABC Color	https://www.abc.com.py/internacionales/2021/08/03/llegan-a-lampedusa-424-migrantes-mientras-mas-de-800-esperan-en-barcos-de-ong/	2021-08-03	Llegan a Lampedusa 424 migrantes mientras más de 800 esperan en barcos de ONGMundo
Estudio advierte peligro para inmigrantes en Ecuador si regresan a sus países - Mundo - ABC Color	https://www.abc.com.py/internacionales/2021/08/03/estudio-advierte-peligro-para-inmigrantes-en-ecuador-si-regresan-a-sus-paises/	2021-08-03	Estudio advierte peligro para inmigrantes en Ecuador si regresan a sus paísesMundo
El “odio” hacia los migrantes venezolanos se apodera de América Latina - La Nación	https://www.lanacion.com.py/reportaje/2021/05/15/el-odio-hacia-los-migrantes-venezolanos-se-apodera-de-america-latina/	2021-05-15	El “odio” hacia los migrantes venezolanos se apodera de América Latina
