title	link	date	title_corrected
Enfrentamientos en campo de refugiados de Jerusalén avivan tensión israelo-palestina - Prensa Libre	https://www.prensalibre.com/internacional/enfrentamientos-campo-refugiados-jerusalen-estado-alerta-0-1244275672/	2014-11-07	Enfrentamientos en campo de refugiados de Jerusalén avivan tensión israelo-palestina
Zaid, el niño refugiado conoció a su ídolo Cristiano Ronaldo - Prensa Libre	https://www.prensalibre.com/deportes/futbol-internacional/zaid-el-nio-refugiado-conocio-a-su-idolo-cristiano-ronaldo/	2015-09-18	Zaid, el niño refugiado conoció a su ídolo Cristiano Ronaldo
Niño refugiado completa su sueño con Real Madrid y Cristiano Ronaldo - Soy502	https://www.soy502.com/articulo/nino-refugiado-completa-sueno-real-madrid-cristiano-ronaldo	2015-09-19	Niño refugiado completa su sueño con Real Madrid y Cristiano Ronaldo
Mueren 12 migrantes por nuevo naufragio en Turquía - Prensa Libre	https://www.prensalibre.com/internacional/mueren-12-migrantes-por-nuevo-naufragio-en-turquia/	2015-10-17	Mueren 12 migrantes por nuevo naufragio en Turquía
Centroamérica vive crisis de refugiados a causa de la violencia, advierte ACNUR - Prensa Libre	https://www.prensalibre.com/guatemala/migrantes/centroamerica-vive-crisis-de-refugiados-a-causa-de-la-violencia-advierte-acnur/	2015-10-28	Centroamérica vive crisis de refugiados a causa de la violencia, advierte ACNUR
Gustavo Alejos asegura que estuvo refugiado en su vivienda - Soy502	https://www.soy502.com/articulo/gustavo-alejos-asegura-siempre-estuvo-refugiado-vivienda	2015-12-28	Gustavo Alejos asegura que estuvo refugiado en su vivienda
Niño de 2 años, primer migrante muerto ahogado en el mar Egeo en 2016 - Prensa Libre	https://www.prensalibre.com/internacional/nio-de-2-aos-primer-migrante-muerto-ahogado-en-el-mar-egeo-en-2016/	2016-01-03	Niño de 2 años, primer migrante muerto ahogado en el mar Egeo en 2016
El invierno agrava penurias de los niños inmigrantes en Europa - Prensa Libre	https://www.prensalibre.com/internacional/el-invierno-agrava-penurias-de-los-nios-inmigrantes-en-europa/	2016-01-19	El invierno agrava penurias de los niños inmigrantes en Europa
Mueren 44 refugiados en nuevos naufragios en el mar Egeo - Prensa Libre	https://www.prensalibre.com/internacional/mueren-21-refugiados-en-2-nuevos-naufragios-en-el-mar-egeo/	2016-01-22	Mueren 44 refugiados en nuevos naufragios en el mar Egeo
Nadadora refugiada siria acapara los focos en la piscina olímpica de Río - La Hora	https://lahora.gt/nadadora-refugiada-siria-acapara-los-focos-la-piscina-olimpica-rio/	2016-08-06	Nadadora refugiada siria acapara los focos en la piscina olímpica de Río
Guatemalteco da su casa para refugiar a migrantes - Prensa Libre	https://www.prensalibre.com/guatemala/migrantes/guatemalteco-da-su-casa-como-refugio-para-migrantes/	2016-12-06	Guatemalteco da su casa para refugiar a migrantes
El niño refugiado afgano fan de Messi conoce a su ídolo en Qatar - Prensa Libre	https://www.prensalibre.com/deportes/futbol-internacional/el-nio-refugiado-afgano-fan-de-messi-conoce-a-su-idolo-en-qatar/	2016-12-13	El niño refugiado afgano fan de Messi conoce a su ídolo en Qatar
Trump actuará ya en seguridad fronteriza y migración - Prensa Libre	https://www.prensalibre.com/internacional/trump-actuara-ya-en-seguridad-fronteriza-y-migracion/	2017-01-24	Trump actuará ya en seguridad fronteriza y migración
Alemania acelerará las expulsiones de inmigrantes - Publinews Guatemala	https://www.publinews.gt/gt/noticias/2017/02/10/alemania-acelerara-expulsiones-inmigrantes.html	2017-02-10	Alemania acelerará las expulsiones de inmigrantes
Ai Weiwei lleva la crisis de los refugiados a Praga - La Hora	https://lahora.gt/ai-weiwei-lleva-la-crisis-los-refugiados-praga/	2017-03-17	Ai Weiwei lleva la crisis de los refugiados a Praga
Alejandro Sanz diseña silla para ayudar a los refugiados - Prensa Libre	https://www.prensalibre.com/vida/escenario/alejandro-sanz-disea-silla-para-ayudar-a-los-refugiados/	2017-07-13	Alejandro Sanz diseña silla para ayudar a los refugiados
Cuatro migrantes guatemaltecos mueren al intentar cruzar río en México - aldia.com.gt	https://aldia.com.gt/2017/07/25/cuatro-migrantes-guatemaltecos-mueren-al-intentar-cruzar-rio-en-mexico/	2017-07-25	Cuatro migrantes guatemaltecos mueren al intentar cruzar río en México
Cuatro migrantes guatemaltecos mueren al intentar cruzar de México a EE. UU. - Publinews Guatemala	https://www.publinews.gt/gt/noticias/2017/07/25/cuatro-migrantes-guatemaltecos-mueren-al-intentar-cruzar-mexico-ee-uu.html	2017-07-25	Cuatro migrantes guatemaltecos mueren al intentar cruzar de México a EE. UU.
Cinco departamentos de Guatemala reportan más índices de migración - Publinews Guatemala	https://www.publinews.gt/gt/noticias/2017/07/27/cinco-departamentos-de-guatemala-reportan-mas-indices-de-migracion.html	2017-07-27	Cinco departamentos de Guatemala reportan más índices de migración
Familias refugiadas en Chiapas continúan sin esperanza de volver al país - Prensa Libre	https://www.prensalibre.com/ciudades/huehuetenango/sigue-dilema-para-las-74-familias-refugiadas-de-yalcastan/	2017-07-27	Familias refugiadas en Chiapas continúan sin esperanza de volver al país
Cada año pasan 400 mil migrantes por Guatemala - Prensa Libre	https://www.prensalibre.com/guatemala/migrantes/refugiados-acnur-migrantes-onu-asilo/	2017-08-02	Cada año pasan 400 mil migrantes por Guatemala
Carta a mi tía Helena, migrante en Rhode Island - Soy502	https://www.soy502.com/articulo/querida-tia-helena-carta-migrante-rhode-island-149	2017-10-17	Carta a mi tía Helena, migrante en Rhode Island
EE. UU. permitirá la entrada de refugiados guatemaltecos - Prensa Libre	https://www.prensalibre.com/guatemala/migrantes/ee-uu-permitira-la-entradad-de-refugiados-guatemaltecos/	2017-10-24	EE. UU. permitirá la entrada de refugiados guatemaltecos
Abren oficina de apoyo a migrantes en La Ruidosa - Prensa Libre	https://www.prensalibre.com/ciudades/izabal/abren-oficina-de-apoyo-a-migrantes-en-la-ruidosa/	2017-10-30	Abren oficina de apoyo a migrantes en La Ruidosa
Mabil de jugar en los campos de refugiados a la élite, ahora busca ayudar a niños y jóvenes - Prensa Libre	https://www.prensalibre.com/deportes/futbol-internacional/mabil-de-jugar-en-los-campos-de-refugiados-a-la-elite-ahora-busca-ayudar-a-nios-y-jovenes/	2017-11-08	Mabil de jugar en los campos de refugiados a la élite, ahora busca ayudar a niños y jóvenes
Esclavitud, cautiverio y torturas: La pesadilla de los migrantes en Libia - elPeriódico (Guatemala)	https://elperiodico.com.gt/noticias/domingo/2017/12/03/esclavitud-cautiverio-y-torturas-la-pesadilla-de-los-migrantes-en-libia/	2017-12-03	Esclavitud, cautiverio y torturas: La pesadilla de los migrantes en Libia
Interceptan en Guatemala a 13 migrantes indocumentados de Nepal - Publinews Guatemala	https://www.publinews.gt/gt/noticias/2018/02/06/localizan-escuintla-13-ciudadanos-nepalies-no-portaban-documentos.html	2018-02-06	Interceptan en Guatemala a 13 migrantes indocumentados de Nepal
Guatemala rechaza agresión a migrantes guatemaltecos en EE. UU. - dca.gob.gt	https://dca.gob.gt/noticias-guatemala-diario-centro-america/guatemala-rechaza-agresion-a-migrantes-guatemaltecos-en-ee-uu/	2018-05-25	Guatemala rechaza agresión a migrantes guatemaltecos en EE. UU.
Comentario racista contra migrante asesinada se hace viral - aldia.com.gt	http://aldia.com.gt/2018/05/26/comentario-racista-contra-migrante-asesinada-se-hace-viral/	2018-05-26	Comentario racista contra migrante asesinada se hace viral
ONU: niños inmigrantes no deben ser separados de sus padres en frontera entre Estados Unidos y México - elPeriódico (Guatemala)	https://elperiodico.com.gt/nacionales/2018/06/18/onu-ninos-inmigrantes-no-deben-ser-separados-de-sus-padres-en-frontera-entre-estados-unidos-y-mexico/	2018-06-18	ONU: niños inmigrantes no deben ser separados de sus padres en frontera entre Estados Unidos y México
¿Qué está pasando en Texas? Eso es lo que sabemos de los niños migrantes que están siendo separados de sus familias - nomada.gt	https://nomada.gt/identidades/guatemala-rural/que-esta-pasando-en-la-frontera-eso-es-lo-que-sabemos-de-los-ninos-migrantes-que-estan-siendo-separados-de-sus-familias/	2018-06-19	¿Qué está pasando en Texas? Eso es lo que sabemos de los niños migrantes que están siendo separados de sus familias
Guatemala condena política migratoria EE. UU. que “destruye” unidad familiar - aldia.com.gt	https://aldia.com.gt/2018/06/20/guatemala-condena-politica-migratoria-ee-uu-que-destruye-unidad-familiar/	2018-06-20	Guatemala condena política migratoria EE. UU. que “destruye” unidad familiar
Hay 16000 niños migrantes de los que el Gobierno de Guatemala no conoce ni su nombre - nomada.gt	https://nomada.gt/identidades/guatemala-rural/hay-16000-ninos-migrantes-de-los-que-el-gobierno-de-guatemala-no-conoce-ni-su-nombre/	2018-06-21	Hay 16000 niños migrantes de los que el Gobierno de Guatemala no conoce ni su nombre
Luka Modrić pasó de ser un refugiado de guerra al mejor jugador del Mundial - Publinews Guatemala	https://www.publinews.gt/gt/deportes/2018/07/15/luka-modric-balon-oro-del-mundial-rusia-2018.html	2018-07-15	Luka Modrić pasó de ser un refugiado de guerra al mejor jugador del Mundial
Inmigración: 6 estados y Nueva York demandan a gobierno federal - Publinews Guatemala	https://www.publinews.gt/gt/noticias/2018/07/18/inmigracion-6-estados-ny-demandan-gobierno-federal.html	2018-07-18	Inmigración: 6 estados y Nueva York demandan a gobierno federal
OIM presenta en Guatemala una guía para la atención psicosocial de migrantes - dca.gob.gt	https://dca.gob.gt/noticias-guatemala-diario-centro-america/oim-presenta-en-guatemala-una-guia-para-la-atencion-psicosocial-de-migrantes/	2018-07-19	OIM presenta en Guatemala una guía para la atención psicosocial de migrantes
Primera dama ofrece apoyo a migrantes – Noticias Última Hora de Guatemala - dca.gob.gt	https://dca.gob.gt/noticias-guatemala-diario-centro-america/primera-dama-ofrece-apoyo-a-migrantes/	2018-07-30	Primera dama ofrece apoyo a migrantes – Noticias Última Hora de Guatemala
Ben Stiller cuenta la historia de familia salvadoreña refugiada en Guatemala - elPeriódico (Guatemala)	https://elperiodico.com.gt/nacionales/2018/08/04/ben-stiller-cuenta-la-historia-de-familia-salvadorena-refugiada-en-guatemala/	2018-08-04	Ben Stiller cuenta la historia de familia salvadoreña refugiada en Guatemala
Guatemala está preparada para recibir migrantes de Nicaragua | Republica.gt - republica.gt	https://republica.gt/2018/08/23/guatemala-migrantes-de-nicaragua-crisis/	2018-08-23	Guatemala está preparada para recibir migrantes de NicaraguaRepublica.gt
Reportan secuestro de migrantes guatemaltecos en México – Noticias Última Hora de Guatemala - dca.gob.gt	https://dca.gob.gt/noticias-guatemala-diario-centro-america/reportan-secuestro-de-migrantes-guatemaltecos-en-mexico/	2018-08-25	Reportan secuestro de migrantes guatemaltecos en México – Noticias Última Hora de Guatemala
Eduardo Stein, será nombrado representante de la ONU para refugiados y migrantes venezolanos - elPeriódico (Guatemala)	https://elperiodico.com.gt/nacionales/2018/09/12/eduardo-stein-sera-nombrado-representante-de-la-onu-para-refugiados-y-migrantes-venezolanos/	2018-09-12	Eduardo Stein, será nombrado representante de la ONU para refugiados y migrantes venezolanos
Eduardo Stein será representante de la ONU para los refugiados y migrantes venezolanos - Prensa Libre	https://www.prensalibre.com/internacional/eduardo-stein-sera-representante-de-la-onu-para-los-refugiados-y-migrantes-venezolanos/	2018-09-19	Eduardo Stein será representante de la ONU para los refugiados y migrantes venezolanos
Eduardo Stein mediará en crisis de migrantes y refugiados de Venezuela | Republica.gt - republica.gt	https://republica.gt/2018/09/19/eduardo-stein-crisis-migrantes-refugiados-venezuela/	2018-09-19	Eduardo Stein mediará en crisis de migrantes y refugiados de VenezuelaRepublica.gt
Venezuela creará policía migratoria por conflictos en fronteras | Republica.gt - republica.gt	https://republica.gt/2018/10/06/venezuela-creara-policia-migratoria-por-conflictos-en-fronteras/	2018-10-06	Venezuela creará policía migratoria por conflictos en fronterasRepublica.gt
3 claves para entender por qué miles de migrantes hondureños llegaron a Guatemala - nomada.gt	https://nomada.gt/pais/actualidad/3-claves-para-entender-por-que-miles-de-migrantes-hondurenos-llegaron-hoy-a-guatemala/	2018-10-15	3 claves para entender por qué miles de migrantes hondureños llegaron a Guatemala
Resumen del día: El plan b para sustituir a la CICIG, migrantes en caravana y un partido que respira - nomada.gt	https://nomada.gt/pais/actualidad/resumen-del-dia-el-plan-b-para-sustituir-a-la-cicig-migrantes-en-caravana-y-un-partido-que-respira/	2018-10-15	Resumen del día: El plan b para sustituir a la CICIG, migrantes en caravana y un partido que respira
“Hoy son hondureños, mañana serán guatemaltecos o salvadoreños”, señalan analistas sobre caravana de migrantes - Publinews Guatemala	https://www.publinews.gt/gt/noticias/2018/10/18/analisis-migracion-irregular-hacia-estados-unidos-caravana-migrantes-hondurenos.html	2018-10-18	“Hoy son hondureños, mañana serán guatemaltecos o salvadoreños”, señalan analistas sobre caravana de migrantes
Acuerdo preliminar entre México y EE. UU. para atender caravana migrante - Prensa Libre	https://www.prensalibre.com/guatemala/migrantes/acuerdo-preliminar-entre-mexico-y-ee-uu-para-caravana-migrante/	2018-10-18	Acuerdo preliminar entre México y EE. UU. para atender caravana migrante
México permitirá el paso de caravana de migrantes hondureños - Publinews Guatemala	https://www.publinews.gt/gt/noticias/2018/10/19/mexico-permitira-paso-caravana-migrantes-hondurenos.html	2018-10-19	México permitirá el paso de caravana de migrantes hondureños
Miles de hondureños reanudan en México caravana migrante hacia EE.UU. - Publinews Guatemala	https://www.publinews.gt/gt/noticias/2018/10/21/hondurenos-reanudan-mexico-caravana-migrante-hacia-eeuu.html	2018-10-21	Miles de hondureños reanudan en México caravana migrante hacia EE.UU.
Joven migrante murió en México al caerse de un tráiler - Publinews Guatemala	https://www.publinews.gt/gt/noticias/2018/10/22/joven-migrante-murio-mexico-al-caerse-trailer-hoy-22-octubre-2018.html	2018-10-22	Joven migrante murió en México al caerse de un tráiler
La migración se convertirá uno de los problemas globales definitorios del siglo XXI - Publinews Guatemala	https://www.publinews.gt/gt/noticias/2018/10/25/la-migracion-se-convertira-uno-los-problemas-globales-definitorios-del-siglo-xxi.html	2018-10-25	La migración se convertirá uno de los problemas globales definitorios del siglo XXI
Caravana migrante de hondureños sale rumbo a Arriaga, México - Publinews Guatemala	https://www.publinews.gt/gt/noticias/2018/10/26/caravana-migrante-hondurenos-sale-rumbo-arriaga-mexico-hoy-26-octubre-2018.html	2018-10-26	Caravana migrante de hondureños sale rumbo a Arriaga, México
El plan de México para evitar que los migrantes lleguen a EE.UU. - Soy502	https://www.soy502.com/articulo/plan-mex-evitar-migrantes-lleguen-eeuu-63338	2018-10-26	El plan de México para evitar que los migrantes lleguen a EE.UU.
Caravana de migrantes: por qué México y Estados Unidos no podrán detener el éxodo - nomada.gt	https://nomada.gt/blogs/caravana-de-migrantes-por-que-mexico-y-estados-unidos-no-podran-detener-el-exodo/	2018-10-30	Caravana de migrantes: por qué México y Estados Unidos no podrán detener el éxodo
Pobreza y migración condicionan el empadronamiento en Huehuetenango - ojoconmipisto.com	https://www.ojoconmipisto.com/se-reduce-padron-electoral-en-concepcion-huista/	2018-11-01	Pobreza y migración condicionan el empadronamiento en Huehuetenango
Países del Triángulo Norte abordarán crisis migratoria - elPeriódico (Guatemala)	https://elperiodico.com.gt/nacionales/2018/11/03/paises-del-triangulo-norte-abordaran-crisis-migratoria/	2018-11-03	Países del Triángulo Norte abordarán crisis migratoria
SBS ha dado atención a migrantes – Noticias Última Hora de Guatemala - dca.gob.gt	https://dca.gob.gt/noticias-guatemala-diario-centro-america/sbs-ha-dado-atencion-a-migrantes/	2018-11-07	SBS ha dado atención a migrantes – Noticias Última Hora de Guatemala
El sueño del migrante - elPeriódico (Guatemala)	https://elperiodico.com.gt/opinion/opiniones-de-hoy/2018/11/08/el-sueno-del-migrante/	2018-11-08	El sueño del migrante
Más de 1.500 centroamericanos de caravana migrante llegaron a frontera México-EEUU - elPeriódico (Guatemala)	https://elperiodico.com.gt/mundo/2018/11/15/mas-de-1-500-centroamericanos-de-caravana-migrante-llegaron-a-frontera-mexico-eeuu/	2018-11-15	Más de 1.500 centroamericanos de caravana migrante llegaron a frontera México-EEUU
Polémica por migrante hondureña que rechazó frijoles en México - Soy502	https://www.soy502.com/articulo/frijoles-son-comida-puercos-dice-migrante-hondurena-32419	2018-11-19	Polémica por migrante hondureña que rechazó frijoles en México
EE.UU. captura a 42 emigrantes – Noticias Última Hora de Guatemala - dca.gob.gt	https://dca.gob.gt/noticias-guatemala-diario-centro-america/ee-uu-captura-a-42-emigrantes/	2018-11-27	EE.UU. captura a 42 emigrantes – Noticias Última Hora de Guatemala
¿Quién es responsable de una emigración? | Republica.gt - republica.gt	https://republica.gt/2018/12/04/quien-es-responsable-de-una-emigracion/	2018-12-04	¿Quién es responsable de una emigración?Republica.gt
Detienen a supuesto líder que pidió 50 mil dólares para migrantes - Soy502	https://www.soy502.com/articulo/detienen-supuesto-lider-pidio-50-mil-dolares-migrantes-101025	2018-12-18	Detienen a supuesto líder que pidió 50 mil dólares para migrantes
Expresan indignación por muerte de niño migrante guatemalteco Felipe Alonzo Gómez - Publinews Guatemala	https://www.publinews.gt/gt/noticias/2018/12/26/expresan-indignacion-muerte-nino-migrante-felipe-alonzo-gomez.html	2018-12-26	Expresan indignación por muerte de niño migrante guatemalteco Felipe Alonzo Gómez
Regresan 470 migrantes a Guatemala en la primera jornada de vuelos de retorno - dca.gob.gt	https://dca.gob.gt/noticias-guatemala-diario-centro-america/regresan-470-migrantes-a-guatemala-en-la-primera-jornada-de-vuelos-de-retorno/	2019-01-03	Regresan 470 migrantes a Guatemala en la primera jornada de vuelos de retorno
La migración más allá de la estadística - nomada.gt	https://nomada.gt/blogs/la-migracion-mas-alla-de-la-estadistica/	2019-01-03	La migración más allá de la estadística
Niños y migrantes: Lo que Morales no hizo en tres años, ¿lo hará en uno? - La Hora	https://lahora.gt/ninos-y-migrantes-lo-que-morales-no-hizo-en-tres-anos-lo-hara-en-uno/	2019-01-05	Niños y migrantes: Lo que Morales no hizo en tres años, ¿lo hará en uno?
Se prepara en Honduras una nueva caravana migrante | Republica.gt - republica.gt	https://republica.gt/2019/01/14/caravana-migrante-honduras/	2019-01-14	Se prepara en Honduras una nueva caravana migranteRepublica.gt
PNC despliega agentes en frontera por caravana migrante | Últimas noticias de Guatemala y el mundo - republica.gt	https://republica.gt/2019/01/15/caravana-migrante-pnc-frontera/	2019-01-15	PNC despliega agentes en frontera por caravana migranteÚltimas noticias de Guatemala y el mundo
Se generan disturbios en la frontera al ingresar caravana de migrantes hondureños - Publinews Guatemala	https://www.publinews.gt/gt/noticias/2019/01/16/disturbios-la-frontera-al-ingresar-caravana-migrantes-hondurenos.html	2019-01-16	Se generan disturbios en la frontera al ingresar caravana de migrantes hondureños
Más de 700 hondureños de caravana de migrantes ingresan a Guatemala - Prensa Libre	https://www.prensalibre.com/guatemala/migrantes/mas-de-700-hondurenos-de-caravana-de-migrantes-ingresan-a-guatemala/	2019-01-16	Más de 700 hondureños de caravana de migrantes ingresan a Guatemala
Pobreza en el Triángulo Norte continuará expulsando a familias migrantes - La Hora	https://lahora.gt/pobreza-en-el-triangulo-norte-continuara-expulsando-a-familias-migrantes/	2019-01-19	Pobreza en el Triángulo Norte continuará expulsando a familias migrantes
Donald Trump anuncia plan para atender crisis humanitaria de migrantes - Prensa Libre	https://www.prensalibre.com/internacional/en-vivo-conferencia-del-presidente-de-estados-unidos-donald-trump-sobre-el-muro-y-cierre-de-gobierno/	2019-01-19	Donald Trump anuncia plan para atender crisis humanitaria de migrantes
Acuerdo favorece a migrantes temporales – Noticias Última Hora de Guatemala - dca.gob.gt	https://dca.gob.gt/noticias-guatemala-diario-centro-america/acuerdo-favorece-a-migrantes-temporales/	2019-01-25	Acuerdo favorece a migrantes temporales – Noticias Última Hora de Guatemala
Vecinos de Ayutla, San Marcos expulsan a migrantes hondureños y salvadoreños y se lían a golpes - Prensa Libre	https://www.prensalibre.com/ciudades/san-marcos/vecinos-de-ayutla-san-marcos-expulsan-a-migrantes-hondurenos-y-salvadorenos-y-se-lian-a-golpes/	2019-01-27	Vecinos de Ayutla, San Marcos expulsan a migrantes hondureños y salvadoreños y se lían a golpes
Estados Unidos pide a Guatemala, El Salvador y Honduras detener caravanas de migrantes - Publinews Guatemala	https://www.publinews.gt/gt/noticias/2019/02/20/estados-unidos-pide-guatemala-salvador-honduras-detener-caravanas-migrantes.html	2019-02-20	Estados Unidos pide a Guatemala, El Salvador y Honduras detener caravanas de migrantes
“Buscamos alianzas y espacios en favor de los migrantes temporales” - dca.gob.gt	https://dca.gob.gt/noticias-guatemala-diario-centro-america/buscamos-alianzas-y-espacios-en-favor-de-los-migrantes-temporales/	2019-03-04	“Buscamos alianzas y espacios en favor de los migrantes temporales”
Publican nombres de los 23 migrantes guatemaltecos que murieron en Chiapas, México - Publinews Guatemala	https://www.publinews.gt/gt/noticias/2019/03/08/nombres-23-migrantes-guatemaltecos-muertos-accidente-chiapas-mexico.html	2019-03-08	Publican nombres de los 23 migrantes guatemaltecos que murieron en Chiapas, México
Guatemala agiliza trámites para repatriar cuerpos de migrantes guatemaltecos fallecidos en México - Publinews Guatemala	https://www.publinews.gt/gt/noticias/2019/03/12/repatriar-cuerpos-migrantes-guatemaltecos-fallecidos-mexico.html	2019-03-12	Guatemala agiliza trámites para repatriar cuerpos de migrantes guatemaltecos fallecidos en México
Repatrian cuerpos de 23 migrantes – Noticias Última Hora de Guatemala - dca.gob.gt	https://dca.gob.gt/noticias-guatemala-diario-centro-america/repatrian-cuerpos-de-23-migrantes/	2019-03-19	Repatrian cuerpos de 23 migrantes – Noticias Última Hora de Guatemala
Este refugiado de 8 años se convierte en campeón escolar de ajedrez en Nueva York y consigue un hogar para su familia - elPeriódico (Guatemala)	https://elperiodico.com.gt/entretenimiento/insolito/2019/03/22/este-refugiado-de-8-anos-se-convierte-en-campeon-escolar-de-ajedrez-en-nueva-york-y-consigue-un-hogar-para-su-familia/	2019-03-22	Este refugiado de 8 años se convierte en campeón escolar de ajedrez en Nueva York y consigue un hogar para su familia
Promueven apoyo a migrantes con discapacidad – Noticias Última Hora de Guatemala - dca.gob.gt	https://dca.gob.gt/noticias-guatemala-diario-centro-america/promueven-apoyo-a-migrantes-con-discapacidad/	2019-04-11	Promueven apoyo a migrantes con discapacidad – Noticias Última Hora de Guatemala
México restringe el paso a migrantes centroamericanos por el norte - Publinews Guatemala	https://www.publinews.gt/gt/noticias/2019/04/24/mexico-restringe-paso-migrantes-centroamericanos.html	2019-04-24	México restringe el paso a migrantes centroamericanos por el norte
Protestas en estación migratoria de México tras fuga de cientos de indocumentados - Publinews Guatemala	https://www.publinews.gt/gt/noticias/2019/04/26/protestas-estacion-migratoria-mexico-fuga-indocumentados.html	2019-04-26	Protestas en estación migratoria de México tras fuga de cientos de indocumentados
Proyecto de ley en Estados Unidos busca atender causas de migración ilegal de Centroamérica - Publinews Guatemala	https://www.publinews.gt/gt/noticias/2019/05/10/proyecto-de-ley-estados-unidos-causas-migracion-ilegal-centroamerica.html	2019-05-10	Proyecto de ley en Estados Unidos busca atender causas de migración ilegal de Centroamérica
"""Aquí no hay nada"": la historia de un migrante guatemalteco - Soy502"	https://www.soy502.com/articulo/aqui-no-hay-nada-desgarradora-historia-guatemalteco-32419	2019-05-15	"""Aquí no hay nada"": la historia de un migrante guatemalteco"
Impulsan hermandad entre los migrantes – Noticias Última Hora de Guatemala - dca.gob.gt	https://dca.gob.gt/noticias-guatemala-diario-centro-america/impulsan-hermandad-entre-los-migrantes/	2019-05-22	Impulsan hermandad entre los migrantes – Noticias Última Hora de Guatemala
Aspirantes a la presidencia darán a conocer su políticas sobre la migración - Publinews Guatemala	https://www.publinews.gt/gt/noticias/2019/05/24/guatemala-migracion-presidenciables.html	2019-05-24	Aspirantes a la presidencia darán a conocer su políticas sobre la migración
Iglesia de El Salvador lamenta decisión de México de detener a migrantes - Publinews Guatemala	https://www.publinews.gt/gt/noticias/2019/06/09/iglesia-salvador-lamenta-decision-mexico-detener-migrantes.html	2019-06-09	Iglesia de El Salvador lamenta decisión de México de detener a migrantes
Muere salvadoreña en ataque con armas de fuego a migrantes en Veracruz - Publinews Guatemala	https://www.publinews.gt/gt/noticias/2019/06/15/muere-salvadorena-ataque-veracruz.html	2019-06-15	Muere salvadoreña en ataque con armas de fuego a migrantes en Veracruz
