title	link	date	title_corrected
México no recibirá migrantes por alta incidencia de Coronavirus - Hondudiario	https://hondudiario.com/nacionales/mexico-no-recibira-migrantes-por-alta-incidencia-de-coronavirus/	2021-01-06	México no recibirá migrantes por alta incidencia de Coronavirus
Alertan “represión y persecución” para primer caravana migrante de 2021 — - confidencialhn.com	https://confidencialhn.com/alertan-represion-y-persecucion-para-primer-caravana-migrante-de-2021/	2021-01-07	Alertan “represión y persecución” para primer caravana migrante de 2021 —
Listas nuevas oficinas para la niñez migrante - La Tribuna.hn	https://www.latribuna.hn/2021/01/07/listas-nuevas-oficinas-para-la-ninez-migrante/	2021-01-07	Listas nuevas oficinas para la niñez migrante
‘No pierdan su tiempo y dinero’ advierte EEUU a caravana de migrantes - La Tribuna.hn	https://www.latribuna.hn/2021/01/08/no-pierdan-su-tiempo-y-dinero-advierte-eeuu-a-caravana-de-migrantes/	2021-01-08	‘No pierdan su tiempo y dinero’ advierte EEUU a caravana de migrantes
Conflictos de política interna en EE. UU no benefician a migrantes centroamericanos » Criterio.hn - criterio.hn	https://criterio.hn/conflictos-de-politica-interna-en-ee-uu-no-benefician-a-migrantes-centroamericanos/	2021-01-08	Conflictos de política interna en EE. UU no benefician a migrantes centroamericanos » Criterio.hn
Gobierno de EE.UU advierte que no permitirán que caravana de migrantes hondureños avance » Criterio.hn - criterio.hn	https://criterio.hn/gobierno-de-ee-uu-advierte-que-no-permitiran-que-caravana-de-migrantes-hondurenos-avance/	2021-01-08	Gobierno de EE.UU advierte que no permitirán que caravana de migrantes hondureños avance » Criterio.hn
Excanciller advierte a migrantes: “Nadie debe meterse en una casa en llamas” - Tiempo.hn	https://tiempo.hn/excanciller-migrantes-no-meterse-eeuu-riesgo/	2021-01-09	Excanciller advierte a migrantes: “Nadie debe meterse en una casa en llamas”
Centroamérica y México abordarán migración de cara a nueva caravana hondureña - La Tribuna.hn	https://www.latribuna.hn/2021/01/10/centroamerica-y-mexico-abordaran-migracion-de-cara-a-nueva-caravana-hondurena/	2021-01-10	Centroamérica y México abordarán migración de cara a nueva caravana hondureña
Países de Triángulo Norte y México abordarán tema de migración irregular - Proceso Digital	https://proceso.hn/paises-de-triangulo-norte-y-mexico-abordaran-tema-de-migracion-irregular/	2021-01-10	Países de Triángulo Norte y México abordarán tema de migración irregular
Triángulo Norte de CA y México abordarán migración segura y regular - elmundo.hn	https://elmundo.hn/triangulo-norte-de-ca-y-mexico-abordaran-migracion-segura-y-regular/	2021-01-10	Triángulo Norte de CA y México abordarán migración segura y regular
«Catracha» migrante: Huyó de violencia doméstica; hoy triunfa en EE. UU. - La Tribuna.hn	https://www.latribuna.hn/2021/01/11/catracha-migrante-huyo-de-violencia-domestica-hoy-triunfa-en-ee-uu/	2021-01-11	«Catracha» migrante: Huyó de violencia doméstica; hoy triunfa en EE. UU.
Triángulo Norte y México discuten desafíos para una migración segura y regular — - confidencialhn.com	https://confidencialhn.com/triangulo-norte-y-mexico-discuten-desafios-para-una-migracion-segura-y-regular/	2021-01-11	Triángulo Norte y México discuten desafíos para una migración segura y regular —
Traficantes de personas infiltran caranavas migrantes, advierte Policía - confidencialhn.com	https://confidencialhn.com/traficantes-de-personas-infiltran-caranavas-migrantes-advierte-policia/	2021-01-11	Traficantes de personas infiltran caranavas migrantes, advierte Policía
Advierten estrictos controles ante nueva caravana de migrantes hondureños - ElHeraldo.hn	https://www.elheraldo.hn/pais/1435068-466/honduras-caravana-migrantes-estrictos-controles-centroamerica	2021-01-11	Advierten estrictos controles ante nueva caravana de migrantes hondureños
Triángulo Norte y México abordarán migración segura y regular El Sol De Honduras - elsoldehonduras.com	http://www.elsoldehonduras.com/nacionales/triangulo-norte-y-mexico-abordaran-migracion-segura-y-regular/	2021-01-11	Triángulo Norte y México abordarán migración segura y regular El Sol De Honduras
Guatemala exigirá prueba negativa de la covid-19 a migrantes hondureños - paradigma.hn	https://paradigma.hn/guatemala-exigira-prueba-negativa-de-la-covid-19-a-migrantes-hondurenos/	2021-01-14	Guatemala exigirá prueba negativa de la covid-19 a migrantes hondureños
Comisionado de EEUU a migrantes: «El ‘sueño americano’ no es lo que creen» - Tiempo.hn	https://tiempo.hn/comisionado-eeuu-caravanas-migrantes-desmanteladas/	2021-01-14	Comisionado de EEUU a migrantes: «El ‘sueño americano’ no es lo que creen»
Guatemala decreta “Estado de prevención” ante llegada de migrantes hondureños - confidencialhn.com	https://confidencialhn.com/guatemala-decreta-estado-de-prevencion-ante-llegada-de-migrantes-hondurenos/	2021-01-14	Guatemala decreta “Estado de prevención” ante llegada de migrantes hondureños
Unos 250 migrantes salen en caravana hacia EE.UU. desde el norte de Honduras - paradigma.hn	https://paradigma.hn/unos-250-migrantes-salen-en-caravana-hacia-ee-uu-desde-el-norte-de-honduras/	2021-01-14	Unos 250 migrantes salen en caravana hacia EE.UU. desde el norte de Honduras
Más de 5.000 migrantes hondureños salen en caravana hacia EE. UU. - paradigma.hn	https://paradigma.hn/mas-de-5-000-migrantes-hondurenos-salen-en-caravana-hacia-ee-uu/	2021-01-15	Más de 5.000 migrantes hondureños salen en caravana hacia EE. UU.
Honduras registra que 78 inmigrantes de caravana retornaron desde Guatemala - paradigma.hn	https://paradigma.hn/honduras-registra-que-78-inmigrantes-de-caravana-retornaron-desde-guatemala/	2021-01-15	Honduras registra que 78 inmigrantes de caravana retornaron desde Guatemala
Otra caravana migrante de connacionales, inició su recorrido hacia los Estados Unidos — - confidencialhn.com	https://confidencialhn.com/otra-caravana-migrante-de-connacionales-inicia-su-recorrido-hacia-los-estados-unidos/	2021-01-15	Otra caravana migrante de connacionales, inició su recorrido hacia los Estados Unidos —
Parte nutrida caravana migrante desde San Pedro Sula - Proceso Digital	https://proceso.hn/parte-nutrida-caravana-migrante-desde-san-pedro-sula/	2021-01-15	Parte nutrida caravana migrante desde San Pedro Sula
Primer caravana de hondureños migrantes - enaltavoz.com	https://enaltavoz.com/tag/primer-caravana-de-hondurenos-migrantes/	2021-01-15	Primer caravana de hondureños migrantes
Se reporta otro grupo de caravana migrante que ingresa a Guatemala por la frontera El Florido - paradigma.hn	https://paradigma.hn/se-reporta-otro-grupo-de-caravana-migrante-que-ingresa-a-guatemala-por-la-frontera-el-florido/	2021-01-16	Se reporta otro grupo de caravana migrante que ingresa a Guatemala por la frontera El Florido
Expertos: Hondureños sufren torturas y violaciones en rutas migratorias - Tiempo.hn	https://tiempo.hn/torturas-violaciones-migrantes-eeuu/	2021-01-16	Expertos: Hondureños sufren torturas y violaciones en rutas migratorias
Niños, discapacitados y ancianos, los otros integrantes de la caravana migrante - Diario El Heraldo - ElHeraldo.hn	https://www.elheraldo.hn/fotogalerias/1436132-468/caravana-migrante-honduras-2021-guatemala-ancianos-discapacitados-ninos	2021-01-16	Niños, discapacitados y ancianos, los otros integrantes de la caravana migranteDiario El Heraldo
VIDEO| Policía hasta le pone el pie a los migrantes hondureños - Tiempo.hn	https://tiempo.hn/video-policia-pone-pie-a-migrantes-hondurenos/	2021-01-16	VIDEO| Policía hasta le pone el pie a los migrantes hondureños
Las 20 fotos más impactantes de la caravana migrante - Diario El Heraldo - ElHeraldo.hn	https://www.elheraldo.hn/fotogalerias/1436199-468/caravana-migrante-honduras-guatemala-imagenes-frontera	2021-01-16	Las 20 fotos más impactantes de la caravana migranteDiario El Heraldo
Noel Orellana, el niño con parálisis cerebral, ocupa atención médica y va en caravana de migrantes - Tiempo.hn	https://tiempo.hn/noel-orellana-nino-caravana-migrante-atencion-medica/	2021-01-17	Noel Orellana, el niño con parálisis cerebral, ocupa atención médica y va en caravana de migrantes
Guatemala obliga a retornar a su país a casi 1.400 migrantes hondureños - paradigma.hn	https://paradigma.hn/guatemala-obliga-a-retornar-a-su-pais-a-casi-1-400-migrantes-hondurenos/	2021-01-17	Guatemala obliga a retornar a su país a casi 1.400 migrantes hondureños
Casi 1.000 migrantes hondureños han sido devueltos a su país por Guatemala - paradigma.hn	https://paradigma.hn/casi-1-000-migrantes-hondurenos-han-sido-devueltos-a-su-pais-por-guatemala/	2021-01-17	Casi 1.000 migrantes hondureños han sido devueltos a su país por Guatemala
VIDEO: caravana migrante intenta pasar y Policía de Guatemala responde con gas y palos - Tiempo.hn	https://tiempo.hn/caravana-migrante-policia-de-guatemala-gas-palos/	2021-01-17	VIDEO: caravana migrante intenta pasar y Policía de Guatemala responde con gas y palos
Guatemala detiene y reprende con violencia a caravana migrante hondureña - paradigma.hn	https://paradigma.hn/guatemala-detiene-y-reprende-con-violencia-a-caravana-migrante-hondurena/	2021-01-17	Guatemala detiene y reprende con violencia a caravana migrante hondureña
Guatemala asiste a niño hondureño con parálisis cerebral en caravana de migrantes (Video) - La Tribuna.hn	https://www.latribuna.hn/2021/01/17/guatemala-asiste-a-nino-hondureno-con-paralisis-cerebral-en-caravana-de-migrantes-video/	2021-01-17	Guatemala asiste a niño hondureño con parálisis cerebral en caravana de migrantes (Video)
Caravana de migrantes rumbo a Estados Unidos es cercada en Guatemala - Diario El Heraldo - ElHeraldo.hn	https://www.elheraldo.hn/minisitios/hondurenosenelmundo/1436258-471/caravana-migrantes-cercada-en-guatemala	2021-01-17	Caravana de migrantes rumbo a Estados Unidos es cercada en GuatemalaDiario El Heraldo
Con gases lacrimógenos Guatemala detiene caravana de migrantes — - confidencialhn.com	https://confidencialhn.com/con-gases-lacrimogenos-guatemala-detiene-caravana-de-migrantes/	2021-01-17	Con gases lacrimógenos Guatemala detiene caravana de migrantes —
"Yani en gira por la capital: ""Sé lo que sufre el migrante; quiero crear oportunidades"" - Tiempo.hn"	https://tiempo.hn/gira-yani-rosenthal-oportunidades-migrantes/	2021-01-17	"Yani en gira por la capital: ""Sé lo que sufre el migrante; quiero crear oportunidades"""
Policía advierte infiltración de traficantes de personas en caravanas migrantes El Sol De Honduras - elsoldehonduras.com	http://www.elsoldehonduras.com/nacionales/policia-advierte-infiltracion-de-traficantes-de-personas-en-caravanas-migrantes/	2021-01-17	Policía advierte infiltración de traficantes de personas en caravanas migrantes El Sol De Honduras
FOTOS| Momentos desgarradores que vivieron migrantes hondureños - Tiempo.hn	https://tiempo.hn/fotos-momentos-desgarradores-vivieron-migrantes-hondurenos/	2021-01-18	FOTOS| Momentos desgarradores que vivieron migrantes hondureños
La superación de la pandemia de COVID-19 sólo es posible con políticas de vacunación universal y sin discriminación por nacionalidad o condición migratoria - enaltavoz.com	https://enaltavoz.com/la-superacion-de-la-pandemia-de-covid-19-solo-es-posible-con-politicas-de-vacunacion-universal-y-sin-discriminacion-por-nacionalidad-o-condicion-migratoria/	2021-01-18	La superación de la pandemia de COVID-19 sólo es posible con políticas de vacunación universal y sin discriminación por nacionalidad o condición migratoria
A pesar de violenta represión en Guatemala, caravana migrante sigue su marcha » Criterio.hn - criterio.hn	https://criterio.hn/a-pesar-de-violenta-represion-en-guatemala-caravana-migrante-sigue-su-marcha/	2021-01-18	A pesar de violenta represión en Guatemala, caravana migrante sigue su marcha » Criterio.hn
¡Imágenes que duelen! El violento desalojo a la caravana migrante en Chiquimula - Diario El Heraldo - ElHeraldo.hn	https://www.elheraldo.hn/fotogalerias/1436552-468/caravana-migrante-violento-desalojo-chiquimula-guatemala-honduras	2021-01-18	¡Imágenes que duelen! El violento desalojo a la caravana migrante en ChiquimulaDiario El Heraldo
Policía guatemalteca desaloja a la caravana migrante y desencadena violento enfrentamiento - elmundo.hn	https://elmundo.hn/policia-guatemalteca-desaloja-a-la-caravana-migrante-y-desencadena-violento-enfrentamiento/	2021-01-18	Policía guatemalteca desaloja a la caravana migrante y desencadena violento enfrentamiento
Comisionada hondureña de DD.HH. pide respetar derechos humanos de migrantes - paradigma.hn	https://paradigma.hn/comisionada-hondurena-de-dd-hh-pide-respetar-derechos-humanos-de-migrantes/	2021-01-18	Comisionada hondureña de DD.HH. pide respetar derechos humanos de migrantes
Más 8,000 hondureños de la caravana migrante permanecen varados en Chiquimula, Guatemala - confidencialhn.com	https://confidencialhn.com/mas-8000-hondureno-de-la-caravana-migrante-permanecen-varados-en-chiquimula-guatemala/	2021-01-18	Más 8,000 hondureños de la caravana migrante permanecen varados en Chiquimula, Guatemala
EN VIVO: Militares antimotines desalojan a la caravana migrante en Guatemala - Diario El Heraldo - ElHeraldo.hn	https://www.elheraldo.hn/minisitios/hondurenosenelmundo/1436516-471/en-vivo-militares-antimotines-desalojan-a-la-caravana-migrante-en-guatemala	2021-01-18	EN VIVO: Militares antimotines desalojan a la caravana migrante en GuatemalaDiario El Heraldo
Caravana migrante: hondureños desafían a Guatemala con tal de huir de Honduras - enaltavoz.com	https://enaltavoz.com/caravana-migrante-hondurenos-desafian-a-guatemala-con-tal-de-huir-de-honduras/	2021-01-18	Caravana migrante: hondureños desafían a Guatemala con tal de huir de Honduras
“Tercer país seguro” viola derechos humanos de los migrantes » Criterio.hn - criterio.hn	https://criterio.hn/tercer-pais-seguro-viola-derechos-humanos-de-los-migrantes/	2021-01-18	“Tercer país seguro” viola derechos humanos de los migrantes » Criterio.hn
Gas lacrimógeno y mucho sufrimiento: Policía de Guatemala a golpes con caravana de inmigrantes hondureños - Diez.hn	https://www.diez.hn/fotogalerias/1436776-499/gas-lacrim%C3%B3geno-y-mucho-sufrimiento-polic%C3%ADa-de-guatemala-a-golpes-con-caravana	2021-01-19	Gas lacrimógeno y mucho sufrimiento: Policía de Guatemala a golpes con caravana de inmigrantes hondureños
Corrupción, impunidad y violencia dan pie a la migración en Honduras » Criterio.hn - criterio.hn	https://criterio.hn/corrupcion-impunidad-y-violencia-dan-pie-a-la-migracion-en-honduras/	2021-01-19	Corrupción, impunidad y violencia dan pie a la migración en Honduras » Criterio.hn
Caravana migrante frena su sueño de llegar a EE UU tras represión en Guatemala - ElHeraldo.hn	https://www.elheraldo.hn/minisitios/hondurenosenelmundo/1436678-471/represion-guatemala-caravana-migrante-frenar-sueno	2021-01-19	Caravana migrante frena su sueño de llegar a EE UU tras represión en Guatemala
Vicecanciller asegura que “inescrupulosos venden a migrantes un sueño imposible de alcanzar” - elmundo.hn	https://elmundo.hn/vicecanciller-asegura-que-inescrupulosos-venden-a-migrantes-un-sueno-imposible-de-alcanzar/	2021-01-19	Vicecanciller asegura que “inescrupulosos venden a migrantes un sueño imposible de alcanzar”
Advierten que EE.UU implementará las mismas leyes migratorias durante 2021 — - confidencialhn.com	https://confidencialhn.com/advierten-que-ee-uu-seguira-implementando-las-mismas-leyes-migratorias-durante-2021/	2021-01-19	Advierten que EE.UU implementará las mismas leyes migratorias durante 2021 —
Guatemala trunca sueños de caravana migrante que iba de Honduras a EEUU - La Tribuna.hn	https://www.latribuna.hn/2021/01/19/guatemala-trunca-suenos-de-caravana-migrante-que-iba-de-honduras-a-eeuu/	2021-01-19	Guatemala trunca sueños de caravana migrante que iba de Honduras a EEUU
OIM relata el drama de 7 mil 500 hondureños en caravana migrante - Proceso Digital	https://proceso.hn/oim-relata-el-drama-de-7-mil-500-hondurenos-en-caravana-migrante/	2021-01-19	OIM relata el drama de 7 mil 500 hondureños en caravana migrante
Presentan informe de investigación “El impacto de la corrupción como factor determinante para la migración” - enaltavoz.com	https://enaltavoz.com/presentan-informe-de-investigacion-el-impacto-de-la-corrupcion-como-factor-determinante-para-la-migracion/	2021-01-19	Presentan informe de investigación “El impacto de la corrupción como factor determinante para la migración”
Save the Children pide a México proteger a la infancia de caravana migrante - paradigma.hn	https://paradigma.hn/save-the-children-pide-a-mexico-proteger-a-la-infancia-de-caravana-migrante/	2021-01-19	Save the Children pide a México proteger a la infancia de caravana migrante
ONU confirma la muerte de más de 40 migrantes en un naufragio en costa Libia - Proceso Digital	https://proceso.hn/onu-confirma-la-muerte-de-mas-de-40-migrantes-en-un-naufragio-en-costa-libia/	2021-01-20	ONU confirma la muerte de más de 40 migrantes en un naufragio en costa Libia
Represión contra migrantes fue un plan de Honduras y Guatemala, según jesuita - paradigma.hn	https://paradigma.hn/represion-contra-migrantes-fue-un-plan-de-honduras-y-guatemala-segun-jesuita/	2021-01-20	Represión contra migrantes fue un plan de Honduras y Guatemala, según jesuita
Más de 1800 migrantes hondureños de caravana han retornado desde Guatemala - Proceso Digital	https://proceso.hn/mas-de-1800-migrantes-hondurenos-de-caravana-han-retornado-desde-guatemala/	2021-01-20	Más de 1800 migrantes hondureños de caravana han retornado desde Guatemala
Más de 1.800 migrantes hondureños de caravana han retornado desde Guatemala - paradigma.hn	https://paradigma.hn/mas-de-1-800-migrantes-hondurenos-de-caravana-han-retornado-desde-guatemala/	2021-01-20	Más de 1.800 migrantes hondureños de caravana han retornado desde Guatemala
Biden comienza su gobierno con decretos sobre el clima, migración y covid-19 - ElHeraldo.hn	https://www.elheraldo.hn/mundo/1436905-466/biden-comienza-su-gobierno-con-decretos-sobre-el-clima-migraci%C3%B3n-y-covid-19	2021-01-20	Biden comienza su gobierno con decretos sobre el clima, migración y covid-19
Las promesas del presidente Joe Biden a los migrantes - ElHeraldo.hn	https://www.elheraldo.hn/mundo/1437025-466/promesas-presidente-joe-biden-migrantes	2021-01-20	Las promesas del presidente Joe Biden a los migrantes
Como 'generalizada y crónica' califica Médicos Sin Fronteras la violencia contra migrantes - ElHeraldo.hn	https://www.elheraldo.hn/minisitios/hondurenosenelmundo/1437378-471/generalizada-cronica-califica-medicos-sin-fronteras-violencia-migrantes	2021-01-21	Como 'generalizada y crónica' califica Médicos Sin Fronteras la violencia contra migrantes
La corrupción suscita la migración entre hondureños, concluye informe del CNA - Proceso Digital	https://proceso.hn/la-corrupcion-suscita-la-migracion-entre-hondurenos-concluye-informe-del-cna/	2021-01-21	La corrupción suscita la migración entre hondureños, concluye informe del CNA
La agenda migratoria de Biden: marcha atrás cuatro años y golpe de timón - ElHeraldo.hn	https://www.elheraldo.hn/mundo/1437367-466/agenda-migratoria-biden-marcha-atras-cuatro-anos	2021-01-21	La agenda migratoria de Biden: marcha atrás cuatro años y golpe de timón
Caravana de migrantes, fenómeno trasnacional que requiere estrategia regional - paradigma.hn	https://paradigma.hn/caravana-de-migrantes-fenomeno-trasnacional-que-requiere-estrategia-regional/	2021-01-21	Caravana de migrantes, fenómeno trasnacional que requiere estrategia regional
OIM pide evitar fuerza 'excesiva' contra migrantes tras represión en Guatemala - ElHeraldo.hn	https://www.elheraldo.hn/mundo/1437366-466/oim-pide-evitar-fuerza-excesiva-migrantes-represion-guatemala	2021-01-21	OIM pide evitar fuerza 'excesiva' contra migrantes tras represión en Guatemala
Caravana de migrantes, fenómeno trasnacional que requiere estrategia regional - Proceso Digital	https://proceso.hn/caravana-de-migrantes-fenomeno-trasnacional-que-requiere-estrategia-regional/	2021-01-21	Caravana de migrantes, fenómeno trasnacional que requiere estrategia regional
Biden habla con AMLO sobre covid-19 y migración - ElHeraldo.hn	https://www.elheraldo.hn/mundo/1437666-466/biden-habla-amlo-sobre-covid-19-migracion	2021-01-22	Biden habla con AMLO sobre covid-19 y migración
Senadores republicanos claves se oponen a reforma migratoria propuesta por Joe Biden - La Tribuna.hn	https://www.latribuna.hn/2021/01/22/senadores-republicanos-claves-se-oponen-a-reforma-migratoria-propuesta-por-joe-biden/	2021-01-22	Senadores republicanos claves se oponen a reforma migratoria propuesta por Joe Biden
Médicos Sin Fronteras alarmados por la violencia contra migrantes hondureños en Guatemala - elmundo.hn	https://elmundo.hn/medicos-sin-fronteras-alarmados-por-la-violencia-contra-migrantes-hondurenos-en-guatemala/	2021-01-22	Médicos Sin Fronteras alarmados por la violencia contra migrantes hondureños en Guatemala
Activista pide un nuevo sistema humanitario para frenar la migración a EE. UU. - paradigma.hn	https://paradigma.hn/activista-pide-un-nuevo-sistema-humanitario-para-frenar-la-migracion-a-ee-uu/	2021-01-22	Activista pide un nuevo sistema humanitario para frenar la migración a EE. UU.
Anuncia INM: 52 niños viajaban solos en caravana de migrantes - La Tribuna.hn	https://www.latribuna.hn/2021/01/22/anuncia-inm-52-ninos-viajaban-solos-en-caravana-de-migrantes/	2021-01-22	Anuncia INM: 52 niños viajaban solos en caravana de migrantes
Denuncian cacería de migrantes hondureños en Guatemala: “Si no nos quieren, no nos golpeen porque no somos animales” - enaltavoz.com	https://enaltavoz.com/denuncian-caceria-de-migrantes-hondurenos-en-guatemala-si-no-nos-quieren-no-nos-golpeen-porque-no-somos-animales/	2021-01-23	Denuncian cacería de migrantes hondureños en Guatemala: “Si no nos quieren, no nos golpeen porque no somos animales”
Biden destinará 4 mil millones de dólares para frenar migración forzada en Centroamérica - Proceso Digital	https://proceso.hn/biden-destinara-4-mil-millones-de-dolares-para-frenar-migracion-forzada-en-centroamerica/	2021-01-23	Biden destinará 4 mil millones de dólares para frenar migración forzada en Centroamérica
Joe Biden destinaría $4 mil millones para frenar migración en Centroamérica - Tiempo.hn	https://tiempo.hn/joe-biden-destinaria-4-mil-millones-migracion-centroamerica/	2021-01-23	Joe Biden destinaría $4 mil millones para frenar migración en Centroamérica
Desconfianza e idioma dificultan vacunar a migrantes en EEUU - ElHeraldo.hn	https://www.elheraldo.hn/mundo/1437769-466/desconfianza-e-idioma-dificultan-vacunar-a-migrantes-en-eeuu	2021-01-23	Desconfianza e idioma dificultan vacunar a migrantes en EEUU
CONADEH: Por descuido del gobierno, algunos migrantes retornados propagan el Covid-19 - Tiempo.hn	https://tiempo.hn/contagio-migrantes-retornados-covid-19/	2021-01-24	CONADEH: Por descuido del gobierno, algunos migrantes retornados propagan el Covid-19
INM: México ya no albergará niños y adolescentes en estaciones migratorias - Tiempo.hn	https://tiempo.hn/inm-mexico-no-albergues-para-menores-migrantes/	2021-01-25	INM: México ya no albergará niños y adolescentes en estaciones migratorias
Joe Biden ilusiona a los migrantes sin permiso de residencia - ElHeraldo.hn	https://www.elheraldo.hn/mundo/1438355-466/joe-biden-ilusiona-a-los-migrantes-sin-permiso-de-residencia	2021-01-26	Joe Biden ilusiona a los migrantes sin permiso de residencia
UNICEF: Niños migrantes retornan cansados, heridos y traumatizados - tiempo.hn	https://tiempo.hn/unicef-ninos-migrantes-hondurenos/	2021-01-26	UNICEF: Niños migrantes retornan cansados, heridos y traumatizados
Hallazgo de 19 cuerpos en Tamaulipas revive terror de peligrosa ruta migrante - ElHeraldo.hn	https://www.elheraldo.hn/minisitios/hondurenosenelmundo/1438341-471/hallazgo-cuerpos-tamaulipas-revive-terror-peligrosa-ruta-migrante	2021-01-26	Hallazgo de 19 cuerpos en Tamaulipas revive terror de peligrosa ruta migrante
El cambio climático influye en la migración de hondureños, alerta ONG Oxfam - Proceso Digital	https://proceso.hn/el-cambio-climatico-influye-en-la-migracion-de-hondurenos-alerta-ong-oxfam/	2021-01-27	El cambio climático influye en la migración de hondureños, alerta ONG Oxfam
Organización humanitaria alerta sobre creciente migración de menores a EEUU - paradigma.hn	https://paradigma.hn/organizacion-humanitaria-alerta-sobre-creciente-migracion-de-menores-a-eeuu/	2021-01-27	Organización humanitaria alerta sobre creciente migración de menores a EEUU
Organización humanitaria alerta sobre creciente migración de menores a EEUU - Proceso Digital	https://proceso.hn/organizacion-humanitaria-alerta-sobre-creciente-migracion-de-menores-a-eeuu/	2021-01-27	Organización humanitaria alerta sobre creciente migración de menores a EEUU
Biden retrasa hasta la próxima semana sus órdenes sobre inmigración - Proceso Digital	https://proceso.hn/biden-retrasa-hasta-la-proxima-semana-sus-ordenes-sobre-inmigracion/	2021-01-28	Biden retrasa hasta la próxima semana sus órdenes sobre inmigración
Biden retrasa hasta la próxima semana sus órdenes sobre inmigración - La Tribuna.hn	https://www.latribuna.hn/2021/01/28/biden-retrasa-hasta-la-proxima-semana-sus-ordenes-sobre-inmigracion/	2021-01-28	Biden retrasa hasta la próxima semana sus órdenes sobre inmigración
Biden retrasa hasta la próxima semana sus órdenes sobre inmigración - paradigma.hn	https://paradigma.hn/biden-retrasa-hasta-la-proxima-semana-sus-ordenes-sobre-inmigracion/	2021-01-28	Biden retrasa hasta la próxima semana sus órdenes sobre inmigración
