title	link	date	title_corrected
Arrestados 286 sospechosos de traficar con migrantes en operación de interpol - Listín Diario	https://listindiario.com/las-mundiales/2021/07/26/681205/arrestados-286-sospechosos-de-traficar-con-migrantes-en-operacion-de-interpol	2021-07-26	Arrestados 286 sospechosos de traficar con migrantes en operación de interpol
Casi 60 migrantes mueren ahogados frente a las costas de Libia - Diario Libre	https://www.diariolibre.com/usa/actualidad/casi-60-migrantes-mueren-ahogados-frente-a-las-costas-de-libia-EE27763632	2021-07-26	Casi 60 migrantes mueren ahogados frente a las costas de Libia
EEUU atribuye inmigración indocumentada a violencia, pobreza, y desastres - Diario Libre	https://www.diariolibre.com/actualidad/internacional/eeuu-atribuye-inmigracion-indocumentada-a-violencia-pobreza-y-desastres-OK27780538	2021-07-27	EEUU atribuye inmigración indocumentada a violencia, pobreza, y desastres
Turquía acusa a Grecia de la 'devolución en caliente' de 388 refugiados - Diario Libre	https://www.diariolibre.com/actualidad/internacional/turquia-acusa-a-grecia-de-la-devolucion-en-caliente-de-388-refugiados-BF27772928	2021-07-27	Turquía acusa a Grecia de la 'devolución en caliente' de 388 refugiados
Atribuye inmigración indocumentada a violencia, pobreza, y desastre - El Caribe	https://www.elcaribe.com.do/destacado/eeuu-atribuye-inmigracion-indocumentada-a-violencia-pobreza-y-desastres/	2021-07-27	Atribuye inmigración indocumentada a violencia, pobreza, y desastre
La marioneta 'Pequeña Amal' comienza su viaje épico de refugiada en Europa - Diario Libre	https://www.diariolibre.com/actualidad/internacional/la-marioneta-pequena-amal-comienza-su-viaje-epico-de-refugiada-en-europa-GF27778943	2021-07-27	La marioneta 'Pequeña Amal' comienza su viaje épico de refugiada en Europa
¿Cuál es el plazo para entregar un documento solicitado por migración? - Diario Libre	https://www.diariolibre.com/usa/blogs/consultorio-de-migracion/cual-es-el-plazo-para-entregar-un-documento-solicitado-por-migracion-HK27782731	2021-07-27	¿Cuál es el plazo para entregar un documento solicitado por migración?
Miles de migrantes permanecen varados en Colombia sin paso hacia Panamá - elnuevodiario.com.do	https://elnuevodiario.com.do/miles-de-migrantes-permanecen-varados-en-colombia-sin-paso-hacia-panama/	2021-07-27	Miles de migrantes permanecen varados en Colombia sin paso hacia Panamá
Hallan un migrante muerto al borde del río en la frontera entre México y EEUU - El Nuevo Diario (República Dominicana)	https://elnuevodiario.com.do/hallan-un-migrante-muerto-al-borde-del-rio-en-la-frontera-entre-mexico-y-eeuu/	2021-07-27	Hallan un migrante muerto al borde del río en la frontera entre México y EEUU
Miles de migrantes permanecen varados en Colombia sin paso hacia Panamá - diariolibre.com	https://www.diariolibre.com/actualidad/internacional/miles-de-migrantes-permanecen-varados-en-colombia-sin-paso-hacia-panama-PK27787877	2021-07-27	Miles de migrantes permanecen varados en Colombia sin paso hacia Panamá
Firman acuerdo para eficientizar procesos de investigación de ley migratoria - El Caribe	https://www.elcaribe.com.do/destacado/firman-acuerdo-para-eficientizar-procesos-de-investigacion-de-ley-migratoria/	2021-07-27	Firman acuerdo para eficientizar procesos de investigación de ley migratoria
Guatemala detiene a 24 migrantes haitianos que buscaban llegar a EE.UU. - Diario Libre	https://www.diariolibre.com/actualidad/internacional/guatemala-detiene-a-24-migrantes-haitianos-que-buscaban-llegar-a-ee-uu-EK27784990	2021-07-27	Guatemala detiene a 24 migrantes haitianos que buscaban llegar a EE.UU.
‘Alerta migratoria’ - Listín Diario	https://listindiario.com/puntos-de-vista/2021/07/28/681417/alerta-migratoria	2021-07-28	‘Alerta migratoria’
EE.UU. prevé recibir esta semana a primeros ciudadanos afganos - El Nuevo Diario (República Dominicana)	https://elnuevodiario.com.do/ee-uu-preve-recibir-esta-semana-a-primeros-ciudadanos-afganos/	2021-07-28	EE.UU. prevé recibir esta semana a primeros ciudadanos afganos
Turquía blinda su frontera con Irán para detener a refugiados afganos - Diario Libre	https://www.diariolibre.com/actualidad/internacional/turquia-blinda-su-frontera-con-iran-para-detener-a-refugiados-afganos-LL27798553	2021-07-28	Turquía blinda su frontera con Irán para detener a refugiados afganos
Colombia considera obligación epidemiológica vacunar a migrantes venezolanos - El Nuevo Diario (República Dominicana)	https://elnuevodiario.com.do/colombia-considera-obligacion-epidemiologica-vacunar-a-migrantes-venezolanos/	2021-07-29	Colombia considera obligación epidemiológica vacunar a migrantes venezolanos
Colombia considera obligación epidemiológica vacunar a migrantes venezolanos - Listín Diario	https://listindiario.com/las-mundiales/2021/07/29/681708/colombia-considera-obligacion-epidemiologica-vacunar-a-migrantes-venezolanos	2021-07-29	Colombia considera obligación epidemiológica vacunar a migrantes venezolanos
La Casa Blanca desvela su nueva estrategia para abordar las causas de la migración en Centroamérica - Listín Diario	https://listindiario.com/las-mundiales/2021/07/29/681627/la-casa-blanca-desvela-su-nueva-estrategia-para-abordar-las-causas-de-la-migracion-en-centroamerica	2021-07-29	La Casa Blanca desvela su nueva estrategia para abordar las causas de la migración en Centroamérica
La OEA advierte que la migración venezolana puede superar la de Siria en 2022 - Diario Libre	https://www.diariolibre.com/actualidad/internacional/la-oea-advierte-que-la-migracion-venezolana-puede-superar-la-de-siria-en-2022-HO27830564	2021-07-29	La OEA advierte que la migración venezolana puede superar la de Siria en 2022
Colombia pide acción regional ante crisis migratoria en frontera con Panamá - Diario Libre	https://www.diariolibre.com/actualidad/internacional/colombia-pide-accion-regional-ante-crisis-migratoria-en-frontera-con-panama-FO27830216	2021-07-29	Colombia pide acción regional ante crisis migratoria en frontera con Panamá
OEA advierte que la migración venezolana puede superar la de Siria en 2022 - El Caribe	https://www.elcaribe.com.do/destacado/oea-advierte-que-la-migracion-venezolana-puede-superar-la-de-siria-en-2022/	2021-07-29	OEA advierte que la migración venezolana puede superar la de Siria en 2022
Bangladesh: Inundaciones dejan sin casa a refugiados rohinya - Diario Libre	https://www.diariolibre.com/actualidad/internacional/bangladesh-inundaciones-dejan-sin-casa-a-refugiados-rohinya-DP27822357	2021-07-29	Bangladesh: Inundaciones dejan sin casa a refugiados rohinya
Congreso de EE.UU. aprueba 2.100 millones para seguridad y refugiados afganos - Diario Libre	https://www.diariolibre.com/actualidad/internacional/congreso-de-ee-uu-aprueba-2100-millones-para-seguridad-y-refugiados-afganos-IO27839155	2021-07-29	Congreso de EE.UU. aprueba 2.100 millones para seguridad y refugiados afganos
Solo uno de cada 7 niños refugiados en Grecia está escolarizado, según HRW - Diario Libre	https://www.diariolibre.com/actualidad/internacional/solo-uno-de-cada-7-ninos-refugiados-en-grecia-esta-escolarizado-segun-hrw-CP27823247	2021-07-29	Solo uno de cada 7 niños refugiados en Grecia está escolarizado, según HRW
Opositor venezolano pide a Canadá acoger a boxeador de equipo de refugiados - Diario Libre	https://www.diariolibre.com/actualidad/internacional/opositor-venezolano-pide-a-canada-acoger-a-boxeador-de-equipo-de-refugiados-LM27817862	2021-07-29	Opositor venezolano pide a Canadá acoger a boxeador de equipo de refugiados
Colombia vive crisis humanitaria; miles de migrantes varados - Diario Libre	https://www.diariolibre.com/actualidad/internacional/colombia-vive-crisis-humanitaria-miles-de-migrantes-varados-LP27820812	2021-07-29	Colombia vive crisis humanitaria; miles de migrantes varados
Colombia vive crisis humanitaria; miles de migrantes varados - Diario Libre	https://www.diariolibre.com/usa/actualidad/colombia-vive-crisis-humanitaria-miles-de-migrantes-varados-GM27818860	2021-07-29	Colombia vive crisis humanitaria; miles de migrantes varados
Casa Blanca presenta plan para abordar la migración desde Centroamérica - Diario Libre	https://www.diariolibre.com/actualidad/internacional/casa-blanca-presenta-plan-para-abordar-la-migracion-desde-centroamerica-CJ27840200	2021-07-29	Casa Blanca presenta plan para abordar la migración desde Centroamérica
Llega a EE.UU. un primer grupo de refugiados afganos en riesgo tras la guerra - Diario Libre	https://www.diariolibre.com/actualidad/internacional/llega-a-ee-uu-un-primer-grupo-de-refugiados-afganos-en-riesgo-tras-la-guerra-EI27854808	2021-07-30	Llega a EE.UU. un primer grupo de refugiados afganos en riesgo tras la guerra
Congreso de EE.UU. aprueba 2.100 millones para seguridad y refugiados afganos - El Nuevo Diario (República Dominicana)	https://elnuevodiario.com.do/congreso-de-ee-uu-aprueba-2-100-millones-para-seguridad-y-refugiados-afganos/	2021-07-30	Congreso de EE.UU. aprueba 2.100 millones para seguridad y refugiados afganos
Los refugiados se suben a un tatami olímpico con sueños y denuncias - Diario Libre	https://www.diariolibre.com/actualidad/internacional/los-refugiados-se-suben-a-un-tatami-olimpico-con-suenos-y-denuncias-HJ27846562	2021-07-30	Los refugiados se suben a un tatami olímpico con sueños y denuncias
Un opositor venezolano pide a Chile detener la deportación de migrantes - Diario Libre	https://www.diariolibre.com/actualidad/internacional/un-opositor-venezolano-pide-a-chile-detener-la-deportacion-de-migrantes-EI27859519	2021-07-30	Un opositor venezolano pide a Chile detener la deportación de migrantes
Casa Blanca presenta plan para abordar la migración desde Centroamérica - El Nuevo Diario (República Dominicana)	https://elnuevodiario.com.do/casa-blanca-presenta-plan-para-abordar-la-migracion-desde-centroamerica/	2021-07-30	Casa Blanca presenta plan para abordar la migración desde Centroamérica
Panamá y Colombia hablan sobre la necesidad de coordinar paso de migrantes - Diario Libre	https://www.diariolibre.com/usa/actualidad/panama-y-colombia-hablan-sobre-la-necesidad-de-coordinar-paso-de-migrantes-DJ27842881	2021-07-30	Panamá y Colombia hablan sobre la necesidad de coordinar paso de migrantes
Los migrantes haitianos, los rezagados en vacunación en el sureste de México - Listín Diario	https://listindiario.com/las-mundiales/2021/07/31/681877/los-migrantes-haitianos-los-rezagados-en-vacunacion-en-el-sureste-de-mexico	2021-07-31	Los migrantes haitianos, los rezagados en vacunación en el sureste de México
Los migrantes haitianos, los rezagados en vacunación en el sureste de México - Diario Libre	https://www.diariolibre.com/usa/actualidad/los-migrantes-haitianos-los-rezagados-en-vacunacion-en-el-sureste-de-mexico-GL27865047	2021-07-31	Los migrantes haitianos, los rezagados en vacunación en el sureste de México
Gobierno EEUU demanda a Texas por detener migrantes – El Nacional - elnacional.com.do	https://elnacional.com.do/gobierno-eeuu-demanda-a-texas-por-detener-migrantes/	2021-07-31	Gobierno EEUU demanda a Texas por detener migrantes – El Nacional
migrantes – El Nacional - elnacional.com.do	https://elnacional.com.do/etiquetas/migrantes/	2021-07-31	migrantes – El Nacional
La frontera colombo-panameña: un problema de fondo para la migración - Diario Libre	https://www.diariolibre.com/actualidad/internacional/la-frontera-colombo-panamena-un-problema-de-fondo-para-la-migracion-HK27873361	2021-07-31	La frontera colombo-panameña: un problema de fondo para la migración
El Gobierno de EEUU demanda a Texas por prohibir transportar a inmigrantes - El Nuevo Diario (República Dominicana)	https://elnuevodiario.com.do/el-gobierno-de-eeuu-demanda-a-texas-por-prohibir-transportar-a-inmigrantes/	2021-07-31	El Gobierno de EEUU demanda a Texas por prohibir transportar a inmigrantes
Gobierno de Estados Unidos demanda a Texas por detención de migrantes - Diario Libre	https://www.diariolibre.com/usa/actualidad/gobierno-de-estados-unidos-demanda-a-texas-por-detencion-de-migrantes-FL27864771	2021-07-31	Gobierno de Estados Unidos demanda a Texas por detención de migrantes
Gobierno de EEUU demanda a Texas por detención de migrantes - Diario Libre	https://www.diariolibre.com/usa/actualidad/gobierno-de-eeuu-demanda-a-texas-por-detencion-de-migrantes-FL27864771	2021-07-31	Gobierno de EEUU demanda a Texas por detención de migrantes
ICE asumirá casos de migrantes por saturación en centros fronterizos de EEUU - Diario Libre	https://www.diariolibre.com/usa/actualidad/ice-asumira-casos-de-migrantes-por-saturacion-en-centros-fronterizos-de-eeuu-DF27887567	2021-08-01	ICE asumirá casos de migrantes por saturación en centros fronterizos de EEUU
Más de 800 migrantes esperan un puerto a bordo de dos barcos de ONG - El Nuevo Diario (República Dominicana)	https://elnuevodiario.com.do/mas-de-800-migrantes-esperan-un-puerto-a-bordo-de-dos-barcos-de-ong/	2021-08-01	Más de 800 migrantes esperan un puerto a bordo de dos barcos de ONG
Rescatan a 101 migrantes haitianos abandonados por traficantes en Guatemala - Listín Diario	https://listindiario.com/las-mundiales/2021/08/02/682118/rescatan-a-101-migrantes-haitianos-abandonados-por-traficantes-en-guatemala	2021-08-02	Rescatan a 101 migrantes haitianos abandonados por traficantes en Guatemala
EEUU expande su programa de refugiados afganos - Diario Libre	https://www.diariolibre.com/usa/actualidad/eeuu-expande-su-programa-de-refugiados-afganos-FE27896407	2021-08-02	EEUU expande su programa de refugiados afganos
Interceptados 1.111 migrantes frente a la costa libia en la última semana - Diario Libre	https://www.diariolibre.com/actualidad/internacional/interceptados-1111-migrantes-frente-a-la-costa-libia-en-la-ultima-semana-EM27906130	2021-08-02	Interceptados 1.111 migrantes frente a la costa libia en la última semana
EE.UU. amplía su programa de refugiados de Afganistán ante el avance talibán - elnuevodiario.com.do	https://elnuevodiario.com.do/ee-uu-amplia-su-programa-de-refugiados-de-afganistan-ante-el-avance-taliban/	2021-08-02	EE.UU. amplía su programa de refugiados de Afganistán ante el avance talibán
Colombia busca trato con miles de inmigrantes - El Dia.com.do	https://eldia.com.do/colombia-busca-trato-con-miles-de-inmigrantes/	2021-08-02	Colombia busca trato con miles de inmigrantes
UE promete ayuda a Lituania para enfrentar crisis migratoria - Diario Libre	https://www.diariolibre.com/actualidad/internacional/ue-promete-ayuda-a-lituania-para-enfrentar-crisis-migratoria-GE27897427	2021-08-02	UE promete ayuda a Lituania para enfrentar crisis migratoria
Policía colombiana captura a 5 personas por tráfico de 99 migrantes haitianos - Listín Diario	https://listindiario.com/las-mundiales/2021/08/03/682275/policia-colombiana-captura-a-5-personas-por-trafico-de-99-migrantes-haitianos	2021-08-03	Policía colombiana captura a 5 personas por tráfico de 99 migrantes haitianos
Primera dama de Honduras viajó a EEUU para conocer situación de migrantes - El Nuevo Diario (República Dominicana)	https://elnuevodiario.com.do/primera-dama-de-honduras-viajo-a-eeuu-para-conocer-situacion-de-migrantes/	2021-08-03	Primera dama de Honduras viajó a EEUU para conocer situación de migrantes
Panamá convoca a reunión regional ante oleada de migrantes - Diario Libre	https://www.diariolibre.com/actualidad/internacional/panama-convoca-a-reunion-regional-ante-oleada-de-migrantes-PN27919978	2021-08-03	Panamá convoca a reunión regional ante oleada de migrantes
Llegan a Lampedusa 424 migrantes mientras más de 800 esperan en barcos de ONG - Diario Libre	https://www.diariolibre.com/actualidad/internacional/llegan-a-lampedusa-424-migrantes-mientras-mas-de-800-esperan-en-barcos-de-ong-KO27925249	2021-08-03	Llegan a Lampedusa 424 migrantes mientras más de 800 esperan en barcos de ONG
Primera dama de Honduras viajó a EEUU para conocer situación de migrantes - Diario Libre	https://www.diariolibre.com/actualidad/internacional/primera-dama-de-honduras-viajo-a-eeuu-para-conocer-situacion-de-migrantes-LO27921912	2021-08-03	Primera dama de Honduras viajó a EEUU para conocer situación de migrantes
Estudio advierte peligro para inmigrantes en Ecuador si regresan a sus países - Diario Libre	https://www.diariolibre.com/actualidad/internacional/estudio-advierte-peligro-para-inmigrantes-en-ecuador-si-regresan-a-sus-paises-BO27922298	2021-08-03	Estudio advierte peligro para inmigrantes en Ecuador si regresan a sus países
El plan de EEUU para Centroamérica abarca gestión y vías legales de migración - Diario Libre	https://www.diariolibre.com/usa/actualidad/el-plan-de-eeuu-para-centroamerica-abarca-gestion-y-vias-legales-de-migracion-EO27927928	2021-08-03	El plan de EEUU para Centroamérica abarca gestión y vías legales de migración
Policía colombiana captura a 5 personas por tráfico de 99 migrantes haitianos - Diario Libre	https://www.diariolibre.com/actualidad/policia-colombiana-captura-a-5-personas-por-trafico-de-99-migrantes-haitianos-LM27908102	2021-08-03	Policía colombiana captura a 5 personas por tráfico de 99 migrantes haitianos
Panamá convoca a reunión regional ante oleada de migrantes - Listín Diario	https://listindiario.com/las-mundiales/2021/08/03/682277/panama-convoca-a-reunion-regional-ante-oleada-de-migrantes	2021-08-03	Panamá convoca a reunión regional ante oleada de migrantes
EEUU detuvo a más un millón inmigrantes en la frontera sur - El Caribe	https://www.elcaribe.com.do/destacado/eeuu-detuvo-a-mas-un-millon-inmigrantes-en-la-frontera-sur/	2021-07-16	EEUU detuvo a más un millón inmigrantes en la frontera sur
Inmigración irregular a Gran Bretaña supera el total de 2020 - Diario Libre	https://www.diariolibre.com/actualidad/internacional/inmigracion-irregular-a-gran-bretana-supera-el-total-de-2020-HH27644416	2021-07-21	Inmigración irregular a Gran Bretaña supera el total de 2020
La Unesco aconseja capacitar a maestros para ayudar a estudiantes migrantes - Diario Libre	https://www.diariolibre.com/actualidad/educacion/la-unesco-aconseja-capacitar-a-maestros-para-ayudar-a-estudiantes-migrantes-OH13149214	2019-06-20	La Unesco aconseja capacitar a maestros para ayudar a estudiantes migrantes
Cámara Baja de EEUU aprueba US$4,600 millones en ayuda para crisis migratoria - Diario Libre	https://www.diariolibre.com/economia/camara-baja-de-eeuu-aprueba-us-4-600-millones-en-ayuda-para-crisis-migratoria-CB13217599	2019-06-27	Cámara Baja de EEUU aprueba US$4,600 millones en ayuda para crisis migratoria
Juez de Nueva York paraliza ley de Trump para endurecer permisos a migrantes - Diario Libre	https://www.diariolibre.com/actualidad/internacional/juez-de-nueva-york-paraliza-ley-de-trump-para-endurecer-permisos-a-migrantes-GL14683775	2019-10-11	Juez de Nueva York paraliza ley de Trump para endurecer permisos a migrantes
Francisco denuncia la 'injusticia' de dejar morir en el mar a los migrantes - Diario Libre	https://www.diariolibre.com/actualidad/francisco-denuncia-la-injusticia-de-dejar-morir-en-el-mar-a-los-migrantes-JL15967806	2019-12-19	Francisco denuncia la 'injusticia' de dejar morir en el mar a los migrantes
Los perdones o waivers y las visas de no inmigrante - Diario Libre	https://www.diariolibre.com/actualidad/blogs/la-columna-de-migracion/los-perdones-o-waivers-y-las-visas-de-no-inmigrante-EG16544356	2020-01-21	Los perdones o waivers y las visas de no inmigrante
Consejo D.Humanos pide a España cambios en 'ley mordaza' y atención migrantes - Diario Libre	https://www.diariolibre.com/actualidad/internacional/consejo-d-humanos-pide-a-espana-cambios-en-ley-mordaza-y-atencion-migrantes-PK16581835	2020-01-22	Consejo D.Humanos pide a España cambios en 'ley mordaza' y atención migrantes
Grecia aplicará leyes especiales para centros de migrantes - Diario Libre	https://www.diariolibre.com/actualidad/internacional/grecia-aplicara-leyes-especiales-para-centros-de-migrantes-DJ16975556	2020-02-10	Grecia aplicará leyes especiales para centros de migrantes
Familias migrantes se abrazan en la frontera con de México con EEUU tras décadas sin verse - Diario Libre	https://www.diariolibre.com/usa/familias-migrantes-se-abrazan-en-la-frontera-con-de-mexico-con-eeuu-tras-decadas-sin-verse-LE26997840	2021-06-19	Familias migrantes se abrazan en la frontera con de México con EEUU tras décadas sin verse
Con manifestación exigen libertad de dominicana apresada por Inmigración - Almomento.net	https://almomento.net/exigen-a-inmigracion-libere-dominicana-arrestada-en-restaurant-de-brooklyn/	2020-03-10	Con manifestación exigen libertad de dominicana apresada por Inmigración
Costa Rica permitirá ingreso de 2.600 migrantes desde Panamá - Diario Libre	https://www.diariolibre.com/actualidad/internacional/costa-rica-permitira-ingreso-de-2600-migrantes-desde-panama-DH17898319	2020-03-24	Costa Rica permitirá ingreso de 2.600 migrantes desde Panamá
Venezolanos residentes en RD piden a Abinader ayuda social y regulación migratoria - Diario Libre	https://www.diariolibre.com/actualidad/venezolanos-residentes-en-rd-piden-a-abinader-ayuda-social-y-regulacion-migratoria-AM20688923	2020-08-10	Venezolanos residentes en RD piden a Abinader ayuda social y regulación migratoria
Grupo llama al Gobierno a ser más enérgico en su política contra la inmigración haitiana - Diario Libre	https://www.diariolibre.com/actualidad/ciudad/grupo-llama-al-gobierno-a-ser-mas-energico-en-su-politica-contra-la-inmigracion-haitiana-NI22088342	2020-10-15	Grupo llama al Gobierno a ser más enérgico en su política contra la inmigración haitiana
Fiestas y Personalidades, con un programa especial de turismo y migración - Diario Libre	https://www.diariolibre.com/revista/cultura/fiestas-y-personalidades-con-un-programa-especial-de-turismo-y-migracion-GF23514200	2020-12-30	Fiestas y Personalidades, con un programa especial de turismo y migración
Inmigrantes aplauden plan migratorio de Biden - Diario Libre	https://www.diariolibre.com/usa/actualidad/inmigrantes-aplauden-plan-migratorio-de-biden-LI23907639	2021-01-20	Inmigrantes aplauden plan migratorio de Biden
ONG mexicanas piden a nuevo Gobierno de EEUU una reforma migratoria integral - Diario Libre	https://www.diariolibre.com/actualidad/internacional/ong-mexicanas-piden-a-nuevo-gobierno-de-eeuu-una-reforma-migratoria-integral-DK23924315	2021-01-21	ONG mexicanas piden a nuevo Gobierno de EEUU una reforma migratoria integral
Chile rectifica y dice que sí vacunará a migrantes irregulares tras polémica - Diario Libre	https://www.diariolibre.com/actualidad/internacional/chile-rectifica-y-dice-que-si-vacunara-a-migrantes-irregulares-tras-polemica-GA24354244	2021-02-11	Chile rectifica y dice que sí vacunará a migrantes irregulares tras polémica
Tensión y violencia en la frontera Perú-Brasil por caravana migrante - Diario Libre	https://www.diariolibre.com/actualidad/internacional/tension-y-violencia-en-la-frontera-peru-brasil-por-caravana-migrante-DG24443189	2021-02-16	Tensión y violencia en la frontera Perú-Brasil por caravana migrante
Rechazan que Biden reactive polémico centro de niñez inmigrante en Florida - Diario Libre	https://www.diariolibre.com/usa/actualidad/rechazan-que-biden-reactive-polemico-centro-de-ninez-inmigrante-en-florida-MK24596468	2021-02-23	Rechazan que Biden reactive polémico centro de niñez inmigrante en Florida
Biden retira prohibición que bloqueaba la inmigración legal - Diario Libre	https://www.diariolibre.com/usa/actualidad/biden-retira-prohibicion-que-bloqueaba-la-inmigracion-legal-CC24626015	2021-02-25	Biden retira prohibición que bloqueaba la inmigración legal
Bukele reafirma que inseguridad es una de las causas de migración salvadoreña - Diario Libre	https://www.diariolibre.com/actualidad/internacional/bukele-reafirma-que-inseguridad-es-una-de-las-causas-de-migracion-salvadorena-PD25049431	2021-03-16	Bukele reafirma que inseguridad es una de las causas de migración salvadoreña
EEUU exonera temporalmente entrevistas presenciales a solicitantes de visa de no inmigrante - Diario Libre	https://www.diariolibre.com/usa/actualidad/eeuu-exonera-temporalmente-entrevistas-presenciales-a-solicitantes-de-visa-de-no-inmigrante-PB25173950	2021-03-23	EEUU exonera temporalmente entrevistas presenciales a solicitantes de visa de no inmigrante
¿De qué trata la nueva orden migratoria de Biden? - Diario Libre	https://www.diariolibre.com/usa/blogs/consultorio-de-migracion/de-que-trata-la-nueva-orden-migratoria-de-biden-EF25311702	2021-03-30	¿De qué trata la nueva orden migratoria de Biden?
Desesperación y cambio de políticas alientan ola migratoria - Diario Libre	https://www.diariolibre.com/usa/actualidad/desesperacion-y-cambio-de-politicas-alientan-ola-migratoria-AA25522130	2021-04-09	Desesperación y cambio de políticas alientan ola migratoria
Biden con más de 50 % de aprobación, pero flaquea en frontera e inmigración - Diario Libre	https://www.diariolibre.com/usa/actualidad/biden-con-mas-de-50-de-aprobacion-pero-flaquea-en-frontera-e-inmigracion-AL25844105	2021-04-25	Biden con más de 50 % de aprobación, pero flaquea en frontera e inmigración
Tensión entre España y Marruecos por llegada de migrantes - Diario Libre	https://www.diariolibre.com/usa/actualidad/tension-entre-espana-y-marruecos-por-llegada-de-migrantes-LG26312832	2021-05-18	Tensión entre España y Marruecos por llegada de migrantes
EEUU discutirá en el SICA el “reto compartido” de la inmigración irregular - Diario Libre	https://www.diariolibre.com/usa/actualidad/eeuu-discutira-en-el-sica-el-reto-compartido-de-la-inmigracion-irregular-OD26617584	2021-06-01	EEUU discutirá en el SICA el “reto compartido” de la inmigración irregular
