title	link	date	title_corrected
Haití saca a refugiados de aparcamiento de estadio - elnacional.com.do	https://elnacional.com.do/haiti-saca-a-refugiados-de-aparcamiento-de-estadio/	2011-07-16	Haití saca a refugiados de aparcamiento de estadio
¡Intentó escapar! Autoridades de migración impiden salida del país de Karim Abu Naba`a - ultimasnoticias.com.do	https://www.ultimasnoticias.com.do/2013/11/13/autoridades-de-migracion-impiden-salida-del-pais-de-karim-abu-nabaa/	2013-11-13	¡Intentó escapar! Autoridades de migración impiden salida del país de Karim Abu Naba`a
Desmantelan red vendía niños a extranjeros; apresan a italianos con bebé de 4 meses - ultimasnoticias.com.do	https://www.ultimasnoticias.com.do/2014/04/13/desmantelan-red-vendia-ninos-extranjeros-apresan-italianos-con-bebe-de-4-meses/	2014-04-13	Desmantelan red vendía niños a extranjeros; apresan a italianos con bebé de 4 meses
Sentencia 168-13 impulsó una profunda reforma migratoria - El Dia.com.do	https://eldia.com.do/sentencia-168-13-impulso-una-profunda-reforma-migratoria/	2015-06-01	Sentencia 168-13 impulsó una profunda reforma migratoria
Miedo lleva a migrantes a asumir los riesgos | Metro Republica Dominicana - Metrord	https://www.metrord.do/do/mundo/2015/10/22/miedo-lleva-migrantes-asumir-riesgos.html	2015-10-22	Miedo lleva a migrantes a asumir los riesgosMetro Republica Dominicana
Puertorriqueños migran a Dominicana por un mejor futuro - Metrord	https://www.metrord.do/do/noticias/2016/01/25/puertorriquenos-migran-dominicana-mejor-futuro.html	2016-01-25	Puertorriqueños migran a Dominicana por un mejor futuro
¿Cómo tratan a los refugiados en la UE? - Listín Diario	https://listindiario.com/las-mundiales/2016/01/31/405914/como-tratan-a-los-refugiados-en-la-ue	2016-01-31	¿Cómo tratan a los refugiados en la UE?
Hallan 45 extranjeras en cabaret Santiago | Hoy Digital - Hoy Digital (República Dominicana)	https://hoy.com.do/hallan-45-extranjeras-en-cabaret-santiago/	2016-05-07	Hallan 45 extranjeras en cabaret SantiagoHoy Digital
Actores de Game Of Thrones repudian maltrato a refugiados sirios - Metrord	https://www.metrord.do/do/entretencion/2016/07/03/actores-game-of-thrones-repudian-maltrato-refugiados-sirios.html	2016-07-03	Actores de Game Of Thrones repudian maltrato a refugiados sirios
La migración de RD es más femenina | Metro Republica Dominicana - Metrord	https://www.metrord.do/do/noticias/2016/09/08/migracion-rd-mas-femenina.html	2016-09-08	La migración de RD es más femeninaMetro Republica Dominicana
Acusan de vandalismo a la reportera húngara que zancadilleó a refugiados - Listín Diario	https://listindiario.com/las-mundiales/2016/09/08/434302/acusan-de-vandalismo-a-la-reportera-hungara-que-zancadilleo-a-refugiados	2016-09-08	Acusan de vandalismo a la reportera húngara que zancadilleó a refugiados
La ONU quiere repartir la carga en la atención a los millones de refugiados - Listín Diario	https://listindiario.com/las-mundiales/2016/09/19/435698/la-onu-quiere-repartir-la-carga-en-la-atencion-a-los-millones-de-refugiados	2016-09-19	La ONU quiere repartir la carga en la atención a los millones de refugiados
Denuncian vulneración de los derechos de inmigrantes en R. Dominicana - Metrord	https://www.metrord.do/do/noticias/2016/12/11/denuncian-vulneracion-derechos-inmigrantes-r-dominicana.html	2016-12-11	Denuncian vulneración de los derechos de inmigrantes en R. Dominicana
La migración del campo a la ciudad - El Dia.com.do	https://eldia.com.do/la-migracion-del-campo-a-la-ciudad/	2017-01-20	La migración del campo a la ciudad
Plan de Regularización ha beneficiado 250 mil extranjeros; 98% haitianos - ultimasnoticias.com.do	https://www.ultimasnoticias.com.do/2017/04/28/plan-regularizacion-ha-beneficiado-cerca-250-mil-extranjeros-98-ciento-haitianos/?nonamp=1	2017-04-28	Plan de Regularización ha beneficiado 250 mil extranjeros; 98% haitianos
EEUU suspende su emisión de visas a no migrantes en Rusia - El Nuevo Diario (República Dominicana)	https://elnuevodiario.com.do/eeuu-suspende-emision-de-visas-rusia/	2017-08-21	EEUU suspende su emisión de visas a no migrantes en Rusia
El Brexit pondrá fin a la migración de comunitarios - Metrord	https://www.metrord.do/do/destacado/2017/09/11/brexit-pondra-fin-la-migracion-comunitarios.html	2017-09-11	El Brexit pondrá fin a la migración de comunitarios
Abogada de migración Yudith Feliz encabeza desfile en Rhode Island - El Dia.com.do	https://eldia.com.do/abogada-de-migracion-yudith-feliz-encabeza-desfile-en-rhode-island/	2017-09-12	Abogada de migración Yudith Feliz encabeza desfile en Rhode Island
DGM entregará documentos de residencia a extranjeros - El Nuevo Diario (República Dominicana)	https://elnuevodiario.com.do/dgm-entregara-documentos-de-residencia-a-extranjeros/	2017-10-19	DGM entregará documentos de residencia a extranjeros
Inmigrantes aseguran que ningún muro “impenetrable” detendrá su viaje a EEUU - El Nuevo Diario (República Dominicana)	https://elnuevodiario.com.do/inmigrantes-aseguran-ningun-muro-impenetrable-detendra-viaje-eeuu/	2017-11-05	Inmigrantes aseguran que ningún muro “impenetrable” detendrá su viaje a EEUU
Así fue la jornada en un “epicentro” del voto migrante - Metrord	https://www.metrord.do/do/destacado/2017/11/19/asi-fue-la-jornada-epicentro-del-voto-migrante.html	2017-11-19	Así fue la jornada en un “epicentro” del voto migrante
Migración inicia renovación o cambio de categoría para extranjeros acogidos al Plan de Regularización - El Dia.com.do	https://eldia.com.do/migracion-inicia-renovacion-o-cambio-de-categoria-para-extranjeros/	2018-01-08	Migración inicia renovación o cambio de categoría para extranjeros acogidos al Plan de Regularización
Migración dice más de 15 mil extranjeros fueron deportados - El Nuevo Diario (República Dominicana)	https://elnuevodiario.com.do/migracion-dice-mas-de-15-mil-extranjeros-fueron-deportados/	2018-02-07	Migración dice más de 15 mil extranjeros fueron deportados
Nuevo cónsul en Haití ha sido acusado de tráfico de migrantes - Listín Diario	https://listindiario.com/la-republica/2018/02/20/503474/nuevo-consul-en-haiti-ha-sido-acusado-de-trafico-de-migrantes	2018-02-20	Nuevo cónsul en Haití ha sido acusado de tráfico de migrantes
Cancillería dominicana. Afirma RD logra avances en materia migratoria - Metrord	https://www.metrord.do/do/destacado/2018/02/28/cancilleria-dominicana-afirma-rd-logra-avances-materia-migratoria.html	2018-02-28	Cancillería dominicana. Afirma RD logra avances en materia migratoria
Migración repatria a más de 7 mil extranjeros durante el mes de febrero - Metrord	https://www.metrord.do/do/destacado/2018/03/06/migracion-repatria-mas-7-mil-extranjeros-mes-febrero.html	2018-03-06	Migración repatria a más de 7 mil extranjeros durante el mes de febrero
Emigración dominicana hacia España: causas y efectos - El Nuevo Diario (República Dominicana)	https://elnuevodiario.com.do/emigracion-dominicana-hacia-espana-causas-y-efectos/	2018-04-13	Emigración dominicana hacia España: causas y efectos
Venezolanos, segundo grupo más grande de inmigrantes en República Dominicana - El Dia.com.do	https://eldia.com.do/venezolanos-segundo-grupo-mas-grande-de-inmigrantes-en-republica-dominicana/	2018-04-16	Venezolanos, segundo grupo más grande de inmigrantes en República Dominicana
Migración detiene cientos de extranjeros en operativo en Santiago - Metrord	https://www.metrord.do/do/destacado/2018/04/26/migracion-detiene-cientos-extranjeros-operativo-santiago.html	2018-04-26	Migración detiene cientos de extranjeros en operativo en Santiago
Acuerdo sobre menores migrantes en EEUU afronta un duro obstáculo legal - El Nuevo Diario (República Dominicana)	https://elnuevodiario.com.do/acuerdo-sobre-menores-migrantes-en-eeuu-afronta-un-duro-obstaculo-legal/	2018-06-21	Acuerdo sobre menores migrantes en EEUU afronta un duro obstáculo legal
Chanel elige a la modelo refugiada para su campaña - Listín Diario	https://listindiario.com/la-vida/2018/07/21/525108/chanel-elige-a-la-modelo-refugiada-para-su-campana	2018-07-21	Chanel elige a la modelo refugiada para su campaña
Vence 26 plazo a extranjeros para renovar sus documentos | Hoy Digital - Hoy Digital (República Dominicana)	https://hoy.com.do/vence-26-plazo-a-extranjeros-para-renovar-sus-documentos/	2018-08-20	Vence 26 plazo a extranjeros para renovar sus documentosHoy Digital
Derechos Humanos presenta informe a RD de cómo actuar ante inmigración masiva de venezolanos - El Caribe	https://www.elcaribe.com.do/destacado/derechos-humanos-presenta-informe-rd-de-como-actuar-ante-inmigracion-masiva-de-venezolanos/	2018-09-04	Derechos Humanos presenta informe a RD de cómo actuar ante inmigración masiva de venezolanos
Impacto socio económico de la inmigración ilegal haitiana - Almomento.net	https://almomento.net/impacto-socio-economico-de-la-inmigracion-ilegal-haitiana/	2018-09-18	Impacto socio económico de la inmigración ilegal haitiana
Comunidad haitianos “organizados” denuncia xenofobia y odio en la RD - Almomento.net	https://almomento.net/comunidad-haitianos-organizados-rd-denuncia-xenofobia-y-odio-en-su-contra/	2018-09-24	Comunidad haitianos “organizados” denuncia xenofobia y odio en la RD
Lanzarán programa combatir trata de personas y tráfico ilícito de migrantes – El Nacional - elnacional.com.do	https://elnacional.com.do/lanzaran-programa-combatir-trata-de-personas-y-trafico-ilicito-de-migrantes/	2018-09-28	Lanzarán programa combatir trata de personas y tráfico ilícito de migrantes – El Nacional
Emigración dominicana – El Nacional - elnacional.com.do	https://elnacional.com.do/emigracion-dominicana/	2018-09-28	Emigración dominicana – El Nacional
Fiscalía mexicana rescata a 39 migrantes cubanos secuestrados en Cancún – El Nacional - elnacional.com.do	https://elnacional.com.do/fiscalia-mexicana-rescata-a-39-migrantes-cubanos-secuestrados-en-cancun/	2018-09-28	Fiscalía mexicana rescata a 39 migrantes cubanos secuestrados en Cancún – El Nacional
Migración cambiará carnets extranjeros – El Nacional - elnacional.com.do	https://elnacional.com.do/migracion-cambiara-carnets-extranjeros/	2018-09-28	Migración cambiará carnets extranjeros – El Nacional
Expulsan inmigrantes Venezuela de Brasil – El Nacional - elnacional.com.do	https://elnacional.com.do/expulsan-inmigrantes-venezuela-de-brasil/	2018-09-28	Expulsan inmigrantes Venezuela de Brasil – El Nacional
Venezuela trata migración con RD – El Nacional - elnacional.com.do	https://elnacional.com.do/venezuela-trata-migracion-con-rd/	2018-09-28	Venezuela trata migración con RD – El Nacional
UAPA inicia diplomado en migración consular – El Nacional - elnacional.com.do	https://elnacional.com.do/uapa-inicia-diplomado-en-migracion-consular/	2018-09-28	UAPA inicia diplomado en migración consular – El Nacional
Crecidas de ríos mantienen diez pueblos incomunicados y más de 4,500 refugiados en Nagua – El Nacional - elnacional.com.do	https://elnacional.com.do/crecidas-de-rios-mantienen-diez-pueblos-incomunicados-y-mas-de-4500-refugiados-en-nagua/	2018-09-29	Crecidas de ríos mantienen diez pueblos incomunicados y más de 4,500 refugiados en Nagua – El Nacional
Historia de la migración haitiana – El Nacional - elnacional.com.do	https://elnacional.com.do/historia-de-la-migracion-haitiana/	2018-09-29	Historia de la migración haitiana – El Nacional
“Inmigración española en RD” es el título del nuevo libro de Juan Manuel Romero Valiente – El Nacional - elnacional.com.do	https://elnacional.com.do/inmigracion-espanola-en-rd-es-el-titulo-del-nuevo-libro-de-juan-manuel-romero-valiente/	2018-09-29	“Inmigración española en RD” es el título del nuevo libro de Juan Manuel Romero Valiente – El Nacional
Yadira Morel: “hay enganchados dando servicios migración” – El Nacional - elnacional.com.do	https://elnacional.com.do/yadira-morel-hay-enganchados-dando-servicios-migracion/	2018-09-30	Yadira Morel: “hay enganchados dando servicios migración” – El Nacional
Migración deporta extranjeros de diferentes nacionalidades en situación irregular en el país – El Nacional - elnacional.com.do	https://elnacional.com.do/migracion-deporta-extranjeros-de-diferentes-nacionalidades-en-situacion-irregular-en-el-paisx/	2018-09-30	Migración deporta extranjeros de diferentes nacionalidades en situación irregular en el país – El Nacional
Migración apresa 854 extranjeros ilegales – El Nacional - elnacional.com.do	https://elnacional.com.do/migracion-apresa-854-extranjeros-ilegales/	2018-09-30	Migración apresa 854 extranjeros ilegales – El Nacional
Utica, el desconsuelo de una ciudad de EEUU que acogió a refugiados – El Nacional - elnacional.com.do	https://elnacional.com.do/utica-el-desconsuelo-de-una-ciudad-de-eeuu-que-acogio-a-refugiados/	2018-09-30	Utica, el desconsuelo de una ciudad de EEUU que acogió a refugiados – El Nacional
Venezolanos piden amnistía migratoria a RD – El Nacional - elnacional.com.do	https://elnacional.com.do/venezolanos-piden-amnistia-migratoria-a-rd/	2018-10-01	Venezolanos piden amnistía migratoria a RD – El Nacional
Crece migración a Villa Altagracia - El Nacional - elnacional.com.do	https://elnacional.com.do/crece-migracion-a-villa-altagracia/	2018-10-01	Crece migración a Villa AltagraciaEl Nacional
Abogada migración Yudith Feliz encabeza desfile de ¨Quisqueya en Acción¨ en Rhode Island – El Nacional - elnacional.com.do	https://elnacional.com.do/abogada-migracion-yudith-feliz-encabeza-desfile-de-%C2%A8quisqueya-en-accion%C2%A8-en-rhode-island/	2018-10-01	Abogada migración Yudith Feliz encabeza desfile de ¨Quisqueya en Acción¨ en Rhode Island – El Nacional
Sugieren en panel RD acoja emigrantes sirios – El Nacional - elnacional.com.do	https://elnacional.com.do/sugieren-en-panel-rd-acoja-emigrantes-sirios/	2018-10-01	Sugieren en panel RD acoja emigrantes sirios – El Nacional
Presidente de migrantes en Cataluña se pronuncia contra el alza consular en España – El Nacional - elnacional.com.do	https://elnacional.com.do/presidente-de-migrantes-en-cataluna-se-pronuncia-contra-el-alza-consular-en-espana/	2018-10-02	Presidente de migrantes en Cataluña se pronuncia contra el alza consular en España – El Nacional
FAO: la migración interna seguirá transformando economía de países pobres - El Nuevo Diario (República Dominicana)	https://elnuevodiario.com.do/fao-la-migracion-interna-seguira-transformando-economia-de-paises-pobres/	2018-10-15	FAO: la migración interna seguirá transformando economía de países pobres
Trump amenaza cerrar frontera con México si no detiene una caravana de migrantes - Listín Diario	https://listindiario.com/las-mundiales/2018/10/18/537995/trump-amenaza-cerrar-frontera-con-mexico-si-no-detiene-una-caravana-de-migrantes	2018-10-18	Trump amenaza cerrar frontera con México si no detiene una caravana de migrantes
Ni las fronteras ni el hambre detienen a la caravana de cinco mil migrantes - Metrord	https://www.metrord.do/do/destacado/2018/10/21/las-fronteras-hambre-detienen-la-caravana-cinco-mil-migrantes.html	2018-10-21	Ni las fronteras ni el hambre detienen a la caravana de cinco mil migrantes
Policía México quita barricada a migrantes – El Nacional - elnacional.com.do	https://elnacional.com.do/policia-mexico-quita-barricada-a-migrantes/	2018-10-27	Policía México quita barricada a migrantes – El Nacional
Centenares de migrantes hondureños se lanzan a río fronterizo e ingresan a México - Listin Diario	https://listindiario.com/las-mundiales/2018/10/29/539534/centenares-de-migrantes-hondurenos-se-lanzan-a-rio-fronterizo-e-ingresan-a-mexico	2018-10-29	Centenares de migrantes hondureños se lanzan a río fronterizo e ingresan a México
8 preguntas, y sus respuestas, para entender las caravanas de migrantes en México - Listin Diario	https://listindiario.com/las-mundiales/2018/11/02/540186/8-preguntas-y-sus-respuestas-para-entender-las-caravanas-de-migrantes-en-mexico	2018-11-02	8 preguntas, y sus respuestas, para entender las caravanas de migrantes en México
Inmigración en Estados Unidos: 7 gráficos que muestran su verdadera dimensión y su contribución a la economía - El Dia.com.do	https://eldia.com.do/inmigracion-en-estados-unidos-7-graficos-que-muestran-su-verdadera-dimension-y-su-contribucion-a-la-economia/	2018-11-29	Inmigración en Estados Unidos: 7 gráficos que muestran su verdadera dimensión y su contribución a la economía
Pacto de migraciones ONU hunde a RD - Listín Diario	https://listindiario.com/puntos-de-vista/2018/12/03/544169/pacto-de-migraciones-onu-hunde-a-rd	2018-12-03	Pacto de migraciones ONU hunde a RD
La migración se convertirá uno de los problemas globales definitorios del s. XXI - Metrord	https://www.metrord.do/do/destacado/2018/12/10/la-migracion-se-convertira-uno-los-problemas-globales-definitorios-del-s-xxi.html	2018-12-10	La migración se convertirá uno de los problemas globales definitorios del s. XXI
Marcan a niños migrantes como en campos de concentración - Metrord	https://www.metrord.do/do/noticias/2018/12/17/marcan-ninos-migrantes-campos-concentracion.html	2018-12-17	Marcan a niños migrantes como en campos de concentración
Cerca de 400 inmigrantes murieron al intentar cruzar frontera de EEUU en 2018 - El Caribe	https://www.elcaribe.com.do/destacado/cerca-de-400-inmigrantes-murieron-al-intentar-cruzar-frontera-de-eeuu-en-2018-2/	2019-01-01	Cerca de 400 inmigrantes murieron al intentar cruzar frontera de EEUU en 2018
Anthony González: “Los niños sufren mucho en los centros de inmigrantes” - Metrord	https://www.metrord.do/do/entretencion/2019/02/17/anthony-gonzalez-los-ninos-sufren-mucho-los-centros-inmigrantes.html	2019-02-17	Anthony González: “Los niños sufren mucho en los centros de inmigrantes”
Apresan hombre estafaba ciudadanos con visas falsas - ultimasnoticias.com.do	https://www.ultimasnoticias.com.do/2019/03/01/apresan-hombre-estafaba-ciudadanos-con-visas-falsas/	2019-03-01	Apresan hombre estafaba ciudadanos con visas falsas
Estudio OIM cifra en unos 25.000 los inmigrantes venezolanos en RD - El Nuevo Diario (República Dominicana)	https://elnuevodiario.com.do/estudio-oim-cifra-en-unos-25-000-los-inmigrantes-venezolanos-en-rd/	2019-03-21	Estudio OIM cifra en unos 25.000 los inmigrantes venezolanos en RD
Arrestan hombre por explotar sexualmente a extranjeras en San Pedro de Macorís | Hoy Digital - Hoy Digital (República Dominicana)	https://hoy.com.do/arrestan-hombre-por-explotar-sexualmente-a-extranjeras-en-san-pedro-de-macoris/	2019-04-01	Arrestan hombre por explotar sexualmente a extranjeras en San Pedro de MacorísHoy Digital
Las remesas de migrantes latinoamericanos crecen un 10 % en 2018 - El Dia.com.do	https://eldia.com.do/las-remesas-de-migrantes-latinoamericanos-crecen-un-10-en-2018/	2019-04-04	Las remesas de migrantes latinoamericanos crecen un 10 % en 2018
Heriberto Medrano mantuvo una vida sin escándalos y refugiado en la vida familiar - Listin Diario	https://listindiario.com/la-republica/2019/05/21/566426/heriberto-medrano-mantuvo-una-vida-sin-escandalos-y-refugiado-en-la-vida-familiar	2019-05-21	Heriberto Medrano mantuvo una vida sin escándalos y refugiado en la vida familiar
Migración asegura extranjeros dejan RD – El Nacional - elnacional.com.do	https://elnacional.com.do/migracion-asegura-extranjeros-dejan-rd/	2019-06-18	Migración asegura extranjeros dejan RD – El Nacional
La OEA aboga por el derecho a la identidad de los migrantes venezolanos - El Nuevo Diario (República Dominicana)	https://elnuevodiario.com.do/la-oea-aboga-por-el-derecho-a-la-identidad-de-los-migrantes-venezolanos/	2019-06-28	La OEA aboga por el derecho a la identidad de los migrantes venezolanos
Muere un migrante hondureño bajo la custodia de autoridades de Estados Unidos - El Nuevo Diario (República Dominicana)	https://elnuevodiario.com.do/muere-un-migrante-hondureno-bajo-la-custodia-de-autoridades-de-estados-unidos/	2019-07-01	Muere un migrante hondureño bajo la custodia de autoridades de Estados Unidos
Dinámica migratoria en RD funciona bajo un nuevo modelo - El Caribe	https://www.elcaribe.com.do/panorama/pais/dinamica-migratoria-en-rd-funciona-bajo-un-nuevo-modelo/	2019-07-16	Dinámica migratoria en RD funciona bajo un nuevo modelo
Hay tres dominicanos en el exterior por cada inmigrante en el país - El Caribe	https://www.elcaribe.com.do/panorama/pais/hay-tres-dominicanos-en-el-exterior-por-cada-inmigrante-en-el-pais/	2019-07-18	Hay tres dominicanos en el exterior por cada inmigrante en el país
Gobierno Trump vuelve a poner en alerta a migrantes con deportaciones rápidas - El Nuevo Diario (República Dominicana)	https://elnuevodiario.com.do/gobierno-trump-vuelve-a-poner-en-alerta-a-migrantes-con-deportaciones-rapidas/	2019-07-22	Gobierno Trump vuelve a poner en alerta a migrantes con deportaciones rápidas
Trump pone en alerta con deportaciones rápidas a migrantes con más de 2 años ilegal - Listín Diario	https://listindiario.com/las-mundiales/2019/07/23/575169/trump-pone-en-alerta-con-deportaciones-rapidas-a-migrantes-con-mas-de-2-anos-ilegal	2019-07-23	Trump pone en alerta con deportaciones rápidas a migrantes con más de 2 años ilegal
Dominicanos ocupan tercer lugar inmigrantes ilegales ingresó a Chile en lo que va de año – El Nacional - elnacional.com.do	https://elnacional.com.do/dominicanos-ocupan-tercer-lugar-inmigrantes-ilegales-ingreso-a-chile-en-lo-que-va-de-ano/	2019-07-25	Dominicanos ocupan tercer lugar inmigrantes ilegales ingresó a Chile en lo que va de año – El Nacional
Muere un migrante haitiano en una celda de aislamiento en el sur de México - Listín Diario	https://listindiario.com/las-mundiales/2019/08/09/577464/muere-un-migrante-haitiano-en-una-celda-de-aislamiento-en-el-sur-de-mexico	2019-08-09	Muere un migrante haitiano en una celda de aislamiento en el sur de México
EEUU defiende estrategia para rechazar inmigrantes legales con bajos ingresos - El Nuevo Diario (República Dominicana)	https://elnuevodiario.com.do/eeuu-defiende-estrategia-para-rechazar-inmigrantes-legales-con-bajos-ingresos/	2019-08-12	EEUU defiende estrategia para rechazar inmigrantes legales con bajos ingresos
Guardia Costera de Puerto Rico devuelve 25 migrantes ilegales a RD – El Nacional - elnacional.com.do	https://elnacional.com.do/guardia-costera-de-puerto-rico-devuelve-25-migrantes-ilegales-a-rd/	2019-08-16	Guardia Costera de Puerto Rico devuelve 25 migrantes ilegales a RD – El Nacional
Ryan Reynolds y Blake Lively donan dos millones a centros con niños migrantes - El Nuevo Diario (República Dominicana)	https://elnuevodiario.com.do/ryan-reynolds-y-blake-lively-donan-dos-millones-a-centros-con-ninos-migrantes/	2019-09-05	Ryan Reynolds y Blake Lively donan dos millones a centros con niños migrantes
5 cosas que tienes que saber sobre la nueva crisis migratoria en Turquía - Metrord	https://www.metrord.do/do/noticias/2019/09/09/5-cosas-que-tienes-que-saber-sobre-la-nueva-crisis-migratoria-en-turquia.html	2019-09-09	5 cosas que tienes que saber sobre la nueva crisis migratoria en Turquía
Madre migrante y su pequeño hijo mueren ahogados al intentar cruzar a EEUU | Hoy Digital - Hoy Digital (República Dominicana)	https://hoy.com.do/madre-migrante-y-su-pequeno-hijo-mueren-ahogados-al-intentar-cruzar-a-eeuu/	2019-09-17	Madre migrante y su pequeño hijo mueren ahogados al intentar cruzar a EEUUHoy Digital
El número de migrantes sigue subiendo en todo el mundo, hasta 272 millonesEl número de migrantes sigue subiendo en todo el mundo, hasta 272 millones - Periódico El Caribe - El Caribe	https://www.elcaribe.com.do/panorama/internacionales/el-numero-de-migrantes-sigue-subiendo-en-todo-el-mundo-hasta-272-millones/	2019-09-17	El número de migrantes sigue subiendo en todo el mundo, hasta 272 millonesEl número de migrantes sigue subiendo en todo el mundo, hasta 272 millonesPeriódico 
Abinader: «No se puede aceptar más inmigración ilegal en el país» - eldia.com.do	https://eldia.com.do/abinader-no-se-puede-aceptar-mas-inmigracion-ilegal-en-el-pais/	2019-09-19	Abinader: «No se puede aceptar más inmigración ilegal en el país»
Toma fuerza la migración por cambio climático | Metro Republica Dominicana - Metrord	https://www.metrord.do/do/noticias/2019/09/26/toma-fuerza-la-migracion-cambio-climatico.html	2019-09-26	Toma fuerza la migración por cambio climáticoMetro Republica Dominicana
Procuraduría arresta a 10 personas vincula a trata ilegal de migrantes - Almomento.net	https://almomento.net/procuraduria-arresta-a-10-personas-vincula-a-trata-ilegal-de-migrantes/	2019-10-01	Procuraduría arresta a 10 personas vincula a trata ilegal de migrantes
Retiran multas a migrantes que se refugian dentro iglesias EEUU | Hoy Digital - Hoy Digital (República Dominicana)	https://hoy.com.do/retiran-multas-a-migrantes-que-se-refugian-dentro-iglesias-eeuu/	2019-10-24	Retiran multas a migrantes que se refugian dentro iglesias EEUUHoy Digital
La justicia suspende orden de Trump de denegar visados a migrantes sin seguro – El Nacional - elnacional.com.do	https://elnacional.com.do/la-justicia-suspende-orden-de-trump-de-denegar-visados-a-migrantes-sin-seguro/	2019-11-03	La justicia suspende orden de Trump de denegar visados a migrantes sin seguro – El Nacional
Corte revisará programa para migrantes del DACA - Listín Diario	https://listindiario.com/las-mundiales/2019/11/11/590911/corte-revisara-programa-para-migrantes-del-daca	2019-11-11	Corte revisará programa para migrantes del DACA
Interceptado en Holanda un autobús con 65 inmigrantes moldavos irregulares - Listín Diario	https://listindiario.com/las-mundiales/2019/11/19/592193/interceptado-en-holanda-un-autobus-con-65-inmigrantes-moldavos-irregulares	2019-11-19	Interceptado en Holanda un autobús con 65 inmigrantes moldavos irregulares
