title	link	date	title_corrected
Policarpo Chaj: el migrante guatemalteco que ayudaba a connacionales en EE. UU. y que murió por covid-19 - Prensa Libre	https://www.prensalibre.com/guatemala/migrantes/policarpio-chaj-el-migrante-guatemalteco-que-ayudaba-a-connacionales-en-ee-uu-y-que-murio-por-covid-19/	2021-03-14	Policarpo Chaj: el migrante guatemalteco que ayudaba a connacionales en EE. UU. y que murió por covid-19
Los jóvenes migrantes centroamericanos ven la era de Biden como una oportunidad para ingresar en EE. UU. | Republica.gt - republica.gt	https://republica.gt/2021/03/14/centroamericanos-era-de-biden-oportunidad-para-ingresar-a-ee-uu/	2021-03-14	Los jóvenes migrantes centroamericanos ven la era de Biden como una oportunidad para ingresar en EE. UU.Republica.gt
Comitancillo llora a su “Messi”, uno de los migrantes víctimas de la masacre en Tamaulipas - Prensa Libre	https://www.prensalibre.com/guatemala/migrantes/comitancillo-llora-a-su-messi-uno-de-los-migrantes-victimas-de-la-masacre-en-tamaulipas/	2021-03-14	Comitancillo llora a su “Messi”, uno de los migrantes víctimas de la masacre en Tamaulipas
Historias Urbanas | La voz del migrante | - republica.gt	https://republica.gt/2021/03/14/historias-urbanas-la-voz-del-migrante/	2021-03-14	Historias UrbanasLa voz del migrante |
“No tenemos muchas opciones”: EE.UU. admite malas condiciones de menores migrantes en centro de Texas - Prensa Libre	https://www.prensalibre.com/guatemala/migrantes/no-tenemos-muchas-opciones-ee-uu-admite-malas-condiciones-de-menores-migrantes-en-centro-de-texas/	2021-03-15	“No tenemos muchas opciones”: EE.UU. admite malas condiciones de menores migrantes en centro de Texas
Facilitarán inserción laboral a refugiados – Noticias Última Hora de Guatemala - dca.gob.gt	https://dca.gob.gt/noticias-guatemala-diario-centro-america/facilitaran-insercion-laboral-a-refugiados/	2021-03-16	Facilitarán inserción laboral a refugiados – Noticias Última Hora de Guatemala
Ocho migrantes mueren en accidente de tránsito en una carretera de Texas y esto dice la Cancillería guatemalteca - Prensa Libre	https://www.prensalibre.com/guatemala/migrantes/ocho-migrantes-mueren-en-accidente-de-transito-en-una-carretera-de-texas-y-esto-dice-la-cancilleria-guatemalteca/	2021-03-16	Ocho migrantes mueren en accidente de tránsito en una carretera de Texas y esto dice la Cancillería guatemalteca
Repunta migración hacia EE. UU. de menores no acompañados y familias guatemaltecas - Prensa Libre	https://www.prensalibre.com/guatemala/migrantes/repunta-migracion-hacia-ee-uu-de-menores-no-acompanados-y-familias-guatemaltecas/	2021-03-16	Repunta migración hacia EE. UU. de menores no acompañados y familias guatemaltecas
México colocará un operativo policial en frontera con Guatemala para detener migración de menores - elPeriódico (Guatemala)	https://elperiodico.com.gt/nacionales/2021/03/19/mexico-colocara-un-operativo-policial-en-frontera-con-guatemala-para-detener-migracion-de-menores/	2021-03-19	México colocará un operativo policial en frontera con Guatemala para detener migración de menores
Migración convoca a empresas nacionales y extranjeras por adquisición de 750 mil cartillas - La Hora	https://lahora.gt/migracion-convoca-a-empresas-nacionales-y-extranjeras-por-adquisicion-de-750-mil-cartillas/	2021-03-19	Migración convoca a empresas nacionales y extranjeras por adquisición de 750 mil cartillas
Las dramáticas imágenes que revelan los sueños rotos de migrantes que apuestan todo por una nueva vida en EE. UU. - Prensa Libre	https://www.prensalibre.com/internacional/las-dramaticas-imagenes-que-revelan-los-suenos-rotos-de-migrantes-que-apuestan-todo-por-una-nueva-vida-en-ee-uu/	2021-03-19	Las dramáticas imágenes que revelan los sueños rotos de migrantes que apuestan todo por una nueva vida en EE. UU.
México se blinda en la frontera con Guatemala para frenar el coronavirus y la migración indocumentada - Prensa Libre	https://www.prensalibre.com/guatemala/migrantes/mexico-se-blinda-en-la-frontera-con-guatemala-para-frenar-el-coronavirus-y-la-migracion-indocumentada/	2021-03-19	México se blinda en la frontera con Guatemala para frenar el coronavirus y la migración indocumentada
Dr. Q, el jornalero migrante que se convirtió en neurocirujano - Soy502	https://www.soy502.com/articulo/dr-q-neurocirujano-salto-muro-huir-pobreza-153	2021-03-20	Dr. Q, el jornalero migrante que se convirtió en neurocirujano
Patrulla Fronteriza consideraría liberar a migrantes retenidos en la frontera con México - Prensa Libre	https://www.prensalibre.com/guatemala/migrantes/patrulla-fronteriza-consideraria-liberar-a-migrantes-retenidos-en-la-frontera-con-mexico/	2021-03-21	Patrulla Fronteriza consideraría liberar a migrantes retenidos en la frontera con México
Niña migrante de 9 años fallece al intentar cruzar el Río Bravo; podría ser guatemalteca - La Hora	https://lahora.gt/nina-migrante-de-9-anos-fallece-al-intentar-cruzar-el-rio-bravo-podria-ser-guatemalteca/	2021-03-21	Niña migrante de 9 años fallece al intentar cruzar el Río Bravo; podría ser guatemalteca
Lea: Otto Barrios, el migrante de Retalhuleu que ahora entrega ayuda humanitaria en Haití - La Hora	https://lahora.gt/otto-barrios-el-migrante-de-retalhuleu-que-ahora-entrega-ayuda-humanitaria-en-haiti/	2021-03-21	Lea: Otto Barrios, el migrante de Retalhuleu que ahora entrega ayuda humanitaria en Haití
Fotos de migrantes detenidos revelan grave situación en frontera de EE. UU. - La Hora	https://lahora.gt/fotos-de-migrantes-detenidos-revelan-grave-situacion-en-frontera-de-ee-uu/	2021-03-22	Fotos de migrantes detenidos revelan grave situación en frontera de EE. UU.
Organizaciones y líderes religiosos se pone a disposición para abordar la migración - La Hora	https://lahora.gt/organizaciones-y-lideres-religiosos-se-pone-a-disposicion-para-abordar-la-migracion/	2021-03-23	Organizaciones y líderes religiosos se pone a disposición para abordar la migración
Gobierno de EE.UU. muestra primeros videos de niños migrantes bajo su custodia - elPeriódico (Guatemala)	https://elperiodico.com.gt/noticias/internacionales/2021/03/23/gobierno-de-ee-uu-muestra-primeros-videos-de-ninos-migrantes-bajo-su-custodia/	2021-03-23	Gobierno de EE.UU. muestra primeros videos de niños migrantes bajo su custodia
Kamala Harris liderará esfuerzos de Washington para abordar causas de la migración en Guatemala, México, El Salvador y Honduras - Prensa Libre	https://www.prensalibre.com/guatemala/migrantes/kamala-harris-liderara-esfuerzos-de-washington-para-abordar-causas-de-la-migracion-en-guatemala-mexico-el-salvador-y-honduras-breaking/	2021-03-24	Kamala Harris liderará esfuerzos de Washington para abordar causas de la migración en Guatemala, México, El Salvador y Honduras
"Norma Torres señala que crisis migratoria es creada por ""narcogobiernos"" - Publinews Guatemala"	https://www.publinews.gt/gt/noticias/2021/03/24/norma-torres-senala-que-crisis-migratoria-es-creada-por-narcogobiernos.html	2021-03-24	"Norma Torres señala que crisis migratoria es creada por ""narcogobiernos"""
Más de 130 migrantes, la mayoría guatemaltecos y menores no acompañados, se entregan a la Patrulla Fronteriza en Arizona - Prensa Libre	https://www.prensalibre.com/guatemala/migrantes/mas-de-130-migrantes-la-mayoria-guatemaltecos-y-menores-no-acompanados-se-entregan-a-la-patrulla-fronteriza-en-arizona-breaking/	2021-03-24	Más de 130 migrantes, la mayoría guatemaltecos y menores no acompañados, se entregan a la Patrulla Fronteriza en Arizona
Pentágono recibe solicitud para albergar a niños migrantes - elPeriódico (Guatemala)	https://elperiodico.com.gt/noticias/internacionales/2021/03/24/pentagono-recibe-solicitud-para-albergar-a-ninos-migrantes/	2021-03-24	Pentágono recibe solicitud para albergar a niños migrantes
El Salvador pide a EE. UU. una agenda migratoria sin Guatemala - republica.gt	https://republica.gt/2021/03/25/el-salvador-pide-estados-unidos-agenda-migratoria-sin-guatemala/	2021-03-25	El Salvador pide a EE. UU. una agenda migratoria sin Guatemala
Niño migrante, de madre guatemalteca, muere en el río Grande en su intento por llegar a EE. UU. - Prensa Libre	https://www.prensalibre.com/guatemala/migrantes/nino-migrante-de-madre-guatemalteca-muere-en-el-rio-grande-en-su-intento-por-llegar-a-ee-uu-breaking/	2021-03-25	Niño migrante, de madre guatemalteca, muere en el río Grande en su intento por llegar a EE. UU.
Arrestan a adolescente por accidente donde murieron un migrante guatemalteco y un mexicano - Prensa Libre	https://www.prensalibre.com/guatemala/migrantes/arrestan-a-adolescente-por-accidente-donde-murieron-un-migrante-guatemalteco-y-un-mexicano-breaking/	2021-03-26	Arrestan a adolescente por accidente donde murieron un migrante guatemalteco y un mexicano
Continúan las migraciones desde San Marcos hacia EE. UU. - elPeriódico (Guatemala)	https://elperiodico.com.gt/nacionales/2021/03/26/continuan-las-migraciones-desde-san-marcos-hacia-ee-uu/	2021-03-26	Continúan las migraciones desde San Marcos hacia EE. UU.
González achaca a las “elites depredadoras” la migración irregular - elPeriódico (Guatemala)	https://elperiodico.com.gt/nacionales/2021/03/27/gonzalez-achaca-a-las-elites-depredadoras-la-migracion-irregular/	2021-03-27	González achaca a las “elites depredadoras” la migración irregular
México y Guatemala lanzan operativo militar contra migración irregular - Spanish Version - Periódico Digital Centroamericano y del Caribe	https://newsinamerica.com/pdcc/boletin/2021/mexico-y-guatemala-lanzan-operativo-militar-contra-migracion-irregular/	2021-03-27	México y Guatemala lanzan operativo militar contra migración irregularSpanish Version
Otto Barrios, un migrante guatemalteco, que entrega ayuda humanitaria - Publinews Guatemala	https://www.publinews.gt/gt/noticias/2021/03/27/otto-barrios-migrante-guatemalteco-ayuda.html	2021-03-27	Otto Barrios, un migrante guatemalteco, que entrega ayuda humanitaria
Biden dice que México se niega a recibir a las familias migrantes que EE.UU. deporta - Spanish Version - Periódico Digital Centroamericano y del Caribe	https://newsinamerica.com/pdcc/boletin/2021/biden-dice-que-mexico-se-niega-a-recibir-a-las-familias-migrantes-que-ee-uu-deporta/	2021-03-28	Biden dice que México se niega a recibir a las familias migrantes que EE.UU. deportaSpanish Version
De Guatemala a EE.UU, la solitaria odisea de un niño inmigrante - elPeriódico (Guatemala)	https://elperiodico.com.gt/nacionales/2021/03/28/de-guatemala-a-ee-uu-la-solitaria-odisea-de-un-nino-inmigrante/	2021-03-28	De Guatemala a EE.UU, la solitaria odisea de un niño inmigrante
Migración coordina acciones ante posible ingreso de caravana de migrantes - elmetropolitano.com.gt	https://elmetropolitano.com.gt/es/2021/03/29/migracion-coordina-acciones-ante-posible-ingreso-de-caravana-de-migrantes/?utm_source=rss&utm_medium=rss&utm_campaign=migracion-coordina-acciones-ante-posible-ingreso-de-caravana-de-migrantes	2021-03-29	Migración coordina acciones ante posible ingreso de caravana de migrantes
Ejecutivo decreta Estado de Prevención por nueva caravana migrante - elPeriódico (Guatemala)	https://elperiodico.com.gt/nacionales/2021/03/29/ejecutivo-decreta-estado-de-prevencion-por-nueva-caravana-migrante/	2021-03-29	Ejecutivo decreta Estado de Prevención por nueva caravana migrante
Decretan estado de Prevención por la llegada de migrantes hondureños - republica.gt	https://republica.gt/2021/03/29/estado-prevencion-cinco-departamentos-caravana-migrantes/	2021-03-29	Decretan estado de Prevención por la llegada de migrantes hondureños
Casa del Migrante y SIMN abogan por protección de migrantes por posible caravana - La Hora	https://lahora.gt/casa-del-migrante-y-simn-abogan-por-proteccion-de-migrantes-por-posible-caravana/	2021-03-29	Casa del Migrante y SIMN abogan por protección de migrantes por posible caravana
Ejecutivo decreta Estado de Prevención ante nueva caravana de migrantes - elPeriódico (Guatemala)	https://elperiodico.com.gt/nacionales/2021/03/30/ejecutivo-decreta-estado-de-prevencion-ante-nueva-caravana-de-migrantes/	2021-03-30	Ejecutivo decreta Estado de Prevención ante nueva caravana de migrantes
Caravana migrante: Qué pasó con el pequeño grupo que salió desde Honduras con el fin de llegar a Estados Unidos - Prensa Libre	https://www.prensalibre.com/guatemala/migrantes/migrantes-honduras-caravana-guatemala-breaking/	2021-03-30	Caravana migrante: Qué pasó con el pequeño grupo que salió desde Honduras con el fin de llegar a Estados Unidos
Kamala Harris y Alejandro Giammattei revisan agenda sobre migración, desarrollo y lucha contra la corrupción y las drogas - Prensa Libre	https://www.prensalibre.com/guatemala/migrantes/kamala-harris-y-alejandro-giammattei-revisan-agenda-sobre-migracion-desarrollo-y-lucha-contra-la-corrupcion-y-las-drogas/	2021-03-30	Kamala Harris y Alejandro Giammattei revisan agenda sobre migración, desarrollo y lucha contra la corrupción y las drogas
EE. UU. acusa a un mexicano de traficar a 13 inmigrantes que murieron en accidente, incluida una guatemalteca - Prensa Libre	https://www.prensalibre.com/guatemala/migrantes/un-mexicano-es-acusado-en-eeuu-de-traficar-a-13-inmigrantes-que-murieron-en-accidente-breaking/	2021-03-31	EE. UU. acusa a un mexicano de traficar a 13 inmigrantes que murieron en accidente, incluida una guatemalteca
Hacinados: rescatan a 61 migrantes (entre ellos menores guatemaltecos) en México - Prensa Libre	https://www.prensalibre.com/internacional/hacinados-rescatan-a-61-migrantes-entre-ellos-menores-guatemaltecos-en-mexico/	2021-04-04	Hacinados: rescatan a 61 migrantes (entre ellos menores guatemaltecos) en México
Empresa venderá datos personales de migrantes radicados en EE.UU. - Soy502	https://www.soy502.com/articulo/empresa-vendera-datos-personales-ice-153	2021-04-04	Empresa venderá datos personales de migrantes radicados en EE.UU.
OPS advierte sobre riesgos que enfrentan los migrantes - Spanish Version - Periódico Digital Centroamericano y del Caribe	https://newsinamerica.com/pdcc/boletin/2021/ops-advierte-sobre-riesgos-que-enfrentan-los-migrantes/	2021-04-04	OPS advierte sobre riesgos que enfrentan los migrantesSpanish Version
Lea: Enviado Especial, Ricardo Zúñiga viajará a Guatemala para abordar las causas de la migración - La Hora	https://lahora.gt/enviado-especial-ricardo-zuniga-viajara-a-guatemala-para-abordar-las-causas-de-la-migracion/	2021-04-04	Lea: Enviado Especial, Ricardo Zúñiga viajará a Guatemala para abordar las causas de la migración
Unos 310 inmigrantes hondureños en caravana a Estados Unidos han retornado - republica.gt	https://republica.gt/2021/04/05/caravana-estados-unidos-migrantes-guatemala-honduras/	2021-04-05	Unos 310 inmigrantes hondureños en caravana a Estados Unidos han retornado
INM de México encontró a decenas de migrantes hacinados en Nuevo León - La Hora	https://lahora.gt/inm-de-mexico-encontro-a-decenas-de-migrantes-hacinados-en-nuevo-leon/	2021-04-05	INM de México encontró a decenas de migrantes hacinados en Nuevo León
Por: Senador y congresistas demócratas hablan de la corrupción que origina migración - La Hora	https://lahora.gt/senador-y-congresistas-democratas-hablan-de-la-corrupcion-que-origina-migracion/	2021-04-05	Por: Senador y congresistas demócratas hablan de la corrupción que origina migración
Enviado de Estados Unidos insistió a Giammattei que debe evitar migración - republica.gt	https://republica.gt/2021/04/06/enviado-estados-unidos-insistio-giammattei-evitar-migracion/	2021-04-06	Enviado de Estados Unidos insistió a Giammattei que debe evitar migración
Video: el desgarrador momento en que un niño migrante solitario se entrega a la Patrulla Fronteriza cerca del desierto - Prensa Libre	https://www.prensalibre.com/guatemala/migrantes/video-el-desgarrador-momento-en-que-un-nino-migrante-solitario-se-entrega-a-la-patrulla-fronteriza-cerca-del-desierto-breaking/	2021-04-06	Video: el desgarrador momento en que un niño migrante solitario se entrega a la Patrulla Fronteriza cerca del desierto
EU capturó a 171 mil migrantes; cifras oficiales durante marzo - Spanish Version - newsinamerica.com	https://newsinamerica.com/pdcc/boletin/2021/eu-capturo-a-171-mil-migrantes-cifras-oficiales-durante-marzo/	2021-04-06	EU capturó a 171 mil migrantes; cifras oficiales durante marzoSpanish Version
Se reestablece servicio de emisión de pasaportes y migración - Publinews Guatemala	https://www.publinews.gt/gt/noticias/2021/04/07/centro-emision-pasaportes-guatemala-covid.html	2021-04-07	Se reestablece servicio de emisión de pasaportes y migración
Guatemala requiere de desarrollo para evitar migración, dice exvicepresidente - elPeriódico (Guatemala)	https://elperiodico.com.gt/nacionales/2021/04/07/guatemala-requiere-de-desarrollo-para-evitar-migracion-dice-exvicepresidente/	2021-04-07	Guatemala requiere de desarrollo para evitar migración, dice exvicepresidente
Largas colas en migración para tramitar pasaportes - Soy502	https://www.soy502.com/articulo/denuncian-largas-colas-migracion-tramitar-pasaportes-100931	2021-04-08	Largas colas en migración para tramitar pasaportes
López Obrador y Kamala Harris hablan sobre migración - elPeriódico (Guatemala)	https://elperiodico.com.gt/noticias/internacionales/2021/04/08/lopez-obrador-y-kamala-harris-hablan-sobre-migracion/	2021-04-08	López Obrador y Kamala Harris hablan sobre migración
SOSEP asiste a 97 familias migrantes – Noticias Última Hora de Guatemala - dca.gob.gt	https://dca.gob.gt/noticias-guatemala-diario-centro-america/sosep-asiste-a-97-familias-migrantes/	2021-04-08	SOSEP asiste a 97 familias migrantes – Noticias Última Hora de Guatemala
Arrestos mensuales de migrantes en frontera de Estados Unidos aumentan 71% y llegan a su mayor nivel en 20 años - Prensa Libre	https://www.prensalibre.com/guatemala/migrantes/arrestos-de-migrantes-indocumentados-en-frontera-de-eeuu-llegan-a-su-mayor-nivel-en-20-anos-breaking/	2021-04-08	Arrestos mensuales de migrantes en frontera de Estados Unidos aumentan 71% y llegan a su mayor nivel en 20 años
Análisis: ¿Cuáles son las claves del éxito para contener la migración? - Prensa Libre	https://www.prensalibre.com/guatemala/migrantes/analisis-cuales-son-las-claves-del-exito-para-contener-la-migracion/	2021-04-09	Análisis: ¿Cuáles son las claves del éxito para contener la migración?
Estados Unidos considera transferencias de efectivo a Guatemala y otros países de Centroamérica para frenar migración - Prensa Libre	https://www.prensalibre.com/guatemala/migrantes/estados-unidos-considera-transferencias-de-efectivo-a-guatemala-y-otros-paises-de-centroamerica-para-frenar-migracion/	2021-04-10	Estados Unidos considera transferencias de efectivo a Guatemala y otros países de Centroamérica para frenar migración
Rescatan a 136 migrantes de Guatemala, El Salvador y Honduras en el centro de México - Prensa Libre	https://www.prensalibre.com/guatemala/migrantes/rescatan-a-136-migrantes-de-guatemala-el-salvador-y-honduras-en-el-centro-de-mexico/	2021-04-11	Rescatan a 136 migrantes de Guatemala, El Salvador y Honduras en el centro de México
Kamala Harris visitará el Triángulo Norte de CA por migración - Soy502	https://www.soy502.com/articulo/kamala-harris-visitara-triangulo-norte-ca-migracion-32419	2021-04-14	Kamala Harris visitará el Triángulo Norte de CA por migración
Kamala Harris viajará pronto a México y Guatemala para hablar sobre migración - elPeriódico (Guatemala)	https://elperiodico.com.gt/nacionales/2021/04/14/kamala-harris-viajara-pronto-a-mexico-y-guatemala-para-hablar-sobre-migracion-1/	2021-04-14	Kamala Harris viajará pronto a México y Guatemala para hablar sobre migración
Primero represión contra migrantes - La Hora	https://lahora.gt/primero-represion-contra-migrantes/	2021-04-14	Primero represión contra migrantes
Faltaron invitados y quinceañera llevó su banquete para compartir con migrantes en México - Prensa Libre	https://www.prensalibre.com/internacional/faltaron-invitados-y-quinceanera-llevo-su-banquete-para-compartir-con-migrantes-en-mexico/	2021-04-14	Faltaron invitados y quinceañera llevó su banquete para compartir con migrantes en México
Lea: Kamala Harris planea visitar Guatemala para abordar causas fundamentales de la migración - La Hora	https://lahora.gt/kamala-harris-planea-visitar-guatemala-para-abordar-causas-fundamentales-de-la-migracion/	2021-04-14	Lea: Kamala Harris planea visitar Guatemala para abordar causas fundamentales de la migración
Video: lanzan a otro niño migrante de 2 años desde lo alto del muro fronterizo entre México y EE. UU. - Prensa Libre	https://www.prensalibre.com/internacional/video-lanzan-a-otro-nino-migrante-de-2-anos-desde-lo-alto-del-muro-fronterizo-entre-mexico-y-ee-uu-breaking/	2021-04-15	Video: lanzan a otro niño migrante de 2 años desde lo alto del muro fronterizo entre México y EE. UU.
Estados Unidos insiste en que combate de la corrupción en Centroamérica es esencial para frenar migración - Prensa Libre	https://www.prensalibre.com/guatemala/migrantes/estados-unidos-insiste-en-que-combate-de-la-corrupcion-en-centroamerica-es-esencial-frenar-migracion-breaking/	2021-04-16	Estados Unidos insiste en que combate de la corrupción en Centroamérica es esencial para frenar migración
Las dramáticas imágenes de cientos de migrantes que llegan a la frontera y buscan un sueño en Estados Unidos - Prensa Libre	https://www.prensalibre.com/internacional/las-dramaticas-imagenes-de-cientos-de-migrantes-que-llegan-a-la-frontera-y-buscan-un-sueno-en-estados-unidos/	2021-04-16	Las dramáticas imágenes de cientos de migrantes que llegan a la frontera y buscan un sueño en Estados Unidos
IGM: Van más de 11 mil migrantes retornados; 211 en los últimos 7 días - La Hora	https://lahora.gt/igm-van-mas-de-11-mil-migrantes-retornados-211-en-los-ultimos-7-dias/	2021-04-19	IGM: Van más de 11 mil migrantes retornados; 211 en los últimos 7 días
La OIM pide a Honduras profundizar en las causas de la migración de menores - elPeriódico (Guatemala)	https://elperiodico.com.gt/noticias/internacionales/2021/04/19/la-oim-pide-a-honduras-profundizar-en-las-causas-de-la-migracion-de-menores/	2021-04-19	La OIM pide a Honduras profundizar en las causas de la migración de menores
Unicef advierte que migración infantil se multiplica por nueve en México en 2021 - elPeriódico (Guatemala)	https://elperiodico.com.gt/noticias/internacionales/2021/04/19/unicef-advierte-que-migracion-infantil-se-multiplica-por-nueve-en-mexico-en-2021/	2021-04-19	Unicef advierte que migración infantil se multiplica por nueve en México en 2021
Estados Unidos está considerando presionar a Guatemala para que aborde temas de gobernabilidad para frenar migración irregular, según CNN - Prensa Libre	https://www.prensalibre.com/guatemala/migrantes/estados-unidos-esta-considerando-presionar-a-guatemala-para-que-aborde-temas-de-gobernabilidad-para-frenar-migracion-irregular-segun-cnn-breaking/	2021-04-20	Estados Unidos está considerando presionar a Guatemala para que aborde temas de gobernabilidad para frenar migración irregular, según CNN
Chapines impulsan restaurante y constructora en Dallas que da trabajo a más migrantes - La Hora	https://lahora.gt/chapines-impulsan-restaurante-y-constructora-en-dallas-que-da-trabajo-a-mas-migrantes/	2021-04-20	Chapines impulsan restaurante y constructora en Dallas que da trabajo a más migrantes
Concepción, la coyote que tenía a 33 inmigrantes guatemaltecos en el sótano de su casa en EE. UU. - Prensa Libre	https://www.prensalibre.com/guatemala/migrantes/concepcion-la-coyote-que-tenia-a-33-inmigrantes-guatemaltecos-en-el-sotano-de-su-casa-en-ee-uu-breaking/	2021-04-21	Concepción, la coyote que tenía a 33 inmigrantes guatemaltecos en el sótano de su casa en EE. UU.
El Salvador atenderá a mujeres migrantes retornadas – Noticias Última Hora de Guatemala - dca.gob.gt	https://dca.gob.gt/noticias-guatemala-diario-centro-america/el-salvador-atendera-a-mujeres-migrantes-retornadas/	2021-04-21	El Salvador atenderá a mujeres migrantes retornadas – Noticias Última Hora de Guatemala
México reforzará plan contra la migración irregular e instalará refugios para menores de edad - Prensa Libre	https://www.prensalibre.com/guatemala/migrantes/mexico-reforzara-plan-contra-la-migracion-irregular-e-instalara-refugios-para-menores-de-edad/	2021-04-21	México reforzará plan contra la migración irregular e instalará refugios para menores de edad
Donan equipo de computación a niñez migrante – Noticias Última Hora de Guatemala - dca.gob.gt	https://dca.gob.gt/noticias-guatemala-diario-centro-america/donan-equipo-de-computacion-a-ninez-migrante/	2021-04-21	Donan equipo de computación a niñez migrante – Noticias Última Hora de Guatemala
El tráfico de migrantes es un negocio lucrativo - elPeriódico (Guatemala)	https://elperiodico.com.gt/opinion/editoriales/2021/04/21/el-trafico-de-migrantes-es-un-negocio-lucrativo/	2021-04-21	El tráfico de migrantes es un negocio lucrativo
Lea: Harris abordará causas de la migración con Giammattei y organizaciones comunitarias - La Hora	https://lahora.gt/harris-abordara-causas-de-la-migracion-con-giammattei-y-organizaciones-comunitarias/	2021-04-21	Lea: Harris abordará causas de la migración con Giammattei y organizaciones comunitarias
ONG's que trabajan por migrantes buscan mitigar fraude laboral - elPeriódico (Guatemala)	https://elperiodico.com.gt/nacionales/2021/04/22/ongs-que-trabajan-por-migrantes-buscan-mitigar-fraude-laboral/	2021-04-22	ONG's que trabajan por migrantes buscan mitigar fraude laboral
Habilitan albergue en California para recibir niños migrantes - La Hora	https://lahora.gt/habilitan-albergue-en-california-para-recibir-ninos-migrantes/	2021-04-22	Habilitan albergue en California para recibir niños migrantes
