title	link	date	title_corrected
ICE asumirá casos de migrantes por saturación en centros fronterizos de EEUU - Mundo - ABC Color	https://www.abc.com.py/internacionales/2021/08/01/ice-asumira-casos-de-migrantes-por-saturacion-en-centros-fronterizos-de-eeuu/	2021-08-01	ICE asumirá casos de migrantes por saturación en centros fronterizos de EEUUMundo
Interceptados 1.111 migrantes frente a la costa libia en la última semana - Mundo - ABC Color	https://www.abc.com.py/internacionales/2021/08/02/interceptados-1111-migrantes-frente-a-la-costa-libia-en-la-ultima-semana/	2021-08-02	Interceptados 1.111 migrantes frente a la costa libia en la última semanaMundo
Policía colombiana captura a 5 personas por tráfico de 99 migrantes haitianos - Mundo - ABC Color	https://www.abc.com.py/internacionales/2021/08/02/policia-colombiana-captura-a-5-personas-por-trafico-de-99-migrantes-haitianos/	2021-08-02	Policía colombiana captura a 5 personas por tráfico de 99 migrantes haitianosMundo
EE.UU. expande su programa de refugiados afganos ante el auge de la violencia - Mundo - ABC Color	https://www.abc.com.py/internacionales/2021/08/02/eeuu-expande-su-programa-de-refugiados-afganos-ante-el-auge-de-la-violencia/	2021-08-02	EE.UU. expande su programa de refugiados afganos ante el auge de la violenciaMundo
Panamá convoca reunión regional para abordar creciente ola migratoria - Mundo - ABC Color	https://www.abc.com.py/internacionales/2021/08/02/panama-convoca-reunion-regional-para-abordar-creciente-ola-migratoria/	2021-08-02	Panamá convoca reunión regional para abordar creciente ola migratoriaMundo
Hasta el 26 de junio extienden jornada de regularización migratoria en CDE - Hoy - Noticas de Paraguay y el Mundo.	https://www.hoy.com.py/nacionales/hasta-el-26-de-junio-extienden-jornada-de-regularizacion-migratoria-en-cde	2021-06-24	Hasta el 26 de junio extienden jornada de regularización migratoria en CDEHoy
Papa denuncia que algunos gobiernos tratan como amenaza a migrantes - ÚltimaHora.com	https://www.ultimahora.com/papa-denuncia-que-algunos-gobiernos-tratan-como-amenaza-migrantes-n2866120.html	2020-01-22	Papa denuncia que algunos gobiernos tratan como amenaza a migrantes
Hasta el 26 de junio extienden jornada de regularización migratoria en CDE - hoy.com.py	https://www.hoy.com.py/nacionales/hasta-el-26-de-junio-extienden-jornada-de-regularizacion-migratoria-en-cde	2021-06-24	Hasta el 26 de junio extienden jornada de regularización migratoria en CDE
La próxima semana habrá jornadas de regularización migratoria en CDE - ABC en el Este - abc.com.py	https://www.abc.com.py/este/2021/06/18/la-proxima-semana-habra-jornadas-de-regularizacion-migratoria-en-cde/	2021-06-18	La próxima semana habrá jornadas de regularización migratoria en CDEABC en el Este
México ha vacunado a más de 25.000 extranjeros entre migrantes y turistas - Mundo - abc.com.py	https://www.abc.com.py/internacionales/2021/07/28/mexico-ha-vacunado-a-mas-de-25000-extranjeros-entre-migrantes-y-turistas/	2021-07-29	México ha vacunado a más de 25.000 extranjeros entre migrantes y turistasMundo
La ONU alerta de la difícil situación de los indígenas que emigran a ciudades - ÚltimaHora.com	https://www.ultimahora.com/la-onu-alerta-la-dificil-situacion-los-indigenas-que-emigran-ciudades-n2700649.html	2018-08-09	La ONU alerta de la difícil situación de los indígenas que emigran a ciudades
Coronavirus: compatriota refugiada en un monasterio de Países Bajos - Nacionales - abc.com.py	https://www.abc.com.py/nacionales/2020/03/27/coronavirus-compatriota-refugiada-en-un-monasterio-de-paises-bajos/	2020-03-27	Coronavirus: compatriota refugiada en un monasterio de Países BajosNacionales
Anuncian jornada de regularización migratoria en Pedro Juan - Hoy	https://www.hoy.com.py/nacionales/anuncian-jornada-de-regularizacion-migratoria-en-pedro-juan	2020-11-24	Anuncian jornada de regularización migratoria en Pedro Juan
