title	link	date	title_corrected
Immigration Corner | How to apply for a provincial nomination - Jamaica Gleaner	https://jamaica-gleaner.com/article/news/20200915/immigration-corner-how-apply-provincial-nomination	2020-09-15	Immigration CornerHow to apply for a provincial nomination
Jamaicans may be among migrant workers infected with COVID at US farm - Jamaica Gleaner	https://jamaica-gleaner.com/article/world-news/20201006/jamaicans-may-be-among-migrant-workers-infected-covid-us-farm	2020-10-06	Jamaicans may be among migrant workers infected with COVID at US farm
Nigerian migrant burned alive in Libya | World News - Jamaica Gleaner	https://jamaica-gleaner.com/article/world-news/20201008/nigerian-migrant-burned-alive-libya	2020-10-08	Nigerian migrant burned alive in LibyaWorld News
Shane Martínez | Canada must acknowledge the migrant farm workers - Jamaica Gleaner	https://jamaica-gleaner.com/article/focus/20201011/shane-martinez-canada-must-acknowledge-migrant-farm-workers	2020-10-11	Shane MartínezCanada must acknowledge the migrant farm workers
Caribbean migrants, smugglers nabbed off Florida coast - Jamaica Observer	https://www.jamaicaobserver.com/latestnews/_caribbean_migrants,_smugglers_nabbed_off_florida_coast	2020-10-12	Caribbean migrants, smugglers nabbed off Florida coast
Twelve migrants dead, others missing off the coast of Djibouti: IOM - Jamaica Observer	https://www.jamaicaobserver.com/latestnews/twelve_migrants_dead,_others_missing_off_the_coast_of_djibouti:_iom__	2020-10-17	Twelve migrants dead, others missing off the coast of Djibouti: IOM
Immigration Corner | Who can travel to Canada | News - Jamaica Gleaner	https://jamaica-gleaner.com/article/news/20201020/immigration-corner-who-can-travel-canada	2020-10-20	Immigration CornerWho can travel to CanadaNews
Caribbean nationals nabbed in immigration dragnet - Jamaica Observer	https://www.jamaicaobserver.com/latestnews/caribbean_nationals_nabbed_in_immigration_dragnet	2020-10-21	Caribbean nationals nabbed in immigration dragnet
Bodies of migrants found in fertilizer shipment in Paraguay - Jamaica Observer	https://www.jamaicaobserver.com/latestnews/Bodies_of_migrants_found_in_fertilizer_shipment_in_Paraguay	2020-10-25	Bodies of migrants found in fertilizer shipment in Paraguay
US judge blocks Trump immigration rule on public benefits - Jamaica Gleaner	https://jamaica-gleaner.com/article/news/20201103/us-judge-blocks-trump-immigration-rule-public-benefits	2020-11-03	US judge blocks Trump immigration rule on public benefits
US judge vacates Trump's 'Public Charge' rule against Caribbean immigrants - Jamaica Observer	https://www.jamaicaobserver.com/latestnews/US_judge_vacates_Trumps_Public_Charge_rule_against_	2020-11-04	US judge vacates Trump's 'Public Charge' rule against Caribbean immigrants
NYIC welcomes Biden's commitment to 'generous' refugee admissions policy - Jamaica Observer	https://www.jamaicaobserver.com/latestnews/NYIC_welcomes_Bidens_commitment_to_generous_refugee	2020-11-17	NYIC welcomes Biden's commitment to 'generous' refugee admissions policy
Judge to rule on motion filed by T&T families of refugees in Syria - Jamaica Observer	https://www.jamaicaobserver.com/news/judge-to-rule-on-motion-filed-by-t-t-families-of-refugees-in-syria_207924	2020-11-18	Judge to rule on motion filed by T&T families of refugees in Syria
Haitian migrants arrested near private property of US president - Jamaica Observer	https://www.jamaicaobserver.com/latestnews/Haitian_migrants_arrested_near_private_property_of_US_president?profile=1228	2020-11-18	Haitian migrants arrested near private property of US president
Immigration remains important to Jamaica under the Biden-Harris Administration - Jamaica Observer	https://www.jamaicaobserver.com/editorial/immigration-remains-important-to-jamaica-under-the-biden-harris-administration_208422	2020-11-24	Immigration remains important to Jamaica under the Biden-Harris Administration
Trinidad gov't slams OAS, Trump administration for latest Venezuela “refugee” wave - Jamaica Observer	https://www.jamaicaobserver.com/latestnews/trinidad_govt_slams_oas,_trump_administration_for_latest_venezuela_refugee_wave	2020-11-25	Trinidad gov't slams OAS, Trump administration for latest Venezuela “refugee” wave
Punishing hurricanes to spur more Central American migration - Jamaica Gleaner	https://jamaica-gleaner.com/article/world-news/20201125/punishing-hurricanes-spur-more-central-american-migration	2020-11-25	Punishing hurricanes to spur more Central American migration
US seeks to distance itself from refugee problem in Venezuela - Jamaica Observer	https://www.jamaicaobserver.com/latestnews/US_seeks_to_distance_itself_from_refugee_problem_in_Venezuela	2020-11-26	US seeks to distance itself from refugee problem in Venezuela
US will appeal order barring expulsions of migrant children - Jamaica Gleaner	https://jamaica-gleaner.com/article/world-news/20201126/us-will-appeal-order-barring-expulsions-migrant-children	2020-11-26	US will appeal order barring expulsions of migrant children
St Lucia police intercept vessels with illegal migrants - Jamaica Observer	https://www.jamaicaobserver.com/latestnews/St_Lucia_police_intercept_vessels_with_illegal_migrants	2020-11-27	St Lucia police intercept vessels with illegal migrants
Ethiopians fleeing conflict bring Sudan refugee camp back to life - Jamaica Observer	https://www.jamaicaobserver.com/international/ethiopians-fleeing-conflict-bring-sudan-refugee-camp-back-to-life_208776	2020-11-30	Ethiopians fleeing conflict bring Sudan refugee camp back to life
14 dead in migrant shipwreck between Venezuela and Trinidad - Jamaica Observer	https://www.jamaicaobserver.com/latestnews/14_dead_in_migrant_shipwreck_between_Venezuela_and_Trinidad	2020-12-13	14 dead in migrant shipwreck between Venezuela and Trinidad
Venezuelan migrant shipwreck death toll rises to 20 - Jamaica Observer	https://www.jamaicaobserver.com/latestnews/Venezuelan_migrant_shipwreck_dead_rises_to_20?profile=1	2020-12-14	Venezuelan migrant shipwreck death toll rises to 20
20 migrants drown after fleeing for Trinidad | World News - Jamaica Gleaner	https://jamaica-gleaner.com/article/world-news/20201215/20-migrants-drown-after-fleeing-trinidad	2020-12-15	20 migrants drown after fleeing for TrinidadWorld News
Caricom urged to help Trinidad and Tobago with Venezuelan migrants - Jamaica Observer	https://www.jamaicaobserver.com/latestnews/_Caricom_urged_to_help_Trinidad_and_Tobago_with_Venezuelan_migrants?profile=1228	2020-12-19	Caricom urged to help Trinidad and Tobago with Venezuelan migrants
Immigration advocacy group decries Trump's new asylum regulations - Jamaica Observer	https://www.jamaicaobserver.com/latestnews/_Immigration_advocacy_group_decries_Trump%26%238217;s_new_asylum_regulations	2020-12-19	Immigration advocacy group decries Trump's new asylum regulations
Caricom urged to help Trinidad and Tobago with Venezuelan migrants - Jamaica Observer	https://www.jamaicaobserver.com/latestnews/_Caricom_urged_to_help_Trinidad_and_Tobago_with_Venezuelan_migrants	2020-12-19	Caricom urged to help Trinidad and Tobago with Venezuelan migrants
Letter of the Day | Britain should not shut doors on migrants - Jamaica Gleaner	https://jamaica-gleaner.com/article/letters/20201219/letter-day-britain-should-not-shut-doors-migrants	2020-12-19	Letter of the DayBritain should not shut doors on migrants
CARICOM help needed in Trinidad, Venezuela migrant crisis - Jamaica Gleaner	https://jamaica-gleaner.com/article/news/20201219/caricom-help-needed-trinidad-venezuela-migrant-crisis	2020-12-19	CARICOM help needed in Trinidad, Venezuela migrant crisis
Two guilty of manslaughter in deaths of 39 migrants | World News - Jamaica Gleaner	https://jamaica-gleaner.com/article/world-news/20201222/two-guilty-manslaughter-deaths-39-migrants	2020-12-22	Two guilty of manslaughter in deaths of 39 migrantsWorld News
US Coast Guard repatriates 110 migrants to Haiti | Caribbean - Jamaica Gleaner	https://jamaica-gleaner.com/article/caribbean/20201224/us-coast-guard-repatriates-110-migrants-haiti	2020-12-24	US Coast Guard repatriates 110 migrants to HaitiCaribbean
OAS report warns of increase in number of Venezuelan refugees - Jamaica Observer	https://www.jamaicaobserver.com/international/oas-report-warns-of-increase-in-number-of-venezuelan-refugees_211388?profile=1373	2021-01-05	OAS report warns of increase in number of Venezuelan refugees
Immigration Corner | New policy to help international students - Jamaica Gleaner	https://jamaica-gleaner.com/article/news/20210112/immigration-corner-new-policy-help-international-students	2021-01-12	Immigration CornerNew policy to help international students
Immigration Corner | How to obtain a Health and Care Worker visa - Jamaica Gleaner	https://jamaica-gleaner.com/article/news/20210112/immigration-corner-how-obtain-health-and-care-worker-visa	2021-01-12	Immigration CornerHow to obtain a Health and Care Worker visa
New migrant caravan leaves Honduras in pursuit of American dream - Jamaica Observer	https://www.jamaicaobserver.com/latestnews/New_migrant_caravan_leaves_Honduras_in_pursuit_of_American_dream	2021-01-15	New migrant caravan leaves Honduras in pursuit of American dream
Large migrant caravan dissolves | World News - Jamaica Gleaner	https://jamaica-gleaner.com/article/world-news/20210120/large-migrant-caravan-dissolves	2021-01-20	Large migrant caravan dissolvesWorld News
Alfred Dawes | The immigration timebomb | Commentary - Jamaica Gleaner	https://jamaica-gleaner.com/article/commentary/20210124/alfred-dawes-immigration-timebomb	2021-01-24	Alfred DawesThe immigration timebombCommentary
Immigration Corner | Be prepared for more travel restrictions to Canada - Jamaica Gleaner	https://jamaica-gleaner.com/article/news/20210202/immigration-corner-be-prepared-more-travel-restrictions-canada	2021-02-02	Immigration CornerBe prepared for more travel restrictions to Canada
Biden turns the page on Trump in push to streamline US immigration process - Jamaica Observer	https://www.jamaicaobserver.com/latestnews/Biden_turns_the_page_on_Trump_in_push_to_streamline_US_immigration_process	2021-02-02	Biden turns the page on Trump in push to streamline US immigration process
Biden ramps up US refugee admissions to 125,000 per year - Jamaica Observer	https://www.jamaicaobserver.com/latestnews/Biden_ramps_up_US_refugee_admissions_to_125,000_per_year	2021-02-04	Biden ramps up US refugee admissions to 125,000 per year
Intra-migration in reverse - Jamaica Observer	https://www.jamaicaobserver.com/news/intra-migration-in-reverse-some-professionals-opting-to-live-outside-metropolitan-area-since-covid-19_214781	2021-02-14	Intra-migration in reverse
Biden faces pressure as US sets new course on immigration - Jamaica Gleaner	https://jamaica-gleaner.com/article/world-news/20210215/biden-faces-pressure-us-sets-new-course-immigration	2021-02-15	Biden faces pressure as US sets new course on immigration
Immigration Corner | Latest Canadian policy directives for international students - Jamaica Gleaner	https://jamaica-gleaner.com/article/news/20210216/immigration-corner-latest-canadian-policy-directives-international-students	2021-02-16	Immigration CornerLatest Canadian policy directives for international students
Path to US citizenship in new Democratic immigration bill - Jamaica Observer	https://www.jamaicaobserver.com/latestnews/Path_to_US_citizenship_in_new_Democratic_immigration_bill	2021-02-18	Path to US citizenship in new Democratic immigration bill
Caribbean American congresswoman joins push to overhaul immigration system - Jamaica Observer	https://www.jamaicaobserver.com/news/caribbean-american-congresswoman-joins-push-to-overhaul-immigration-system_215285?profile=0	2021-02-20	Caribbean American congresswoman joins push to overhaul immigration system
US Coast Guard repatriates seven migrants to Cuba - Jamaica Observer	https://www.jamaicaobserver.com/latestnews/US_Coast_Guard_repatriates_seven_migrants_to_Cuba	2021-02-21	US Coast Guard repatriates seven migrants to Cuba
Coast guard repatriates migrants to Cuba | World News - Jamaica Gleaner	https://jamaica-gleaner.com/article/world-news/20210222/coast-guard-repatriates-migrants-cuba	2021-02-22	Coast guard repatriates migrants to CubaWorld News
Rights group advocates legislation to overhaul US immigration system - Jamaica Observer	https://www.jamaicaobserver.com/news/rights-group-advocates-legislation-to-overhaul-us-immigration-system_215456?profile=1373	2021-02-23	Rights group advocates legislation to overhaul US immigration system
Haitian migrants, one Cuban arrested in Brazil | News - Jamaica Gleaner	https://jamaica-gleaner.com/article/news/20210227/haitian-migrants-one-cuban-arrested-brazil	2021-02-27	Haitian migrants, one Cuban arrested in BrazilNews
US needs migrant labour, Mexican president to tell Biden - Jamaica Observer	https://www.jamaicaobserver.com/latestnews/US_needs_migrant_labour,_Mexican_president_to_tell_Biden?profile=1228	2021-02-27	US needs migrant labour, Mexican president to tell Biden
Nicaragua finds boat with bodies of six migrants in Caribbean - Jamaica Observer	https://www.jamaicaobserver.com/latestnews/Nicaragua_finds_boat_with_bodies_of_six_migrants_in_Caribbean	2021-03-02	Nicaragua finds boat with bodies of six migrants in Caribbean
Dominican Republic plans wall to keep out Haitian migrants - Jamaica Observer	https://www.jamaicaobserver.com/latestnews/Dominican_Republic_plans_wall_to_keep_out_Haitian_migrants	2021-03-02	Dominican Republic plans wall to keep out Haitian migrants
Five migrants survived January massacre of 19 | World News - Jamaica Gleaner	https://jamaica-gleaner.com/article/world-news/20210303/five-migrants-survived-january-massacre-19	2021-03-03	Five migrants survived January massacre of 19World News
US Coast Guard interdicts Haitian migrants off Southern Florida coast - Jamaica Star Online	http://jamaica-star.com/article/news/20210306/us-coast-guard-interdicts-haitian-migrants-southern-florida-coast	2021-03-06	US Coast Guard interdicts Haitian migrants off Southern Florida coast
US Coast Guard interdicts Haitian migrants off Southern Florida coast - Jamaica Observer	https://www.jamaicaobserver.com/latestnews/us_coast_guard_interdicts_haitian_migrants_off_southern_florida_coast	2021-03-06	US Coast Guard interdicts Haitian migrants off Southern Florida coast
39 African migrants die as boat sinks off coast - Jamaica Gleaner	https://jamaica-gleaner.com/article/world-news/20210310/39-african-migrants-die-boat-sinks-coast	2021-03-10	39 African migrants die as boat sinks off coast
Remains of migrants return home | World News - Jamaica Gleaner	https://jamaica-gleaner.com/article/world-news/20210313/remains-migrants-return-home	2021-03-13	Remains of migrants return homeWorld News
David Jessop | In immigration policy, perception, actions and explanations matter - Jamaica Gleaner	https://jamaica-gleaner.com/article/business/20210314/david-jessop-immigration-policy-perception-actions-and-explanations-matter	2021-03-14	David JessopIn immigration policy, perception, actions and explanations matter
EU mulls visa pressure so African states take back migrants - Jamaica Gleaner	https://jamaica-gleaner.com/article/world-news/20210316/eu-mulls-visa-pressure-so-african-states-take-back-migrants	2021-03-16	EU mulls visa pressure so African states take back migrants
Biden tells migrants 'don't come' as criticism grows - Jamaica Observer	https://www.jamaicaobserver.com/latestnews/Biden_tells_migrants_dont_come_as_criticism_grows_	2021-03-16	Biden tells migrants 'don't come' as criticism grows
US House passes immigration bills including pathway for 'Dreamers' - Jamaica Observer	https://www.jamaicaobserver.com/latestnews/US_House_passes_immigration_bills_including_pathway_for_Dreamers	2021-03-18	US House passes immigration bills including pathway for 'Dreamers'
US House passes immigration bills for farm workers, 'Dreamers' - Jamaica Gleaner	https://jamaica-gleaner.com/article/world-news/20210319/us-house-passes-immigration-bills-farm-workers-dreamers	2021-03-19	US House passes immigration bills for farm workers, 'Dreamers'
IDB, Canada, Colombia, private companies to support working-age migrants and returnees in C'bean - Jamaica Observer	https://www.jamaicaobserver.com/latestnews/IDB,_Canada,_Colombia,_private_companies_to_support	2021-03-20	IDB, Canada, Colombia, private companies to support working-age migrants and returnees in C'bean
Biden is on his heels amid a migrant surge at Mexico border - Jamaica Gleaner	https://jamaica-gleaner.com/article/news/20210320/biden-his-heels-amid-migrant-surge-mexico-border	2021-03-20	Biden is on his heels amid a migrant surge at Mexico border
Stop deporting Haitian migrants, Archbishop of Miami pleads - Jamaica Observer	https://www.jamaicaobserver.com/latestnews/Stop_deporting_Haitian_migrants,_Archbishop_of_Miami_pleads?profile=1228	2021-03-21	Stop deporting Haitian migrants, Archbishop of Miami pleads
US Coast Guard repatriates 17 Cuban migrants trying to enter US illegally - Jamaica Observer	https://www.jamaicaobserver.com/latestnews/US_Coast_Guard_repatriates_17_Cuban_migrants_trying_to_enter_US	2021-03-23	US Coast Guard repatriates 17 Cuban migrants trying to enter US illegally
US Coast Guard repatriates 17 Cuban migrants trying to get into US illegally - Jamaica Star Online	http://jamaica-star.com/article/news/20210323/us-coast-guard-repatriates-17-cuban-migrants-trying-get-us-illegally	2021-03-23	US Coast Guard repatriates 17 Cuban migrants trying to get into US illegally
Photos of migrant detention highlight Biden's border secrecy - Jamaica Gleaner	https://jamaica-gleaner.com/article/world-news/20210323/photos-migrant-detention-highlight-bidens-border-secrecy	2021-03-23	Photos of migrant detention highlight Biden's border secrecy
Expelled from US at night, migrant families weigh next steps - Jamaica Observer	https://www.jamaicaobserver.com/international/expelled-from-us-at-night-migrant-families-weigh-next-steps_218113	2021-03-29	Expelled from US at night, migrant families weigh next steps
Huge rise in child migrants crossing dangerous Panama jungle — UN - Jamaica Observer	https://www.jamaicaobserver.com/latestnews/Huge_rise_in_child_migrants_crossing_dangerous_Panama_jungle	2021-03-30	Huge rise in child migrants crossing dangerous Panama jungle — UN
Poll: Border woes dent Biden approval on immigration - Jamaica Observer	https://www.jamaicaobserver.com/international/poll-border-woes-dent-biden-approval-on-immigration_218542	2021-04-06	Poll: Border woes dent Biden approval on immigration
New York to pay undocumented migrants pandemic relief - Jamaica Observer	https://www.jamaicaobserver.com/latestnews/New_York_to_pay_undocumented_migrants_pandemic_relief	2021-04-08	New York to pay undocumented migrants pandemic relief
UK offers US$59 million to help Hong Kong migrants settle down - Jamaica Observer	https://www.jamaicaobserver.com/latestnews/UK_offers_US$59_million_to_help_Hong_Kong_migrants_settle_down	2021-04-08	UK offers US$59 million to help Hong Kong migrants settle down
Mexico expects a 'constant and growing' flow of migrants - Jamaica Gleaner	https://jamaica-gleaner.com/article/world-news/20210409/mexico-expects-constant-and-growing-flow-migrants	2021-04-09	Mexico expects a 'constant and growing' flow of migrants
Massive increase of migrant children at Mexico-US border — UNICEF - Jamaica Observer	https://www.jamaicaobserver.com/latestnews/massive_increase_of_migrant_children_at_mexico-us_border,_unicef	2021-04-19	Massive increase of migrant children at Mexico-US border — UNICEF
Death of 130 migrants at sea shameful, says Pope - Jamaica Gleaner	https://jamaica-gleaner.com/article/world-news/20210426/death-130-migrants-sea-shameful-says-pope	2021-04-26	Death of 130 migrants at sea shameful, says Pope
Harris vows US relief as Central America tackles migration - Jamaica Observer	https://www.jamaicaobserver.com/latestnews/Harris_vows_US_relief_as_Central_America_tackles_migration	2021-04-26	Harris vows US relief as Central America tackles migration
UN agencies say latest shipwreck in C'bean underscores need for safe migration pathways - Jamaica Observer	https://www.jamaicaobserver.com/latestnews/UN_agencies_say_latest_shipwreck_in_Cbean_underscores_need?profile=0	2021-04-27	UN agencies say latest shipwreck in C'bean underscores need for safe migration pathways
Claiming for refugee status in Canada - Jamaica Observer	https://www.jamaicaobserver.com/news/claiming-for-refugee-status-in-canada_220162	2021-04-28	Claiming for refugee status in Canada
Drug suspects, migrants nabbed in major bust in Caribbean Sea - Jamaica Observer	https://www.jamaicaobserver.com/latestnews/_Drug_suspects,_migrants_nabbed_in_Caribbean_Sea?profile=1228	2021-04-30	Drug suspects, migrants nabbed in major bust in Caribbean Sea
Trinidad urges support for dealing with illegal migration - Jamaica Observer	https://www.jamaicaobserver.com/latestnews/_Trinidad_urges_support_for_dealing_with_illegal_migration	2021-05-02	Trinidad urges support for dealing with illegal migration
US to begin reuniting migrant families separated under Trump - Jamaica Observer	https://www.jamaicaobserver.com/latestnews/US_to_begin_reuniting_migrant_families_separated_under_Trump	2021-05-03	US to begin reuniting migrant families separated under Trump
Immigration advocates welcome US increase in refugee admissions cap - Jamaica Observer	https://www.jamaicaobserver.com/latestnews/Immigration_advocates_welcome_US_increase_in_refugee_admissions_cap	2021-05-04	Immigration advocates welcome US increase in refugee admissions cap
Immigration Corner | What are my chances? | News - Jamaica Gleaner	https://jamaica-gleaner.com/article/news/20210511/immigration-corner-what-are-my-chances	2021-05-11	Immigration CornerWhat are my chances?News
Immigration Corner | My daughter is pregnant, is her filing void? - Jamaica Gleaner	https://jamaica-gleaner.com/article/news/20210511/immigration-corner-my-daughter-pregnant-her-filing-void	2021-05-11	Immigration CornerMy daughter is pregnant, is her filing void?
EU funds for Trinidad and Tobago in dealing with Venezuelan refugees - Jamaica Observer	https://www.jamaicaobserver.com/latestnews/EU_funds_for_Trinidad_and_Tobago_in_dealing_with_Venezuelan_refugees	2021-05-18	EU funds for Trinidad and Tobago in dealing with Venezuelan refugees
Spain offers to speak for Morocco at EU amid migration spat - Jamaica Gleaner	https://jamaica-gleaner.com/article/world-news/20210525/spain-offers-speak-morocco-eu-amid-migration-spat	2021-05-25	Spain offers to speak for Morocco at EU amid migration spat
2 dead, 10 missing as Cuban migrant vessel sinks off Florida - Jamaica Observer	https://www.jamaicaobserver.com/latestnews/2_dead,_10_missing_as_cuban_migrant_vessel_sinks_off_florida	2021-05-28	2 dead, 10 missing as Cuban migrant vessel sinks off Florida
US Coast Guard repatriates Cuban migrants | News - Jamaica Star Online	http://jamaica-star.com/article/news/20210530/us-coast-guard-repatriates-cuban-migrants	2021-05-30	US Coast Guard repatriates Cuban migrantsNews
Bahamas deports nearly 100 Haitian migrants | Caribbean - Jamaica Gleaner	https://jamaica-gleaner.com/article/caribbean/20210604/bahamas-deports-nearly-100-haitian-migrants	2021-06-04	Bahamas deports nearly 100 Haitian migrantsCaribbean
Speid: COVID saved Ja from mass teacher migration - Jamaica Gleaner	https://jamaica-gleaner.com/article/lead-stories/20210605/speid-covid-saved-ja-mass-teacher-migration	2021-06-05	Speid: COVID saved Ja from mass teacher migration
Antigua offering extension of stay to illegal migrants who take COVID vaccine - Jamaica Gleaner	https://jamaica-gleaner.com/article/caribbean/20210606/antigua-offering-extension-stay-illegal-migrants-who-take-covid-vaccine	2021-06-06	Antigua offering extension of stay to illegal migrants who take COVID vaccine
Antigua offering extension of stay to illegal migrants who take COVID vaccine - Jamaica Star Online	http://jamaica-star.com/article/news/20210606/antigua-offering-extension-stay-illegal-migrants-who-take-covid-vaccine	2021-06-06	Antigua offering extension of stay to illegal migrants who take COVID vaccine
US Supreme Court rules against immigrants with temporary status - Jamaica Star Online	http://jamaica-star.com/article/news/20210607/us-supreme-court-rules-against-immigrants-temporary-status	2021-06-07	US Supreme Court rules against immigrants with temporary status
Kamala Harris visits Latin America to tackle migration, corruption - Jamaica Gleaner	https://jamaica-gleaner.com/article/world-news/20210607/kamala-harris-visits-latin-america-tackle-migration-corruption	2021-06-07	Kamala Harris visits Latin America to tackle migration, corruption
Two drown as boat carrying Haitian migrants capsize in Bahamas - Jamaica Star Online	http://jamaica-star.com/article/news/20210614/two-drown-boat-carrying-haitian-migrants-capsize-bahamas	2021-06-14	Two drown as boat carrying Haitian migrants capsize in Bahamas
Concern raised at increased illegal migration from St Vincent and the Grenadines - Jamaica Gleaner	https://jamaica-gleaner.com/article/world-news/20210615/concern-raised-increased-illegal-migration-st-vincent-and-grenadines	2021-06-15	Concern raised at increased illegal migration from St Vincent and the Grenadines
Officials detain migrants, reportedly from Jamaica, who came ashore in Florida - Jamaica Star Online	http://jamaica-star.com/article/news/20210617/officials-detain-migrants-reportedly-jamaica-who-came-ashore-florida	2021-06-17	Officials detain migrants, reportedly from Jamaica, who came ashore in Florida
Officials detain 14 migrants, reportedly from Jamaica, who came ashore in Florida - Jamaica Gleaner	https://jamaica-gleaner.com/article/news/20210617/officials-detain-14-migrants-reportedly-jamaica-who-came-ashore-florida	2021-06-17	Officials detain 14 migrants, reportedly from Jamaica, who came ashore in Florida
