title	link	date	title_corrected
Aumenta migración de mujeres por violencia de género - El Sol de México	https://www.elsoldemexico.com.mx/mexico/sociedad/aumenta-migracion-de-mujeres-por-violencia-de-genero-mexico-refugiados-comar-5935315.html	2020-10-26	Aumenta migración de mujeres por violencia de género
Buscan revivir programa 3x1 para apoyar a migrantes | El Universal - El Universal	https://www.eluniversal.com.mx/nacion/buscan-revivir-programa-3x1-para-apoyar-migrantes	2020-10-27	Buscan revivir programa 3x1 para apoyar a migrantes
Indocumentados intentan realizar motín en la estación migratoria del INM en Villahermosa - heraldodemexico.com.mx	https://heraldodemexico.com.mx/nacional/2020/10/29/indocumentados-intentan-realizar-motin-en-la-estacion-migratoria-del-inm-en-villahermosa-220047.html	2020-10-29	Indocumentados intentan realizar motín en la estación migratoria del INM en Villahermosa
Dejan en el olvido albergue migrante - reforma.com	https://www.reforma.com/dejan-en-el-olvido-albergue-migrante/ar2062282	2020-11-02	Dejan en el olvido albergue migrante
INM rechaza acusación de CNDH respecto a fallecimiento de migrante por Covid | El Universal - El Universal	https://www.eluniversal.com.mx/nacion/inm-rechaza-acusacion-de-cndh-respecto-fallecimiento-de-migrante-por-covid	2020-11-05	INM rechaza acusación de CNDH respecto a fallecimiento de migrante por Covid
Patrulla fronteriza libera a migrantes; desmantelan casas de seguridad - Excélsior	https://www.excelsior.com.mx/global/patrulla-fronteriza-libera-a-migrantes-desmantelan-casas-de-seguridad/1415545	2020-11-07	Patrulla fronteriza libera a migrantes; desmantelan casas de seguridad
Esperar y sobrevivir: historias de migrantes atrapados en un campamento en Matamoros - El Financiero	https://www.elfinanciero.com.mx/nacional/esperar-y-sobrevivir-historias-de-migrantes-atrapados-en-un-campamento-en-matamoros/	2020-11-09	Esperar y sobrevivir: historias de migrantes atrapados en un campamento en Matamoros
Gana mujer migrante de Huajuapan cargo en EU, fue reelecta concejal de Calistoga, California | Oaxaca - El Universal Oaxaca	https://oaxaca.eluniversal.com.mx/sociedad/10-11-2020/gana-mujer-migrante-de-huajuapan-cargo-en-eu-fue-reelecta-concejal-de-calistoga	2020-11-10	Gana mujer migrante de Huajuapan cargo en EU, fue reelecta concejal de Calistoga, CaliforniaOaxaca
Profesor de la FES Aragón insulta a migrantes y habitantes de Iztapalapa (VIDEO) - La Razon	https://www.razon.com.mx/mexico/profesor-fes-aragon-insulta-migrantes-habitantes-iztapalapa-unam-destituye-412358	2020-11-11	Profesor de la FES Aragón insulta a migrantes y habitantes de Iztapalapa (VIDEO)
EEUU.- Un juez deroga las limitaciones impuestas por Trump en el programa DACA para migrantes indocumentados - Publimetro México	https://www.publimetro.com.mx/mx/noticias/2020/11/15/eeuu-un-juez-deroga-las-limitaciones-impuestas-por-trump-en-el-programa-daca-para-migrantes-indocumentados.html	2020-11-15	EEUU.- Un juez deroga las limitaciones impuestas por Trump en el programa DACA para migrantes indocumentados
Ubican a 44 migrantes hacinados en vivienda de Ecatepec - Periódico Excélsior	https://www.excelsior.com.mx/comunidad/ubican-a-44-migrantes-hacinados-en-vivienda-de-ecatepec/1417120	2020-11-16	Ubican a 44 migrantes hacinados en vivienda de Ecatepec
Rescatan a 44 migrantes de un domicilio en Ecatepec - La Prensa	https://www.la-prensa.com.mx/policiaca/rescatan-a-44-migrantes-de-un-domicilio-en-ecatepec-6021089.html	2020-11-16	Rescatan a 44 migrantes de un domicilio en Ecatepec
Rescatan a 44 migrantes centroamericanos en Ecatepec (+video) - 24 HORAS	https://www.24-horas.mx/2020/11/17/rescatan-a-44-migrantes-centroamericanos-en-ecatepec-video/	2020-11-17	Rescatan a 44 migrantes centroamericanos en Ecatepec (+video)
Festeja Unicef auxilio a niños migrantes en México - REFORMA	https://www.reforma.com/festeja-unicef-auxilio-a-ninos-migrantes-en-mexico/ar2072686	2020-11-17	Festeja Unicef auxilio a niños migrantes en México
La migración no es una amenaza para el cristianismo: papa Francisco - Milenio	https://www.milenio.com/internacional/papa-francisco-afirma-migracion-amenaza-cristianismo	2020-11-23	La migración no es una amenaza para el cristianismo: papa Francisco
Indagan a Policía por desalojo migrante en París - REFORMA	https://www.reforma.com/indagan-a-policia-por-desalojo-migrante-en-paris/ar2077062	2020-11-24	Indagan a Policía por desalojo migrante en París
Los lobos, una de las cintas mexicanas más inteligentes sobre la migración - razon.com.mx	https://www.razon.com.mx/entretenimiento/lobos-cintas-mexicanas-inteligentes-migracion-414146	2020-11-26	Los lobos, una de las cintas mexicanas más inteligentes sobre la migración
Gobierno de Trump apelará fallo que prohíbe expulsar a niños migrantes - El Sol de México	https://www.elsoldemexico.com.mx/mundo/gobierno-de-trump-apelara-fallo-que-prohibe-expulsar-a-ninos-migrantes-6062441.html	2020-11-26	Gobierno de Trump apelará fallo que prohíbe expulsar a niños migrantes
Nuevo cardenal en México es conocido por su cercanía con indígenas y migrantes - 24 HORAS	https://www.24-horas.mx/2020/11/28/nuevo-cardenal-en-mexico-es-conocido-por-su-cercania-con-indigenas-y-migrantes/	2020-11-28	Nuevo cardenal en México es conocido por su cercanía con indígenas y migrantes
Ahora Coyotes ofrecen a migrantes por Facebook hasta INE y CURP - La Razon	https://www.razon.com.mx/mexico/coyotes-ofrecen-ine-curp-face-414307	2020-11-28	Ahora Coyotes ofrecen a migrantes por Facebook hasta INE y CURP
Temor en casas y albergues de migrantes por militarización del INM: CNDH - elfinanciero.com.mx	https://www.elfinanciero.com.mx/nacional/temor-en-casas-y-albergues-de-migrantes-por-militarizacion-del-inm-cndh/	2020-12-01	Temor en casas y albergues de migrantes por militarización del INM: CNDH
En Tapachula, ACNUR abre primer albergue en México para refugiados - Milenio	https://www.milenio.com/politica/acnur-abre-albergue-mexico-refugiados-tapachula	2020-12-02	En Tapachula, ACNUR abre primer albergue en México para refugiados
Temen en Patrulla Fronteriza caos en migración con Biden - REFORMA	https://www.reforma.com/temen-en-patrulla-fronteriza-caos-en-migracion-con-biden/ar2082055	2020-12-02	Temen en Patrulla Fronteriza caos en migración con Biden
Segob advierte de más caravanas migrantes en 2021 - El Sol de México	https://www.elsoldemexico.com.mx/mexico/sociedad/segob-advierte-de-mas-caravanas-migrantes-en-2021-migracion-6096324.html	2020-12-04	Segob advierte de más caravanas migrantes en 2021
Adiós a la era de Trump: ordenan restaurar DACA para proteger jóvenes migrantes - El Sol de México	https://www.elsoldemexico.com.mx/mundo/adios-a-la-era-de-trump-ordenan-restaurar-daca-para-proteger-jovenes-migrantes-migracion-6096408.html	2020-12-04	Adiós a la era de Trump: ordenan restaurar DACA para proteger jóvenes migrantes
Jovencita de 17 años tuvo que ser refugiada tras ser víctima de ciberacoso - Milenio	https://www.milenio.com/policia/tamaulipas-menor-edad-refugiada-victima-ciberacoso	2020-12-07	Jovencita de 17 años tuvo que ser refugiada tras ser víctima de ciberacoso
Baja California será declarada santuario para migrantes | El Universal - El Universal	https://www.eluniversal.com.mx/estados/baja-california-sera-declarada-santuario-para-migrantes	2020-12-08	Baja California será declarada santuario para migrantes
Desorden y xenofobia: los retos de la migración en Europa (+Infografía) - 24 HORAS	https://www.24-horas.mx/2020/12/08/desorden-y-xenofobia-los-retos-de-la-migracion-en-europa-infografia/	2020-12-08	Desorden y xenofobia: los retos de la migración en Europa (+Infografía)
Ola de migrantes centroamericanos, la crisis que Biden deberá enfrentar - El Financiero	https://www.elfinanciero.com.mx/mundo/ola-de-migrantes-centroamericanos-la-crisis-que-biden-debera-enfrentar/	2020-12-09	Ola de migrantes centroamericanos, la crisis que Biden deberá enfrentar
Niño migrante que vende flores en Los Ángeles recibe cheque por 800 mil pesos - 24 HORAS	https://www.24-horas.mx/2020/12/12/nino-migrante-que-vende-flores-en-los-angeles-recibe-cheque-por-800-mil-pesos/	2020-12-12	Niño migrante que vende flores en Los Ángeles recibe cheque por 800 mil pesos
Sube a 20 la cifra de migrantes ahogados en naufragio en Venezuela - El Financiero	https://www.elfinanciero.com.mx/mundo/hallan-a-14-migrantes-ahogados-que-huian-de-venezuela-hay-6-desaparecidos/	2020-12-14	Sube a 20 la cifra de migrantes ahogados en naufragio en Venezuela
Presentan informe sobre migrantes en 2020 - 24 HORAS	https://www.24-horas.mx/2020/12/14/presentan-informe-sobre-migrantes-en-2020/	2020-12-14	Presentan informe sobre migrantes en 2020
Se dispara la ‘caza’ de migrantes en la recta final de la era Trump - Milenio	https://www.milenio.com/politica/se-dispara-captura-de-migrantes-en-la-recta-final-de-la-era-trump	2020-12-17	Se dispara la ‘caza’ de migrantes en la recta final de la era Trump
Autonomía, migrantes y Covid-19 - El Financiero	https://www.elfinanciero.com.mx/opinion/rosario-guerra/autonomia-migrantes-y-covid/	2020-12-17	Autonomía, migrantes y Covid-19
Infonavit captó de los migrantes más de $200 millones para pago de créditos - El Economista	https://www.eleconomista.com.mx/sectorfinanciero/Infonavit-capto-de-los-migrantes-mas-de-200-millones-para-pago-de-creditos-20201217-0110.html	2020-12-17	Infonavit captó de los migrantes más de $200 millones para pago de créditos
¿Vives en el extranjero y quieres una casa? Ley del Infonavit te facilitará el proceso - El Financiero	https://www.elfinanciero.com.mx/empresas/vives-en-el-extranjero-y-quieres-una-casa-ley-del-infonavit-facilitara-el-proceso/	2020-12-17	¿Vives en el extranjero y quieres una casa? Ley del Infonavit te facilitará el proceso
Congreso de Baja California aprueba ley para proteger derechos de migrantes | El Universal - El Universal	https://www.eluniversal.com.mx/estados/congreso-de-baja-california-aprueba-ley-para-proteger-derechos-de-migrantes	2020-12-18	Congreso de Baja California aprueba ley para proteger derechos de migrantes
Gobierno de Puebla invierte en programas de bienestar para comunidad migrante - Reporte Indigo	https://www.reporteindigo.com/reporte/gobierno-de-puebla-invierte-en-programas-de-bienestar-para-comunidad-migrante/	2020-12-21	Gobierno de Puebla invierte en programas de bienestar para comunidad migrante
Solo quiere sepultar a su esposa; migrante clama permiso a EU para un último adiós - El Sol de México	https://www.elsoldemexico.com.mx/mundo/solo-quiere-sepultar-a-su-esposa-migrante-clama-permiso-a-eu-para-un-ultimo-adios-6169087.html	2020-12-23	Solo quiere sepultar a su esposa; migrante clama permiso a EU para un último adiós
Coronavirus.- Venezuela denuncia ante la ONU a Duque por decir que migrantes irregulares de Venezuela no serán vacunados - publimetro.com.mx	https://www.publimetro.com.mx/mx/noticias/2020/12/25/coronavirus-venezuela-denuncia-ante-la-onu-a-duque-por-decir-que-migrantes-irregulares-de-venezuela-no-seran-vacunados.html	2020-12-25	Coronavirus.- Venezuela denuncia ante la ONU a Duque por decir que migrantes irregulares de Venezuela no serán vacunados
Tijuana, tierra de migrantes | El Universal - El Universal	https://www.eluniversal.com.mx/opinion/carlos-mora-alvarez/tijuana-tierra-de-migrantes	2020-12-26	Tijuana, tierra de migrantes
Patrulla Fronteriza de EU halla 150 migrantes escondidos dentro de un camión | El Universal - El Universal	https://www.eluniversal.com.mx/mundo/patrulla-fronteriza-de-eu-halla-150-migrantes-escondidos-dentro-de-un-camion	2021-01-03	Patrulla Fronteriza de EU halla 150 migrantes escondidos dentro de un camión
Telefónica México concluye primera etapa de migración de tráfico a red de AT&T - El Financiero	https://www.elfinanciero.com.mx/empresas/telefonica-mexico-concluye-primera-etapa-de-migracion-de-trafico-a-red-de-at-t/	2021-01-05	Telefónica México concluye primera etapa de migración de tráfico a red de AT&T
Si Biden cumple promesas sobre migración, se avecina una crisis: Mark Morgan - La Razon	https://www.razon.com.mx/mundo/biden-cumple-promesas-migracion-avecina-crisis-mark-morgan-418618	2021-01-05	Si Biden cumple promesas sobre migración, se avecina una crisis: Mark Morgan
Gestiona México con gobierno de EU vacunas contra Covid-19 para migrantes - El Economista	https://www.eleconomista.com.mx/politica/Gestiona-Mexico-con-gobierno-de-EU-vacunas-contra-Covid-19-para-migrantes-20210105-0080.html	2021-01-05	Gestiona México con gobierno de EU vacunas contra Covid-19 para migrantes
La pandemia no es obstáculo para la migración por México - El Economista	https://www.eleconomista.com.mx/politica/La-pandemia-no-es-obstaculo-para-la-migracion-por-Mexico-20210106-0094.html	2021-01-06	La pandemia no es obstáculo para la migración por México
Pandemia pausa reencuentros de familias migrantes (+video) - 24 HORAS	https://www.24-horas.mx/2021/01/06/pandemia-pausa-reencuentros-de-familias-migrantes-video/	2021-01-06	Pandemia pausa reencuentros de familias migrantes (+video)
'En busca de un futuro', ciclo de cine sobre migración, de Filmoteca UNAM y Filmin Latino - El Financiero	https://www.elfinanciero.com.mx/culturas/en-busca-de-un-futuro-ciclo-de-cine-sobre-migracion-de-filmoteca-unam-y-filmin-latino/	2021-01-08	'En busca de un futuro', ciclo de cine sobre migración, de Filmoteca UNAM y Filmin Latino
Alistan primera caravana migrante de 2021 - El Sol de México	https://www.elsoldemexico.com.mx/mundo/alistan-primera-caravana-migrante-de-2021-6220710.html	2021-01-08	Alistan primera caravana migrante de 2021
México suspende recepción de visas humanitarias a migrantes; anuncio provoca trifulca - 24 HORAS	https://www.24-horas.mx/2021/01/08/mexico-suspende-recepcion-de-visas-humanitarias-a-migrantes-anuncio-provoca-trifulca/	2021-01-08	México suspende recepción de visas humanitarias a migrantes; anuncio provoca trifulca
Guatemala y Honduras despliegan militares para evitar paso de caravanas migrantes - La Razon	https://www.razon.com.mx/mundo/guatemala-honduras-despliegan-militares-evitar-paso-caravanas-migrantes-419169	2021-01-09	Guatemala y Honduras despliegan militares para evitar paso de caravanas migrantes
Vitamina D, efectiva contra COVID-19, se redujo por la migración - Reporte Indigo	https://www.reporteindigo.com/piensa/estudio-revela-que-vitamina-d-efectiva-contra-covid-19-se-redujo-por-la-migracion/	2021-01-10	Vitamina D, efectiva contra COVID-19, se redujo por la migración
Detienen en Texas a 52 mil migrantes - REFORMA	https://www.reforma.com/detienen-en-texas-a-52-mil-migrantes/ar2102926	2021-01-10	Detienen en Texas a 52 mil migrantes
Embajada de EU en México advierte cárcel a migrantes de nueva caravana - El Sol de México	https://www.elsoldemexico.com.mx/mexico/sociedad/embajada-de-eu-en-mexico-advierte-carcel-a-migrantes-de-nueva-caravana-6228315.html	2021-01-11	Embajada de EU en México advierte cárcel a migrantes de nueva caravana
Centroamérica y México se preparan ante otra caravana de migrantes - El Economista	https://www.eleconomista.com.mx/internacionales/Centroamerica-y-Mexico-se-preparan-ante-otra-caravana-de-migrantes-20210111-0079.html	2021-01-11	Centroamérica y México se preparan ante otra caravana de migrantes
Países piden prueba COVID a migrantes centroamericanos que saldrán en caravana hacia EU - El Financiero	https://www.elfinanciero.com.mx/nacional/paises-piden-prueba-covid-a-migrantes-centroamericanos-que-saldran-en-caravana-hacia-eu/	2021-01-12	Países piden prueba COVID a migrantes centroamericanos que saldrán en caravana hacia EU
México invocará capítulo del T-MEC para que migrantes reciban la vacuna en EU: Ebrard - El Economista	https://www.eleconomista.com.mx/politica/Mexico-invocara-capitulo-del-T-MEC-para-que-migrantes-reciban-la-vacuna-en-EU-Ebrard-20210113-0039.html	2021-01-13	México invocará capítulo del T-MEC para que migrantes reciban la vacuna en EU: Ebrard
Whatsapp retrasa cambios en políticas de datos tras migración masiva a Telegram - El Heraldo de México	https://heraldodemexico.com.mx/tecnologia/2021/1/15/whatsapp-retrasa-cambios-en-politicas-de-datos-tras-migracion-masiva-telegram-245397.html	2021-01-15	Whatsapp retrasa cambios en políticas de datos tras migración masiva a Telegram
ONU: pandemia redujo migración mundial en 30% - El Economista	https://www.eleconomista.com.mx/internacionales/ONU-pandemia-redujo-migracion-mundial-en-30-20210115-0063.html	2021-01-15	ONU: pandemia redujo migración mundial en 30%
Las nuevas condiciones de WhatsApp están llevando a la migración digital más grande de la historia | El Universal - El Universal	https://www.eluniversal.com.mx/techbit/las-nuevas-condiciones-de-whatsapp-estan-llevando-la-migracion-digital-mas-grande-de-la	2021-01-15	Las nuevas condiciones de WhatsApp están llevando a la migración digital más grande de la historia
GN busca impedir ingreso de migrantes – unomásuno.com.mx - UnomásUno	https://www.unomasuno.com.mx/gn-busca-impedir-ingreso-de-migrantes/	2021-01-15	GN busca impedir ingreso de migrantes – unomásuno.com.mx
Anhelo y voz de la migración; tres historias para niños - Periódico Excélsior	https://www.excelsior.com.mx/expresiones/anhelo-y-voz-de-la-migracion-tres-historias-para-ninos/1427212	2021-01-15	Anhelo y voz de la migración; tres historias para niños
Guardia Nacional y Ejército refuerzan vigilancia en Tabasco por caravana migrante - El Financiero	https://www.elfinanciero.com.mx/estados/guardia-nacional-y-ejercito-refuerzan-vigilancia-en-tabasco-por-caravana-migrante/	2021-01-16	Guardia Nacional y Ejército refuerzan vigilancia en Tabasco por caravana migrante
Fundamental, participación política de mujeres migrantes: IECM - Periódico Excélsior	https://www.excelsior.com.mx/comunidad/fundamental-participacion-politica-de-mujeres-migrantes-iecm/1427606	2021-01-16	Fundamental, participación política de mujeres migrantes: IECM
Cerca de mil migrantes llegan a Tecún Umán tras burlar cerco militar (+fotos) - 24 HORAS	https://www.24-horas.mx/2021/01/17/cerca-de-mil-migrantes-llegan-a-tecun-uman-tras-burlar-cerco-militar-fotos/	2021-01-17	Cerca de mil migrantes llegan a Tecún Umán tras burlar cerco militar (+fotos)
México envía a Guatemala camiones para devolver migrantes hondureños | El Universal - El Universal	https://www.eluniversal.com.mx/mundo/mexico-envia-guatemala-camiones-para-devolver-migrantes-hondurenos	2021-01-17	México envía a Guatemala camiones para devolver migrantes hondureños
Reprende Guatemala con gas lacrimógeno a caravana migrante - REFORMA	https://www.reforma.com/reprende-guatemala-con-gas-lacrimogeno-a-caravana-migrante/ar2107318	2021-01-17	Reprende Guatemala con gas lacrimógeno a caravana migrante
Caravana migrante avanza hacia México | El Universal - El Universal	https://www.eluniversal.com.mx/mundo/caravana-migrante-avanza-hacia-mexico	2021-01-17	Caravana migrante avanza hacia México
Busca Biden amplia reforma migratoria - REFORMA	https://www.reforma.com/busca-biden-amplia-reforma-migratoria/ar2108061	2021-01-18	Busca Biden amplia reforma migratoria
Cienfuegos, caravana migrante y vacunación destacan en la mañanera de AMLO - El Economista	https://www.eleconomista.com.mx/politica/Cienfuegos-caravana-migrante-y-vacunacion-destacan-en-la-mananera-de-AMLO-20210118-0040.html	2021-01-18	Cienfuegos, caravana migrante y vacunación destacan en la mañanera de AMLO
Hay diálogo por caravanas de migrantes: AMLO - El Sol de México	https://www.elsoldemexico.com.mx/mexico/sociedad/hay-dialogo-por-caravanas-de-migrantes-amlo-6255565.html	2021-01-18	Hay diálogo por caravanas de migrantes: AMLO
Con bombas lacrimógenas, Policía de Guatemala dispersa a caravana migrante - El Sol de México	https://www.elsoldemexico.com.mx/mundo/con-bombas-lacrimogenas-policia-de-guatemala-dispersa-a-caravana-migrante-6256448.html	2021-01-18	Con bombas lacrimógenas, Policía de Guatemala dispersa a caravana migrante
Guatemala hace reclamo a Honduras por no contener caravana migrante - La Razon	https://www.razon.com.mx/mundo/guatemala-reclamo-honduras-contener-caravana-migrante-420121	2021-01-18	Guatemala hace reclamo a Honduras por no contener caravana migrante
La reforma migratoria 'radical' de Biden planea dar ciudadanía a quien tenga 8 años viviendo en EU - El Financiero	https://www.elfinanciero.com.mx/mundo/la-reforma-migratoria-radical-de-biden-planea-dar-ciudadania-a-quien-tenga-8-anos-viviendo-en-eu/	2021-01-18	La reforma migratoria 'radical' de Biden planea dar ciudadanía a quien tenga 8 años viviendo en EU
AMLO se pronuncia por diálogo y atención a migrantes - 24 HORAS	https://www.24-horas.mx/2021/01/18/amlo-se-pronuncia-por-dialogo-y-atencion-a-migrantes/	2021-01-18	AMLO se pronuncia por diálogo y atención a migrantes
Caravana migrante se convierte en grupos agotados de hondureños - El Sol de México	https://www.elsoldemexico.com.mx/incoming/caravana-migrante-se-convierte-en-grupos-agotados-de-hondurenos-chiapas-guatemala-6258037.html	2021-01-18	Caravana migrante se convierte en grupos agotados de hondureños
Se debe garantizar seguridad sanitaria ante llegada de migrantes: CEDH de Chiapas - El Sol de México	https://www.elsoldemexico.com.mx/republica/sociedad/debe-garantizarse-la-seguridad-sanitaria-ante-caravana-cedh-prevencion-medidas-sanitarias-pandemia-coronavirus-migrantes-6260977.html	2021-01-19	Se debe garantizar seguridad sanitaria ante llegada de migrantes: CEDH de Chiapas
Corrupción y desempleo fomentan migración en Honduras: estudio - Milenio	https://www.milenio.com/internacional/migracion-honduras-fomentada-corrupcion-desempleo-estudio	2021-01-19	Corrupción y desempleo fomentan migración en Honduras: estudio
Ciudadanía y no explotación: Éste es el proyecto de ley de Biden sobre migrantes - Milenio	https://www.milenio.com/internacional/inmigrantes-eu-proyecto-ley-inmigracion-joe-biden	2021-01-20	Ciudadanía y no explotación: Éste es el proyecto de ley de Biden sobre migrantes
A partir de hoy, todo cambia: migración - El Financiero	https://www.elfinanciero.com.mx/opinion/pablo-hiriart/a-partir-de-hoy-todo-cambia-migracion/	2021-01-20	A partir de hoy, todo cambia: migración
Biden cancela Quédate en México y revive 'sueño americano' de migrantes en frontera - El Sol de México	https://www.elsoldemexico.com.mx/mexico/sociedad/biden-cancela-programa-migrantes-quedate-en-mexico-revive-sueno-americano-de-migrantes-en-frontera-6269653.html	2021-01-21	Biden cancela Quédate en México y revive 'sueño americano' de migrantes en frontera
Rescatan a 128 migrantes en Veracruz; se encontraban escondidos en la caja de un camión - Reporte Indigo	https://www.reporteindigo.com/reporte/rescatan-a-128-migrantes-en-veracruz-se-encontraban-escondidos-en-la-caja-de-un-camion/	2021-01-21	Rescatan a 128 migrantes en Veracruz; se encontraban escondidos en la caja de un camión
Rescatan a 128 migrantes en Veracruz: gritos de auxilio y golpes alertaron de su presencia en un trailer - El Financiero	https://www.elfinanciero.com.mx/estados/rescatan-a-128-migrantes-en-veracruz-gritos-de-auxilio-y-golpes-alertaron-de-su-presencia-en-un-trailer/	2021-01-21	Rescatan a 128 migrantes en Veracruz: gritos de auxilio y golpes alertaron de su presencia en un trailer
Seguridad fronteriza y migración, los retos: especialistas - 24 HORAS	https://www.24-horas.mx/2021/01/21/seguridad-fronteriza-y-migracion-los-retos-especialistas/	2021-01-21	Seguridad fronteriza y migración, los retos: especialistas
Reforma migratoria de Biden puede descarrilarse si la 4T no atiende crisis en la frontera sur - El Financiero	https://www.elfinanciero.com.mx/nacional/crisis-en-la-frontera-descarrilaria-reforma-migratoria-de-biden-especialistas/	2021-01-22	Reforma migratoria de Biden puede descarrilarse si la 4T no atiende crisis en la frontera sur
Estados Unidos.- Expertos de Naciones Unidas piden un acceso equitativo a las vacunas, migrantes incluidos - Publimetro México	https://www.publimetro.com.mx/mx/noticias/2021/01/22/estados-unidos-expertos-de-naciones-unidas-piden-un-acceso-equitativo-a-las-vacunas-migrantes-incluidos.html	2021-01-22	Estados Unidos.- Expertos de Naciones Unidas piden un acceso equitativo a las vacunas, migrantes incluidos
Dialogan AMLO y Biden sobre Covid-19, migración y relación México-EU - El Economista	https://www.eleconomista.com.mx/politica/Dialogan-AMLO-y-Biden-sobre-Covid-19-migracion-y-relacion-Mexico-EU-20210122-0071.html	2021-01-22	Dialogan AMLO y Biden sobre Covid-19, migración y relación México-EU
A la orilla del Bravo, migrantes aguardan asilo de Biden - El Sol de México	https://www.elsoldemexico.com.mx/republica/sociedad/a-la-orilla-del-bravo-migrantes-aguardan-asilo-de-biden-6272416.html	2021-01-22	A la orilla del Bravo, migrantes aguardan asilo de Biden
Benefactor de migrantes pide cautela ante promesas de EU - 24 HORAS	https://www.24-horas.mx/2021/01/22/benefactor-de-migrantes-pide-cautela-ante-promesas-de-eu/	2021-01-22	Benefactor de migrantes pide cautela ante promesas de EU
Honduras.- Save the Children alerta del “alto riesgo” de “explotación” de 1.400 niños de la caravana migratoria - Publimetro México	https://www.publimetro.com.mx/mx/noticias/2021/01/22/honduras-save-the-children-alerta-del-alto-riesgo-de-explotacion-de-1-400-ninos-de-la-caravana-migratoria.html	2021-01-22	Honduras.- Save the Children alerta del “alto riesgo” de “explotación” de 1.400 niños de la caravana migratoria
Biden apoyará con 4 mil mdd a Honduras, Guatemala y El Salvador para atender migración: AMLO - El Financiero	https://www.elfinanciero.com.mx/nacional/biden-apoyara-con-4-mil-mdd-a-honduras-guatemala-y-el-salvador-para-atender-migracion-amlo/	2021-01-23	Biden apoyará con 4 mil mdd a Honduras, Guatemala y El Salvador para atender migración: AMLO
