title	link	date	title_corrected
The world must do more for Venezuelan refugees, migrants and their hosts - Jamaica Observer	https://www.jamaicaobserver.com/opinion/the-world-must-do-more-for-venezuelan-refugees-migrants-and-their-hosts_224081	2021-06-18	The world must do more for Venezuelan refugees, migrants and their hosts
World needs to do more for Venezuelan refugees - Jamaica Gleaner	https://jamaica-gleaner.com/article/focus/20210620/world-needs-do-more-venezuelan-refugees	2021-06-20	World needs to do more for Venezuelan refugees
Guyana moving to implement visa restrictions on Haiti, Cuba to curb illegal migration - Jamaica Gleaner	https://jamaica-gleaner.com/article/caribbean/20210623/guyana-moving-implement-visa-restrictions-haiti-cuba-curb-illegal	2021-06-23	Guyana moving to implement visa restrictions on Haiti, Cuba to curb illegal migration
Guyana to implement visa restrictions on Haiti, Cuba to reduce illegal migration - Jamaica Star Online	http://jamaica-star.com/article/news/20210623/guyana-implement-visa-restrictions-haiti-cuba-reduce-illegal-migration	2021-06-23	Guyana to implement visa restrictions on Haiti, Cuba to reduce illegal migration
US Supreme Court says no right to hearing for some immigrants - Jamaica Gleaner	https://jamaica-gleaner.com/article/world-news/20210629/us-supreme-court-says-no-right-hearing-some-immigrants	2021-06-29	US Supreme Court says no right to hearing for some immigrants
Uprooted again: Venezuela migrants cross US border in droves - Jamaica Gleaner	https://jamaica-gleaner.com/article/world-news/20210629/uprooted-again-venezuela-migrants-cross-us-border-droves	2021-06-29	Uprooted again: Venezuela migrants cross US border in droves
Biden calls for bipartisan action on pathway to citizenship for some migrants - Jamaica Gleaner	https://jamaica-gleaner.com/article/world-news/20210702/biden-calls-bipartisan-action-pathway-citizenship-some-migrants	2021-07-02	Biden calls for bipartisan action on pathway to citizenship for some migrants
US stops jailing pregnant migrants, reversing Trump policy - Jamaica Observer	https://www.jamaicaobserver.com/latestnews/US_stops_jailing_pregnant_migrants,_reversing_Trump_policy	2021-07-09	US stops jailing pregnant migrants, reversing Trump policy
US Coast Guard repatriates 23 migrants to Cuba - Jamaica Observer	https://www.jamaicaobserver.com/latestnews/US_Coast_Guard_repatriates_23_migrants_to_Cuba	2021-07-11	US Coast Guard repatriates 23 migrants to Cuba
Biden vows to appeal ruling against 'Dreamers' immigration program - Jamaica Observer	https://www.jamaicaobserver.com/latestnews/Biden_vows_to_appeal_ruling_against_Dreamers_immigration_program	2021-07-17	Biden vows to appeal ruling against 'Dreamers' immigration program
Cameroon refugee achieves Olympic dream after UK ordeal - Jamaica Observer	https://www.jamaicaobserver.com/sports/cameroon-refugee-achieves-olympic-dream-after-uk-ordeal_227342	2021-07-28	Cameroon refugee achieves Olympic dream after UK ordeal
Harris releases strategy to tackle migration's root causes - Jamaica Gleaner	https://jamaica-gleaner.com/article/news/20210731/harris-releases-strategy-tackle-migrations-root-causes	2021-07-31	Harris releases strategy to tackle migration's root causes
Jamaican among RBC Top 25 Canadian immigrants | News - Jamaica Gleaner	https://jamaica-gleaner.com/article/news/20190708/jamaican-among-rbc-top-25-canadian-immigrants	2019-07-08	Jamaican among RBC Top 25 Canadian immigrantsNews
US House passes legislation to protect immigrants | News - Jamaica Gleaner	https://jamaica-gleaner.com/article/news/20190714/us-house-passes-legislation-protect-immigrants	2019-07-14	US House passes legislation to protect immigrantsNews
Lockdown - Jamaicans go into hiding as news of sweeping deportation raids drives fear into immigrants - Jamaica Gleaner	https://jamaica-gleaner.com/article/lead-stories/20190716/lockdown-jamaicans-go-hiding-news-sweeping-deportation-raids-drives	2019-07-16	LockdownJamaicans go into hiding as news of sweeping deportation raids drives fear into immigrants
Haitian diplomat urges Bahamas not to jail nationals on minor immigration offences - Jamaica Gleaner	https://jamaica-gleaner.com/article/caribbean/20191028/haitian-diplomat-urges-bahamas-not-jail-nationals-minor-immigration	2019-10-28	Haitian diplomat urges Bahamas not to jail nationals on minor immigration offences
US judge blocks Trump's health insurance rule for immigrants - Jamaica Gleaner	https://jamaica-gleaner.com/article/world-news/20191103/us-judge-blocks-trumps-health-insurance-rule-immigrants	2019-11-03	US judge blocks Trump's health insurance rule for immigrants
India to create registry to identify undocumented immigrants | World News - Jamaica Gleaner	https://jamaica-gleaner.com/article/world-news/20191121/india-create-registry-identify-undocumented-immigrants	2019-11-21	India to create registry to identify undocumented immigrantsWorld News
US seeks review of state laws granting driver's licence to illegal immigrants - Jamaica Gleaner	https://jamaica-gleaner.com/article/world-news/20200101/us-seeks-review-state-laws-granting-drivers-licence-illegal-immigrants	2020-01-01	US seeks review of state laws granting driver's licence to illegal immigrants
UNITED STATES | Trump deploys elite agents targeting Caribbean immigrants - Jamaica Gleaner	https://jamaica-gleaner.com/article/world-news/20200217/united-states-trump-deploys-elite-agents-targeting-caribbean-immigrants	2020-02-17	UNITED STATESTrump deploys elite agents targeting Caribbean immigrants
Immigration Corner | Would a same-sex marriage in Ja be good for US immigration? - Jamaica Gleaner	https://jamaica-gleaner.com/article/news/20200310/immigration-corner-would-same-sex-marriage-ja-be-good-us-immigration	2020-03-10	Immigration CornerWould a same-sex marriage in Ja be good for US immigration?
COVID-19 is serious - Elephant Man says he did not lie to Immigration - Jamaica Star Online	http://jamaica-star.com/article/entertainment/20200319/covid-19-serious-elephant-man-says-he-did-not-lie-immigration	2020-03-19	COVID-19 is seriousElephant Man says he did not lie to Immigration
UK government slammed for failing its Windrush immigrants - Jamaica Gleaner	https://jamaica-gleaner.com/article/world-news/20200319/uk-government-slammed-failing-its-windrush-immigrants	2020-03-19	UK government slammed for failing its Windrush immigrants
Elephant Man charged with breaches of the Immigration Act - Jamaica Star Online	http://jamaica-star.com/article/news/20200323/elephant-man-charged-breaches-immigration-act	2020-03-23	Elephant Man charged with breaches of the Immigration Act
AGs fight for asylum protections for Caribbean immigrants | World News - Jamaica Gleaner	https://jamaica-gleaner.com/article/world-news/20200330/ags-fight-asylum-protections-caribbean-immigrants	2020-03-30	AGs fight for asylum protections for Caribbean immigrantsWorld News
US Supreme Court sides with government in immigration case that involves a Jamaican - Jamaica Star Online	http://jamaica-star.com/article/news/20200423/us-supreme-court-sides-government-immigration-case-involves-jamaican	2020-04-23	US Supreme Court sides with government in immigration case that involves a Jamaican
US supreme court rejects Trump's bid to end young immigrants' protections - Jamaica Star Online	http://jamaica-star.com/article/news/20200618/us-supreme-court-rejects-trumps-bid-end-young-immigrants%E2%80%99-protections	2020-06-18	US supreme court rejects Trump's bid to end young immigrants' protections
US Supreme Court ruling on census count 'hurts' Caribbean immigrants - Jamaica Gleaner	https://jamaica-gleaner.com/article/caribbean/20201014/us-supreme-court-ruling-census-count-hurts-caribbean-immigrants	2020-10-14	US Supreme Court ruling on census count 'hurts' Caribbean immigrants
Person of interest in police custody for shooting of immigration officer Kevin Lewin - Jamaica Observer	https://www.jamaicaobserver.com/latestnews/person_of_interest_in_police_custody_for_shooting_of_immigration_officer_kevin_lewin	2020-11-26	Person of interest in police custody for shooting of immigration officer Kevin Lewin
Trump appointees pressure census bureau for report on undocumented immigrants - Jamaica Gleaner	https://jamaica-gleaner.com/article/world-news/20210113/trump-appointees-pressure-census-bureau-report-undocumented-immigrants	2021-01-13	Trump appointees pressure census bureau for report on undocumented immigrants
Biden to propose 8-year citizenship path for undocumented immigrants - Jamaica Gleaner	https://jamaica-gleaner.com/article/news/20210120/biden-propose-8-year-citizenship-path-undocumented-immigrants	2021-01-20	Biden to propose 8-year citizenship path for undocumented immigrants
Advocates welcome legislation to overhaul US immigration system - Jamaica Observer	https://www.jamaicaobserver.com/latestnews/Advocates_welcome_legislation_to_overhaul_US_immigration_system	2021-02-22	Advocates welcome legislation to overhaul US immigration system
New York AG sues company for preying on vulnerable Caribbean immigrants - Jamaica Gleaner	https://jamaica-gleaner.com/article/world-news/20210302/new-york-ag-sues-company-preying-vulnerable-caribbean-immigrants	2021-03-02	New York AG sues company for preying on vulnerable Caribbean immigrants
Get ready for the immigrant visa interview - Jamaica Observer	https://www.jamaicaobserver.com/news/get-ready-for-the-immigrant-visa-interview_218646	2021-04-07	Get ready for the immigrant visa interview
New York to offer COVID aid to undocumented immigrants - Jamaica Star Online	http://jamaica-star.com/article/news/20210408/new-york-offer-covid-aid-undocumented-immigrants	2021-04-08	New York to offer COVID aid to undocumented immigrants
'An immigration issue, not a criminal case', Dovey Magnum's manager clarifies arrest - Jamaica Star Online	http://jamaica-star.com/article/entertainment/20210523/immigration-issue-not-criminal-case-dovey-magnums-manager-clarifies	2021-05-23	'An immigration issue, not a criminal case', Dovey Magnum's manager clarifies arrest
