title	link	date	title_corrected
Cientos de migrantes haitianos llevan seis días varados en frontera Brasil-Perú - listindiario.com	https://listindiario.com/las-mundiales/2021/02/17/657537/cientos-de-migrantes-haitianos-llevan-seis-dias-varados-en-frontera-brasil-peru	2021-02-17	Cientos de migrantes haitianos llevan seis días varados en frontera Brasil-Perú
Entrada ilegal no impide proteger a los refugiados - Listín Diario	https://listindiario.com/la-republica/2021/02/18/657618/entrada-ilegal-no-impide-proteger-a-los-refugiados	2021-02-18	Entrada ilegal no impide proteger a los refugiados
EE.UU. conversa sobre migración con El Salvador y llama a crear oportunidades - Diario Libre	https://www.diariolibre.com/usa/actualidad/ee-uu-conversa-sobre-migracion-con-el-salvador-y-llama-a-crear-oportunidades-CB24524565	2021-02-19	EE.UU. conversa sobre migración con El Salvador y llama a crear oportunidades
ONG española Salvamento Marítimo rescata a 102 migrantes y auxilia a otros 46 - diariolibre.com	https://www.diariolibre.com/actualidad/internacional/ong-espanola-salvamento-maritimo-rescata-a-102-migrantes-y-auxilia-a-otros-46-BC24518797	2021-02-19	ONG española Salvamento Marítimo rescata a 102 migrantes y auxilia a otros 46
Los primeros inmigrantes beneficiados por Joe Biden - Listín Diario	https://listindiario.com/las-mundiales/2021/02/20/657957/los-primeros-inmigrantes-beneficiados-por-joe-biden	2021-02-20	Los primeros inmigrantes beneficiados por Joe Biden
Militares de EUA, más refugiados – Diario Dominicano - diariodominicano.com	https://diariodominicano.com/?p=264899	2021-02-23	Militares de EUA, más refugiados – Diario Dominicano
Biden revoca medida de Trump que vetaba a migrantes por riesgo laboral – El Nacional - elnacional.com.do	https://elnacional.com.do/biden-revoca-medida-de-trump-que-vetaba-a-migrantes-por-riesgo-laboral/	2021-02-25	Biden revoca medida de Trump que vetaba a migrantes por riesgo laboral – El Nacional
Pelegrín asegura que no importa el costo de la verja fronteriza sino solucionar la migración haitiana - El Caribe	https://www.elcaribe.com.do/destacado/pelegrin-asegura-que-no-importa-el-costo-de-la-verja-fronteriza-sino-solucionar-la-migracion-haitiana/	2021-03-02	Pelegrín asegura que no importa el costo de la verja fronteriza sino solucionar la migración haitiana
Verja fronteriza, apuesta dominicana ante la migración ilegal de Haití - Diario Libre	https://www.diariolibre.com/actualidad/verja-fronteriza-apuesta-dominicana-ante-la-migracion-ilegal-de-haiti-JE24754085	2021-03-03	Verja fronteriza, apuesta dominicana ante la migración ilegal de Haití
Otro muro fronterizo surge en América Latina: ¿solucionar la migración irregular o aislar al país más pobre de la región? - El Dia.com.do	https://eldia.com.do/otro-muro-fronterizo-surge-en-america-latina-solucionar-la-migracion-irregular-o-aislar-al-pais-mas-pobre-de-la-region/	2021-03-04	Otro muro fronterizo surge en América Latina: ¿solucionar la migración irregular o aislar al país más pobre de la región?
Se normaliza área migración del AILA – El Nacional - elnacional.com.do	https://elnacional.com.do/se-normaliza-area-migracion-del-aila/	2021-03-05	Se normaliza área migración del AILA – El Nacional
Rep. Dominicana se propone legalizar cien mil inmigrantes venezolanos - Almomento.net	https://almomento.net/rep-dominicana-se-propone-legalizar-a-cien-mil-inmigrantes-venezolanos/	2021-03-05	Rep. Dominicana se propone legalizar cien mil inmigrantes venezolanos
HRW detecta extorsiones y secuestros de migrantes en la frontera México-EEUU - Diario Libre	https://www.diariolibre.com/usa/actualidad/hrw-detecta-extorsiones-y-secuestros-de-migrantes-en-la-frontera-mexico-eeuu-EO24804606	2021-03-05	HRW detecta extorsiones y secuestros de migrantes en la frontera México-EEUU
Puerto Rico detiene a 18 migrantes indocumentados, la mayoría dominicanos - Listín Diario	https://listindiario.com/las-mundiales/2021/03/08/660280/puerto-rico-detiene-a-18-migrantes-indocumentados-la-mayoria-dominicanos	2021-03-08	Puerto Rico detiene a 18 migrantes indocumentados, la mayoría dominicanos
La patrulla fronteriza de EEUU tiene en custodia a 3.200 migrantes menores - Diario Libre	https://www.diariolibre.com/usa/actualidad/la-patrulla-fronteriza-de-eeuu-tiene-en-custodia-a-3200-migrantes-menores-HH24894636	2021-03-09	La patrulla fronteriza de EEUU tiene en custodia a 3.200 migrantes menores
EEUU aplaza deportación de guatemalteca refugiada en iglesia - Diario Libre	https://www.diariolibre.com/usa/actualidad/eeuu-aplaza-deportacion-de-guatemalteca-refugiada-en-iglesia-FI24978269	2021-03-12	EEUU aplaza deportación de guatemalteca refugiada en iglesia
Abel Martínez al Gobierno sobre migración: La primera tarea es sacar del territorio a miles de ilegales haitianos - Listín Diario	https://listindiario.com/la-republica/2021/03/13/661030/abel-martinez-al-gobierno-sobre-migracion-la-primera-tarea-es-sacar-del-territorio-a-miles-de-ilegales-haitianos	2021-03-13	Abel Martínez al Gobierno sobre migración: La primera tarea es sacar del territorio a miles de ilegales haitianos
El problema de los niños migrantes en la frontera - Listín Diario	https://listindiario.com/las-mundiales/2021/03/15/661206/el-problema-de-los-ninos-migrantes-en-la-frontera	2021-03-15	El problema de los niños migrantes en la frontera
EEUU: Más inmigrantes “que en los últimos 20 años” llegarían a la frontera - Almomento.net	https://almomento.net/eeuu-mas-inmigrantes-que-en-los-ultimos-20-anos-llegarian-a-la-frontera/	2021-03-16	EEUU: Más inmigrantes “que en los últimos 20 años” llegarían a la frontera
EEUU espera más migrantes ahora que en últimos 20 años en frontera con México - Listín Diario	https://listindiario.com/las-mundiales/2021/03/16/661400/eeuu-espera-mas-migrantes-ahora-que-en-ultimos-20-anos-en-frontera-con-mexico	2021-03-16	EEUU espera más migrantes ahora que en últimos 20 años en frontera con México
Migración y el Ejército detienen 70 extranjeros indocumentados durante operativo en Santiago - Periódico El Caribe - El Caribe	https://www.elcaribe.com.do/panorama/pais/migracion-y-el-ejercito-detienen-70-extranjeros-indocumentados-durante-operativo-en-santiago/	2021-03-16	Migración y el Ejército detienen 70 extranjeros indocumentados durante operativo en SantiagoPeriódico 
El gobierno de Biden niega una “crisis” de migrantes - Diario Libre	https://www.diariolibre.com/usa/actualidad/el-gobierno-de-biden-niega-una-crisis-de-migrantes-MC25059050	2021-03-17	El gobierno de Biden niega una “crisis” de migrantes
La Suprema Corte de Justicia de EU falla que los inmigrantes llevan la carga de la prueba - Periódico El Caribe - El Caribe	https://www.elcaribe.com.do/opiniones/migracion-sin-fronteras/la-suprema-corte-de-justicia-de-eu-falla-que-los-inmigrantes-llevan-la-carga-de-la-prueba/	2021-03-18	La Suprema Corte de Justicia de EU falla que los inmigrantes llevan la carga de la pruebaPeriódico 
Rescatados 72 migrantes en el Canal de la Mancha, al norte de Francia - Listín Diario	https://listindiario.com/las-mundiales/2021/03/21/662196/rescatados-72-migrantes-en-el-canal-de-la-mancha-al-norte-de-francia	2021-03-21	Rescatados 72 migrantes en el Canal de la Mancha, al norte de Francia
Muere niña rescatada en barco de migrantes cerca de Canarias - Diario Libre	https://www.diariolibre.com/usa/actualidad/muere-nina-rescatada-en-barco-de-migrantes-cerca-de-canarias-GC25145030	2021-03-22	Muere niña rescatada en barco de migrantes cerca de Canarias
Al menos cuatro muertos en accidente con transporte ilegal de 30 refugiados - Diario Libre	https://www.diariolibre.com/actualidad/internacional/al-menos-cuatro-muertos-en-accidente-con-transporte-ilegal-de-30-refugiados-ND25150085	2021-03-22	Al menos cuatro muertos en accidente con transporte ilegal de 30 refugiados
Biden a la defensiva ante su primera crisis migratoria - listindiario.com	https://listindiario.com/las-mundiales/2021/03/22/662267/biden-a-la-defensiva-ante-su-primera-crisis-migratoria	2021-03-22	Biden a la defensiva ante su primera crisis migratoria
Harris asume la misión de frenar la migración y coordinarse con Centroamérica - El Nuevo Diario (República Dominicana)	https://elnuevodiario.com.do/harris-asume-la-mision-de-frenar-la-migracion-y-coordinarse-con-centroamerica/	2021-03-24	Harris asume la misión de frenar la migración y coordinarse con Centroamérica
Biden busca frenar migración a EE.UU. con apoyo a países de Centroamerica - Diario Libre	https://www.diariolibre.com/usa/actualidad/biden-busca-frenar-migracion-a-ee-uu-con-apoyo-a-paises-de-centroamerica-IA25259607	2021-03-26	Biden busca frenar migración a EE.UU. con apoyo a países de Centroamerica
Abel Martínez sobre migración: Este país tiene que respetarse - Listín Diario	https://listindiario.com/la-republica/2021/03/28/663348/abel-martinez-sobre-migracion-este-pais-tiene-que-respetarse	2021-03-28	Abel Martínez sobre migración: Este país tiene que respetarse
Tensión en frontera México-Guatemala por la migración - diariodominicano.com	https://diariodominicano.com/?p=269879	2021-03-29	Tensión en frontera México-Guatemala por la migración
Detienen en el centro de Colombia a 52 migrantes, entre ellos 14 menores - Diario Libre	https://www.diariolibre.com/actualidad/internacional/detienen-en-el-centro-de-colombia-a-52-migrantes-entre-ellos-14-menores-NA25348115	2021-03-31	Detienen en el centro de Colombia a 52 migrantes, entre ellos 14 menores
De Guatemala a EEUU, la solitaria odisea de un niño inmigrante - Listín Diario	https://listindiario.com/las-mundiales/2021/03/31/663881/de-guatemala-a-eeuu-la-solitaria-odisea-de-un-nino-inmigrante	2021-03-31	De Guatemala a EEUU, la solitaria odisea de un niño inmigrante
ACNUR pide a vecinos de Birmania que acojan refugiados huidos de la represión - Diario Libre	https://www.diariolibre.com/actualidad/internacional/acnur-pide-a-vecinos-de-birmania-que-acojan-refugiados-huidos-de-la-represion-FH25338296	2021-03-31	ACNUR pide a vecinos de Birmania que acojan refugiados huidos de la represión
Familias migrantes quedan libres en EEUU sin cita judicial - Diario Libre	https://www.diariolibre.com/usa/actualidad/familias-migrantes-quedan-libres-en-eeuu-sin-cita-judicial-DB25353653	2021-04-01	Familias migrantes quedan libres en EEUU sin cita judicial
Llegan a El Salvador los restos de la migrante asesinada por policías en México - El Dia.com.do	https://eldia.com.do/llegan-a-el-salvador-los-restos-de-la-migrante-asesinada-por-policias-en-mexico/	2021-04-03	Llegan a El Salvador los restos de la migrante asesinada por policías en México
EEUU y BID anuncian ayuda para migrantes venezolanos - Diario Libre	https://www.diariolibre.com/usa/actualidad/eeuu-y-bid-anuncian-ayuda-para-migrantes-venezolanos-HG25457330	2021-04-06	EEUU y BID anuncian ayuda para migrantes venezolanos
Nicaragüenses exiliados piden protección para niño migrante hallado en EE.UU. - El Nuevo Diario (República Dominicana)	https://elnuevodiario.com.do/nicaraguenses-exiliados-piden-proteccion-para-nino-migrante-hallado-en-ee-uu/	2021-04-07	Nicaragüenses exiliados piden protección para niño migrante hallado en EE.UU.
EEUU y BID anuncian ayuda para migrantes venezolanos - Listín Diario	https://listindiario.com/las-mundiales/2021/04/07/664750/eeuu-y-bid-anuncian-ayuda-para-migrantes-venezolanos	2021-04-07	EEUU y BID anuncian ayuda para migrantes venezolanos
Inmigrantes se manifiestan frente a la casa de Kamala Harris para pedir ayuda - El Dia.com.do	https://eldia.com.do/inmigrantes-se-manifiestan-frente-a-la-casa-de-kamala-harris-para-pedir-ayuda/	2021-04-07	Inmigrantes se manifiestan frente a la casa de Kamala Harris para pedir ayuda
EU y El Salvador valoran causas de migración - El Dia.com.do	https://eldia.com.do/eu-y-el-salvador-valoran-causas-de-migracion/	2021-04-08	EU y El Salvador valoran causas de migración
EEUU detiene cifra récord de niños migrantes en frontera - diariolibre.com	https://www.diariolibre.com/usa/actualidad/eeuu-detiene-cifra-record-de-ninos-migrantes-en-frontera-BC25506315	2021-04-08	EEUU detiene cifra récord de niños migrantes en frontera
Panamá investiga la muerte de cuatro migrantes irregulares en zona selvática - Listín Diario	https://listindiario.com/las-mundiales/2021/04/11/665294/panama-investiga-la-muerte-de-cuatro-migrantes-irregulares-en-zona-selvatica	2021-04-11	Panamá investiga la muerte de cuatro migrantes irregulares en zona selvática
La cifra de niños inmigrantes en tutela de EEUU cae un 45% en menos de un mes - Periódico El Caribe - El Caribe	https://www.elcaribe.com.do/panorama/internacionales/la-cifra-de-ninos-inmigrantes-en-tutela-de-eeuu-cae-un-45-en-menos-de-un-mes/	2021-04-12	La cifra de niños inmigrantes en tutela de EEUU cae un 45% en menos de un mesPeriódico 
Biden elige a jefe policial ya activista para dirigir agencias migratorias - El Caribe	https://www.elcaribe.com.do/destacado/biden-elige-a-jefe-policial-y-a-activista-para-dirigir-agencias-migratorias/	2021-04-12	Biden elige a jefe policial ya activista para dirigir agencias migratorias
Video | El tortuoso e incierto viaje de los migrantes hacia Estados Unidos - Diario Libre	https://www.diariolibre.com/usa/actualidad/video-el-tortuoso-e-incierto-viaje-de-los-migrantes-hacia-estados-unidos-DA25610120	2021-04-13	VideoEl tortuoso e incierto viaje de los migrantes hacia Estados Unidos
Clinton, los campamentos de refugiados solicitados al Dr. Balaguer, y la defensa del interés general asumida por un presidente nacionalista - El Nuevo Diario (República Dominicana)	https://elnuevodiario.com.do/clinton-los-campamentos-de-refugiados-solicitados-al-dr-balaguer-y-la-defensa-del-interes-general-asumida-por-un-presidente-nacionalista/	2021-04-13	Clinton, los campamentos de refugiados solicitados al Dr. Balaguer, y la defensa del interés general asumida por un presidente nacionalista
Naufragio deja 42 migrantes muertos ante la costa de Yibuti - Listín Diario	https://listindiario.com/las-mundiales/2021/04/13/665592/naufragio-deja-42-migrantes-muertos-ante-la-costa-de-yibuti	2021-04-13	Naufragio deja 42 migrantes muertos ante la costa de Yibuti
Destacan aportes migrantes chinos – El Nacional - elnacional.com.do	https://elnacional.com.do/destacan-aportes-migrantes-chinos/	2021-04-13	Destacan aportes migrantes chinos – El Nacional
Clinton y los campamentos de refugiados solicitados a Balaguer - Almomento.net	https://almomento.net/opinion-clinton-y-los-campamentos-de-refugiados-solicitados-a-balaguer/	2021-04-14	Clinton y los campamentos de refugiados solicitados a Balaguer
Oposición venezolana agradece a República Dominicana por buscar regular a migrantes - Listín Diario	https://listindiario.com/las-mundiales/2021/04/15/665995/oposicion-venezolana-agradece-a-republica-dominicana-por-buscar-regular-a-migrantes	2021-04-15	Oposición venezolana agradece a República Dominicana por buscar regular a migrantes
Oposición venezolana agradece a RD por buscar regular a migrantes - Diario Libre	https://www.diariolibre.com/actualidad/oposicion-venezolana-agradece-a-rd-por-buscar-regular-a-migrantes-GF25643252	2021-04-15	Oposición venezolana agradece a RD por buscar regular a migrantes
Oposición venezolana agradece a República Dominicana por buscar regular a migrantes - El Dia.com.do	https://eldia.com.do/oposicion-venezolana-agradece-a-republica-dominicana-por-buscar-regular-a-migrantes/	2021-04-15	Oposición venezolana agradece a República Dominicana por buscar regular a migrantes
"López Obrador pide ""respetuosamente"" a EEUU que contribuya ""rápido"" a frenar la migración desde Centroamérica - listindiario.com"	https://listindiario.com/las-mundiales/2021/04/15/665946/lopez-obrador-pide-respetuosamente-a-eeuu-que-contribuya-rapido-a-frenar-la-migracion-desde-centroamerica	2021-04-15	"López Obrador pide ""respetuosamente"" a EEUU que contribuya ""rápido"" a frenar la migración desde Centroamérica"
Biden acelera admisión de refugiados, pero no sube su número - Diario Libre	https://www.diariolibre.com/usa/actualidad/biden-acelera-admision-de-refugiados-pero-no-sube-su-numero-KG25673696	2021-04-16	Biden acelera admisión de refugiados, pero no sube su número
Estudio confirma inmigración haitiana no constituye peligro para RD – El Nacional - elnacional.com.do	https://elnacional.com.do/estudio-confirma-inmigracion-haitiana-no-constituye-peligro-para-rd/	2021-04-16	Estudio confirma inmigración haitiana no constituye peligro para RD – El Nacional
Casa Blanca: Biden elevará el tope de refugiados en mayo - Listín Diario	https://listindiario.com/las-mundiales/2021/04/17/666228/casa-blanca-biden-elevara-el-tope-de-refugiados-en-mayo	2021-04-17	Casa Blanca: Biden elevará el tope de refugiados en mayo
George Bush se arrepiente especialmente de no haber hecho reforma migratoria – El Nacional - elnacional.com.do	https://elnacional.com.do/george-bush-se-arrepiente-especialmente-de-no-haber-hecho-reforma-migratoria/	2021-04-18	George Bush se arrepiente especialmente de no haber hecho reforma migratoria – El Nacional
Tráfico de migrantes, un crimen millonario con los pobres como mercancía - Listín Diario	https://listindiario.com/las-mundiales/2021/04/19/666497/trafico-de-migrantes-un-crimen-millonario-con-los-pobres-como-mercancia	2021-04-19	Tráfico de migrantes, un crimen millonario con los pobres como mercancía
Qué hacer si el peticionario fallece mientras solicita a un familiar la visa de inmigrante - El Caribe	https://www.elcaribe.com.do/panorama/caribe-migracion/que-hacer-si-el-peticionario-fallece-mientras-solicita-a-un-familiar-la-visa-de-inmigrante/	2021-04-19	Qué hacer si el peticionario fallece mientras solicita a un familiar la visa de inmigrante
George Bush se arrepiente especialmente de no haber hecho reforma migratoria - Listín Diario	https://listindiario.com/las-mundiales/2021/04/19/666445/george-bush-se-arrepiente-especialmente-de-no-haber-hecho-reforma-migratoria	2021-04-19	George Bush se arrepiente especialmente de no haber hecho reforma migratoria
Abren albergue en California para recibir niños migrantes - Diario Libre	https://www.diariolibre.com/usa/actualidad/abren-albergue-en-california-para-recibir-ninos-migrantes-LP25804807	2021-04-22	Abren albergue en California para recibir niños migrantes
Abren albergue en California para recibir niños migrantes - Listín Diario	https://listindiario.com/las-mundiales/2021/04/23/667178/abren-albergue-en-california-para-recibir-ninos-migrantes	2021-04-23	Abren albergue en California para recibir niños migrantes
Fallecen 3 migrantes venezolanos en un naufragio en aguas del Caribe - Listín Diario	https://listindiario.com/las-mundiales/2021/04/24/667435/fallecen-3-migrantes-venezolanos-en-un-naufragio-en-aguas-del-caribe	2021-04-24	Fallecen 3 migrantes venezolanos en un naufragio en aguas del Caribe
López Obrador y Kamala Harris se reunirán para tratar la migración - Listín Diario	https://listindiario.com/las-mundiales/2021/04/24/667428/lopez-obrador-y-kamala-harris-se-reuniran-para-tratar-la-migracion	2021-04-24	López Obrador y Kamala Harris se reunirán para tratar la migración
Fallecen tres migrantes venezolanos en un naufragio en aguas del Caribe - Diario Libre	https://www.diariolibre.com/actualidad/internacional/fallecen-tres-migrantes-venezolanos-en-un-naufragio-en-aguas-del-caribe-AM25837340	2021-04-24	Fallecen tres migrantes venezolanos en un naufragio en aguas del Caribe
El papa considera una vergüenza la muerte de 130 migrantes - Diario Libre	https://www.diariolibre.com/actualidad/internacional/el-papa-considera-una-verguenza-la-muerte-de-130-migrantes-BL25844173	2021-04-25	El papa considera una vergüenza la muerte de 130 migrantes
Una nueva ola de migrantes haitianos llega a la ciudad mexicana de Tapachula - El Caribe	https://www.elcaribe.com.do/destacado/una-nueva-ola-de-migrantes-haitianos-llega-a-la-ciudad-mexicana-de-tapachula/	2021-04-26	Una nueva ola de migrantes haitianos llega a la ciudad mexicana de Tapachula
Una nueva ola de migrantes haitianos llega a la ciudad mexicana de Tapachula - Diario Libre	https://www.diariolibre.com/actualidad/una-nueva-ola-de-migrantes-haitianos-llega-a-la-ciudad-mexicana-de-tapachula-CJ25865315	2021-04-26	Una nueva ola de migrantes haitianos llega a la ciudad mexicana de Tapachula
EEUU lanza operación contra redes trasnacionales de tráfico de migrantes - Diario Libre	https://www.diariolibre.com/usa/actualidad/eeuu-lanza-operacion-contra-redes-trasnacionales-de-trafico-de-migrantes-GH25888493	2021-04-27	EEUU lanza operación contra redes trasnacionales de tráfico de migrantes
Una nueva ola de migrantes haitianos llega a la ciudad mexicana de Tapachula - Listín Diario	https://listindiario.com/las-mundiales/2021/04/27/667772/una-nueva-ola-de-migrantes-haitianos-llega-a-la-ciudad-mexicana-de-tapachula	2021-04-27	Una nueva ola de migrantes haitianos llega a la ciudad mexicana de Tapachula
Corte Suprema de EEUU vota a favor de migrante guatemalteco - Diario Libre	https://www.diariolibre.com/usa/actualidad/corte-suprema-de-eeuu-vota-a-favor-de-migrante-guatemalteco-KM25929164	2021-04-29	Corte Suprema de EEUU vota a favor de migrante guatemalteco
Inmigrantes se apropian del Primero de Mayo en EEUU para pedir la ciudadanía - Diario Libre	https://www.diariolibre.com/usa/actualidad/inmigrantes-se-apropian-del-primero-de-mayo-en-eeuu-para-pedir-la-ciudadania-JJ25971778	2021-05-01	Inmigrantes se apropian del Primero de Mayo en EEUU para pedir la ciudadanía
Inmigrantes se apropian del Primero de Mayo en EEUU para pedir la ciudadanía - Listín Diario	https://listindiario.com/las-mundiales/2021/05/02/668473/inmigrantes-se-apropian-del-primero-de-mayo-en-eeuu-para-pedir-la-ciudadania	2021-05-02	Inmigrantes se apropian del Primero de Mayo en EEUU para pedir la ciudadanía
España busca que 15,000 menores y jóvenes migrantes no queden desprotegidos - listindiario.com	https://listindiario.com/las-mundiales/2021/05/02/668476/espana-busca-que-15000-menores-y-jovenes-migrantes-no-queden-desprotegidos	2021-05-02	España busca que 15,000 menores y jóvenes migrantes no queden desprotegidos
Biden comenzará a reunificar a familias de inmigrantes separadas por Trump - El Nuevo Diario (República Dominicana)	https://elnuevodiario.com.do/biden-comenzara-a-reunificar-a-familias-de-inmigrantes-separadas-por-trump-2/	2021-05-03	Biden comenzará a reunificar a familias de inmigrantes separadas por Trump
Gobierno de Biden comienza a reunir a las familias migrantes separadas - Diario Libre	https://www.diariolibre.com/usa/actualidad/gobierno-de-biden-comienza-a-reunir-a-las-familias-migrantes-separadas-NH25996586	2021-05-03	Gobierno de Biden comienza a reunir a las familias migrantes separadas
Biden comenzará a reunificar a familias de inmigrantes separadas por Trump - Listín Diario	https://listindiario.com/las-mundiales/2021/05/04/668816/biden-comenzara-a-reunificar-a-familias-de-inmigrantes-separadas-por-trump	2021-05-04	Biden comenzará a reunificar a familias de inmigrantes separadas por Trump
Salud Pública inocula al personal de migración en el paso fronterizo por Jimaní - El Caribe	https://www.elcaribe.com.do/destacado/salud-publica-inocula-al-personal-de-migracion-en-el-paso-fronterizo-por-jimani/	2021-05-06	Salud Pública inocula al personal de migración en el paso fronterizo por Jimaní
Opositora venezolana pide reabrir frontera con Colombia en pro de migrantes - El Nuevo Diario (República Dominicana)	https://elnuevodiario.com.do/opositora-venezolana-pide-reabrir-frontera-con-colombia-en-pro-de-migrantes/	2021-05-07	Opositora venezolana pide reabrir frontera con Colombia en pro de migrantes
Alertan de que 23 migrantes están desaparecidos tras un naufragio en el mar - El Caribe	https://www.elcaribe.com.do/actualidad/alertan-de-que-23-migrantes-estan-desaparecidos-tras-un-naufragio-en-el-mar/	2021-05-10	Alertan de que 23 migrantes están desaparecidos tras un naufragio en el mar
Hallan cadáver de haitiano que huyó de inmigración tras desembarco en Florida - Listín Diario	https://listindiario.com/las-mundiales/2021/05/12/670124/hallan-cadaver-de-haitiano-que-huyo-de-inmigracion-tras-desembarco-en-florida	2021-05-12	Hallan cadáver de haitiano que huyó de inmigración tras desembarco en Florida
Banco Mundial subraya que las remesas de migrantes se mantienen pese a la pandemia - Listín Diario	https://listindiario.com/economia/2021/05/12/670131/banco-mundial-subraya-que-las-remesas-de-migrantes-se-mantienen-pese-a-la-pandemia	2021-05-12	Banco Mundial subraya que las remesas de migrantes se mantienen pese a la pandemia
Apresan tres extranjeros por delitos criminales en Canadá - El Caribe	https://www.elcaribe.com.do/destacado/apresan-tres-extranjeros-por-delitos-criminales-en-canada/	2021-05-13	Apresan tres extranjeros por delitos criminales en Canadá
No se habla mucho de migrantes solos, pero van en aumento - Diario Libre	https://www.diariolibre.com/actualidad/internacional/no-se-habla-mucho-de-migrantes-solos-pero-van-en-aumento-MH26210729	2021-05-13	No se habla mucho de migrantes solos, pero van en aumento
Biden revoca decretos de Trump sobre migración, redes sociales y estatuas - Periódico El Caribe - El Caribe	https://www.elcaribe.com.do/panorama/internacionales/biden-revoca-decretos-de-trump-sobre-migracion-redes-sociales-y-estatuas/	2021-05-14	Biden revoca decretos de Trump sobre migración, redes sociales y estatuasPeriódico 
Repatrían a 22 migrantes cubanos, interceptados en el mar por EE.UU. - El Nuevo Diario (República Dominicana)	https://elnuevodiario.com.do/repatrian-a-22-migrantes-cubanos-interceptados-en-el-mar-por-ee-uu/	2021-05-14	Repatrían a 22 migrantes cubanos, interceptados en el mar por EE.UU.
